Başlık,Metin
ayrışmadan birlik beraberlik günü,arkadaşlar partimizin kurultayı denebilir dönüm başında toplanmıştır 1927 kurultayı doğuda kopan azıyı yenerek cumhuriyetin sarsılmaz temelde olduğunun anlaşılmasına 1931 kurultayı güvenlik sükûnun kesin kurulmasına rast gelir kurultayımız geniş ölçüde gelişim devri bulunduğumuz günlerde toplanmış kurultayın yeniden alacağı ilerleme yükselme tedbirleriyle vatanın yüksek yönetimini erdemli ellerinde tutan partimizin şerefli tarihini zenginleştireceğine şüphe yoktur mustafa kemal atatürk mayıs 1935te chpnin kurultay açış konuşmasında cümleleri kurmuştu kurultayla başladım pazar günü chp olağanüstü kurultayını gerçekleştirecek chp kanatların yapacağı merak konusu dün chpnin genel başkanı kemal kılıçdaroğlu kurultayla noktayı koydu habertürk yazarı muharrem sarıkayaya konuşan kılıçdaroğlu aday mısınız sorusuna efendim aday değilim yanıtını verdi kurultaya gidecek misiniz şeklindeki soruya cevap veren kılıçdaroğlu biliyorsunuz süredir bayram tatildeyim davetiye geldiyse giderim ofiste olmadığım davetiyenin gelip gelmediği hakkında bilgim güne döneceğim davetiye gelmişse giderim ifadelerini kullandı kimsenin açıp sormadan hakkında yorumda bulunduğunun altını çizen kılıçdaroğlu aday aday değilim ifadelerini kullandı ekrem mamoğlu ekibi pazar günü düşünüyor bilgi chp lideri özgür özel silivride mamoğlunu ziyaretinde aralarında gerilim görüşmenin kısa sürdüğü kulislerde konuşulmuştu gerçek ekrem mamoğluna yakın isimler kurultay kararı acele alındı ekrem bey başından yana düşünüyor özgür beye acele karar acele edilmesine görmüyorum kayyum riski varsa alınması gereken karardır eğrisini doğrusuna getiririz aralarında konuşmayı kısa kesecek gerilim yaşanmıyor tersi meseleleri uzun uzun konuştuklarını ifade gelelim kurultaya mamoğlu çevresinde bilgileri aktaralım imza kampanyası başladı önümüzde 23 nisan 19 mayıs süreç hızlı gelişiyor bunlardan parti geç 2026 kasım ayında süresi dolacağı olağan kurultayını olağanüstü kurultayda kurultay delegesi seçmiyoruz 2026nın kasım ayında olacak olacak olağan kurultayda delegelerimizi seçeceğiz olağan kurultaydan evvel yerel genel seçim olma şansı zayıf gördüğümüzü söyleyebiliriz kurultay milletin eline kılıcı alıp cengaver birbirine girişeceği zamanda yapılmıyor türkiyenin partinin toplu saldırı yaşandığı günlerde yapılıyor saldırıyı püskürtmek partiyi bütünleştirecek kurultay görüntüsü verecek etkinliğe ihtiyacımız ekrem başkan birlik beraberlik günü ayrışmadan yola devam edeceğiz düşüncesinde sonuç nisan olağanüstü kurultayı başlangıç kılıçdaroğlunun tavrı net aday olmayacak mamoğlu cephesi birlik beraberlik vurgusu bakalım pazar günü oluşacak parti meclisi sonrasında neler yaşanacak
mektup,gezi soruşturmasından gözaltında gazeteci smail saymaz 11 kasım 2024te tutuklanan esenyurt eski belediye başkanı ahmet özerin mektubunu yayımlamıştı özer mamoğlunu oyun dışı bırakmayı hedefliyorlar başlıklı mektubunda açık konuşmuştu esenyurtta kişiden birinin oyunu alarak seçildim hakkımda kara propaganda yaptılar halk itibar etmedi seçimle elde edemediklerini yargı yoluyla ele geçirmeye çalışıyorlar kayyum halk iradesinin gaspıdır meselenin ikinci kısmı buradan sonuç alırlarsa mamoğlunu oyun dışı bırakmayı hedefliyorlar üçüncü hedef partimizin operasyonlarla iktidar yolculuğunu engellemek olacak biliyordu konuşmuyordu hedefte mamoğlu sonrasındaki hedef chp dün ahmet özer iddianamesini yazdım esenyurt belediye başkanı şüpheli ahmet özer stanbul ilinde görevli kısım belediye başkanı başkan yardımcısı belediye meclis üyesinin 31 03 2024 yerel seçimler sonrasında terör örgütünce verilen talimatla kent uzlaşısı faaliyeti kapsamında terör örgütünün uzlaşma sağladığı partiden seçilmeleri sağlanarak görev yapmaya başladıkları görevli oldukları yukarıda izah edildiği özerlik sistemi kent uzlaşısı formülünün dem parti üstü örgütlenme sistemi örgütlenme konusunda çalışmalar yürüten örgüt bünyesindeki oluşumların dbp hdk örgütün taban halk örgütleme sistemini geliştiren yöneten esas kurumlar hususu nazara alındığında şahısların terör örgütünün kent uzlaşısı faaliyeti kapsamında faaliyet yürüten örgüt mensuplarından oldukları anlaşılmıştır sayfa 25 bunlara geliyorum diyen operasyonlara net tepki gelmemişti ana muhalefetten devam stanbul başsavcılığı yolsuzluk terör suçlarından başlattığı ayrı soruşturma kapsamında gözaltına alınan stanbul büyükşehir belediye başkanı ekrem mamoğlu suç örgütü lideri ifadesini kullandı başsavcılıkça açıklamada suç örgütü lideri şüpheli ekrem mamoğlu murat ongun tuncay yılmaz fatih keleş ertan yıldız şahıslarla bağlantılı 95 şüpheli başta toplam 106 kişi hakkında gözaltı kararı verilmiştir denildi tarih 15 mart 2025 ekrem mamoğlu ankarada konuştu hazırlıkların davaların soruşturmaların temelsiz kanıtsız zorlama iddialar uyduruk iddiaları araya getirecekler mamoğlunun etrafında toplanmış çıkar amaçlı örgüt icat etme çabasındalar tek tek denetlenmiş göz önündeki ihaleleri bahane yapacaklar etrafımdaki kişileri kurdukları kirli hesap düzeniyle suçlu ilan etmeye çalışacaklar 23 martta seçim olmadan mamoğlunun işini bitirelim derdindeler turbun büyüğü heybeden eskiden sözüm örgüt çıkarmak mamoğlunu hapse atmaktan bahsediyorlar köşe yazılarında mamoğlu oyun dışı kalacakmış mamoğlu sonrasında fark 15 martta yönelik operasyonu anlattı chp örneğin esenyurta kayyumdan nöbet tutacak unutulacak gidecek ktidara varım buradayım diyecek mamoğlunun diploması iptal edildikten chp lideri özgür özelin dediği dare mahkemesi cümlesini kuracak saraçhanede karargah kuran chp liderliği halkı akşam 20 30da belediyenin önüne çağırıyor operasyonu diri tutmaya çalışıyor dağınıklık konuşuluyor chpyi toparlayacak baba ağabey figürüne ihtiyaç açık mamoğlu gündemiyle birlikte yol haritası harekete geçmek gerekiyor yazıyı bitirirken tkp genel sekreteri kemal okuyanın sol portalda yazısını gördüm yazının ana fikri çarpıcı mamoğluna dönük ardı ardına hamlelerin beşinci kolla yolsuzlukla sahtecilikle ilgisi şin özü seçim yeter yaklaşımını sevdiler anlamda hayatı boyunca müesses nizamı savunmuş gelenekten parti genel başkanının cumhurbaşkanlığı seçimi boykot edilsin açıklaması önemlidir direniş çağrısı sistemin işlemeyeceğine ilişkin içerden uyarıdır
akpnin oy depolarında destek chpnin oy depolarında destek,ii meşrutiyetin ilanından ay osmanlı krizle sarsıldı ekim 1908de bulgaristan bağımsızlığını ilan ertesi avusturya macaristan bosna herseki işgal osmanlının savaş açacak gücü yoktu halk öfkeliydi çözüm servet fünunda horasani takma adıyla yazan jön türk ubeydullah efendiden geldi avusturya bulgar ürünlerine boykot önerisi hüseyin cahitin tanin gazetesinde işlemesiyle geniş yankı uyandırdı boykotun hedefinde avusturyadan ithal edilen fes şeker ttihatçıların örgütlü yapısı boykotaj sendikasının çalışmalarıyla ülkeye yayılan protestolar sonucunda tüccarlar siparişlerini iptal liman işçileri avusturya mallarını indirmedi sokaklarda avusturya fesleri parçalanırken kalpak popüler hale geldi gazeteler hareketi iktisadi savaş tanımlarken osmanlıda milli iktisat kavramı yaygınlaştı avusturya boykotu protesto ttihat terakki geri adım atmadı ay süren boykot osmanlı avusturyalı tüccarları zarara uğrattı sonunda avusturya bulgaristan cüzi tazminat ödemeyi kabul boykot sona erdi doğan çetinkaya 1908 osmanlı boykotu toplumsal hareketin analizi letişim yayınları 2004 hafta sonu 1908 osmanlı boykotunu boykotaj sendikasını ttihat terakkinin temellerini attığı milli ktisat ulus devlet değerlendirmelerini okurken ankara merkezli toplum çalışmaları enstitüsünden siyasi direktör hüseyin raşit yılmazın ilettiği çalışmayı analiz etmeye çalıştım raporun başlığı boykot etki analiz birinci bölümde google mapsin sağladığı yoğunluk saatleri verileri kullanılarak stanbul ankaradaki seçili avmlerin yoğunluk düzeyleri incelenmiş örneğin stanbulda akpnin toplumsal tabanının güçlü ilçelerdeki avmlerde boykotun gerçekleştiği nisan 2025 tarihinden nisan tarihinde gözlemlenen yoğunluk değişimlerine bakalım veriler ilçelerdeki avmlerde boykotun ertesi günü yoğunluğun hafif artış gösterdiğini ortaya koymakta güngörendeki kale outlet centerda ortalama yoğunluk 66 başakşehirdeki mall of stanbulda 88 esenyurttaki marmara parkta 22 puan artmış örneğin chpnin toplumsal tabanının güçlü ilçelerdeki avmlerdeki değişimlerse akpnin güçlü yerlerden boykot günü nisana kıyasla nisanda avmlerdeki yoğunlukta yüksek oranlı artışlar meydana gelmiş şişlideki citys nişantaşı avmde yoğunluk 29 sarıyerdeki stinye parkta 14 55 beşiktaştaki akmerkezde 13 77 puan artmış yüksek oranlar muhalefet seçmeninin boykot çağrısına güçlü karşılık verdiğini eylem etrafında yoğun birleştiğini göstermekte raporun ikinci bölümündeyse boykotun ertesi günü nisan 2025 tarihinde ankarada 384 esnaf işletme çalışanı gerçekleştirilen yüze anketlerin sonuçları analiz edilmiş esnaf tespitinde avmlerde iktidar muhalefet seçmen yoğunluğu dikkate alınmış ankete katılan işletmelere çalışanlarına boykot eylemini buluyor musunuz sorusu yöneltilmiş boykotu bulmayanların oranı 43 seviyesinde ankete katılanların 7si boykotu haklı bulmasa siyasi çaresizlik sonucu ortaya çıktığını kabul etmekte boykotu bulan esnafla 47 boykota seçeneksizlik nedeniyle ortaya çıktığını belirten esnafın toplamı 56 ankete katılanlara boykot demokratik eylemdir insanların tepkilerini dile getirebilmek boykot etme hakkı vardır şeklinde ifade okunmuş katılmıyorum 10 katılıyorum olacak puanlamaları istenmiş 16 5u katılmadığını 42 1i katılıyorum yanıtını vermiş söz konusu ifadeye katılan esnafın oranı yüksek kabul edilebilecek seviyede sonuç chp nisan 2025 tarihinde uygulanmak ilan edilen genel boykot toplumun kutuplaştığını bizlere gösteriyor muhalefetin güçlü yerlerde eyleme destek iktidarın güçlü yerlerdeyse destek görülen chpnin pazar günü gerçekleştirdiği olağanüstü kurultayının ardından kutuplaşma artacak
mamoğlunu aşan gençler,protestocuları eylemlere katılmaya motive unsur sorulduğunda gelecek kaygısı 60 tercih edilen seçenek olmuştur 52 hükümetin anti demokratik uygulamaları seçeneği takip etmiştir 31 mevcut siyasi sistemin taleplerime cevap vermemesi tercih edilen üçüncü seçenek olmuştur bb başkanı ekrem mamoğlunun tutuklanmasıyla başlayan protestolarda ekrem mamoğlunun şahsında muhalefete yönelik tutum seçeneğini katılımcıların yalnızca 11 1i işaretlemiştir toplum çalışmaları enstitüsünün ankara merkezli gençler başlıklı raporu gündür tartışılıyor yazımın girişine raporun çarpıcı tespitiyle başladım çarpıcı tespit dedim protestolarda ekrem mamoğlunun şahsında muhalefete yönelik tutumun 11 gelecek kaygısınınsa 60 çıkması kısa notla raporun analizine başlayalım rapora dayanak oluşturan veriler 24 25 26 mart 2025 tarihlerinde 19 00 23 00 saatleri arasında ankaranın kızılay meydanında toplanan 19 mart 2025te ekrem mamoğlunun gözaltına alınmasıyla başlayan protestolara katılan 208 eylemciyle eylemler sırasında yüze görüşerek oluşturulmuş noktada geçen pazar günü yayımlanan yazımda bahsettiğim mamoğlunun chpli hurşit güneşin silivri ziyaretinde kurduğu cümleleri hatırlatayım planımızı yaptık mesele cumhurbaşkanlığı haksızlığa kamuoyu oluşturmak gerekiyordu liderlik edecektim topluma millet liderlik yapar hale geldi arkasında kaldım millet liderlik yapar hale geldi cümlesinin gelecek kaygısıyla birleştiğini söyleyelim gençlerin ekonomi adalet sorusuna verdikleri yanıt dönemde anketlerden sonuca ulaşmış ankette türkiyenin çözülmesi gereken sorunlarını protestocuların öncelediği ölçülmüştür çerçevede protestoculara türkiyenin çözülmesi gereken sorunu nedir sorulduğunda 54 3ü adalet seçeneğini işaretlemiştir ekonomiyi sorun görenlerin oranı 13 9da kalmıştır sonuçlar karşılaştırmalı incelendiğinde anlam kazanmaktadır toplum çalışmaları enstitüsünün çalışmalarında ekonomi 54 sorun belirirken adalet 14 üçüncü sırada yer almaktadır türkiyenin sorunlarına yönelik protestocuların ülkenin geneliyle ayrışan konumda gözlenmiştir protestocular adalet sorunu ekonomik sorunun önünde görünmektedir raporun gelecek kaygısını güçlendiren sonuçları siyasetin anlaması gereken sonuçlar örneğin anki ekonomik durumunuzu tatmin edici buluyorsunuz sorulduğunda protestocuların 31 7si seçeneğini işaretlemiş tatmin edici bulmadığını belirtmiş örneklemin ortalaması 10 üzerinden 77 ölçülmüş örneğin türkiyenin mevcut iktidarla yakın gelecekte ekonomik gelişme göstereceğini düşünüyorsunuz sorulduğunda katılımcıların 63 5i kötü olacak seçeneğini işaretlemiştir soruda örneklemin ortalaması 10 üzerinden 79 ölçülmüş örneğin protestocuların 37 2si türkiyenin yönetimi devam sürece yaparsam yapayım ülkede iyi geleceğim olmayacak ifadesine 10 10 katılmaktadır ifadeye katılım 10 üzerinden 88 ölçülmüş ankara saraçhane eylemlerinde hakim mustafa kemal atatürk türk bayrağı milliyetçi pankart sloganlardı gelelim raporun önümüzdeki dönemde tartışılması gereken sonuçlarına protestocuların ideolojik kendilerini tanımladıklarını oy verme davranışlarını anlamak çeşitli sorular sorulmuştur protestocuların 55 6sı atatürkçü tanımlamaktadır sırasıyla milliyetçi 16 sosyalist 10 sosyal demokrat seçenekleri takip etmektedir protestocuların 72 5i atatürkçü yahut türk milliyetçisi tarif etmektedir yüksek oran kalabalıklarda çokça rastlanan milli milliyetçi sembollerin zeminini açıklar niteliktedir buradan çıkan sonuç eylemlerden anladığımız atatürkün yeniden keşfedildiği durum fransız htilali sonrasında kurulan ulus devletler üzerinden milliyetçilik halkçılık birleşmiştir emperyalizmden kopuş anlamına gelmektedir 1640 ngiliz 1789 fransız burjuva demokratik devrimleri feodaliteye verdi milli pazarı oluşturdu emperyalizm döneminde milli devrimler mazlumların emperyalizme verdiği ders kuruldu türk devrimi yüzden milliyetçi halkçı devletçi sac ayakları üzerinde başarıya yazımın sonunda devrimci türkçülük fikrinin ideoloğu yusuf akçuraya uzanalım banka reji düyûn umumiye avrupa kapitalinin türkiye istiklal iktisadiyesini asmak hazırladığı altından sehpadır 19 haziran 1921 sonuç önümüzdeki dönem ulus devlet diyenlerle küreselcilik arasında tercih yapılacak
lider olacaktım toplum liderlik,olağanüstü dönemlerde baskıdan sansürden kaçabilmek kitaplar tehlikeler göze alınarak gizlice yazılıp gizlice basılıp gizlice dağıtılır ruslar tür kitaplara samizdat adını koydu isim evrensel hale geldi kişisel basım samizdat soner yalçın silivri cezaevinde kitabı kaleme aldı dönemi anlatan iyi tanıklıklardan biriydi maltepe mitingini silivriyi yazacaktım akpli eski vekil mehmet metinerin sosyal medya paylaşımı önüme düştü gezi sürecinde çıkıp konuşmadı 17 25 aralıkta çıkıp konuşmadı uzunca süre ekranlara çıkıp konuşan kişinin dışında derin suskunluğa gömüldü fetö mücadele sürecinde reis alenen destek veren kişinin dışında yalnızdı reis yalnız bırakılmadı içeriden vuruldu içimizdeki muhalefet kıyıcıydı 15 temmuzda meydanlarda yoktu 16 temmuzun mücahitleri zuhur ettiler yolunu bulup itibarlı katlarda oldular kişinin dışında çıkıp konuşan tepki veren derin sessizlik çölündeyiz itibarlı katlarda olanlardan çoklarının tek paylaşımı tebrik ediyorum kendilerini akıllılar vesselam metinerin dediği mamoğlu operasyonu başladığı günden yana derin sessizlik akp cenahında 2002de özgürlük adına yola çıkan partinin kodlarını kaybettiği olabilir derin yoksulluk adaletsizlik bildiğimiz akp operasyonlara sessiz kalmaktan seçeneği kadro bildiğimiz stanbul büyükşehire kayyum atanmasına itiraz kadro kadro erdoğanı kayyum atanmaması ikna durum gidecek taraftan operasyonun yarım kaldığını düşünenlerin söyleyelim samizdat kişisel basımını kişisel tanıklığını anlata anlata yol bulunacak diyelim silivriye geçelim ekrem mamoğlu geçen pazar gününden yana silivri cezaevinde onlarca kişi mamoğlunu ziyaret ziyaretçilerden chpnin ağır isimlerinden eski milletvekili hurşit güneşti güneşi aradım gördüğünü sordum kalabalıktı erken gitmeme ekrem beyle uzun konuşamadım geldi hurşit güneş gelmedi dememen geldim ay gelirim uzun konuşuruz söze başladım necati özkanla emrah şahanla mahir polatla murat çalıkla konuştum rahatlardı necati özkan ağustostan yana hazırlanıyorduk duruma cümleyi ekrem bey kurdu planımızı yaptık mesele cumhurbaşkanlığı haksızlığa kamuoyu oluşturmak gerekiyordu liderlik edecektim topluma millet liderlik yapar hale geldi arkasında kaldım konuştu görüşebildiğim metin olun dışarıda yapılacak mücadele ruhsal durumunuzla sağlıklı olmanız kitleyi etkiler dedim unutmamak gerekiyor siyaset gerekiyor mitinglerle gitmez maraton ay seçim saraçhanedeki topluluk gezi gezi olayları olduğunda iktidara geliyoruz umutlandık türkiyenin 80i aydın ilerici üniversiteli gençlerden oluşmuyor sosyolojiden siyasal sonuca atlamayalım türkiyenin aydın gençlerinin kaygılı gösteriyor özgürlük gelecek kaygıları gösteriyor meselenin mamoğlu olmadığını söylüyorlar mamoğlu sembol birikimin sonucu teğmenlerden başladı durum ümit özdağın hapishaneye atılması tüsi ad gözaltıları diploma vs bardak taştı gençlik saraçhanede buluştu sürekli mitinglerle iktidar değişir seçimlere başkanlık sistemi güçlü liderlik mitinglerden vazgeçilmemeli meclis siyasetini kapatmamak gerekiyor protesto siyasetiyle söyledim davaların siyasi hukuki boyutunu unutmamalı hukuk mücadelesi yapılmalı mesela mahir polat emrah şahan sorularına cevap verdim dosyaları biliyorsunuz sordular 560 liradan bahsediliyor 20 dolar yapar afaki rakamlar dosyanın içeriğine bakıyorsunuz lira para yollamış metro ihaleleri stanbul belediyesi metro ihaleleri dosyada aklımızla alay etmesinler siyasi dava hukuki savunma yapılmalı
kumpasçılar harekete geçti,gündem toz duman tarafta ekrem mamoğlu merkezli operasyon yandan boykot yandan chp kurultayı yaşanan tartışmalar üzerinden dosyalar havada uçuyor sözler yankılanıyor süreç yaşanırken geçen hafta gündeme video belgesel youtube üzerinden yayınlandı belgesele geçmeden hatırlatmakta fayda tarih temmuz 2023 fenerbahçe eski başkanı aziz yıldırım sözde şike kumpasının dönümünde kripto uykuda sanmayın fetö bitti yargıda kurumlarda tarikatların içindeler be uykudalar devleti uyarıyorum bunlarla mücadele bitmedi anda tehlike partilerin fetö bylock çıkıyor affettik fakir adamın elinde atın içeri gitsin acısını ileride yaşayacağız açıklama üzerinde derin sessizlik derinde çalışmalar yapıldı çalışmalar püskürtüldü yıldırım devleti uyarıyorum bunlarla mücadele bitmedi demişti gerçek ortaya çıktı youtube kanalı yapı şikenin anatomisi başlıklı belgesel yayınladı fenerbahçe trabzonun oynayacağı maç öncesinde sokakta hareketlilik olmasını isteyenlere gollük pas vermek belgesel 2010 2011 sezonunda dönem adı cemaat fetullahçı terör örgütünün öznesi fenerbahçe aziz yıldırım kumpasını haklı çıkarmak yapılmış örgütün dokümanlarıyla hazırlanmış dönemin polis yargı mensuplarının dosyaları üzerinden hazırlanmış adrese teslim belgesel kumpas yargı onaylanmış yargıtay ceza dairesinin 21 mart 2024 tarihli kararından kumpas kuranlarla verdiği karardan okuyalım soruşturmanın amacının suçu ortaya çıkarmak asıl amacın yaşanan olaylar üzerinden ülkemizde bulunan kısım futbol kulüpleri taraftar gruplarını karşıya getirmek üzerinden doğacak tartışmaları yaşanacak kargaşayı fetö pdynin amaçları doğrultusunda kullanılmasını sağlamak tanık t mahrem mamlarından özgür kayanın verdiği kendisinin detayları bilmemekle birlikte üstü kapalı söylenen şeylerin dönem başbakan şimdiki cumhurbaşkanımız tayyip erdoğanın yıpratılması buradan yola çıkılarak hükümetin yıpratılmasının amaçlandığını kendisinin düşündüğünü kulüp olmasına fenerbahçenin konuda ses getireceği seçilmiş olabileceğini fenerbahçeyi ele geçirmek fenerbahçe üzerinden algı yükseltip hükümet operasyon düşündüğünü belirttikten kendilerinden kamuoyunda askeri casusluk davası bilinen davada benzer istemlerde bulunulduğu şeklindeki beyanlarından anlaşılacağı soruşturmanın örgütsel saik gerçekleştirildiği nitekim soruşturmanın operasyona dönüştüğü günden günümüze kulüp taraftar grupları arasında tartışmaların devam ettiğinin izahtan vareste dosya kapsamından belirlenmiştir yargıtay kararı davanın mağdurları örgütün faaliyetlerini tek tek anlatmış çalışma yaptıklarını mahkemede delillendirmişti bunlara kumpasın üzerinden 14 geçmesine belgesel kumpasçılar karşımıza çıktı önceki fenerbahçe kulübü aziz yıldırım şekip mosturoğlu belgeselle stanbul nöbetçi sulh ceza hakimliğine başvuru başvuruda tespitlere talebe yer verildi suç duyurusunda aşağıda uzantısı verilen youtube isimli internet sitesi üzerinden yayınlanan videoda fetö pyd mensubu yargı görevlileri polis memurları fetö pyd silahlı terör örgütünün faaliyet kapsamında gerçekleştirilen sözde şike operasyonuyla yanıltıcı bilgiler verildiği fetö pdy terör örgütünün faaliyetinin övüldüğü müştekilerin kişilik haklarına saldırıda bulunduğu iddia edildiğinden yukarıda yazılı url adresine erişimin engellenmesi talep olunur sulh ceza mahkemesi yıldırım mosturoğlunun şikayet başvurusunu kabul bilgi teknolojileri letişim kurumuna btk yazı gönderdi dün videoya erişim engeli kararı verildi unutulmaması gereken şekip mosturoğlunun cümleleri temmuz fenerbahçenin fetönün boyun eğdiği duvara çarparak geriye tosladığı dava haline dönüşmüştür türkiyeye ilham olmuştur darbe teşebbüsü sırasında fenerbahçenin haklılığı günkü refleksinin benzeri kamuoyu gösterilmiştir 27 aralık 2024
