Başlık,Metin
24 radara takılan yasa dışı bahis,gazeteci dostum murat ağırelin kirli çark kırmızı kedi yayınevi kitabını bitirirken operasyon haberi geldi stanbul başsavcılığı örgütlü suçlar soruşturma bürosu yürütülen yasa dışı bahis soruşturması kapsamında aralarında pozitifbank flash tv payfix ödeme kuruluşu finans medya sektöründe faaliyet gösteren şirketlerin sahibi erkan korkun aralarında bulunduğu 59 kişiye yönelik geniş çaplı operasyon gerçekleştirildi şüpheliler suç işlemek amacıyla örgüt kurma suçtan kaynaklanan mal varlığı değerlerini aklama 7258 sayılı futbol spor müsabakalarında bahis şans oyunları düzenlenmesi hakkında kanuna muhalefet suçlamalarıyla soruşturuluyor kitaba daldım lk yasa dış bahisle tanışan türkiyenin hikayesi ilginçti tarih aralık 2001 adı lorella razetti talyan razettinin adının karıştığı olayla başladı masak bankanın ihbarı internet üzerinden bahis oynatarak haksız kazanç sağlayan şebekenin peşine düştü lk araştırma sonucunda lorella razetti adlı talyan kadının hesabına sayıda kişinin açıklama yapmadan dikkat çekici miktarlarda para transfer görüldü harekete geçen masak müfettişleri gizli ibareli yazıyla devlet bakanı kemal dervişe bilgi verdi soruşturma amacıyla dervişe bağlı bakanlıktan onay alındı lorella razettinin adına açılan hesaplardaki para hareketleri takibe alındı hbarı yapan bankadaki hesap kayıtlarında razettinin 1959 doğumlu muhasebe müdürü tanıttığı adresini stanbul mecidiyeköyde gösterdiği belirlendi stanbul genelindeki bankalarla yazışmalar sonucunda razettinin tl dolar euro üzerinden açılmış hesaplarının anlaşıldı bankanın gönderdiği yazıda lorella razetti adına kurulmuş easybets com adlı internet sitesinde bahis oynayanların para yatırması hesap numaraları verildiği belirtildi hesaplara sayıda vatandaşın paralar yatırdığı iletildi bahis oynayanların razettinin hesabına yatırdığı paraları beşiktaş noterliği aracılığıyla vekâletname verdiği türk vatandaşı semih sadinin çektiği bildirildi sefer semih sadinin izi sürülmeye başlandı sadinin annesi stella salem adına girnede hesap açtığı ortaya çıkarıldı kolaybahis com adlı internet sitesinde müşterek bahis oynayanların paralarını kıbrıstaki hesaba yatırmasının sağlandığı anlaşıldı masak vurgunu önlemek amacıyla işbirliği bankalara söz konusu hesapları kapattırdı sadi süreçte yöntemler buldu nokta otomasyon bilişim ticaret limited şirketini kurdu nternet üzerinde sanal kart aracılığıyla alışveriş yapıldığı görüntüsünü vererek bahis oynattıran sadi para toplamaya devam sırada müfettişler hesap numaralarına para yatıran türk vatandaşlarının adres kimlik vergi numaralarına ulaşmak harekete geçti çoğunun kimlik bilgilerine ulaşılamadı sayıda kişinin ifadesi alınabildi masak emniyet yasadışı sanal bahis hareketini tanıdı yasa dışı bahis sistemi çalışıyor sanal bahis yalnızca kolay para kazanma vaadiyle bireyleri çeken oyun zamanda organize suç örgütlerinin kontrol devasa çark çarkta oyuncular yalnızca birer piyon kazanan sistemi kontrol edenler yasa dışı bahis sistemi çalışıyor okuyalım yasadışı bahis sitelerinin yönetimi panel kullanılır yazılım sitelerin dönen paranın teknik altyapının yönetilmesi panel üzerinden yazılımcılarla birlikte sağlanıyor bahis oranları ayarlanıyor bakiye düzenlemeleri yapılıyor sunucuları yurtdışında bölgesel düzeyde faaliyet gösteren oyuncularla doğrudan temas kuran ara birime alt kasa adı veriliyor düzen komisyon üzerinden çalışıyor çarka katılan birim aldığı sorumluluğa komisyonunu alarak yoluna devam anda birden fazla bankada açılmış paravan hesap gruplarıyla set hesaplar kuruluyor genelde fazla hesap içeren yapı organizasyonun finansal izini gizlemek kullanılıyor fraud ekibini duydunuz profesyonel holding çalışıyorlar back office kuruluyor departman müşteri taleplerini karşılarken bakiye sorunlarını çözüyor oyunculara rehberlik fraud ekibini duydunuz anlamı risk birimi oyuncuların hesapların sistem kurallarına uygunluğunu kontrol eder dolandırıcılık sistemi aldatmaya yönelik girişim tespit edildiğinde hızlı müdahale eder düzende kullanılan kripto para cüzdanları sayede neredeyse dijital iz kalmıyor paranın takibi yapılamıyor ödemeler gerçekleştiriliyor üstelik sitelerde bildiğiniz alışveriş sitelerindeki canlı destek hizmeti sunuluyor anlık sorunları gidermeyi düşünen müşteri memnuniyeti kurumsal kurulmuş durumda bayilik sistemi organizasyonun bölgesel yayılmasını sağlayan komisyon bazlı yapı üst kasa alt kasalara operasyonel izinler komisyon payı vererek bayilik sistemini işletiyor sonuç kitapta baronlar sayıda isim sistem hepsinden ayrı ayrı portreler yapılır kirli çarkın fotoğrafı çekilebilir haydi çarka çomak sokmaya
mümkün hukuk sisteminde yapabileceğiniz ortam,dün ankara valiliği ankara büyükşehir belediyesi abb 2021 2024 yılları arasında düzenlenen müfettişler incelemeye alınan 130 konserden 33ü hakkında kamu zararı iddiasıyla soruşturma izni verilmesi yönünde karar aldı soruşturmayla abb hemen açıklama yapıldı ankara büyükşehir belediyesi 2021 2024 yılları arasında düzenlenen dizi kültür sanat etkinlikleri süredir müfettişler incelemeye alınmıştı müfettişler sürdürülen 130 konseri kapsayan hizmet alımlarına ilişkin inceleme tamamlanmıştır söz konusu inceleme sonucunda 97 konser usulsüzlük tespit edilmemiş etkinliklerle soruşturma izni verilmemiştir 33 konser hakkında kamu zararı iddiasıyla soruşturma izni verilmesi yönünde karar alınmıştır önemle belirtmek isteriz etkinlikler sayıştayın rutin denetimlerinde çişleri bakanlığı teftişlerde detaylıca incelenmiş olumsuz bulguya rastlanmamıştır karara hakkında inceleme belediye çalışanı hukuki haklarını kullanarak bölge dare mahkemesi nezdinde itirazda bulunacaklardır olayın geçmişine baktığımızda tarih 13 kasım 2024 ankara başsavcılığı 67 ayda konserlere 810 lira ödediği iddia edilen ankara büyükşehir belediyesinin konser harcamalarında usulsüzlük yapıldığına yönelik iddiaları soruşturmak çişleri bakanlığına müzekkere yazdı teftiş kurulu inceleme başlattı mansur yavaştan sosyal medya paylaşımı geldi 11 kasım tarihinde konuyla basına açıklama yaptığım çişleri bakanlığı mülkiye müfettişi konuyu incelemek gönderilmiştir inceleme devam etmektedir durum söz konusu değildir hesap verebilirlikte üstümüze yoktur sözümüzün arkasındayız suçu varsa cezasını çekecektir davranışı kamu belediyelerden bekliyoruz konuyla abb başkanı mansur yavaşı aradım nasılsınız sordum sesi kısıktı ankara stanbul arasında gidip geldik sırada sesimiz kısılmış 33 konsere soruşturma izni konusunda düşünüyor yavaş normal süreç konuda açığız şeffafız söyleyebilirim insana istiyorsanız hukuk sisteminde yapabileceğiniz ortam doğmuştur maalesef mansur yavaşın bende kalan cümleleri söyleyebilirim süreci yakından takip önümüzdeki günlerde neler yaşanabileceği konusunda mutlaka öngörüleri anda sessiz sessiz kalmaya devam 14 martta köşede okumuştunuz erdoğan zorlu rakip yazımda demiştim erdoğan mamoğlu siyaseten saf dışı kalırsa karşısına kazanacağı iddia edilen mansur yavaşın çıkmasını ister konuda ankara koridorlarında konuşulanlara kulak kabarttım ktidarın oyun planını anlayabilen gerçek ekrem başkanın yargı eliyle siyaset dışı bırakılmak istendiği görülüyor olası rakibi mansur yavaşla kurgu içindeler yavaşın önünün açıldığına dair kanıt sonuçta ankara belediyesi müfettişler inceleniyor sgk borçları üzerinden belediye bütçesine darbe vuruldu ekrem başkanın önü kapanırsa heybeden yavaş çıkacak bilmiyor bildiğimiz iktidar muhalefetin parçalı görüntü vermesi işlerine mansur başkan yarışta chp kaos varmış algısı seçmen üzerinden etkili olabilir iktidara içlerinde birlik olamayanlar ülkeyi yönetecek kampanyası el altından yapılıyor sonuç chp kayyum konusunda önlemini almış nisanda olağanüstü kurultay çağrısı yapmış süreç devam olağanüstü kurultay kararının iptali hatay eski büyükşehir belediye başkanı lütfü savaş ismin iptal kararı başvuru biliyoruz ankara başsavcılığında kasım 2023te gerçekleşen kurultayla soruşturmasını sürdürüyor
medyada yapı varsa yapının ağababası belli,tartişmalarin odağindaki si m mamoğlunun basin danişmani murat ongunla konuştum televizyon kanalında chp kurultay delegelerine 1200 cep telefonu alındı alımı medya aş iddiasıyla gündeme geldi başında stanbul büyükşehir belediye bb iştiraki medya ş ihale verdiği şirketlerin listesi tartışıldı murat ongun bb başkanı ekrem mamoğlunun basın danışmanı ongunla dönemde adının geçtiği bb iştiraki medya ş süreci konuştum murat ongun kimdir gizemli değilim iş hayatına başladığımdan kamuoyu önünde biriyim özgeçmişim bbnin sitesinde mevcut soruya şaşırmıyorum sosyal medyada benimle hurafeleri okuyunca insan kendinden korkabilir vay be neymişim dedirtiyorlar insana samimiyetle söyleyebilirim işini ahlaklı başarılı yapmaya çalışan sıradan biriyim vazifem sayın başkanın bbnin faaliyetlerini başta stanbullular topluma ulaştırmak anlatmak iletişim propaganda faaliyetleri diyoruz mütevazı olmayacağım işimde başarısız olsam saldırıya iftiraya maruz kalmazdım türkiyede başarı cezasız kalmaz ifadesi baştan sona doğrudur bakınız ekrem mamoğlu imkanlara performansta gerimizde kalanlar iftiralar hurafeler komplo teorileri uydurarak bizleri yaftalama peşinde rahatsız değilim birileri yaşıyor yapayım ekrem mamoğlu tanıştınız 2014 yılıydı ortak arkadaşımız vasıtasıyla beylikdüzü belediye başkanlığına seçilmişti yol haritası belirlemişti alanımla yardımcıya ihtiyacı lk görüşmemizde fikren anlaşsak profesyonel şartlarda anlaşamadık kinci görüşmemiz mamoğlu varsa çözüm sloganını anladım dediğim şartlarını değiştirdi sonuçta çalışan mutlu formül bulmuştu başladık kendisiyle yol yürümek nasip olmuş medya aş neler şirketin bütçesi nedir medya aş yüzümden hedefte şirketin yönetim kurulu başkanı olsam iştirakimizi hedef alacaklardı sayın mamoğlu yol arkadaşı olduğum yıllardır saldırılara önde durduğum saldıranların aksine zeki tavırla mücadele verdiğim yılmadan cesurca karşılarına çıktığım hedef yapıldım yaşanan durum yıldır hayatımın parçası saldırı tehdit paketinde milletimiz bilsin yaşamın getirdiği gerçeklik kabul edip konuyu memleket meselesi içselleştirirseniz sorun kalmıyor yaptım kuşkusuz medya aşye saldırılar üzüyor şirketimizde birbirini seven omuz omuza dayanışmayla çalışan işe gönülden bağlı genç sayıda mesai arkadaşım dostlarım kıymetli genel müdürümüz yol arkadaşım yönetici dostlarım üzülüyor geriliyor endişe ediyorum düşünseniz tgrt haberde gazeteci chp kurultay delegelerine 1200 cep telefonu alındı alımı medya aş iftira atıyor yalan dediğimizde diyenin alnını karışlarım belgesi elimde olmasa söylemem alnımı karışlayacağına elinde iddia faturayı yayınlayabilse sorun çözülecek fatura yayınlanır sözüm yayındaki gazeteci arkadaşlardan belgeyi gösterin murat ongun utansın demiyor diyemiyorlar yalan biliyor aparat dediğim feryat figan ediyorlar vasıtanızla medya meydan okuması yapayım programdaki hodri meydan diyorum fatura elinizde yayınlayın görevlerimden anında istifa edip özür dileyeyim onurlu insanlar yapmalı hodri meydan bekliyoruz faturayı murat ongunun ekrem mamoğlu adına sosyal medyada kurduğu trol ordusu medyada haber kanallarında kurduğunuz örgütlenme tane örgütüm halk partisi örgütü 10 yıllık parti üyesiyim 23 martta sandığa gidip oyumu kullanacağım medyaya dönersek allahaşkına medyada muhalefete yakın yayın organlarının sayısı nedir yapımız medyada yapı varsa yapının ağababası belli yeri gelmişken demokrasi adına acı verici olayı anlatayım 2019 seçimleri döneminde ekrem mamoğlu kanal trt haber cnn türk ntvye çıktı 2024 seçimlerinde trt bırak canlı yayını parasıyla reklamlarımızı yayınlamadı cnn türk ntv talep etmememize ekrem mamoğluna ekranlarını açmadılar üstelik rakibimiz kanallarda boy gösterirken mamoğluna hak tanınmadı türkiyenin eski haber kanalı üzücü adaletsizliklerin türlüsü yapıldı yapılmaya devam kazanan oluyoruz olmaya devam göreceksiniz örnek yılda medyada yaşadığımız demokratik gerilemeyi gösteren güzel örnek bunlara medyada örgütlenmişiz ordan atıp burdan tutuyormuşuz baştan sona saçmalık gelelim sosyal medyaya sosyal medya deyince anladıkları x şte orda trol ordularımız varmış ordu ordular yahu olsak olsak 300 spartalı oluruz yeteriz merak etmeyin kişi kendinden bilir işi dile getirenler asıl trol ordusu sahipleridir ekrem mamoğlu ülkenin sevilen siyasilerinden doğal sevenler destek paylaşım yapabilirler desteklemeyenler haksızlıklar adaletsizlikler nedeniyle destek insanları trol yapmaz anlamaktan aciz olanlar yıllardır trol yalanına sarılmış birilerini aldatıyor mamoğlunun trol ordusu palavrası uyanıklar sosyal medya üzerinden para kazandı kazanmaya devam öfkesinin kıskançlığının esiri olmuş tvlerde boy gösteren isim önemsiyor halkta karşılıkları dost acı söyler medya aşnin ihale verdiği kişileri koruduğunuz tanıdıklarınıza ihale verdiğiniz yönünde iddialar iddialara dersiniz hemen ekleyeyim medya aşden ihale alan basın kuruluşu unutmamak lazım medya aş bbye bağlı iştirak şirketi yüzden sayıştay denetimine açık müfettiş denetimine açık ticaret bakanlığından tutun çişleri bakanlığına onlarca devlet organının denetimine açık şirket açık derken gelsinler denetlesinler demiyorum daim denetim altındayız diyorum bb iştirak şirketleri denetlenen kurum kuruluş türkiye cumhuriyetinde üstelik didik didik denetleniyoruz sayıştay dahil raporlarımız denetimlerimiz pırıl pırıl seçimin ardından ticaret bakanlığı müfettişleri denetime geldi raporlarını bakanlığa sunmuşlar duydum bakanlığımız arzu keşke raporu verse medya aşnin çalıştığını görse keza benimle defalarca teftiş 2022 yılında derinlemesine incelemelere tabi tutuldum ailem incelendi bakmadık bırakmadılar hakkımda masak raporu hazırlandı tertemiz çıktı rahatsız olmadım bunlardan olmam devletimizin kurumuna istediği bildiğim şeyle açıklama yaparım anında hesap vermeye hazırım sosyal medya şarlatanlarına yanıt verecek halim medya aşde ihale alma koşulları bellidir medyadan birisiyim eski medya çalışanı yıllar şirketlerini kurmuş kah etkinlik organizasyon alanında kah film çekimi prodüksiyon alanında piyasaya iş yapmışlar aralarında başarılı insan bunlardan tanıdığım kişiler ihale koşullarını karşılamak kaydıyla iş alabilir sayıda tanıdığım kişiler tabi gazete tv medya kuruluşunun aldığı ihale bulunmamaktadır konuşulan para verdiğiniz gazeteci konuşuluyor cevap yalanı söylemekten zevk alanları gruba ayırıyorum başarısız siyasal iletişimciler para verin duygusu yaşayan tuhaflar kıskanç loserlar merkez medyada yetişmiş gazeteci kökenli birisiyim siyaseten tarafta gazeteciye suçlamanın yapılmasını kabullenirim tasvip ederim gazetecilik kıymetli meslektir iktidar öncesinde kuvvet gösterilirdi basın güçlerin tamamı bire indiği hatırlamıyorlar bb medya aşde yönetimi almadan tablo geçmişe bakınca gördünüz cevap önceki arkadaşların çalışma tarzı kayıtlı kayıt dışı kayıt dışına örnek vermem gerekirse 2017 yılında medya ş tv kurmaya yetecek elektronik cihaz almış aklınıza gelirse kamera reji masası ışık vesaire ciddi meblağ medya aşnin kamu parasıyla aldığı mallar nedense vakıf üniversitesine hibe edilmiş kaydı unutmuyoruz tabi mahkemeye gidip kazanacak durumumuz üniversite ismi veremiyoruz durumda 2017de üniversite televizyon stüdyosu kurduysa anlam veremediğim işler mesela medya ş idareden bbden değerli reklam alanının ihalesini almış 20 süreli ihale bbden aldığı değerli işin kar payı ekleyerek özel şirkete ihale etmiş değerli alan 30 40 kâr payı koyarak ihale edilebilirdi sebeplerle tercih edilmedi herhalde mesela bizde alanlardan görece değersiz reklam alanları 30 ila 50 arasındaki karlılıkla ihaleye çıktı anlatacak devletimiz sorarsa anlatırız teker teker polemik çıkarmak derdim bugünlerde tvlerde şirketimiz tartışmaya açıldığı söylemek isterim ddialar akla ziyan ifadeleri dile getiren arkadaşlar zahmet ddia medya aşde açıklama yalanladı demeyi öğrensinler aleyhimize iddia kılıfına sokarak saatlerce tartışıyorlar kurumsal açıklamamızdan cümle bahsetmiyorlar vicdansız oldunuz
erdoğan zorlu rakip,soruyu sormadım akademisyen gazeteci sordu önceki akşam katıldığım tv100 canlı yayınında açılar programı prof deniz ülke kaynak soruyu yöneltti anketlerde mansur yavaş birinci çıkıyorsa tayyip erdoğanı yeniyorsa ekrem mamoğlunun önü kapatılmak isteniyor çelişki tartışma soruya kilitlendi ankara büyükşehir belediye başkanı yavaş anketlerde önde çıkıyorum geldiğinde anketlere bakarız kararımızı veririz cümlesini kurması yargının mamoğlu kuşatması diplomayla birlikte yakın arkadaşlarının mallarına tedbir konulması tartışmanın ana nedenlerinden soruyu iktidar cenahından hürriyet gazetesi genel yayın yönetmeni ahmet hakan sordu hakan erdoğan zorlu rakip ekrem mamoğlu mansur yavaş başlıklı yazısında tespitleri erdoğan zorlu rakip ekrem mamoğlu mansur yavaş durumu dikkate almak gerekir mamoğlu yıpranırken yavaşın devlet adamı algısı artıyor yavaşın milliyetçi sağdan oy alma potansiyeli yüksek mamoğlunun yavaştan avantajlı yönler yön mesela aktif mücadeleci siyasi kişilik dem oylarını alabilme potansiyeli durumda soruyorum erdoğan açısından zorlu rakip sorunun yanıtını verebilir konuya yaklaşabilir görüşüm kısım dem seçmeninin cumhur ttifakına kayma ihtimali göz önünde bulundurulursa mansur yavaşın erdoğan açısından zorlu rakip olacağı söylenebilir mart 2025 hürriyet tespitlere baktığımızda iktidar mamoğlunun önünün kesilmesi konusunda heyecanlı bilmediğimiz oyun akla mhp lideri devlet bahçelinin mamoğlunun bilirkişiyle açıklama turpun büyüğü başlıklı açıklama yazılı açıklaması bugünkü basın toplantısının ardından cumhurbaşkanı adaylığı kisvesine bürünen mamoğluna parti içindeki rakiplerinin yorum getirip diyeceği önümüzdeki günlerde açıklığa kavuşacak muammadır ekrem mamoğlu sade vatandaş meydana çıkmalı cumhurbaşkanı adayı gerekli adımları atmalı güveniyorsa 100 kişinin imzasıyla cumhurbaşkanı adayı olabilecektir bb başkanlwığından istifa belediye hizmetlerinin aksamasının önüne geçmelidir 27 ocak 2025 açıklamayla bahçeli erdoğanın karşısına rakip mamoğlunu görmek istediklerini üstü kapalı açıklamış noktada tayyip erdoğan akp stanbul olağan l kongresinde neymiş 23 yılda yapamadığımızı yılda yapmışlar gördünüz tür konutlar ey ekrem efendi delillendir ispat et bak bakalım erdoğan icraatımızın ulaştığı yerlere hayallerin ulaşamaz ekrem şubat 2025 sözleriyle hedef aldı cumhur ttifakı yandan ekrem mamoğlunu rakibi gördüğünü açıkladı taraftan mamoğlu soruşturmalarıyla kuşatma devam sorumuza yanıt alamadık erdoğan mamoğlu siyaseten saf dışı kalırsa karşısına kazanacağı iddia edilen mansur yavaşın çıkmasını ister konuda ankara koridorlarında konuşulanlara kulak kabarttım ktidarın oyun planını anlayabilen gerçek ekrem başkanın yargı eliyle siyaset dışı bırakılmak istendiği görülüyor olası rakibi mansur yavaşla kurgu içindeler yavaşın önünün açıldığına dair kanıt sonuçta ankara belediyesi müfettişler inceleniyor sgk borçları üzerinden belediye bütçesine darbe vuruldu ekrem başkanın önü kapanırsa heybeden yavaş çıkacak bilmiyor bildiğimiz iktidar muhalefetin parçalı görüntü vermesi işlerine mansur başkan yarışta chp kaos varmış algısı seçmen üzerinden etkili olabilir iktidara içlerinde birlik olamayanlar ülkeyi yönetecek kampanyası el altından yapılıyor sonarın anketini eklemekte fayda hakan bayrakçının şirketi vip üyelere özel araştırmasında pazar cumhurbaşkanlığı seçimi kazanmasını istersiniz sorusuna yanıt aramış tayyip erdoğan 36 ekrem mamoğlu 31 mansur yavaş 15 selahattin demirtaş ümit özdağ hakan fidan devlet bahçeli bence anketin çarpıcı yanıtlarından erdoğanın gerekli çağrı yapılır terör örgütü bağlantılı yapılarda gereken adımları atarsa kazanan türküyle kürdüyle türkiye olacaktır açıklamasını destekliyor musunuz sorusuna verilen yanıt 54 4ü desteklediğini 36 4ü desteklemediğini söylemiş
güvenmiyorum 74,genar türkiye raporu şubat 2025 sayısı türkiye ekonomisinin mevcut durumunu geleceğine dair beklentileri analiz ekonomi yönetimine duyulan güven enflasyon beklentileri döviz kuru tahminleri ekonomik konuları detaylı ele almaktadır araştırma sonuçları ekonomi yönetimine duyulan güvenin önceki aya azaldığını göstermektedir önümde 180 sayfalık araştırma duruyor bölümden oluşan araştırmayı iktidara yakınlığıyla bilinen genar araştırma yapmış genar türkiye raporunun üçüncü bölümü ekonomi beklentiler duvarlar rakamlar raporu prof dr rasim özcan hazırlamış rapordan okuyalım genar türkiye raporunun sayısı ekonomi yönetimine güven konusunun yanında abd doları kurunun sonu seviyesini sonu enflasyon beklentilerini edinmiştir kamuoyunun başlıklarındaki düşünce beklentilerini ortaya çıkarmak amacıyla araştırma katılımcılarına ekonomi yönetimine duydukları güvenin düzeyi sorulmuştur enflasyonla mücadele yolunda ekonomi yönetimine güven konusu hâl almıştır yüzden ekonomi yönetimine güven duyuyor musunuz sorusu sayıda araştırma katılımcılarına yöneltilmiştir ortalama skor seviyeleri göz önüne alındığında şubat ayı ortalama skoru katılımcılarının görüşlerinde miktar erozyona işaret etmektedir güvenmiyorum diyenlerin oranı önceki ayki seviyesi 34 6dan şubat ayında 36 3e çıkmıştır önceki ay 32 gerçekleşen güvenmiyorum düşüncesinde olanların oranı 38 3e yükselmiştir güveniyorum güvenmiyorum diyenlerin oranı önceki ay 13 seviyesinden şubat ayında seviyesine gerilemiştir güveniyorum diyenlerin oranı benzer 13 seviyesine gerilemiştir güveniyorum diyenlerin oranı seviyesine gerilemiştir ekonomi yönetimine duyulan güvende gerilemenin nedenine bakalım rapor enflasyon ekonomik sosyal olguyu etkilediğinden yıllarda ekonomi yönetiminin toplumun fazla ilgilendiği konuların başında gelmektedir enflasyonun istenen seviyelere indirilmesinde beklentilerin yönetilmesi parametrelerden biridir sonuçlar şubat ayında katılımcıların ekonomi yönetimine güvenlerinde bozulmaya işaret etmektedir görüşlerdeki bozulmanın sebepleri arasında önemlisi ocak 2025 enflasyon rakamlarının beklenenden yüksek gelmiş olabilir noktadan hareketle ocak 2025 enflasyon oranının beklenenden yüksek çıkmasının yanında türkiye merkez bankasının sonu enflasyon hedefini 21den 24e çıkarmış olmasının sonu enflasyon hedefine dair beklentileri etkilediği katılımcılara sorulmuştur katılımcıların 16 1i sonu enflasyon beklentilerinin t c merkez bankasının tahmini 24ten düşük oranda belirtmişlerdir katılımcıların 6sı sonu enflasyonun hedeflenen seviyede gerçekleşeceği görüşünde bildirmişlerdir hedeften yüksek diyenlerin oranının 26 gözlenmektedir hedeften yüksek diyenlerin oranı 47 yüksek seviyede gerçekleşmiştir hedeften uzaklaşılacağını düşünenlerin oranının yüksek enflasyonla mücadelede beklenti yönetiminde istenen seviyenin oluşmadığını göstermektedir genar araştırmanın yönetim kurulu başkanı hsan aktaşın hazırladığı türkiye siyaseti başlıklı bölümde soru siyasetnamelere olacak soru soralım stanbul büyükşehir başkanı ekrem mamoğlu geleceğin cumhurbaşkanı olabilmek onca çaba ortaya koyarken ankara büyükşehir belediye başkanı mansur yavaşın oyları yükselmeye devam aktaşın verdiği yanıt rakamlara bakalım chpde cumhurbaşkanı adayı sorusunun karşılığı yavaş 36 mamoğlu 27 şeklinde yavaş chp tabanının benimsediği aday mamoğlu ak parti polemiğe giren sürekli siyasal ortamın kesif tartışmalarının parçası hâline getiren isim öne çıkıyor yavaşın ankarada aldığı oy oranı rakibi mamoğluna yüksek olmasına yavaş mamoğluna gündem tartışmalara polemiklere giriyor yavaşın başarılı görünen iletişim tarzının siyasal iletişimin ders konularından gerektiğini düşünüyorum anket soru mamoğlunun geçen hafta sonu zmirde başlattığı adaylık yürüyüşü yargı hamleleri önümüzdeki ay anket sonuçlarını etkileyecek
