Başlık,Metin
emre itaatsizlik komutan,1998 yılının haziran ayı idi pkknın irakın kuzeyinde bulunan üslerine yönelik şafak harekâtı ismiyle kapsamlı operasyon planlandı harekâtı bizzat asayiş kolordu komutanı korgeneral çetin doğan paşa yönetecekti günün sonunda pkknın mevzileri susturuldu süre sayıda şehit verilmişti çetin paşa üzgün öfkeliydi harekâtın günlerinde verilen şehidin tamamı siirt jandarma özel harekat dadaşlar timindendi engin çırakoğlunun anlatımına olayın akabinde çetin doğan paşa gözyaşlarına hâkim olamamıştı çetin paşanın olayla göstermediği duygusal yönüne tanık olmuştu bölgede binlerle ifade edilen terörist bulunmaktaydı birlikler topçu atışları hava kuvvetlerinin desteğiyle zapın derinliklerine ilerlemeye başlamıştı günün sonunda inisiyatif tsknın eline geçmişti sırada üs bölgesinde bulunan kriptolu telefon çaldı telefonu çetin paşa açtı üsteğmen engin çırakoğlu sırada hemen yanındaydı arayan dönemin genelkurmay kinci başkanıydı engin çırakoğlunun birebir tanık konuşma gerçekleşti kinci başkan amerikalıların bölgede alçak uçuş eğitimi yapacakları bölgeye topçu atışları uçak kobra helikopter uçuşlarının durdurulmasını istediklerini söyledi abdlilerin pkklılara kazandırmak istedikleri açıktı çetin paşa birliklerin ilerlemesinin durmasına sebep sıkışan pkklılar kaçar boyunca çetin çatışmalar yaşandı sayıda şehidimiz zapa gireceğimiz sıradaki isteğin amacı bellidir isteği getirmeyeceğim komutanım karşılık verdi kinci başkan ısrarla abdlilerin yoğun baskısı söyleyince çetin paşa öfkelendi sert ses tonuyla muhatabının kendinden kıdemli olmasına aldırış etmeden operasyon devam komutanım geri adım atmayacağım sonrasında telefonu şiddetli kapattı telefonun ahizesi kırılmıştı operasyon amerikalıların genelkurmaya baskısına çetin doğan paşanın inisiyatifi devam yüzün 900 üzerinde terörist etkisiz hale getirildi dün emekli kurmay albay mustafa önselin kitabı kelebekler kanat çırpınca mucizesi adamın sıradışı öyküsü kırmızı kedi yayınevi kitabını okudum emekli edilen tümgeneral engin çırakoğlu emekli albay abdurrahman bakırın hikayeleri cumhuriyetin hikayesi balyoz kumpasından 1300 hapis yatan mustafa önsel silah arkadaşını anlatmış yukarıda okuduğunuz çetin doğan paşanın emre itaatsizlik eylemini okudunuz dün chp genel başkan yardımcısı yankı bağcıoğluya sohbet ettim 22 aralıkta muğlada hastaneye çarpan ambulans helikopter düşmesi sonucu kişi yaşamını yitirmişti bağcıoğlu konuyla çarpıcı bilgiler verdi heliportlar helikopterlerin iniş kalkış yapabilmesi özel tasarlanmış alanlar alanların etkin kullanımı helikopterlerin güvenli operasyon yapmalarını sağlamak amacıyla gerekli altyapıya güvenlik önlemlerine sahip olmaları mümkündür muğlada meydana helikopter kazasından sağlık bakanlığı helikopterin görerek uçuş şartlarında pilot inisiyatifinde uçtuğu belirtilmiş dolaylı sorumluluk pilotlara yüklenmiş kritik önemdeki hastane heliportunun gerekli işletim emniyet standartlarına uyup uymadığı konusunda açıklama yapılmamıştır çerçevede sağlık bakanlığına bağlı heliportlar öncelikli askeri heliportların sivil havacılık genel müdürlüğü heli port yapim şleti m esaslari tali mati sht heli port çerçevesinde kontrollerinin ivedilikle zorunluluktur talimatta yer alan heliportlar emniyet standartları fiziksel özellikler mânia ortamı zorunlu görsel yardımcılar heliport hizmetleri kurtarma yangınla mücadele sistemleri heliport eğitimleri ana başlıklarındaki uygulanması zorunlu hususlar heliporta sahip hastanelerde ivedilikle kontrol edilmeli aksaklıklar giderilmelidir
rıza akpolata sorulan 37nci soruya dikkat,hbar mektubu bi li rki şi raporu bb haleleri soru 37 başsavcılığımıza 25 10 2024 tarihinde ihbarda beşiktaş belediyesinde usulsüzlüklerden bahsedilmiş alınan ihalelerde usulsüzlükler yapıldığı belirtilmiştir hususta söyleyecekleriniz nelerdir riza akpolat belediyenin yapmış ihalelerde usulsüzlük düşünmüyorum aziz hsan aktaşla bağlantım bulunmamaktadır belediye başkanlarına rüşvet vererek ihale süreçlerini manipüle iddia edilen suç örgütüne yönelik yürütülen soruşturma kapsamında gözaltına alınan beşiktaş belediye başkanı rıza akpolat tutuklandı savcılık sorgusunda 38 soru yöneltildi 37nci soru kritikti soruşturmaya dayanak ihbar mektubuyla yanıt istendi akpolattan ihbar mektubunda akpolatın avukatlarıyla yaptığım görüşmede dosyada gizlilik ihbar mektubunu görmediklerini söylediler sorulan sorular üzerinden yanıtlar verildiğinin altını çizdiler ddiaya soruşturma savcılığa 25 ekim 2024te gönderilen ihbar mektubuyla başladı mektuptaki iddiaya aziz hsan aktaş belediye başkanlarına belediyelerin üst düzey yöneticilerine rüşvet vererek ihale süreçlerini organize ediyordu noktada soruşturmayı yakından takip kaynaklarım dosyada gizlilik olabilir sabah gazetesinde ihbar mektubuyla özet dikkat et hemen arşive girip habere baktım okuyalım hbar evrakında chpli beşiktaş belediyesinde çekmeköy avcılar üsküdar esenyurt belediyelerinde 1er bb iştirakleri halk ekmekte ettde sfaltta gdaşta ihale dosyasına aziz hsan aktaş liderliğindeki suç örgütünün fesat karıştırdığı iddia edildi suç örgütünün rüşveti verdikten hazırladıkları ihale teknik şartnamelerinin belirledikleri şartlarda ihaleye çıkılmasını sağladıkları firmanın ihaleyi almasını engelledikleri saptandı şebekenin suçtan elde ettikleri geliri ait çeşitli firmalar üzerinden düzenledikleri faturalarla akladıkları ifade edildi hbar stanbul başsavcılığı soruşturma başlattı savcılık kaynaklarına ihbar mektubunu sorduğumda değerlendirmeyi yaptılar hbarlar gelir araştırma yapılmadan soruşturma dosyası oluşturulmaz ihbar mektupları bilirkişi raporları bilirkişi raporları ortaya çıktığında durum netleşir bilgiyi aktarmakta fayda savcılığın yürüttüğü 2024 236201 sayılı beşiktaş belediyesi soruşturmasında bbyle istenen ihale dosyalarından 13ü 2021 2022 2023 yıllarına ait üçüyse 2024 tarihli yıllara ait açılmış soruşturmalarla gizlilik kararı alınmış buradaki esas soru aziz hsan aktaş liderliğindeki suç örgütünün iddia chpli belediyelerle ilişkisinin gidildi
teğmen soruşturmasında 28 koğuşun sırrı,ahmet kaptan cezaevinde fakir mahkumların yaşadığı pis koğuş 72 koğuşta kalmaktadır annesinin günler hatırı sayılır para 150 lira göndermesi sayesinde yaşam koşulları değişecektir koğuşa geçmek 72 koğuşun koşullarını koğuş arkadaşları iyileştirmeye çalışır kumarda şansı dönen kaybetmeye başlayan kaptan elindeki paraları yitirir aklı fatmaya duyduğu kara sevdadadır fatma hapisten çıktıktan kaptan unutmaz yolunu gözlemeye devam eder usta edebiyatçı orhan kemalin 72 koğuş eseri 1987 yılında film yapılmış kadir nanırın oynadığı ahmet kaptan etrafında yaşanılan olaylarla bursa hapishanesi tasvir edilmiştir 72 koğuşla başladım yazıya önceki emekli hava albay ahmet zeki üçok aradı gazetesinin yayım hayatına başlaması nedeniyle tebriklerini iletti sohbet ederken 28 koğuş deyince aklıma orhan kemalin unutulmaz eseri 72 koğuş geldi sevdiği kadın sahip kaybedebilen adamın hikayesidir 72 koğuş nereden çıktı 28 koğuş dediğinizi duyar gibiyim ahmet zeki üçok anlatmaya başladı teğmenler hakkında organize disiplinsizlik söylemlerini biliyorsunuz haklarında iddia edilen suç nedir kısaca özetlersek 2023 yılında yönetmelikten çıkarılan yemin metnini komutanları verilen emirlere resmi tören sonrası ağızdan söylemeleridir araya girdim cümleleri kurdum teğmenler komutanlarının emirlerini dinlemediler emre itaatsizlik ettiler iddia üçok iddia doğruysa resmi tören sonrasında subaylık yeminini etmeyeceksiniz komutanları emir verildiyse teğmenlerin avukatları resmi tören sırasında subaylık yemini etmeyeceksiniz emir verildiğini açıkladılar teğmenlerde yemini etmişlerse suç 6413 sayılı askeri disiplin kanununun hizmet yerini terk etmeme cezasını gerektiren disiplinsizlikler başlıklı 19 maddesinde emre itaatsizlik kasıtlı hizmete ilişkin emri yapmamak değiştirerek sınırını aşmak suretiyle yapmaktır yer alan disiplin suçu oluşmuştur 1632 sayılı askeri ceza kanununun taatsizlikte ısrar edenlerin cezası başlıklı 87 maddesinde hizmete ilişkin emri yapmayan asker kişiler aydan seneye emrin getirilmesini söz fiil açıkça reddeden emir tekrar edildiği emri getirmeyenler aydan seneye hapis cezası cezalandırılırlar yer alan eskiden askeri mahkemelerin yetkisine giren askeri suç oluşmuştur askeri mahkemeler kaldırıldığı asliye ceza mahkemelerinin yetkisine giren suç oluşmuştur sesleniyorum emri dinlememenin emre itaat etmemenin cezası hizmet yerini terk etmeme izinsizlik cezasıdır ordudan atılmak değildir sohbetimiz ilerledikçe üçok çarpıcı bilgiler verdi teğmenlerin takım bölük tabur komutanlarına teğmenlere resmi tören sırasında sonrasında subaylık yeminini etmeyeceksiniz emir verdiniz soru sormuşlar ifadelerini aldıkları teğmenlere alay kıdemlisi okul birincisi teğmen organize sormuşlar yönlendirme alay kıdemlisi teğmen zzet talip akarsu kara harp okulunda öğrenciyken 28 koğuşta kalıyor yüksek disiplin kuruluna sevk edilen teğmenden kızlar koğuşunda kalan ebru teğmen hariç teğmen 28 koğuşta kalıyor amaç organizasyon kanaatini oluşturmak kanaati güçlendirmek yemin töreninden yurt dışındaki harp okulları arası pentatlon yarışmasından yurda dönüp törene katılan teğmeni 28 koğuşta kaldığı yüksek disiplin kuruluna sevk ediyorlar dönen birisini organizasyonun içerisinde göstermek hukuki uygulamadır takdirinize bırakıyorum şte yüzden 28 koğuş deyince aklıma orhan kemalin unutulmaz eseri 72 koğuş geldi
silah bırakma kararını pkk abd verecek,tarih 20 ocak 2010 taraf gazetesi fatih camii bombalanacaktı manşetiyle kamuoyundaki gerekli algıyı oluşturdu manşetin ardından fatih beyazıt eyüp smailağa camilerine eylem maksadıyla 2002 yılında istihbarat çalışmalarında bulunulduğuna ilişkin word dijital verilerinin 2009 yılından maddi gerçeğe aykırı üretildiklerinin bilimsel ispatlanmasına fetöcü hakimlerce 16 yıla mahkum tuğgeneral ali demir hapis yattı 15 temmuz 2016 gecesi fetullahçı darbe girişimi başladı jandarma genel komutanlığı cari harekat daire başkanı jandarma kurmay albay ali demir jandarma plan prensip başkanı tuğgeneral ahmet hacıoğlu jandarma kurmay albay nurettin alkan jandarma kurmay albay güven şağbanı telefonla arayarak darbe girişiminin haber verdi jandarma kurmay albay aziz yılmazın katılımıyla isimlerini yazdığım komutanlar beştepe jandarma genel komutanlığı kışlasını ele geçiren darbecilerle sabaha çatıştılar demir 2016 yılında tuğgeneral 2020 yılında cumhurbaşkanlığı kararnamesiyle emekli edildi partide genel başkan müsavat dervişoğlunun güvenlik danışmanı geçen cumartesi günü nefesteki köşemde ahmet türkle röportaja itirazı söyledi neydi itirazlar sözü ali demir paşaya bırakıyorum ahmet türk nefeste başlangıç adına süreç diyemeyiz adı konulmamış iyi niyetli başlangıç türk kürt halkının tarihten dostluğu tekrar inşa edilmeli görüyoruz iraka gittim suriyeye gittim anda dışarıya çıkamıyorum kürtlerin gözü türkiyede kendilerini hâlâ osmanlıdan yana türkiyenin parçası görüyorlar kürtler türklerle adil yaşam sürebilir özgürleşir şansları türklerin kürtleri dışlayan tavrı pkk kck terör örgütünce 40 yıllık sürede kürt halkının ekonomik açıdan bilinçli geri bırakıldığı propagandası yapılmasına karayolu inşasında görevli kamu görevlileri çocuklarımıza ilim irfan öğreten öğretmenlerimiz sağlık hizmeti veren doktor ebe hemşirelerimiz polis askerimiz silahlı eylemler hedef alınmıştır söz konusu terörist faaliyetlerin yanı sıra terörizm mücadele kapsamında ekonomimize dolar zarar verilmesi nedeniyle bölge vatandaşlarımızın refahına aktarılması kaynağın kürt vatandaşlarımıza ulaşmasına engel olunmuştur kürt vatandaşlarımızın 60a yakını fiilen batı illerimizde yaşamaktadır kürt vatandaşlarımızın yarısından fazlası pkk kck terör örgütü iltisak irtibat atılı suçlaması anayasa mahkemesince kapatılan isim değişikliği yaparak siyasi faaliyetine devam partiye oy verme yönünde tercihte bulunmamaktadır türkler kürt vatandaşlarımız arasında evlilik tahmin edilmektedir türkiyenin bölünmesi sosyolojik olası değildir ali demir itirazlarını sürdürdü türk kürt kardeşliğini dostluğunu bozan yüce türk milleti kürt ifade kıymetli vatandaşlarımız fetö pyd terör örgütünün darbeye teşebbüs girişimi başarılı idare edildikleri güç merkezlerinden aldıkları talimat gereğince birlik komutanlarının çoğunluğunun tutuklandığı hassas konjonktürde 15 temmuz 2016 cuma günü saat 19 00 22 temmuz 2016 tarihleri arasında türkiye genelinde süresince tek terörist eylemi yapmayan emperyalist güçlerin taşeronu maşası bebek katili teröristbaşı pkk kck terör örgütünün kendisidir yakın zamanda yayımlanan köşe yazısında çözüm süreci döneminde teröristbaşı murat karayılanın mralı devlet kandil arasında mesajları getirip götüren heyete faks metni göstermeyi müteakip ciain bizimle biriminin başındaki yetkiliden türkiyedeki gazeteciden ikisi tıpatıp ifadesini kullanması mektupların içeriğini cia yetkilisi türkiyeden gönderen gazeteci söylüyorlar amerika olmadan türkiye müzakereleri doğrudan yürütmeyin türkiye aldatır amerika hukukunuzu korur müzakerelerde amerikanın varlığını şart koşun diyorlar şeklinde açıklamada bulunulması sebebiyle pkk kck pyd ypg sdg terör örgütünün geleceğinin teröristbaşının yapacağı çağrıda abdnin vereceği karara bağlı aşikardır sonuç htş kaynaklarına pyd ypg sdgli teröristlerin suriye ordusu içerisinde belirli kolordu adı altında yeniden yapılandırılması görüşmelerinin devam ebu muhammet colani ismi ahmet el şaraanın ypg pkkya bağlı sdgnin suriye ordusuna katılması yönünde çalışmalar yürütüleceğini açıkladığı süreçte teröristbaşı öcalanın pkknın suriye kolu pyd ypg sdgli teröristlere silah bırakmaları çağrısında bulunmasına gerekçe ihtiyaç duyulmuştur
silkeleme hikayesi stanbulda sgk akpli belediyeden aldığı arsayı satamadı,cumhurbaşkanı tayyip erdoğan çalışma sosyal güvenlik bakanı vedat işıkhana belediyelerin sgk borçlarına yönelik talimat vermiş kendilerini kararlı silkelemende fayda demişti günden chpli belediyelere yönelik silkeleme başladı sizlere sgknın akpli belediye silkelendiğini anlatacağım spotu vereyim akpli esenler belediyesinin borçlarına karşılık sgkya yaklaşık dolara sattığı arsayı sgk geçen kasım ayında dolara satamadı açalım sayıştay raporuna yansıyan bilgilere akpli esenler belediyesi mart 2019 tarihinde mülkiyetindeki 11 metrekarelik arsayı oruç reis borçlarına karşılık sgkya 41 601 112 tlye sattı mar planlarında kamu eğitim tesisi alanında kalan 1082 ada 28 parseli sgk 20 kasım 2024 tarihinde 225 muhammen bedelle satışa çıkardı ihaleye teklif veren çıkmadı sgk alacağına karşılık esenler belediyesinden söz konusu arsayı günkü kur üzerinden 627 74 dolara satın almıştı kurum arsayı satmak 225 tl bugünkü kurla 379 178 dolar bedel belirledi ifadeyle sgk aldığı arsayı yaklaşık 248 dolar ucuza satışa çıkardı alıcı bulamadı belediye cami okulu borcuna karşılık sattı sayıştay raporundan okuyalım esenler belediyesi 2018 yılında vergi borçlarına karşılık cami okulu maliye hazinesine sattı camilerden sgkya sattığı arsanın bitişiğinde bulunuyor yaklaşık 600 metrekarelik parsel kurulu bulanan hz hatice camini 29 813 190 tlye oruç reis mahallesinde atışalanı bulunan mimar sinan camini 10 754 480 tlye menderes mahalleside bulunan hasip dinçsoy lkokulunu 16 81 125 tlye hazineye satan esenler belediyesi kemer mahalleside bulunan 11 455 metrekarelik arsayı spor bakanlığına 30 tlye verdi 2019 belediye seçimlerinden yaklaşık ay 27 şubat 2019 tarihinde belediye hizmet alanında kalan kemer mahallesindeki arsayı 12 411 485 tlye bbye sattı esenler belediyesinin söz konusu gayrimenkulün satış tarihindeki dolar kuru karşılığı günümüzde yaklaşık 867 tl tutuyor sgk aldıklarının 8ini satabildi belediye sgkya borçlarını arazi vererek kapattı sgk aradan onca geçmesine söz konusu arazilere aldığı fiyattan alıcı bulamıyor durum sayıştay raporu tespit edilmiş durumda sayıştayın eylül 2024te yayımlanan sosyal güvenlik kurumu 2023 yılı sayıştay denetim raporunda konuya dikkat çekiliyor raporun prim borcuna karşılık satış amacıyla alınan taşınmazların nakde dönüştürülememesi başlığını taşıyan bulgu konunun vahametini ortaya koyuyor lgili bölümde özetle deniyor 2023 yılı sonuna toplam 636 taşınmaz alınmıştır kapsamda alınan taşınmazlar hizmet alınanlar bulunsa taşınmaz satılmak amacıyla prim borcuna karşılık nakit elde etmek amacıyla alınmıştır söz konusu taşınmazların alış bedeli toplam 250 046 914 60 tl belirlenmiş karşılık kurum alacakları terkin edilmiştir kurumun geçici 41inci madde kapsamında satmak amacıyla aldığı taşınmazların sayısı yıllar itibarıyla giderek artmakta satışı gerçekleştirilen taşınmaz sayısı artmamaktadır 2012 yılından madde kapsamında satış amacıyla alınan taşınmazların neredeyse üçte birinin satışı gerçekleştirilmekle birlikte taşınmazların alım bedelleri itibarıyla değerlendirildiğinde alınan taşınmazların 8i satılabilmiştir kurum taşınmazlarının elektronik ortamda satışına ilişkin gerekli mevzuat düzenlemesi yapılmasına 2023 yılı sonu itibarıyla satış sürecini uzatan problemlerle karşılaşılmıştır
soros htş yazılan rapor,george soros kurulan açık toplum vakıfları hak eşitlik adalet çalışan bağımsız gruplara dünyanın özel fon sağlayıcısıdır bağışları vakıflarının ötesine geçerek global witness uluslararası kriz grubu avrupa dış lişkiler konseyi ekonomik düşünce enstitüsü bağımsız örgütleri destekliyor turuncu devrimlerin mimarı sorosun açık toplum vakfının bağımsız gruplara verdiği destek vakfın internet sitesinde duyurulmuş destek verilen gruplardan uluslararası kriz grubu icg belçika brüksel merkezli icg 1995 yılında kurulmuş küresel kar amacı gütmeyen hükümet dışı kuruluştur politika yapıcılar akademisyenler kullanılan küresel krizler araştırma analizler yürüten düşünce kuruluşudur savaşları önlemek barışçıl dünya inşa politikalar oluşturmak çalışmaktadır kendilerini liberal tanımlamışlar icg sorostan bahsettim önümde noah bonsey dareen khalifa imzalı rapor duruyor raporun tarihi şubat 2021 suriyenin dlib kentinde washingtonın terörle mücadeleyi yeniden tasarlama şansı başlıklı çalışmada suriyenin liderliği htşyle çarpıcı tespitler yapılmış htşnin abd srail batıyla kavga etmediğinin raporu diyebiliriz n oah bonsey dareen khalifanın hazırladığı raporda deniyor biden yönetimi washingtonın aşırı militarize edilmiş dış politikasını düzeltmeyi hedefliyorsa abdnin terörle mücadele stratejisini yeniden tanımlamak fırsatı abd yetkililerinin zamanlar 11 eylülden yana el kaide güvenli limanı tanımladığı bölge dlib dlibin baskın isyancı grubu eski el kaide üyesi htş ulus ötesi cihatçı ağlarla bağlarını kopardı suriyenin geleceğiyle siyasi angajman alanına girmeye çalışıyor teoride gelişme yenilenen şiddeti önlemek fırsatlar açmalı pratikte htşnin terörist örgüt devam statüsü abd rusya bm güvenlik konseyi türkiye tanımlandığı engel teşkil biden yönetimi htşyi yerel uluslararası temel endişeleri ele alacak fazla eyleme zorlamak karşılanırsa htşnin terörist etiketinden kurtulmasını sağlayabilecek net ölçütler tanımlamak avrupa müttefikleri türkiye birlikte çalışmalıdır raporun özetinden anlaşılıyor soros destekli icg htşnin suriyede rol model olacağı konusunda net htşnin geçmişine yönelik endişeleri anlatan raporun yazarları ahmet el şaraya colani şans verilmesini istiyor abd yönetimine çağrıda bulunuyor colaninin anlattığı saldırı iddiasını gündeme getirmişler yakın zamanda yaptığımız sohbette el culani hikayenin versiyonunu anlattı uluslararası saldırıları reddetmesinin işid lideri ebu bekir el bağdadiyi çevreleyen radikal çevre arasında el nusranın 2013te irak liderliğindeki örgütten kopmasından fay hattı ortaya çıktığını söyledi el culani benzer düşünen müttefiklerinin işi din stanbuldaki suriye muhalefeti toplantısını bombalama talebini reddettiği durum ortaya çıktı rapordan anlıyoruz colani stanbulda işi din suriye toplantısını bombalama önerisine çıkmış raporun sonuç bölümünde değerlendirme çarpıcı nato ülkelerinin sonunda htşyi terör örgütü görmeyi etiketlemeyi bırakması bmde benzer değişikliği desteklemesi bölgenin geleceği hakkında htş görüşmelere girmesi htşnin yapması gerektiğine dair ortak standartlar tanımlayın potansiyel faydalar dezavantajlardan açıkça ağır basıyor açık koşullara dayalı yaklaşımdaki riskler asgari düzeyde görünüyor abd avrupa doğrudan görüşmelere koşullu teşviklere kapı açarak anda sahip olmadıkları suriyenin bölgesinde nüfuz nüfuz kazanacaklardır yaklaşım washingtonın diplomasi öncelikli terörle mücadele politikası araçlar tanımlamasına test etmesine yardımcı olacaktır sonuç george soros destekli icgnin şubat 2021 tarihli raporu açık
hakan fidanın şifreli mesajı,dışişleri bakanı hakan fidan ulusal uluslararası medya kuruluşlarının temsilcileriyle stanbulda düzenlenen toplantıda konuştu örgütün ülkeyle ilişkisi istihbarat servisiyle operasyonel ilişkisi ülkenin askeri yapısıyla ilişkileri sızılmış manipüle edilmiş örgütün liderlerinden talimatla derece güçlü refleksi olabilir sorun alanı geçmişte örgüt liderliği talimat verdi silahları bırakın çıkın yönde çıkış başladı suriye meselesi bahane edilerek durdurdular yaklaşık 11 senaryoyla karşıyayız dinlerler tercihleri 10 ocak 2024 stanbul açıklamalardan geriye döndüm abdullah öcalan 2013teki nevruzda terör örgütüne ateşkes çağrısı yapmıştı silahlar sussun fikirler siyasetler konuşsun noktasına geldik sayan inkar dışlayan modernist paradigma yerle çağrıma kulak veren milyonların şahitliğinde diyorum dönem başlıyor silah siyaset öne çıkıyor silahlı unsurlarımızın sınır ötesine çekilmesi aşamasına gelinmiştir yüreğini açan davaya inanan sürecin hassasiyetlerini sonuna gözeteceğine inanıyorum çağrıya uyulmadığını gördü devam edelim 12 ocakta cumhurbaşkanı başdanışmanı mehmet uçum terörsüz türkiyeye hal şartta ulaşılacaktır başlıklı sosyal medya paylaşımı uçumun tespitlerin şifresini çözelim şi fre1 lk dikkat çeken aşamayı müzakereymiş gösterme çabası mralı görüşmesi üzerinden politik şovlara yeltenilmesi konuya aktörler katma girişimi tarihi fırsatı tahrip tutumlardır cümlelerde dem heyetinin pervin buldan sırrı süreyya önder mralı sonrası mecliste grubu partilerle görüşmelerin müzakere pazarlık şov ekseninde yürütüldüğüne ilişkin eleştiri eleştiriyse konuya aktörler katma girişimi cümlesinde selahattin demirtaşın ismine dikkat çekiliyor şi fre özetle terörün sona ermesine yönelik devlet inisiyatifi nettir terör anlamda mecrada devamlı surette sonlandırılacaktır konuyla ilişkisi yoktur müzakere pazarlık söz konusu değildir terörü sona erdirmek mutabakat aramak komisyon kurmak yasama yetkisine atıf abestir işi yokuşa sürmektir mehmet uçumun tepkilerinden chpnin mecliste komisyon kuralım önerisine noktada beştepe mhp silaha verilsin örgüt lağvedilsin sonrasında neler konuşulacak masaya yatırılacaktır çizgisinde edirne ziyaretine uzanalım edirnede hapis yatan selahattin demirtaşın dem heyetini ziyaretinden açıklama çarpıcı demirtaşın cümlelerin çizildi örneğin barış dilinin çevrelere hakim önemlidir konularda konuşan tehdit şantaj aşağılama dilinden provokatif söylemlerden uzak durmak yenme yenilme üzerinden boş anlamsız retorik oluşturmak hepimizin kazanacağı ortak gelecek üzerinde durmalıdır tespitlerin adresi cumhur ttifakı iktidar cenahı terör yenilmiştir açıklamasını sık sık hdpnin eski lideri yenme yenilme üzerinden boş anlamsız retorik oluşturmak demirtaş bizler barış girişimlerine aşamada türlü desteği sunarız çağrıyı olası çağrının muhatabı değiliz temel sorumluluğumuz demokrasi özgürlükler eşitlik adalet temel insan hakları barışçıl sivil siyasi mücadeleyi büyütmektir mücadelenin kanal imkanlarının şimdiden açılması gerekir barış zemini güçlensin hususu ilgililerin dikkatine sunmak isteriz demirtaşın mesajı okundu içeride olmam destek vereceksem kanal imkanlar açılmalı kararı verecek beştepe devlet bahçeli bakalım demirtaşın önü açılacak
