Başlık,Metin
sayfalık savunmada gazetecilik hayat dersi,1904 yılında the north american reviewde yazdığı makalesinde adına ödül verilen gazeteci joseph pulitzer der cumhuriyetimiz gazeteleri beraber yükselir beraber çöker hakları bilen zekayla uygulayan çıkarcılıktan uzak bağımsız kamusal hizmet bilinçli basın kamusal erdemi koruyabilir erdem olmadan hükümet sahtekar alaycıdır sinik çıkarcı demagojik basın zamanla benzeyen insan yığını üretir örneğin eylül 2019 güldal mumcu uğur mumcu öldürülmeden zamanki t müsteşarı teoman koman gazetecileri te davet ti gezdiriyor sırada aranızdan öldürülecek basında yer aldı ülkenin t müsteşarı aranızdan öldürülecek diyorsa öldürüleceğini öldüreceğini biliyor demektir demişti açıklamanın peşine düşen gazeteci önceki akşam tahliye edilen halk tv genel yayın yönetmeni suat toktaşın çağlayanda savunmayı okuyalım gazetecilik dışında çıkmaz öne çıkmam ekrana koşmam tweet atmam sosyal medyada kendimi sergilemem dediğim gazetecilik dışında çıkarılamaz politik kimliğim duruşum fikrim tek sadakatim haberdir haberciliktir politik kavgaların haberci slogan atan taraftarı yansıtan aktaran gazeteciliktir yerim gazeteci kimdir basit tanımıyla güncel toplumu ilgilendiren olay olguları araştıran belge bilgiye dayanarak görünürdeki gerçekliğe uygun yorumunu katarak toplumun ilgisini çekebilecek konular hakkında toplumun merak konular hakkında kamuoyunu bilgilendirmek amacıyla gazetecilik etik kurallarına uygun haber yapan kişidir haber kanalı nedir 18 saat canlı yayın yapan zamanla kanallarla yarışan nefese koşturmadır sıradan günlerde 100 karar verirsiniz krizli zamanlarda 300ü bulabilir 500ü kararınız zorundadır nsanlık dışı hayattır haber kanalında çalışmak 24 saatlik günlük dilimin saniyesinde haber değeri taşıyan birden olay meydana gelirken gazeteciler yaşanan olayları tarafız olaylar haber değerini yitirmeden hızlı kamuoyu paylaşan haberi yapan zamanla rakiplerinle sürekli yarış halinde olmaktır haber kanalları gazete değildir tımarhane derim haber kanallarına gazete değildir haber kanalları dönüp dönüp yazdığınızı kontrol edemez varsa düzeltemezsiniz haber kanalında canlı yayında anda haberi hızlı ekrana vermek başarı kriteridir sebeple olma rekabetinde saniyelerle yarışırsınız canlı yayında haber ekrana yansıdığı anda geri dönüşü yoktur kazada kişi ölmüşken kişi duyurursanız kişiyi tekrar diriltemezsiniz haber kanalında verilen karar zorundadır hayat yürür ekibinizden kaynaklanan hatalar ekrana yansıyabilir hızla düzeltmeye çalışırsınız isteyen hata bakabilir isteyen altında niyet arayabilir acımasız denetim saldırı altında çalışırsınız sonuç bilirkişinin ses kaydını yayınladığı silivride 34 hapis yatan gazeteci suat toktaşın sayfalık savunması iletişim fakültelerinde okunmalı tartışılmalı
futbol yuvarlaktır,uruguaylı sosyalist gazeteci yazar eduardo galeanonun cümlelerini mırıldanırım basit iyi futbol dilencisiyim elimde şapkam dünyanın yanını geziyor stadyumlarda yalvarıyordum tanrı rızası güzel maç lütfen iyi futbol görsem seyrederim futbolla derinlikli kitap bulursam okurum pazar sizleri okuduğum futbol yuvarlaktır nihat özdal kırmızı kedi yayınevi kitabıyla buluşturmak istedim haydi başlayalım kitabın önsözünü usta şair yazar enis batur yazmış eeee baturun önsözünü yazdığı kitap okunur futbolun incelikten yoksun spor türü sayılmasına katılmıyorum teknik hüner organizasyon ekip çalışması açısından bakıldığında ince spor dalıdır futbol şostakoviç bestecinin takımının maçını izlemek trenle moskovadan baküye gitmesini gerekçelere dayandırmak şart değildir edebiyatımızda orhan kemalden haldun tanere ülkü tamere sıkı fıkı olmuş örneklere kuşağın önde şairi nihat özdal katılıyor futbol yuvarlaktır güçlü serbest vuruş kalede kafka teknik direktör nazım hayal kurduran yazar özdal kuruyor adı dünya edebiyatı futbol kulübü kaleci franz kafka dünyanın absürtlüğüne baskıya dirençli duruşuyla kalede sağlam bekçi olurdu defans ernast hemingway güçlü keskin doğrudan tarzıyla defansın sağlam kalesi defans leo tolstoy nsan doğasını derinlemesine anlama yeteneğiyle rakip atakları öngörür defans virginia woolf derin düşünceli keskin sezgileriyle defansın stratejik yönünü güçlendirir defans edgar allan poe katanlık gizemli tarzıyla rakipleri şaşırtır orta saha william shakespeare oyun kurucu oyunun yönünü ustalıkla yönetir orta saha gabriel garcia marquez gerçekçilikle oyunu dönüştürebilir beklenmedik oyun açılımları yaratır orta saha jane austen toplumsal zekasıyla oyunu okur mükemmel paslar dağıtır forvet dostoyevski nsan ruhunun derinliklerinden güçlü vuruşlar yapar forvet charles dickens hikayelerindeki karmaşık savunmaları aşacak stratejileri geliştirir forvet sylvia plath keskin güçlü dil kullanımıyla rakip savunmayı sarsar kursanız kimleri yeşil çimde görmek isterdiniz örneğin şair küçük skender 11i kurmuş kaleye yahya kemal geçsin defansa necip fazıl behçet necatigil melih cevdet oktay rıfat orta sahaya edip cansever sezai karakoç ece ayhan ileriye attila lhan lhan berk cemal süreya sık sık tribüne gönderileceğini biliyorum teknik direktör nazım hikmet gol şiirseldir futbol hayattır örneğin şair ahmet erhanın futbolcu futbolu bırakmak zorunda kaldığını biliyor muydunuz adana demirsporda oynardım futbol adıyamanın sağ beki kaval kemiğime girişti kırıldı kemiğim küsme huylarım vardır sonuçta futbola küstüm anda şiirle benzer mecra üzerinde gibiyim kitapta şiiri bırakıyorum futbolda anlar şiirseldir golden devam edelim gol anını taraftarlar sanatsal deneyim yaşar gol oyunun naratifinde dönüm noktası sunar tıpkı etkileyici sanat eseri izleyiciler üzerinde derin etki bırakır pier paolo pasolini futbolda anlar yalnızca şiirseldir gol anları gol buluş kod ihlalidir gol kaçınılmazlık parıltı hayret geri dönülmezlik taşır şiirsel kelime yılın gol kralı yılın iyi şairidir gol atılan maç şiirsel olanıdır futbol kolektif oyun paylaşımcı yeteneğiyle öne çıkanlar yıldız takım oyununda olurlarsa messi arjantin milli takımında zayıf barcelonada efsane futbolun siyasetle ilgisi geçici ittifaklar sürekli rekabetler oyunu tıpkı siyaset toplar sahalar söz futbol temsil hayattır
pkk ypg sraili güvence gördüğü almadı,açıklamayı derinleştirelim birinci açıklama abdullah öcalanın gruplar silah bıraksın açıklamasının ardından omurgasını terör örgütü pkk ypgnin oluşturduğu suriye demokratik güçleri sdg adına konuşan mazlum abdi çağrının suriyedeki kürtlerle olmadığını türkiyenin iç politikasıyla olduğunusöyledi washingtondaki basın kulübünün toplantısına video konferans yoluyla katılan abdi ifadeleri kullandı çağrı doğrudan bölgemiz değildi pkk türkiye arasındaki ilişki barışın sağlanması bölgemiz üzerinde etkili olacaktır kinci açıklama pkk pydnin eski eşbaşkanı salih müslim al arabiyaya açıklamada abdullah öcalanın açıklamalarına katılıyoruz siyasi grup faaliyet göstermemize izin verilirse silah bırakacağız mazlum abdiyle salih müslim arasındaki çelişkiyi fark etmişsinizdir çağrıyı almadı diğeriyse olumlu karşıladı açıklamaları ypg srail ilişkisi üzerinden okuduğumuzda anlamlı olabileceğini düşünenlerdenim not öcalanın çağrısına çağrı doğrudan bölgemizle değildi yanıtını veren abdi pyd ypg homurdanmalar abdullah öcalanı dinlemiyor eleştirileri yapıldığı iddialar arasında lk tarihsel bilgiyle paylaşalım srail devleti 1948 yılında kuruldu arap srail savaşı sırasında kürt nüfusun yoğunlukla yaşadığı bölgelerdeki yahudi kürt nüfusu yaşanan sorunlardan sraile göç açık kaynaklara sraildeki 200 ila 500 arasında tahmin edilen kürt nüfusun kökleri topluluğa dayanıyor 1961 1970 arasında yaşanan eylül ayaklanması adı verilen savaş sırasında srail iraka savaşan baba mustafa barzani güçlerine destek vermişti srail dönemde peşmergeye askeri eğitim vermiş baba barzani bildiğimiz kadarıyla sraili ziyaret etmişti bitmedi irak hatırlanacağı 2003 yılında amerika işgal edildi saddam hüseyinin devrilmesinin ardından srail kürt bölgesiyle temaslarını artırdı bölgeden çıkarılan ham petrolün yarısının sraile satıldığı biliniyor baba barzaniden 2017ye irakın kuzeyini yöneten mesut barzani srail ilişkileri olumlu seviyede tuttu bildiğimiz srail başbakanı netanyahu irak kürdistanının bağımsız gerektiğini söyledi bugüne gelecek olursak neçirvan barzani iktidarında sraille ilişkiler üst seviyede diyebiliriz 2017 yılında bölgesel parlamento alınan irak merkezi hükümeti tanınmayan bağımsızlık yolundaki kararı destekleyen sraildi uzmanlara srail kürtleri düşmanlarıyla arasında tampon görüyor buradan çıkarılan ham petrol yakıta ihtiyacı srailin kaynaklarından unutmayalım 28 eylül 2024te kölnde öcalan düzenlenen mitingde srail bayrakları açılmıştı 10 kasımda erdoğanın suriye irakta pkkya yönelik kara operasyonlarına hazırlanıldığı açıklamasından hemen srailin dışişleri bakanı gideon saar kürtler siyasi bağımsızlığı milletlerden yahudilerin doğal müttefiki saar aralık ayında srail kürtleri savunmak askeri eylemde bulunmamış desteklemek ahlaki diplomatik zorunluluktur kürtler batı yanlısı dost gruptur yanında durmalıyız ocak 2025 tarihli rudawın haberini hatırlatmakta fayda srail basını dışişleri bakanı saarın rojava özerk yönetimi yetkililerinden lham ahmed telefon görüşmesi gerçekleştirdiğini bildirdi srailin gazetelerinden srael hayom srailli yetkililere dayandırdığı haberinde dışişleri bakanı gideon saarın doğu suriye özerk yönetimi dışişleri büro eşbaşkanı lham ahmed arasında kapsamlı telefon görüşmesi gerçekleştirildiğini duyurdu bölgedeki gelişmelerin ele alındığı görüşmede ahmed suriyedeki silahlı gruplar kürt vatandaşlara yönelik keyfi tutuklamalar infazlar hakkında bilgi verdi bakan saar uluslararası meslektaşlarıyla diplomatik görüşmelerde kürtler hakkındaki endişelerini dile getirdiğini belirtti 25 şubatta srail hükümeti dışişleri bakanlığının sdgnin kontrolündeki bölgelerin suriyede kürtlerin haklarının desteklenmesi yönündeki mesajları sorulan mazlum abdi yanıtı vermişti doğruydu yerinde tutumdu politikalarıyla açıklamalarını takdir ediyoruz mazlum abdinin temsil örgütlenme sdg pkk ypg srail abdye güveniyor geçen hafta ukrayna lideri zelenski neler yaşadı amerikan dış siyasetinin ete kemiğe bürünmüş hali kabul edilen abdnin eski dışişleri bakanı henry kissingerın ünlü amerikanın düşmanı tehlikeli olabilir dostu ölümcüldür sözü hafızalarda türkiye suriye konusunda amerika masaya oturmadı bakalım süreç evrilecek
çayırhan germi naldir,nisan güneşi toprağı ısıtıyor vadilerden hayat fışkırıyor tomurcuklar patlıyor ekinler yükseliyordu yandan tohumlar şişiyor uzuyor toprağı deliyordu arkadaşlar tekrar tekrar yüzeye yaklaşmışlar berrak vuruyorlar vuruyorlardı nsanlar yetişiyor kara kin dolu ordu asır sonraki hasada hazırlanıyor tohumlarını patlatıyordu emile zolanın başyapıtlarından 1860larda kuzey fransada maden işçilerinin gerçek grev öyküsünü anlatan germinalden alıntıyla başladım yazıma ankaranın nallıhan ilçesi germinaldir nallıhandaki çayırhan termik santrali santrale kömür sağlayan maden ocaklarının satışına geçen kasım ayından yana mücadele enerji maden işçisinin ankara yürüyüşü önceki hazine maliye bakanlığı önüne basın açıklamasında bakan mehmet şimşeke yanlıştan dönün sonu varırsa varsın mücadeleden vazgeçmeyeceğiz mesajı verildi marksist iktisatçı prof dr korkut boratav küreselleşme emperyalizm yerelcilik işçi sınıfı kitabında küreselleşme emperyalizmin adı tespiti birinci yenilik kuruluş örgütlenmelerin imf dünya bankası oecd g7 kapitalist dünya sisteminin tümünü kapsayacak üstyapılar biçiminde roller üstlenmiş olmasıdır kinci yenilik üçüncü dünya ülkeleri üzerinde icra edilen etkilerin yönüne ilişkindir ana hedef ulusal ekonomileri devletsizleştirmek küreselleştirmek olmuştur üçüncü dünya devletlerinin ekonomik sosyal politikalar alanlarında anlamıyla hükümran sayılamazlar çayırhanın özelleştirilmesiyle maden mühendisleri odasıyla görüştüm ulusal ekonomileri devletsizleştirme anlayışına karşılar şçilerin geleceği sayılıyor kısa bilgi özelleştirme ilanında santral kısmında 751 işçinin kömür sahası kısmında 1393 işçinin çalıştığı beyan santral tarafında çalışanların statüsü bilinmemekle birlikte kömür sahasında çalışan işçilerin kömür şletmeleri anonim şirketi aş işçisi sendikalı bilinmekte özelleştirme dosyasında işçilerin gelecekleri hakkında olumlu madde bulunmadığı adeta sayıldığı eylem yapan işçilerin sendika yöneticilerinin ifadelerinden anlaşılmakta şçilerin haklı eylemi kamuoyunun gündemine çözümlense kömür havzasında plansız bölünmeler nedeni oluşacak problemler devam havzanın çayırhan tarafında özelleştirmeye saha öi b sayfasında 131 ton rezerv 620 mw elektrik santrali havzanın mihalıççık tarafında tmsf özelleştirilen koyunağılı sahası yaklaşık 40 60 ton rezerv 290 mw elektrik santrali bulunmakta koyunağılı sahasında mevcut kömür rezerv kalite itibarı santral yeterli uygun olmadığından santralden kapasitesine uygun elektrik üretimi yapılamamakta maden mühendisleri maden mühendisleri odasının yaklaşımı madencilik enerji üretimi kamucu anlayış bütünlüklü bakış açısı devlet yapılmalı bölgedeki kömür sahalarının plansız parçalanması kaynak israfına gereksiz elektrik santrallerinin hesapsız anlayış sonucunda oluşan maliyet yoksul halkımızın sırtına yüklenmekte sorulara yanıt istiyorlar çayırhan termik santraline yenileme yatırımları bedelle yapılmıştır koyunağılı santral sahası slovakyadan alınan krediler tutarda ödenmiştir geçiş dönemi 2020 2024 kasım arasında aş firmasına doğrudan verilen kömür üretimi işi bedel ödenmiş karşılığında elektrik üretim anonim şirketi eüaş elde edilmiştir sözleşmesi sonlandırılan çayırhan sahasında yükümlülüklerini getirmeyen firmalara yaptırım uygulanmıştır uyarılarımıza yukarıda kısmı belirtilen plansız uygulama yatırımların toplam maliyeti nedir karşılanmıştır koyunağılı sahasında rezerv kalite sorunu nedeni santral dürüst çalışamazken sahanın ihalesinin anlamı nedir özelleştirme uygulamaları çabalarından vazgeçip havzadaki toplam rezerv yaklaşık 180 200 ton toplam 910 mw 620 290 santral gücü proje değerlendirilip maksimum verim alınması mümkün iken özelleştirmede ısrar edilmesinin arkasında vardır
mamoğlu ülkeyi kiminle yönetecek,31 mart 2024 yerel seçimleri öncesi afişle donatılmıştı stanbul işin sağı solu aklın yolu mamoğlu geldik 2025e 23 martta cumhurbaşkanlığı adaylığı açıklanacak mamoğlunun yoluna sayın mamoğlu gazeteleri ziyaret hadi söyleyeyim karar gazetesini ziyaret hadi adını vereyim karar yazarı ali bayramoğlu soru yöneltiyor vizyonunuz nedir kürt sorunu vs mamoğlu yanıt veriyor danışmanlarım heyetle ülkeyi yönetiriz önceki akşam tv100de katıldığım canlı yayında cümleleri akademisyen ufuk uras kurdu urasın bilgiyi vermesinin nedeni programda yaptığım tespitler öncesinde kaleme aldığım yazıydı yazıda demiştim chp adayını erken belirliyor chp üst yönetiminin bakış açısını ankara koridorlarında gezerken öğrendim diyorlar öncesinden programıyla çalışma arkadaşlarıyla halka umut veren isim çıksın halkı ikna etsin mamoğlu olabilir yavaş şubat 2025 gazetesi bilgi tespitlere tv100 yayınındaki chp eski milletvekili turan aydoğan itiraz partinin programı söyledi önceki ekrem mamoğlunun gazeteci smail saymaza verdiği röportaja baktım mamoğlu yol haritanız olacak sorusuna yanıtı verdi meseleye bakarım hafta 23 marta gerekenler parti programı sürecinin nisan mayıs yakın planı içine alan çalışma düzeni sonrasında muhalefeti siyasi partiler sivil toplum kuruluşları ekseninde içine alan müzakerelerin tabiri caizse hükümet programı oluşturmaya dönük planının tasarlanması çerçevesinde önümüzdeki sonbaharı bulabilir kademeli aşamalı biçimde toplumla paylaşılır hareket edildiğinde türkiyenin görmediği hassasiyet içerisinde halkımızın önüne sunulacağına kanaatim nettir sürecin öndeki destekçisiyim umarım yakın zamanda aday belli kabineniz temel politikalarınız ilan gayet diliminde olgunlaşacaktır ana gövdesinin chp muhalefetin erklerinin araya geldiği kurumsal yapılanma türkiyenin önüne güçlü kadro yapısını koyacaktır kapsayıcı olacaktır chpnin cumhurbaşkanı adayı önümüzdeki yaz ayını sonbaharı anlatmış gösteriyor mamoğlu ekibi çalışmalarını yapmış programını oluşturmuş yaz ayında gazetecilerle akademisyenlerle aydınlarla iş dünyasıyla dizi toplantılar yapılacağı net soru mamoğlu danışmanları heyetle ülkeyi yönetecek chp üst yönetiminin çizeceği rotada ilerleyecek geriye döndüm ufuk urasın işaret karar gazetesi ziyaretinde mamoğlunun söylediklerine baktım 23 eylül 2024te cümleleri kurmuş chp merkezde durmalı partimiz merkezde duruyor sağ sol görmemek lazım kişisel merkezi temsil ediyorum kendimi türkiyenin merkezinde görüyorum chp tabanı bizimle düşünceyi paylaşıyor yüzden mansur beye önem atfediyorlar kendimi türkiyenin merkezinde görüyorum vurgusunun altını çizelim ekrem mamoğlunun yakın çevresi seçim chpde olacak mamoğlu türkiyenin adayı olacak sağdan soldan muhafazakar kürt cenahından oy alacak stanbul modeli unutulmaması gereken önümüzde uzun zamandır muhalefetle hareket dem parti kartı chpnin mamoğlunun elinden alınırsa konuyu yazacağım
toktaşın savunmasında yargitay kararı,barış pehlivan yayınlanacağını bilmiyorum demektedir anlık reflekstir ismi geçen kişi arıyor konuşmaya başlıyor barış gazetecilik faaliyeti yürütmüştür taraf yayınlamayın dememiştir kürşad oğuzun kaydettiğini biliyorum gönderdi sonrasında ses kaydı geldiğinde bilirkişi konuştu dediğinde barış yazmaya başladı ses kaydını alıp montaja gittim barışa zin dava açar sordum 38 yıllık gazeteciyim 56 yaşındayım yaptığım işin sorumluluğunu taşırım barış ağabey gazeteciyiz cevabını verince izin dahilinde düşündüm dakika ekrana verildi kısa ses kaydıdır konuşmanın dokunmadık zin dava açar gazeteciyiz ağabey yayınlıyorum kısmı dakikalık meseledir sonrasında metin yayınlasan iyi ağabey dava açar cevabını aldım dakika olmuştur gazetecilik yaptım halk tv genel yayın yönetmeni suat toktaşın ifadesi stanbul büyükşehir belediye bb başkanı ekrem mamoğlunun chpnin davalarında olduğuna dikkat çektiği bilirkişi s b konuyla ses kaydını halk tvde yayımladıkları gerekçesiyle bilirkişiyi etkilemeye teşebbüs kişiler arasındaki konuşmaların dinlenmesi kayda alınması suçlamasıyla haklarında başlatılan soruşturma kapsamında kanaldan alınarak ifadeye götürülen halk tv genel yayın yönetmeni suat toktaş kaçma saklanma delilleri etme şüphesiyle tutuklandı toktaşın avukatlığını yapan lkay sezer yargıtayın aldığı kararı savunmasında kullanmış neydi yargıtayın aldığı karar televizyonda yorumculuk yapan rasim ozan kütahyalı 30 eylül 2013te yayınlanan programda dönemin milli futbol direktörü fatih terim galatasaray spor kulübü başkanı ünal aysalın aralarındaki mesajlaşmayı canlı yayında ekranlara göstermişti ünal aysal aralarındaki mesajlaşma şeklindeki konuşmanın basına yansıması fatih terim avukatı rezan epözdemir aracılığıyla haberleşmenin gizliliğinin ihlal suçundan şikayetçi olmuştu stanbul 28 asliye ceza mahkemesinde görülen davada 31 mayıs 2016 tarihinde karar çıkmıştı davayı karara bağlayan mahkeme kütahyalıya hakaret suçundan 150 lira adli para cezası verdi kütahyalıyı kişiler arasındaki haberleşme içeriklerini hukuka aykırı ifşa etmek suçundan hapisle cezalandıran mahkeme sanığın pişmanlık göstermemesi cezasında indirim erteleme uygulamadı kütahyalı aysalın avukatları karara itiraz davayı yargıtaya taşımıştı temyiz incelemesi yapan yargıtay 12 ceza dairesi yerel mahkemenin verdiği kararı ölçüsüz bularak kütahyalı aysal lehine bozmuştu kütahyalının sözlerinin yorumlarının ifade özgürlüğü kapsamında kaldığı belirtilen yargıtayın kararında denilmişti galatasaray başkanı sanık ünal aysalın eylem gündemde kamuoyunun ilgisinde zıt açıklamaların yapıldığı ortamda sanık söyleyip söylemediği yönünde kamuyu aydınlatmak terim aysal arasında geçen mesajlaşma içeriklerini haber vermesi eyleminde basın özgürlüğü kapsamında hareket gözetilmeden beraatı mahkumiyetine karar verildi dairemizin 10 ekim 2018 tarih 2018 1722 esas 2018 9484 karar sayılı kararında yer alan gazeteci televizyoncu sanık ın galatasaray teknik direktörlüğünden ayrılarak milli takım teknik direktörlüğüne geçen ai hm kararlarına eleştiriye katlanma sınırı geniş katılan galatasaray başkanı sanık ın eylem gündemde kamuoyunun ilgisinde zıt açıklamaların yapıldığı ortamda sanık söyleyip söylemediği yönünde kamuoyunu aydınlatmak katılan sanık arasında geçen mesajlaşma içeriklerini haber verme kurgusu ağır eleştiri sınırları içerisinde katılana doğrudan hakaret etme küçük düşürme amacı taşımadan değer yargıları içerisinde kamuoyuna sunması eyleminde basın özgürlüğü kapsamında hareket gözetilmeden beraatı yazılı mahkumiyetine karar verilmesi şeklindeki bozma gerekçesinin sonucu bakımından usul kanuna uygun olduğundan kararda değişiklik yapılmasına yer olmadığına suat toktaşın avukatı lkay sezer sorgu hakimliğine savunmada yargıtay kararını örnek gösterdi toktaşın basın özgürlüğü kapsamında hareket bilirkişiyle söyleşinin ses kaydını bağlamda yayınladığını ifade
