Başlık,Metin
çalınan dikkat,ngiliz gazeteci johann harinin yaşadıkları şuydu yaşındayken vaftiz oğlum adamda elvis presley saplantısı gelişmişti kral elvis mırıltılarla kalça sağlayarak avaz avaz jailhouse rock şarkısını söylüyordu elvis hakkında öğrenmek istiyor heyecan verici üzücü aptalca hikayeyi ana hatlarıyla çırpıda anlatıyordum gayet ciddi gözlerle bakıp johann elvisin evi gracelande götürür müsün sordu düşünmeden dedim anı düşünmedim sarpa sarıncaya geldiğimizde adam yolunu kaybetmişti yaşındayken okulu bırakmıştı uyanık saatlerin neredeyse tamamını boş gözlerle baktığı ekranların karşısında geçiriyordu whatsapp facebook mesajlarının kesintisizce akıp durduğu telefonunun youtube porno videolarının birbirine karıştığı ipadinin karşısında yaşanmaz dedim kendime adam dedim usulca haydi gracelande gidelim yıllar verdiğim sözü anımsattım gittiğimizde sırf telefonuna bakıp duracaksan geceler hariç telefonunu kapalı tutacağına söz vereceksin gerçekliğe dönmemiz gerekiyor söz verdi adam seyahatin bölümünde sözünde durmadı yaşanmaz dedim anı yaşamayı bilmiyorsun hayatını kaçırıyorsun kaçırmaktan korktuğun ekrana bakıp duruyorsun sonuçta baba oğul geziden dargın döndü gazeteci hari uzmanlar konuşarak çalınan dikkat kitabını 2022 yılında yazdı girişi yapmamın nedeni adamın yaşadığı ekran bağımlılığı ngiliz hari ailesinde dikkat becerisi günümüzde ağır hasarlı odaklanamama dikkat dağınıklığının ana sebebi ekran bağımlılığı bağımlılık dünyayı kuşattı türkiyede neredeyse evde hari ailesinde benzer olaylar yaşanmıyor evde adam önceki gördüğüm manzarayla heyecanlandım gurur duydum umutlandım anlatamam stanbul ankara zmir mersin amasya antalya muğla adana ülkemizdeki onlarca proje okulda lise öğrencileri eylem öğretmenime dokunma öğrencilerin okul bahçesine sokağa meydanlara çıktıklarından eylem yapmalarını önemsedim düşünebiliyor musunuz ekran bağımlısı sanılan lise öğrencilerinin talebi cep telefonu taşıma ipad kullanma sosyal medyaya getirilen kısıtlamalar vs değildi öğretmenlerini istemeye odaklanmışlardı ülkemizin yanında dikkatleri çalınmamış çocuklarımız demek yarına olumlu umutlu bakmayız heyhat ktidara yakın gazeteler lise öğrencilerini chpnin kışkırttığını manşetlerine taşıdı kaba kısır yüzeysel siyasi bakıştan kendilerini kurtaramıyorlar dar bakarlar çocukların eylemlerine yetişkinin liseliler gurur duyması temelde çocuklarımız hari ailesinin çocuğu adam olmayı reddediyor anlamıyor musunuz kaybetmemişiz çocuklarımızı dikkat isyanıdır can yücelden mülhem aşk çocuklar aşk yetişkinlerin eylem yapan lise öğrencilerinden çıkaracak dersi dikkat becerisinin gitgide azalması çocukların kişisel hatası yetişkinlerde ekran bağımlılığı sorunu sosyal medyada geçiriyorsunuz ortada sistematik problem mesela sosyal medya dikkat aralığını kırmak tasarlanıp özgürlük masalıyla yaygınlaştırılmış olabilir eve kapanılmayı zorunlu kılan pandemiyle ekran virüsü bağımlılık haline getirildi göremediğimiz anlamadığımız anlamamıza izin verilmeyen virüsle karşıya bırakıldık ekranlara gömülmemiz sağlandı zihinlerimiz esir köle yapan gözetim kapitalizmi deniyor anımız adımımız kontrol altında keza türlü kolektif mücadelenin önüne set çekiyor bireyci sistem demokrasiyi yozlaştırıyor sorunlara çözüm arayan bulan siyasi sorumlulardan hesap soran anayasal hak eylemliliğini suç kapsamına sokuyor nsan elinden çıkma kriz insan eliyle bulacak kuşkusuz tıpkı üniversiteliler ekran ideolojisiyle duvar arasına hapsedilmiş liselilerin sokaklara meydanlara çıkması ileriye dönük beklentiyi artırıyor açacak çiçek tohumda amerikadaki sivil haklar hareketinin öncülerinden siyahi yazar james baldwinin sözüdür yüzleştiğiniz değiştiremezsiniz yüzleşmeden değiştiremezsiniz
suriye alevileri,tarihçi hukukçu devlet adamı ahmet cevdet paşanın 1854 1884 yılları arasında yazdığı ciltlik tarih cevdet eserinde osmanlı merkezi idaresinin resmi görüşünü yazdı mesela nusayrileri aşağılayıcı üslupla ele aldı medenileştirilmesi ehlileştirilmesi gereken gizli sapkın idiler hedef inançlarının düzeltilmesi tashih akaid olmalıydı sünnileştirmek köylerine kasabalarına camiler okullar yapılmalıydı vs girişi yapmamın sebebi suriye gelişmeleri konusunda nusayriler gündeme gelmiyor getirilmiyor sayılıyorlar şin özü dünden bugüne devlet yoldan çıktığını yanlışa düştüğünü sandığı ötekini el fırak ed dâlle sayıyor aşağılamak rafizi reddedenler esatlara düşmanlığın sebebi düşünce aşırıya kaçan gulat görülen nusayri hakikati öncelikle belirteyim slam batı kaynaklarında nusayri kullanılan adlandırmaya soğuklar kendilerini alevi tanımlıyorlar müslümanlar arap yarımadasından çıktıklarında kültürler karşılaştı slama geçmek isteyenler hz muhammetin sahabelerinden arap aşiretlerinden birine yanaşıp mevali oldular nusayriler 9uncu yüzyılda irakta doğdu nanç kökleri mam sistemine inanıyor hz ali naki oğlu hz askerinin yakını muhammet ibn nusayra dayanıyordu etnik kökenleri türk müydüler nusayriler türk kökenli türk dil kurumu kurucularından kurumda ikinci başkanlık etimolojik linguistik filoloji kolları başkanlığı dil tarih coğrafya fakültesi tarih bölümünde öğretim görevlisi görev yapan hasan r tankut hatay devleti hükümetinin maarif sıhhiye bakanlığı yapan ciltlik mufassal hatay kitabını yazan türkiyeye katılımı bizzat bölgeye giderek mücadeleye katılan ahmet f türkmen atatürk kültür dil tarih yüksek kurumu üyeliği eski eserler müzeler genel müdürlüğü yapıp yaklaşık tarih makalesi yazan mehmet önder gerekse 1890larda antakya bölgesinde araştırmalar yapan antropolog felix von luschan yabancı araştırmacılar nusayrilerin türk yazdı kola mensup hatayda yaşayanlara türk alevi lazkiyede yaşayanlara arap nusayri denilebilir türkler yıllar boyunca şamanizm manicilik budhacılık mazdekçilik nesturilik musevilik hristiyanlık slam dinleri benimsedi slama geçtikten eski inanç kültürlerini aleviliğe taşıdılar tenasüh ruh göçü gaybet imamların ölmemesi ricat geri dönüş hülul imamiye yaratıcı ruhun insanda bulunması cem saz türkü bn teymiyye sünni alimlerin çıkardığı fetvalar yüzünden nusayriler kafir ilan edildi osmanlının parçalanma sürecine girdiği 19uncu yüzyıldan nusayriler siyasi açıdan günah keçisi muamelesi gördü örneğin lazkiye bölgelerde nüfusun çoğunluğunu oluşturmalarına bölge meclislerinde temsilcileri yoktu hama yerlerde nusayrilere şeriat mahkemelerinde yararlanma hukuki haklar verilmedi slamda mürted dönme görülen nusayrilerin kanuni kazanımı yoktu osmanlı nusayrilerin türk olmadığını umursamadı alevi türk kartı osmanlıda nusayrilik rakibini kötüleme aracı kullanıldı yazıya girişi ahmet cevdet paşa yaptım örneği vereyim rakip gördüğü keçecizade fuat paşanın antakyalı eşinin nusayri belirtip kulaktan dolma dedikodular aşağılayıcı ifadeler kullandı grup taife ahlâkı önemsememektedir fuad paşa babası kayınvalidesi galata mevlevîhânesi postnişini kudretullah efendiye eşi ailesi yenikapı mevlevîhânesi şeyhi osman efendiye bağlıydı can sıkıcı tarihi örnekleri sebeple veriyorum suriyede yeniden yapılanma gündemde sünni araplar kürtler yazdım çerkezler nusayri alevi türkler esatlara yönelik kindarlığın altında nusayri alevi düşmanlığı türkün türke düşmanlığı sırf cahillikten kaynaklanıyor fransa işgal döneminde nusayri devleti devlet el aleviyyun kurdu ders çıkarmıyoruz türkiyenin elinde güçlü nusayri alevi türk kartı kullanmıyor tarihi ezberlerden kurtulmak şart unutmayınız osmanlı askeri bürokrasisi kendilerini saklayan antakyalı kara mehmet paşa kilisli emin vahit efendi nusayri aleviler 21inci yüzyılda tarihi yargıları yıkmak nusayriler öz kardeşimizdir
sokağa düşmanlık,sokak kültürdür nsanın ifade etme biçiminin mekânıdır sokak siyasetten bağımsız değildir eşitsizlik farklılık görenlerin hak ettikleri duruma erişebilmek toplumsal hareketlilik başlatması demokratik toplumda yaşanır toplumsal hareketliliğin temsil mekânlarından sokak insanın araya gelerek haksız baskıcı yapıya kolektif sesin duyurulma aracıdır hoşnutsuzluğun öfkenin dışa vurumudur tiraz hakkıdır sonuçta halkın ekonomik politik sosyal kültürel yapıya şekil veren siyasete katılma alanlarından biridir sokak çeşitli sebeplerle baskı altında hisseden grupların ortak amaç araya gelmesini sağlayan sokağın çeşitli toplumsal hareketliliklere sahne olmasından kimler rahatsız sokağı kötülemek 12 eylül 1980 askeri darbesinin mirasıdır baskıcı otoriter yönetim sokak eylem yeri görüldüğü an şiddetle bastırılması gereken politik alandır 12 eylül darbesi üzerinden yaklaşık yarım asır geçti antidemokratik zihniyeti hâlâ sürdürülüyor sokak bugünkü iktidara ayna tutuyor mamoğlu operasyonuna sesini yükselten sokağı baskı altına almak göstericilere şiddet uygulamak derece demokrasi sorunumuz gösteriyor saraçhane çankaya konak anadolunun yanında aktif sokak eylemleri mamoğlunun cumhurbaşkanlığı adaylığı sandıklara giden 15 497 957 insanın gösterdiği şudur sokak hayli siyasallaşmıştır olağanüstü sayıdır türkiyede sokak siyasetinin derece gelişmesi katılımcı demokrasi adına sevindiricidir siyaseti salt parti genel merkezi duvarlarla çevrili parlamento arasına sıkıştırılmasına tepkidir sokağın 12 eylül darbesi ürünü sığ politik anlayışı değiştirme talebidir politikayı hiçleştiren anlayış aşılıyor halkın yılda oy vererek siyasete katılma yüzeyselliği buluyor tarih gösterir egemenler parti genel merkezlerini parlamentoyu etkisizleştirir sokağın gayriresmî politik potansiyeli öne çıkar siyasal alan yeniden şekillenir sokağı kolektif düşüncelerinin siyasi alanı gören kuşaklar genel başkanın gitmesi diğerinin gelmesi bıktırıcı tek adamlık siyasi anlayışına alanlar meydanlar ağırlığını koyuyor keza belirtmem ktidar milyonlarca insanın tepkisini duymamak protestocuları kriminalize etmek sokağın zamanda müzakere alanı görmek istemiyor sokak eyleminin perde arkasında üst akıl gizli senaryosunun düşünüyor gösterileri fırsatçı gizli ellerin kontrol düşünüyor hepsinin saklı hedefinin iktidarı düşünüyor siyasetin olağan akışı kafasında eylemciler kandırılıyor uyanık nedeni kültürel siyasi kodlarından kaynaklanıyor çoğunluğunu gençlerin kadınların oluşturduğu sokağın dilini çözemiyor anlamıyor itibarıyla siyasi kültür anlamında yetersiz kalıyor tek göstericileri sürekli aşağılamak sebeple tek çözüm silahı daima güvenlik güçleri ktidar şiddet dışında çözüm üretemiyor ktidar salt güce indirgenemez halktan rıza almak zorundadır sokağı susturanlar demokrasiden bahsedemez sokak meşrudur meşruiyet sesidir toplumsal hareketliliğin ülkeye yayılmasını kolaylaştıran unsur medyadır gelişen sosyal medya sokağın sesini dünyaya duyurmaktadır sokak protestocular gazeteciler sosyal medya kullanıcıları şiddete uğruyor gözaltına alınanların tutuklananların sayısı geçen artıyor ktidar hakkında savunmacı görüşe sahip yıpratmaya çalışıyorlar arkasından yoğun baskı sansür medyada olağanüstü hâl kanunları uygulanıyor ana muhalefet partisinin düzenlediği gösterileri yayınlayan televizyonlar tehdit bilinir demokratik sistemin temeli kuvvetler ayrılığına yasama yürütme yargı ilaveten dördüncü güç medya gösterilir siyasi anlayış medyaya halk adına siyasal iktidarı denetleme gözetleme bilgiyi halka aktarma görevleri vermiştir sorun şudur iktidar kamu yararını gözeten medya denetlenmek istemiyor desteklemek propaganda yapan olumlu algı oluşturan medya kurdu kuruyor yapmayan öteki medyanın sonu daima kötek dayak medyanın dördüncü güç görevini derece getirip getirmediği ülkedeki demokrasi kalitesini gösterir gazetecilere düşünürlere sanatçılara cezaevi yol yapıldığında ülkede demokrasiden bahsedilemez yaşadığımız budur bilgiye erişim kısıtlaması nsanlar sokakta şaşırıyorsunuz ülke alamaz hale geldi getirildi sokak belirsiz gidişe dikkat çekiyor inatla ders almak istemiyor iktidar mamoğlunu hapse atmak siyasi mühendislik iktidarını sürdüreceğini sanıyor
sivil haklar eylemleri,araştırmacılar ilgimi çekiyor amerikalı prof g william domhoff d 1936 bunlardan 68 kuşağı öncülerinden abdde 1954 1968 yılları arasında ülkedeki ırk ayrımcılığını ortadan kaldırma hedefli itaatsizlik eylemleri yapan sivil haklar hareketi adlı politik yapı bulundu hareketi duymuşsunuzdur lise öğrencisi 15 yaşındaki claudette colvin aralık 1955te alabamada halk otobüsünde beyaz yolcuya yerini vermeyi reddetmesi tutuklandı ay rosa parks benzer eylemi sivil itaatsizlikler ülke genelinde ilgi gördü sembolleşip büyüdü hayli ilginç eylem çeşitliliği sivil haklar hareketinin martin luther king jr malcolm x nice protestocu eylemlerle tanındı hareketin desteğiyle seçilen başkan john f kennedy 1963te suikasta uğradı hareketin önde gelenleri king jr malcolm x nice genç aktivistler katledildi yılmadılar dönemin davaları duruşmaları tarihsel önemdedir uzatmayayım 1967 abdnin yanında getto watts detroit newark isyanlar yaşanırken akademisyen g william domhoff kitabını yayınladı who rules america amerikayı yönetiyor kitabı hatırlamamın sebebi oraya geleceğim amerikayı yönetiyor kitabı dönem kıyametler kopardı satış rekorları kırdı iyi arşiv araştırmacısı yanıyla tanınan prof domhoff konuyu yıllar seri kitap yazmayı sürdürdü 1983te amerikayı yönetiyor 1980lere bakış 1998de amerikayı yönetiyor 2000 yılında güç politika 2006da amerikayı yönetiyor güç politika değişim 2010da amerikayı yönetiyor şirket sınıf egemenliğine meydan okumalar 2014te amerikayı yönetiyor şirket zenginlerinin zaferi 2022de amerikayı yönetiyor 2020lerde şirket zenginleri beyaz milliyetçi cumhuriyetçiler keza yirminci yüzyılda kurumsal zenginler güç elitleri kazandılar şçiler kaybetti ceolar düzende sınıf güç kitapları çalışkanlığı kıskanmamak elde demem bugünlerde trump yatıp trump kalkıyoruz trump kimler neler istiyor kavrayabilmek bakış açısına sahip prof domhoff kitapları kaynak abdye hükmeden seçimle amerikan hükümetleri değildir salt trump trump temsilcisi kuşkusuz para mülk sahiplerinin abdde seçkin güç kavramı üst sınıf liderliği tanımlar federal hükümete beyaz saraya kongre yürütme birimlerine nüfuz eder lobiler düşünce kuruluşları medya içi boşaltılmış sivil toplum örgütleri amaç kullanılır abddeki parti cumhuriyetçiler demokratlar ideolojik ayrılıklar üzerinden çıkarlarına uygun politikalar yüzünden kapışır vitrinde solcunun olmasına ses çıkarmazlar özgürlük balondan ibarettir çıkarları söz konusunda olduğunda hatırlanır 1776 amerikan bağımsızlığından para kimlerdeyse abdye hükmeder abd iktidarı oligarşidir küçük grup yönetilir demokrasi plütokrasi trumpa buradan bakın prof domhoff röportajı özetleyeyim amerikayı yönetiyor gelir getiren mülklerin sahipleri yöneticileri şirketlerin bankaların finansal kurumların tarım işletmelerinin sahipleri işe aldıkları yöneticilerden uzmanlardan bolca yardım alıyorlar perde arkasından gizlice komplo şeklinde yönetiyorlar komplo teorileri nedenden yanlıştır şirket liderlerinin yalan söylediği çaldığı hükümet yetkililerinin başkan dahil gizli eylemler başlattığı gazetelerden uzak tutmaya çalıştığı doğrudur faaliyetler komplo teorisiyle kastedilen değildir hükmediyorlar karmaşık hikâye kısa cevabı şöyledir lobicilik yoluyla sorunlarla genel politika planlamasına açık doğrudan katılımla siyasi kampanyalara seçimlere katılımla ölçüde kampanya bağışları yoluyla hükümette kilit karar alma pozisyonlarına ekiplerini atamalarla seçimlerin önemi olmadığını söylüyorsunuz genellikle olabileceğinden önemlidir amerikada sanayileşmiş demokrasilerde olduğundan önemlidir nedeni seçim kurallarının doğası köle sahibi güneyin benzersiz tarihidir sosyal bilim araştırmaları ilerici toplumsal değişimi etkili kılmak konusunda faydalı işlev söylüyor kişi araştırmaya dikkat
mesih garabeti,kışkırtıcı başlık başınıza iş açacaksınız diyecektir okuyucular haklılar dönemde gözaltı tutuklama haberi okuyoruz dini değerleri aşağılamak halkı kin düşmanlığa tahrik etmek huzur sükuneti bozmak seksene yakın ceza maddesi ülke gündeminden ceza maddelerinin sebep yargılamalar düşmüyor basit suçlardan tutuklama kararı veriliyor kışkırtıcı başlık uyarınızı anlayabiliyorum başlığı atan değilim günümüzün tanınmış düşünürü s zizek etkili ilahiyatçı j milbankin din tartışmayı alan kitabın adı mesih garabeti kitabı okurken düşündüm zizek ülkemizde dini değerleri aşağılamak iddiasıyla tutuklanıp hemen hapse konurdu zizek kardinal carlo m martini inanç inançsızlık tartışan umberto eco hapse atılırdı ülkemizde sosyal medya fenomeni murat övüç başını bağlayıp espri cezaevine gönderildi acıklı halimiz budur mamoğlu operasyonunu protesto gencecik çocukların tutuklanmasının bunlardan farkı otoriterliğin geldiği aşamayı gösteriyor ülke gündeminin daima ceza maddeleri ülkeye ayna tutuyor nsanı bilgiyi özgür düşünceyi aşağılayan akıl dışılığa demokratik yönetim istiyor sokaklardaki insanlar bakınız gerçeği arama anlayışınız karakterinizi ortaya koyar yetersiz kanıta insanları peşinen mahkûm edenlerin zihniyetine ocu bucu suçlu yeterli nanmak bilmek arasındaki fark nanan sunulanın gerçek olmamasıyla değildir şüphe duymaz spekülatif kurgusal hurafe olana inanmayı sürdürür gizli kabulleri vardır türlü iddiayı yutmaya hazırdır türlü komployu yayma konusunda fütursuz çekinmezdir hakikati aramayan tavır hayli korunaklıdır adaletsiz politik düzen destekçileri yüceltilir arenadaki fanatizm sesleri duyulur katlet katlet gerçek kabul edilen yalan tehlikeli olandır dostoyevski parantez açmalıyım hristiyanlık inancı orta çağda tahakkümüne zorbalığına boyun eğmeyeni cadı avı karalamasıyla meselenin büyü kehanet ilgisi yoktu engizisyon yargılamalarının tek konusu hristiyanlığa sadakat idi karşılığı ölümdü umurunda değildi kanıt bendensin yakılırsın günümüz dilinde cadı avı mecazi sözde yıkıcı faaliyetleri vs ortaya çıkarmak gerçek amacı muhaliflere zarar vermek soruşturmalar anlamına ülkemizde hayli dönemdir egemen ideolojinin onaylamadığı düşünce eylem yasa dışılık adı altında cezalandırılıyor şte nsanların umut kaynağı gördüğü mamoğlunun hapse atılması sokaktaki tepkiyi büyüttü dayatılana sorgusuz inanma akıl süzgecinden geçiren bilme arasındaki mücadele algı akıl arasındaki fark algı amaçlı propagandalar hakikat gösterilmek istense gerçekler yalnızca aklın sınırları açığa çıkar askeri darbeler neoliberalizm ülkemizdeki düşünsel kaliteyi erozyona uğrattı aydın entelektüel kıtlığı yaşıyoruz ürkek çekingen oldular meydanı kışkırtıcı vasatlığa bıraktılar görmüyorlar işleneceğini bildiği engel kimsenin yapmadığı hukuk adı altındaki siyasi cinayeti savunmanın kutsallığına masumiyet karinesine yapılanlar ktidar koltuğu muhtemel tehdit üzerinden suç yaratıyor suçsuz ispatla gereken tersidir suçlu olduğumu ispatla ortaya gizli tanık sürülüyor hadi buyur gizli tanığın hezeyanını saçma sapan iddialarını çürüt aylar yıllar geçiyor masumiyetin ortaya çıkması yaraların iyileşmesi gerçekten hz eyüp sabrı lazım yaşadım silivri cezaevinde 682 kaldım süreçte uğramadığım haksızlık hakaret kalmadı sonuç geldi beraat evrensel gereken türk hukukun geldiği acıklı hâl ktidar başından ekran kafalarına dün hakaret yağdıranlar benzer sözleri mamoğlu sarf vurun abalıya aydınımız gerçeği bilmiyor adalet doğruluktur adalet özgürlüğün teminatıdır adalet özgürlük arasında tezatlık varsa hukuk cinayeti vardır hukuk lazım olacak ktidarı elimden alabilirler anlayışıyla muhalifler yaratılan düşman ceza hukukuna verilmek zorunda halkın zihnini iradesini harekete geçirecek hakikati korkusuzca anlatacak aydınlara entelektüellere ihtiyaç
burunlara koku,önceydi tarih 19 mart 2019 srail televizyonlarında siyasi reklam yayına girdi kadın adalet bakanı sağcı ayelet shaked reklamda ağır ağır yürüyerek üzerinde faşizm yazan parfüm şişesini eline alıp sıkarken anlatıcı ses güçler ayrılığı yargı devrimi anayasal denetim shaked kameraya döndü faşizm etiketli parfümü göstererek demokrasi kokuyor shaked faşist diyenlere güya siyasi reklamla yanıt verdi demokratım reklam ters döndü bakan shaked gitse insanlar faşist kokuyor deyip yanından uzaklaştı haklılardı filistinli çocuklara küçük yılanlar diyecek faşistti bakan shaked hafta sonu srailde insanlar sokaktaydı netanyahunun gazzeye tekrar saldırı başlatmasını protesto ettiler tvden eylemleri izlerken düşündüm shaked gerekse netanyahunun faşist eylemlerinin hepsinin onayını veren demokratik parlamenter sistemin yasaları binlerce masum çocuğu katleden netanyahu yaptığının yasal söylüyor faşist görünen demokrasi kokuyor örneği vermemin sebebi mamoğlu operasyonuna gelmek burnunuza koku faşizm demokrasi belçikalı gerçeküstücü ressam rené magrittein 1929de pipo resmi bilinir pipo tablosuna alt yazı yazdı pipo değildir mamoğlu operasyonu iktidar yanlısı kimilerini ekranda seyrederken aklıma ressam magritte geldi gerçek anladığın değildir tabloda pipo imgesini gösteren resim gerçekçi çizilip renklendirilmiş gerçekte pipo olmadığıdır tablodur şte insana mamoğlu yargı konusu siyasi operasyon kuşkusuz yasalar ceza maddeleri adım hukuk çerçevesinde atılıyor sokaklarda protesto yapanların burnuna koku demokrasinin temel sorunu kâğıt üzerinde yazılana nereden baktığınla sert örnek olacak milyonlarca filistinliyi bombalayan netanyahu yasal görünen yasadışı gücünü parlamentarizmden demokrasiden kanunlardan almıyor örneğin üstünkörü bırakın hukuk görevini yapsın ezberi kitlelere samimi gelmiyor türkiyede kâğıt üzerinde vatandaşlık hakları ifade özgürlüğü örgütlenme özgürlüğü toplanma özgürlüğü mülkiyet hakları vd iktidarın kendinden olana demokrasinin sınırını belirliyor diğerlerini fırsat bulduğunda ceza kesilecek düşman görüyor karşıtına anti demokratik zulüm ayelet shaked demokrasi kokuyor tavır demokrasinin özü uzlaşma kültürünü saf dışı bırakıyor babanızım dersem ötekini hor gören kibirli dar görüşlülük toplumsal çatışmaya sebep akpliler görmüyor mesele mamoğluna ameliyat operasyon sorun derin keşmekeşlik itibarıyla rejim krizi karşıyayız çıkmaza sürükleniyoruz mamoğlu gösterilerinde fotoğraf toplumsal iyileşmeye yönelik umudumu artırdı muhtemelen üniversite öğrencisi genç kız sıralı polis tomaları önünde oturmuş jean jacques rousseau eserini okuyordu toplumsal sözleşme 1762de yazılan kitap hükümet tek kişinin eline geçince hükümdar halk arasına açıklık girmiş devlet bağlantıdan yoksun kalır tek adamın başına verdiği buyruklar yasa olamaz iktidar işleri neme devleti olmuş bilmeli nsanlar onaylanmamış yasa hükümsüzdür geçersizdir yasa değildir aradan 263 geçti demokrasi hukuk özgürlük kâğıda yazılınca hakikat olmuyor sebeple gencinden yaşlısına ülkede sokağa çıkıp eylem gelecek adına umut vericidir gencinden yaşlısına mamoğlunun aday sandıklara gidilmesi gelecek adına umut vericidir tbmm duvarında yazılı egemenlik kayıtsız şartsız milletindir eylemidir etkin dayanışmayı sistem dışı görmek düşünsel kabızlıktır gösterilerin hedefindeki iktidar daima eylem enerjisini olumlu yönetme konusunda beceriksiz şiddeti tek çözüm görüyor onca siyasi gerginliğe gündür sokaklardaki olgunluk demokrasi bilinci ülkeye duyulan sorumluluğu gösteriyor kazanımdır soğuk savaş dönemi ürünü düşünsel farklılığı fırsatta düşmanlaştırmak hatadır hayata olaylara iktidar bakmak zorunda çizilen resmin gerçek pipo olmadığının farkında
