Başlık,Metin
ferdi tayfur marks,lk marksist frankfurt okuluna nazi almanyası başlattı komplo teorisini abd dünyaya yaydı bolşevik kültürü komünistler dini kültürlerini koyacak ülkemize yansıması soğuk savaş geldi allahsız komünistler kuşkusuz komplo teorisinin dayanağı yoktu unutulup gitti saptırılsa marksist kültür teorisi değildi 20nci yüzyıl marksist teorisyenleri arasında yer alan lukacs gramsci ernst bloch walter benjamin adorno fredric jameson terry eagletona uzanan düşünür kültürel formların üretimini toplum tarihle bağını kitleler sosyal hayat üzerindeki etki etkileşimlerini inceledi batıda 1960larda hayli rağbet gören tartışmalara türkiyedeki sol hareketler duyarsız kaldı göstermelik türkü saz kilimi aşamadı şte özgü arabeski anlamaya kavramaya çalışmadı yoz müzik deyip üstten bakıp geçti keza ülkemizdeki akademi dünyası milyonları etkilemiş müziğe dair çalışma nanılacak 1970lerde gecekondunun taşranın arabeski koşullar doğdu koşullar yerini 1990larda şehirli pop müziğe bıraktı olgu analiz edilmedi hele toplumu dönüştürmeyi amaçlayan sol üstten ezberci sözle sırtını döndü konuyu ferdi tayfura getireceğim çocukluğum çorumda geçti annem mahalleli kadınları çoluk çocuğu toplayıp saray sinemasına götürürdü zengin kız fakir oğlan aşkını anlatan salon filmleriydi ağabeyim turan sinemasına götürdü yılmaz güneyin umut filmi 12 yaşına basınca küçük yaşlara izin yoktu arkadaşlarımla sinemaya gitmeye başladım unutmuyorum salon tıklım tıklımdı seyircilerin yarısı askerdi adını öğrendiğim ferdi tayfurun çeşme filmiydi ferdi tayfur şarkı söylediğinde seyirciler şarkıya eşlik baba bağırarak taşkınlık yapıyordu neler oluyordu ferdi tayfur kimdi ülkemizde politik sloganlar dışında söz duyuluyordu üstelik kitleseldi sinemaya müziğe egemendi ihtiyacı gideriyordu koşullardan doğmuştu 1970ler türkiyenin sosyolojik yapısı değişiyordu sol sosyokültürel yönüyle toplumsal değişimiyle dönüşümüyle ilgilenmedi tek doğrusu halk devrimi gecekondu yaparak halkı yanına çekmek halkın müziğine dudak büktü sinizm idi arabeskin sembollerini kodlarını çözemedi anlamaya çalışmadı sol ezberi halkın dini iktisadi siyasi toplumsal sosyokültürel yapısına dönüp bakmadı 1970lerin dehşetengiz enflasyon hızı ekonomik açmazları bunalımları katlanılmaz acıları umutsuzluğu ferdi tayfurun sesiyle acılar çeken toplumun çığlığı idi sessiz kitle devrimci marşları ferdi tayfurun şarkısını söylüyordu arabesk kimlik doğuruyordu sol duyarsızdı anlamaya çalışmadı yazı arabeski ferdi tayfuru övmek amacıyla yazılmadı yazının gayreti kitleselleşmiş olguya solcuların duyarsız kaldığını nitelikli kültürel eleştiri yapmadığının altını çizmek adorno sosyalist devrim hitler faşizminin iktidara gelmesindeki kültürel nedenleri anlamaya çalıştı kapitalizm koşullarında sanatın metalaştırıldığını halkı yozlaştırmak araç yapıldığını caz adlı makalelerinde ele aldı dönemin modası müzik türünü 1930larda hunharca yerden yere vurdu adornonun yazdıkları gülünçtür beyaz ırkın tahakkümüne afro amerikalı halkın direnişinin müziği gözden kaçırdı adorno caz müziğe bakıyorsa sol arabeske baktı tiksintiyle adornonun gerçekliği değildi cazı insanların acı çektirdiği sadomazoşist tür buldu arabesk benzerliği karamsarlığın dertlerin umutsuzluğun başarısızlığın dışa vurumu toparlarsam 1970lerde sol arabeski dinleyen kitleyi kavramaya çalışmadı saydı türkiyenin yıllarda spotify verilerine dinlenen arabesk türü rap müziğine hâlâ benzer bakışı arabesk hayranı oldum rap müzik dinledim milyonları ilgilendiren müzik olgusunun sayılmasına seçkinci tavırla yukarıdan bakılmasına karşıyım sığ dağınık eleştirilere tahammülüm tavırların sebebi kitle kültürü kültür endüstrisi kavramlarını ele alan entelektüel çalışmaların tartışmaların ülkemize uğramaması milyonları etkilemiş ferdi tayfur olgusu ciyak ciyak sese indirgenebilir halkın içinden çıkanların halka yabancılaşması ayrı yazı konusudur
sovyetler birliğini yıktı,suriyede olanlar iktidar taraftarlarınca devrim açıklanıyor akpnin kuruluşu dönem yenilikçi tanımlanmıştı akpnin çeyrek asırda yenilikçi yaşadık partinin çeyrek asır yaşayacağını tahmin musunuz örnekle açıklamak istiyorum yazıma solcu arkadaşlar tepki gösterecek alaka diyecek yazıma stalinist çevreler tepki gösterecek öncelikle belirteyim yazı hayatımda kaba stalin düşmanlığı yapmadım yapmam eleştirmekten geri durmam yazının amacı eleştiri kültürü olmadığında sonun daima hüsranla bittiğini göstermektir şaşıracağınız benzetme yapacağım bolşevik parti akp bakışta alakasız gözüküyor doğrudur ideolojileri dahil tek ortak benzerlik taban tabana zıtlar ele alacağım zamanla parti yapısının benzerliği aklıma düşüren marksist sungur savran geçen ay yıkılış yıldönümünde sovyetler birliğini yıktı makale yazdı marksistler 1991den konuda tartışıyor küreselleşme post fordizm dünya düzeni emperyalizm 11 eylül ılımlı slamcılık arap baharı müşterekler küresel finansal kriz mülksüzleştirme yoluyla birikim isterseniz tartışma konuları arasında deleuzeler foucaultlar lacanlar bourdieuler tek çığır açmış ekim devriminin ürünü sovyetler birliği çöktü sungur savran sorusuna 85 sayfada yanıt arıyor katıldığım katılmadığım tespitleri meselem aradığım devrimci partinin içindeki yozlaşmasının çöküşe yol açtığı ders alınacak tarihsel deneyim karşımızda bolşevik partiyi yazdım akp anla lenin 1924 ocak ayında öldü felçli yatağındayken bolşevik parti yönetiminde iktidar mücadelesi başlamıştı partide temel hizip genel sekreter sıfatıyla parti üzerinde güçlü kontrol kurmuş stalin parti birlikte yürümüş orta yolcu zinovyev kamenev ikilisi parti teorisyeni sivrilmiş sağ eğilimli bukharin sürekli devrim teorisyeni troçki hizip arasında ittifaklar sürekli değişse kazanan stalin 1932de öteki hizipler ryutin muhalefeti staline birleşse başarıya ulaşamadı stalin kazandı bolşevik partide neler yaşananları benzeyenlerden seçtim kontrol tek liderde toplandı stalin işaret ederse koltuğa oturtuldu parti içi demokrasi edildi partinin seçim ilkesi kağıt üzerinde gerçekleşti partide devlette tek kişiye bağlı bürokratik elitlerin bulunduğu nomenklatura oluştu tibarıyla parti giderek çıkarlarını halktan ayıran üstünlükler elde etmeye elde etmiş ayrıcalıkları korumaya çalışan kariyerist köşe dönmeci grupların istilasına uğradı gelinen durumu eleştiren düşman iş birliği farazi suçlamalara maruz kaldı kızıl ordu kumpaslardan kurtulamadı askeri deha mihail tuhaçevski vd idam edildi süreçte bolşevik parti liderlerinin beyaz temizlik tasfiye edildi seferinde dendi ülkenin mevcut durumu reel politiği zorunlu kılıyor sonuçta devrim insan yaratamadı çürüme başladı tanıdık bolşevik parti yozlaşması ülkenin çöküşüne giden yolu açan bürokratikleşme buradan döneyim halktan kopuk bürokratizm deniyor ahmet davutoğlu akpye dönecek deniyor ali babacan akpye dönecek dönerler bilmem gittikleri üzerinde durmak gerekmiyor soruyu ideolojik parti yapısı üzerinden yanıtlamak istiyorum demokratikleşme hedefi kurulup iktidara akp çeyrek yüzyılda değişim geçirdi erdoğan parti içi kanatları hizbi kör testereyle biçti gitmeleri epey zorladı yaşananları biliyorsunuz parti noktaya geldi il ilçe kongrelerinde görüyoruz erdoğan işaret ederse isimler seçiliyor kongreler göstermelik düzenleniyor kabine seçimi bürokrat atamaları dahil erdoğanın dudağı arasına mesele akp tek adamın verdiği vereceği kararlar öngörü yoksunluğu kavrayışsızlık parti devlet yönetimi ülkeyi derinden etkiliyor aslolan ülkenin bekasıdır vs konuşanlar tek ses duymak istemiyor kuşak inşası ortaya atılan imam hatip okulları projelere girmeyeyim devrim yapacaklardı ülkeyi vasatlığa mahkum etmediler bolşevik partinin başına gelenler ders alınacak nitelikte dünyanın yarısına hükmeden sovyetler birliğinin paramparça olmasında parti yozlaşması göz ardı edilemez
mevlit şeriften noele,mevlit doğum yeri zamanı anlamına gelir mevlit kandili hz muhammetin doğum günü kutlanan özel gece yazılan eserlere mevlit şerif denir meşhur mevlit şerifler bilinen süleyman çelebinin 1409da yazdığı vesiletün necat meşhur akşemsettinin oğlu yusuf züleyha eseriyle tanınan hamdullah hamdi ahmediyye adlı mevlüt yazdı slam dünyasında hz muhammetin doğum günü mezheplerde kutlanıyor örneğin sünniler şiiler ayrı tarihlerde kutlar kadir gecesinden kandiller kuranda yer almaz sebeple suudiler başta hz muhammetin doğumunu kutlamaya çıkanlar haksız sayılmazlar kutlu doğum hicri üçüncü asırdan kutlanmaya başlandı osmanlıda kinci selimden başladı kutlama gelenek türkiyede 1989 yılında diyanet şleri başkanlığı desteği kutlu doğum haftası ilan edildi slam ülkesinde benzer görüş farklılıkları hristiyan ülkelerde hz sanın doğumu üzerinden yaşanıyor 24 aralıkta 25 aralıkta ocakta ocakta kutluyor ngilterede püritenler kutlamıyor yasaklıyor nüshası bedava dağıtılan the plain truth dergisi noelin kutlanmaması kampanya türkiyede ufak azınlık noel christmas kutlamalarına tepki gösteriyor takvim yılbaşı türkiyede müslümanlar ısrarla noel yılbaşı kutlamalarını kabul yazdık görüş yanlıştır cehalet sonucudur noel dini kavramdır yılbaşı seküler kavramdır ortada noel kutlamaları yokken roma mparatoru julius sezar döneminde m ö 46da kabul edilen jülyen takvim yılbaşı kutlanmaya başlandı ortada hz sa yoktu hristiyanların yüzyılda kutladığı bayram arasında hz sanın doğumu noel christmas adlı bayram bulunmuyordu yılbaşına çıkan müslümanların argümanı nedir mesela osmanlının yaşadıklarından haberleri hz muhammetin hicretini baz alan hicri kameri takvime dönmek isteniyor bilmeleri 1678 tarihinden kamu mali işlerde 365 günlük güneş yılını esas alan rumi yahut mali bilinen takvime geçildi tanzimat fermanı 1839dan takvimin kullanılma alanını hayli büyüttü jülyen gregoryen rumi takvim kullanıldı yılbaşına gelirsek jülyen esaslı rumi takvime sene başı marttı 1918den gregoryen esaslı rumi takvime geçildi takvimde yılbaşı ocak osmanlı takvim sorununu çeşitli denemeler gidermeye çalıştı hicri takvim ay yılına rumi takvim güneş yılına hesaplanıyor hicri yılın rumi yıldan yaklaşık 11 geriye düşmesi zamansal sorunlara sebep sebeple suudiler 2016 yılında hicri takvimi bıraktı sebeple slam ülkeleri dini bayramları ortak kutlamak tekl takvim arayışında takvimin hristiyanlık ilgisi japonya 1873te çin 1912de takvimlerini değiştirdi türkiye cumhuriyeti 1925ten miladi takvim kullanıyor kuranı kerimdeki hz sa steyen yıla ocakta girsin steyen yıla martta girsin steyen yıla günü değişen hicri takvimle girsin steyen yılbaşı kutlamasın gerginlik çıkarma aracı kullanılması siyasi çıkar sebebiyledir hz sanın doğumunu kutlamaya müslümanlar çıksın kuranı kerimde hz sa hz meryem adı geçiyor melekler demişti meryem şüphesiz allah kendisinden kelimeyi müjdeliyor ismi meryem oğlu sa mesihtir dünyada âhirette şerefli itibarlı allaha yakın kullardan olacaktır al mran 45 bilin meryem oğlu sa mesih allahın peygamberi meryeme ulaştırdığı kelimesi ruhtur nisa 171 meryem oğlu mesih peygamberdir nice peygamberler gelip geçti annesi sözlü iffetli dürüst kadındır maide 75 kutsal kitapta ayetler hz sa müslümanların peygamberi hz muhammetin doğumunu kutlayıp hz sanın doğumunu kutlayanlara tepki göstermekte noeli yılbaşını huzursuzluk yaratmak kullanmak tağut hurafesidir
srail ordusunda teğmen çerkez,adı zzet nafsu srailin küçük çerkez azınlığına mensup idi orduda teğmen rütbesine yükselmişti ocak 1980de tutuklandı srailin yurt gizli servisi şin betin kiraladığı otelde günlerce işkenceli sorgudan geçirildi dördüncü gününde suçunu itiraf çıkarıldığı mahkemede 18 yıla mahkum edildi suçu arafatın örgütü el fetih grubunun komutanıyla lübnanda görüşmesiydi ddiaya gazzeli gencin yapacağı 300 nolu otobüs saldırısının bilgilerini vermişti ağır ceza kararından sraildeki çerkezler kararın iptali çabaladı tiraf işkence altında alınmıştı davayı 1890larda haksız yere mahkum edilerek hapse atılan fransız yahudi yüzbaşı alfred dreyfus yargılamasına benzettiler gizli tanık lübnanlı ebu kasımın mahkemeye çıkarılması yoğun çabalar sarf etseler mahkeme kararından geri adım atmadı 1987 300 nolu otobüs olayında sağ yakalanan filistinli gencin şin bet yargısız infaz istihbarat örgütünün sorgulamalarını gündeme getirdi bunlardan zzet nafsu idi şin bet istihbarat zafiyetini genç teğmenin yıkmıştı çerkez halkı srailde sahipsizdi çerkez dreyfus serbest bırakıldı köyünde kahraman karşılandı girişi yapmamın sebebi çerkezler deyince aklımıza folklor çarlık rusyanın kafkasyanın köklü yerleşimcilerinden çerkezlere soykırıma direnişleri ardından göç sonucu yaşanan ağır kayıpları anmak karadenize bırakılan kırmızı karanfiller çerkezlerin rus çarlığına verdiği mücadeleyi halkın tümünün bizzat katıldığı haklı özgürlük savaşı değerlendiren karl marks çerkez ulusal kurtuluş savaşı hakkında temmuz 1864te yazdı rusyanın kuzey kafkasyalılara uyguladığı aşırı önlemleri avrupanın aptalca umursamazlıkla karşılaması kendileri kolay kafkasyanın işgali olaylarını 1815 yılından yana avrupanın ciddi olayı değerlendiriyorum acıdır tarihimize yabancılaştırıldık buçuk milyonu aşkın çerkez osmanlı topraklarına sığındı beklentilerini bulamadılar ayrı osmanlı paramparça olunca türkiye toprakları dışındaki çerkezler suriye konusunda araplar kürtler nusayriler dürziler hakkında birileri konuşuyor siyasi talep elde etmeye çalışıyor süreçte suriyedeki çerkezlerin ismini anan çerkez adı esatlar döneminde suriye istihbaratının başındaki ali memlükün çerkez sebebiyle geçiyor suriyede çerkez yoktu elimde sömürgeci fransız istihbaratının 1935 yılında suriye çerkezleri konusunda yazdığı rapor biliyorsunuz birinci dünya savaşından suriye itibarıyla ülkedeki çerkezler fransız mandasına sokuldu rapor ayrıntılı bilgilerle dolu osmanlının döneminde suriyede günümüzde etnik grup nüfusunu yüksek gösteriyor yapay saçmalığın gizli amacına girmeyeyim somut örnek üzerinden yazayım fransız istihbaratı suriyedeki çerkez kafkasyalıların soylarının il ilçe köylere dağılımını tespit yıllarda nüfusu suriyeden örnekler vereyim halep 100 aile kabardey abzah kabileleri menbic 400 aile abzah konezer 100 aile kabardey rakka 100 aile kabardey çeçen hama 50 aile bjeduğ azez 15 aile abzah deyrizor selahiye mahallesi 20 aile çeçen tell smane 120 aile bjeduğ abaza rasulayn 70 aile çeçen tel adda 60 aile bjeduğ cessine 30 aile dağıstanlı ayn zad 180 aile bjeduğ tell amri 150 aile bjeduğ assila 60 aile bjeduğ deyr for 160 aile dağıstanlı till 50 aile bjeduğ şam mohajerin mahallesi 60 aile bjeduğ kabardey abzah koçha marj sultan 70 aile abzah bley 150 aile koçha karaçay liste uzun bugünlerde sıklıkla dile getirilen yer golan buradaki çerkez nüfusundan örnekler sıralayayım kuneytra 400 aile abzah mansura 120 aile bjeduğ abzah ayn ziyuan 150 aile abzah kumsiyeh 50 aile abaza cueyzeh 100 aile abzah kabardey breyka 150 aile abzah beerajam 70 aile bjeduğ surman 120 aile bjeduğ kuşniye 150 aile kabardey abzah uzatmayayım alevilerin yoğun yaşadığı bölgelerde çerkezler ceble 50 aile bjeduğ arap el melk 30 aile kabarbey sukas 15 aile bjeduğ suriyedeki çerkezler töreleri yabancı kız alıp vermeyen çerkezlerin asimile zor suriyeden göçtü kalan girişte yazdım srailden göçmedikleri görülüyor ürdünde irakta suudi arabistanda vd varken suriyede olmamaları imkansız ortadoğunun sahipsiz halkı çerkezler tıpkı teğmen zzet nafsunun başına gelenler medyada yer bulamıyor maalesef
zamanın soykütüğü,yılın günündeyiz geri dönülemez süreç hakiki öğretmen öğrenmek isteyene nsanoğlu zamanı sayısını takip etmek saatler takvimler bulup kullandı ayın dünya etrafında dönmesini esas aldı dünyanın güneş etrafında dönmesini esas aldı nsanoğlu zamanı ölçebilmek güneş saatinden su saatine günümüzde saniyenin milyarda birinden kısa süreyi ölçülebilir hale getiren zamanı tutan atomik saatlere geldi horoloji deniyor heyhat 2025 nsanlar zamanı ölçmeye dini kılıf geçirdi birbirleriyle kavga edip duruyor yılbaşı kutlanmaz çine gidip 6ncı yüzyıldan dini ibadet kullandığınız tütsü saatini kaldırdınız deseniz şaşkınlıkla bakarlar kimileri yaz saati uygulamalarına çıkmakta trump uygulamayı kaldıracağını ifade zamanı yönetmek tartışma konusu yöneltilen değerli hazinedir insanlar zamanı fırsata çevirmek verimli kullanmak istiyor zamanın soy kütüğüne bakarsanız ölçmenin temelinde ticaret ekonomik çıkar ilişkisi vardır mesela yaz saati uygulamalarının ekonomiyi canlandırdığı rakamsal ortaya konuyor 2025 yılı dünya gündeminde trump geri adım atmazsa yaz saati uygulaması olacak kuşkusuz ışığını yakala yaz saati uygulaması bilim insanlarından politikacılara din adamlarından komplo teorisyenine tartışılıp duruyor ışığını ele geçir ay boyunca uygulanan yaz saati uygulaması dünya çapında milyardan fazla insanı etkiliyor insan devrim niteliğindeki fikrin nereden geldiğini tarihi boyunca uygulamanın dünyanın yanındaki politikacı bilim insanı din adamı çıkar grubu arasında şaşırtıcı derecede çekişmeli çatışmalara yol açtığını bilmiyor başkan trump 2025te fitilini ateşleyecek görünüyor tibarıyla dünya medyasında yer alacak amerikalı isim dr david s prerau olacak mit massachusetts institute of technology üniversitesi öğretim üyesi yaz saati uygulaması konusunda dünyanın tanınmış otoritelerinden seize the daylight the curious and contentious story of daylight saving time işığını ele geçir işığından yararlanma zamanının merak uyandıran tartışmalı hikayesi adlı referans kitabı dr prerau abd ulaştırma bakanlığında araştırmacı çalışırken yaz saati uygulamasıyla ilgilendi enerji kullanımı motorlu taşıt kazaları suç artışı alanda incelemeler gördü kimseler yaz saati uygulaması tarihi üzerinde çalışma yapmamıştı başkan benjamin franklin büyükelçi bulunduğu pariste mum israfını önlemek uygulamayı abdde hayata geçirmişti ngilterede sir arthur conan doyledan winston churchille isimler uygulama kampanyalar yürütmüştü almanyada uygulamayı 1916da mparator wilhelm kullanmıştı hitler kinci dünya savaşı sırasında enerji tasarrufu maksadıyla yaz saati uygulamasını başlattı dr prerau kitap yazmadı abd kongresine yaz saati uygulamasını uzatan raporlar yazdı ngiliz parlamentosundan hollanda güney afrika onlarca yerde yığın konuşma neredeyse batıda çıkmadığı yazmadığı medya kuruluşu kalmadı şikayetçi olmasına türkiye konuda sessiz zeitgeist zamanın ruhu zelandalı böcek bilimci george vernon hudson yaz aylarında saatlerin ileri alınmasını öneren kişi 1895 yılın ayı saatlik ayarlama önerdi zelandalılar hudsonın fikrinden etkilenmiş alay zelanda uygulamayı ülkenin kullanmaya başlamasından 1927ye benimsemedi batılı ülkelerin benimsediği yaz saati uygulamasına doğrudan yol açan fikrin sahibi william willett adlı ngiliz inşaatçı idi 1900 başlarında willett londranın dışında bahar yaz sabahı at sırtında günlük gezi erken kalkardı insanın yaz gününün iyi bölümünde uyuduğu tadını çıkaramadığından yakınıyordu ışığı israfını düşünerek 1905te yaz aylarında saatleri ileri alma fikrini tasarladı teklifinin ayrıntılarını veren işığının srafı başlıklı broşür yayınladı milletvekili robert pierce william willettin fikrini duyar duymaz destekledi parlamentoya işığından yararlanma yasası sundu destekçileri arasında winston churchill sonuçta günümüzde uygulama ülkemiz dahil yerde tartışılıyor nsanoğlunu birinci dünya savaşı gerekse kinci dünya savaşı uygulamaya geçmeye mecbur bıraktı randa 1979da slam devrimi uygulama kaldırıldı enerji tasarrufu konularda hayat dayatınca tekrar uygulamaya geçti bakalım trump tartışmalara sebep olacak
mukaddesatçıların mezhepçiliği,bilimsel bilginin kaynağı gösterilen tümdengelim kullanalım hamas sraile savaş açtı faşist netanyahu karşılığını çoluk çocuk demeden katlederek verdi akp iktidarı haklı tepki gösterdi fırsatta netanyahuyu kınadı katliamların durdurulması dünyayı harekete geçirmeye çalıştı keza akpye yakın sivil toplum kuruluşları mitingler yürüyüşler alkışlanacak tutumlar eylemler ortadoğuda sraile çıkan müslüman ülkeler arasında başı çekiyordu ran suriye ittifakları hizbullahtan husilere örgütler ülkeler örgütlerin çimentosu şiilik nusayrilik srail düşman bildiği ranı bombaladı srail düşman bildiği hizbullahı barındıran lübnanı bombaladı srail ezeli düşmanı esatları yenilgiye uğrattı ülkenin ortak davası filistine destek vermeleri idi yıllarda sünni hamas ran yakın temas içindeydi bitenler yaşanırken türkiyedeki mukaddesatçıların tavrına şahit olduk srail rana saldırdı kem küm ettiler tahranı suçladılar srail lübnanda hizbullaha saldırıp hizbullah lideri nasrallahı öldürmesine sevindiler srail esatları yendi sevinç naraları attılar bombalananlar yenilenler filistine sınırsız destek verenler bilinmesine ülkemizdeki mukaddesatçılar gizli sevinç duydu hâl örtülü netanyahu desteği anlamına gelmiyor kircikli tavrın nedeni olmalı mezhepçilik mezhepsel nefret gözleri kör mukaddesatçılar arap ulusalcısı laik modernist baas hareketine mezhepsel bakıyor mukaddesatçıların siyasi tavrını kitap üzerinden anlatmaya çalışayım soğuk savaştan neoliberalizm el kitabı çıkardı samuel huntingtonın medeniyetler çatışması 1996 tezi şuydu dünyada mücadele sahasının kaynağı ideolojiler etnisite olacaktır olmalıdır demek istiyor deolojinin yerini dinin laik milliyetçiliğin yerini dini milliyetçiliğinin alacağını ileri sürdü emperyalizmin küreselleşmenin zorunlu sonucu söyleyen huntington batının gelişim şekli bakımından değerlerinin ayırt edici özelliğinden medeniyetlerden ayrıldığını vurguladı dünya düzeni kurulmalıydı ulus devletleri parçalama hedefli 22 ülkeyi kapsayan ortadoğu projesi bop kaynağını buradan aldı projelere çıkanlara neler yapılacağını yazdı huntington devlet devletin potansiyel tehdit haline geldiğini görürse gücünü artırarak devletlerle müttefik güvenliğini sağlamaya çalışmalıdır abd başta batının netanyahu katliamlarına ses çıkarmamasının temeli budur huntington kafalara slam kılıç dini idi törpülenmesi gerekiyordu mesela neoliberalizmin dış politika manifestosunu yazdığı kitabında hedefine slam ülkelerini koyması şaşırtıcı değildi slam medeniyetimizin istikrarsızlığına yol açan nüfus patlaması yaşıyor durdurulmalıdır kontrolden çıkan dünya düzene sokulabilirdi yaşadıklarımız budur savaşlar iç çatışmalar nüfus artışını önlüyorlar uzatmayayım müslümanlar hâlâ meseleye mezhep gözlüğü bakıyor emperyalizm ortadoğunun yeraltı yerüstü kaynaklarını sömürmek binbir tuzak kuruyor dini sanan kimileri oyuna şiiler nusayriler aleviler yıkılsın kör inananların sözde hz ali aşığı tarihsel arka plan böl yönet yıldan fazla süre ortadoğuyu idare osmanlı mparatorluğunun parçaladığını unuttunuz emperyalist güçlerin müslüman ülkeleri yıllarca din mezhep üzerinden kontrol altında tutup birbirleriyle çatıştırarak dizayn unuttunuz tek osmanlı anti emperyalist baas hareketi edildi emperyalizm ulus kimliklerini din mezhebi plana çıkardı kazandı emperyalizm ortadoğudaki sorunların neredeyse tamamını mezhep sorunlarına mezhepsel çatışmalara dayandırdı dayandırmaya devam günümüzde hakikatin türlü görülmemesinin sebepleri kuşkusuz neoliberal emperyalizm yılda suudi selefi vehhabi anlayışı pompaladı planını yerde ılımlı slam örtüsü altına sakladı cia projesiydi dünden bugüne parçaya bölünen aydınlık slam emperyalizm siyasetine araç kılındı yıla girerken baş düşmanları ran kimilerinin ran bombalandıkça gizli gizli sevinmeleri mezhepçiliğin gözlerini kör etmesinden ortadoğuda yaşanan sorunları mezhep ayrılığına dayandırmak yaklaşım değildir emperyalizmin böl yönet politikasıdır slam ülkelerinin birbirine güvensizliğinin şarttır bölgede tek kazanan kırılganlığı sürekli tetikleyen emperyalizm olacaktır
