Başlık,Metin
hayat yaşanmaz,lev tolstoy van lyiçin ölümü eserini yazdığında 58 yaşındaydı savaş barış romanı üzerinden 17 sene anna karenina romanı üzerinden geçmişti yüksek rütbeli yargıç van lyiç ölümcül hastalığının farkına vardığında güne anlam yüklediği uğruna çaba verdiği serveti şöhreti saygınlığı anda boş saçma görünür tolstoy baş karakterine ahlâk felsefesinin temel sorusunu sordurur hayat yaşadım van lyiç yazar tolstoyun kendisidir hayat benimkisi dünyada bunca yoksulluk varken varlık yaşamam başkaları yoksulluk içindeyken mutlu olmam mümkün tolstoy eserini din değiştirdiği sorgulama döneminde kaleme aldı ğrenç beden çağrılarından kaçtım dünyada alınacak hazlar başkalarının zevk almıyor aldığım zevki sakatlıyor yıllar felsefeci theodor adorno benzer aforizmayı çarpıcı sözü sarf hayat yaşanmaz bolu kartalkayada 78 insanın can verdiği yangın sonrası olmamış tatilini sürdürenlerin kayak yapanların ruh sağlığı üzerinde durmak gerekmiyor hayatın yaktığının farkında değiller kötü sınavdalar patolojik vakalar yaşadıkları travmatik hayat toplumsal yaşamımıza bulaşıyor hayatı biçimlendiriyor tolstoyun van lyiçin ölümü eserini yazdığı yaştayım kuşağımı anlamlandıran büyüten yazarın kemalettin tuğcu düşünürüm talihsiz yoksul gözyaşı dolu çocuk masallarının yazarıydı tuğcu masum yıllardı çocukluğumuz zengin fakir ayrımı bilmezdik utanılacak hayat yoktu zenginin parası varsa yoksulun haysiyeti başı dikti kanaatkârdık merhametliydik yimserdik sadaka bilmezdik yardımseverdik çalışanın karşılığını alacağına inanıyorduk eski mahallelerin çocuk insanlarıydık hepimiz değersiz değildi öteki değildi vicdansız değildi büyüdük aydınlık bakışlı sosyal gerçekçi orhan kemalin emekçi çocuk hikayeleriyle tanıştık geçim dünyasında kâr duygusu ar duygusunun çelişkisini öğrenmeye başladık hayat sertleşiyordu keskin duygusallığımız bozulmamıştı umutluyduk kötülükten iyilik doğacağına inanıyorduk yıllar öğrendik orhan kemal bugünün karanlığına işaret ediyordu büyüdük toplumun korkutularak savunmasız bırakıldığına şahitlik ettik güvensiz insanın cahilliği yücelten karanlığın doğumuna destek verdiğini gördük bakınız nsan aklıyla görür akıl bozulursa toplum bozulur insan yıkımına yol açan vasat dönüşümün özü budur akılsızlık kemalettin tuğcunun çocukları tüketim peşinde kötülüğün ürkütücü sıradanlığını yaşıyor kötülük bulaşıcı virüs ülkeye yayılıyor kötülük kişiyle kitleyle paylaşılırsa toplumsal sorumluluk azalıyor grand kartal otel yangınından hepimizin sorumlu olduğunun kişi farkında moliere yalnız yaptıklarımızdan yapmadıklarımızdan sorumluyuz yangından kayak yapanlar tepkisiz kalanlar arasında fark kendimiz dışında suçlayarak adaleti hâkim kılamayız temiz kalamayız düzeni değiştiremeyiz tolstoy dünyayı değiştirmeyi düşünür değiştirmeyi düşünmez evrende belirsizlik bulanıklık gizem yoktur düşünememe mantıksızlığı vardır mantık gerçekle yüzleşen aklın ölçüsüdür mizan ül akl aklın yerde safsata başlar tibarıyla abartma mübalağa etme kehanetvari komplocu çıkarımlar toplumsal yaşamın bel kemiğini oluşturur işin altında çapanoğlu aranır kendinden saymadığı dinlenmez okunmaz sorgulanmaz sorumluluk insan karalamakla ötekinin sırtından atılır muhatabın kişiliğe karakterine vasıflarına ailesine saldırılarak görüşlerinin çürütüleceği sanılır ad hominem tek amaç vardır delil olmadığına bakmaksızın hasmını köşeye sıkıştıracak polemik yaratmak devede kulak misali hayli önemsiz konular ileri sürülerek kafalar karıştırılır münazara katledilir görüş biçilir düşünüyorum doğrusu budur anlayışı düşünceyi öldürür yıllarda yaşadığımız budur sebeple olay lar işin içinden çıkılamaz hale getiriliyor konunun özü gözden kaçırılıyor olay gündemden düşürülüyor zarfa mazrûfa aslolana meselenin dışına baktırılıyor olayda safsataya dayalı sonuç çıkarmalar kısır döngüsü sürüp gidiyor maksat daima grup baskısıyla çoğunluğu yanına çekmek ktidara yaranacak insan olduğundan taktik başarılı görünüyor ülkemizin bıkkınlık veren durumu hal pürmelali budur yangından kayak yapmayı sürdürenler toplumsal hayata yabancılaşmış mahluklardır nsana muhtacız insan arıyoruz
erdoğanın mektubu,meslektaşımız ahmet hakan telaşlandı anlamadım trump filistinlileri tehcir edip gazzeyi boşaltacağım binaları yıkıp temizleyip 30 katlı binalar yapacağım deniz kıyısında lüks restoran oteller inşa edeceğim nşaatlar 10 15 sürecek dolar para harcayacağım ahmet hakan erdoğana tavsiyede bulundu sayın cumhurbaşkanı trumpa kırıp dökücü cevap vermemeniz muhalefetin susuyorsun cevap vermiyorsun demesine aldırış etmeyin gazzenin iyiliği istemiyorlar trumpla kurabileceğiniz diyalog potansiyelini ortadan kaldırmayı hedefliyorlar sayın cumhurbaşkanı trumpa hak cevabı vermeyin ahmet hakanın yazısını okuyunca trumpa içimden argo seslendim yap ulan yap görelim açıyla yazı yazayım istedim vazgeçtim ahmet hakan erdoğana tavsiyede bulunuyor bende erdoğanın ağzından mektup yazabilirim dedim aldım kağıdı kalemi elime başladım erdoğanın dilinden trumpa mektup yazmaya sayın mevkidaşım gazze önerinizi duyunca irkildim ahmet hakan iyi niyetiyle cevap vermeyin dese tanıyorsunuz yanıt vermemezlik etmem karakterime ters sayın trump gazzeden aynaya devletinizin belgelerine bakar mısınız dolar bütçe açığınız parayla gazzeyi onaracaksınız 1981 yılında 141 dolar dünyanın önde borç veren ülkesiydiniz 36 dolar dünyanın borçlu ülkesi haline geldiniz parayla gazzeyi onaracaksınız sayın trump ülkenizin altyapısını yenilemeniz acil dolara ihtiyacınız 600 köprünüzün ortalama yaşı 42 yarısı kusurlu hemen onarıma girmesi şart yılda 17 köprünüz çöktü elliye yakın vatandaşınız öldü bozuk karayolları yüzünden 230 dolarınız kazalara gidiyor keza 80 dolarlık yakıt kaybı yaşıyorsunuz dünyanın iyi yolları raylı sistemleri havaalanları sizde bulunmuyor dökülüyor gazzeyi onaracaksınız los angelesta gördük doğal afetle başa çıkabildiniz başınızda tehlike 104 nükleer tesisinizin 71i onarım bekliyor yıllardır elektrik altyapılarını yenileyemiyorsunuz milyona yakın insanın kanalizasyonu bozuk nsanlar temiz su içemiyor milyonlarca işsiziniz insanlar gıda yardımıyla karnını doyuruyor gazze çocuklarına yardımdan ülkenizdeki bebek ölüm hızlarını düşürün 15 çocuğunuz sağlık hizmetlerinden mahrum çocuk cinsel istismara uğruyor gazzeyi bırakın new york metrosundaki fareyle baş ediniz uzatmayayım mektubumu uzun yazıları okumadığınızı biliyorum selamlar türkiye cumhurbaşkanı yukarıda okudunuz trumpın geçen salı günü beyaz sarayda netanyahuyu ağırlarken açıkladığı gazze onarımı teklifi gevezelik abdnin gazzeye harcayacağı parası konuşmasına trumpın alışık olduğumuz gelişigüzel lakırtısı demeliyiz sözlerin altında gerçekler faşist netanyahu proje tarihi değiştirebilecek yıllardır ortaya atılan orijinal fikir karşılandı netanyahu diyorsa altında çapanoğlu aramak şart trumpa gazze projesini veren kişiyi araştırdım ekonomist prof joseph pelzman george washington üniversitesi öğretim üyesi yolu sraile uğrayan araştırmacılardan fulbright bursuyla kudüste negev gurion üniversitesinde bulundu tel avivde herzliya akademisinde çalıştı maurice falk ekonomi araştırmaları enstitüsünde araştırma görevlisi yer aldı kudüs brani üniversitesinde görev vs prof joseph pelzman ilginç dikkat çekici karakter harvard üniversitesinde 1980lerde sovyetler birliği çalıştı ülkenin 1990larda dağılımıyla tiflis gürcistandaki uluslararası ekonomi okulu kurucu başkanı görev ukrayna kiev ekonomi okulunda uluslararası danışma kurulu üyesi görev başkent washington dcde küresel çalışmalar vakfının yönetim kurulu üyesi görev global economy journalın anki genel yayın yönetmeni gazzeyi yeniden nşa etmek çin ekonomik plan bot yap şlet devret yaklaşımı başlıklı makalesi ekim ayında dergide yayınlandı cümlesi önemlidir hamasın 1993 oslo anlaşmaları uyarınca gazze üzerinde mülkiyet hakkı yoktur srailin 2005te gazzeden çekilmesiyle haklar bozulmamıştır gazze srailin niyet belli prof joseph pelzmanın siyonizmi pazarlayan akademisyenlerden su götürmez gerçek
ver gazı coştur lazı,erdoğan geçen hafta malezya endonezya pakistan gezisine çıktığında elimde osmanlı tarihi konusunda otorite tarihçi suraiya faroqhinin osmanlılar babürlüler kitabı gezide ülke liderlerinin gazze katliamı konusunda erdoğanın mücadeleciliğini öven sözlerini duyunca tarihimiz değişmeyecek dedim osmanlı döneminde ngilizler almanlar başta avrupa ülkeleri alavere dalavere savaşa soktu gezide devlet başkanlarının iltifatları savcı sayandan rahim ere kimilerini heyecana getirdi halife isteriz demeye başladılar coştular gidilen ülkeler halife toprağı idi lozanda halifelik elimizden alınmış idi çabuk manipüle ediliyorlar kutsal aldanışın soyağacı tağut kitabımın ikinci cildini çıkarsam gerçi gerçeği arıyor girişi suraiya faroqhiden açtım onunla sürdüreyim osmanlı tarihi ncelenir adlı kitabı tarih yazıcılığının olmazsa olmazının kaynak okumak ısrarla vurguluyor dolduruşa gelip halifelik isteyenler hakikati biliyor yazayım derine kazmayayım emevilerin abbasilerin halifeliğine girmeyeyim günümüz resmi tarihine yavuz selim 1517de kahiredeki memlük devletine vererek halifelik unvanını stanbula getirdi dönemin osmanlı tarihçileri yazdı osmanlı tarihine dair mirât kâinât adlı kitaplar yazan mehmet muhyettin nişancızade eserlerinde halifelik transferinden bahsetmedi tarih al osman kitaplar yazan mehmet mehmet edirnevi eserlerinde halifelik transferinden bahsetmedi osmanlı beyliğinin ortaya çıkışından yavuz selim devri sonuna yazdığı bedayiül vekayi kitabında koca hüseyin halifelik transferinden bahsetmedi tarih solakzade döneminin osmanlı tarihini kaleme alan solakzade mehmet hemdemi eserlerinde halifelik transferinden bahsetmedi şeyhülislam osmanlı padişahlarının tarihini yazan karaçelebizade abdülaziz eserlerinde halifelik transferinden bahsetmedi yazdıkları osmanlının kaynakları gösterilen müneccimbaşı ahmet dede eserlerinde halifelik transferinden bahsetmedi kahire feyyum kadılığında bulunan mürit tevarih adlı tarihi kitaplar yazan şemdanizade süleyman eserlerinde halifelik transferinden bahsetmedi uzatmayayım dönemin tarihçilerinde halifelik konusunda ima hemen şeyhülislam tarihçi kemal paşazade bn kemal yavuz selimi fatih memalikül arab arap ülkelerinin fatihi adlandırdı keza slam osmanlı tarihi çalışmış vasili v bartold v dimitriyeviç smirnov anna s tveritinova asyalı yazar benzerini yazdı avrupalı tarihçiler eğilmedi sorunun yanıtı soruda gizli halife rivayeti çıktı şunun altını çizmek şart kavram dini siyasi amaç yaratıldı 18inci yüzyıl ortası stanbul ermenisi sveç tercümanlık katiplik 1796 1798 yılları arasında büyükelçilik yapan ignatius m dohsson padişah üçüncü selime sunduğu tableau general lempire ottoman adlı ciltlik eserinde halifelik unvanını kullanarak padişah slam müslümanların memalik slamın başı yazdı sebebi şuydu küçük kaynarca antlaşması 1774 rusyaya müslümanların yoğun topraklarını kaybeden osmanlı halife rivayeti yürürlüğe sokuldu rusyayı kuşatan yeşil kuşak projesi idi hedef başta kırım kafkas müslümanlarını kışkırtarak rusyayı durdurmaktı osmanlı halifelik merkezli panislamı resmi tezi namık kemal mithat paşa osmanlılar uydu 1876 anayasasına koydular dün sorgusuz tarihsel yazın halifelik propagandasını daim siyaset malzemesi kullanmayı sürdürüyor cehalet lozanda ngilizler halifeliği kaldırın demiş kemalistler uymuş ngilizler icadına katkı sunduğu halifeliği çıkarları daima kullandı mesela sömürdüğü hindistandaki müslümanlar arasında osmanlı padişahının slam halifesi görüşünü destekledi yaydı halifeler üçüncü selim birinci abdülmecite hindistan müslümanlarına ngiliz yönetimini desteklemelerini söyleyen mektup name hümayun yazdırdı keza cehalet osmanlı dönemde hindistanda halifelik bilmiyor üçüncü ekber 1556 1605 döneminde babürlüler ahmediye halifeliği vd osmanlı paralel yerde halifelik bilmiyorlar endonezyada yogyakarta halifeliği kamerunda bornu halifeliği nijeryada sokoto halifeliği sahraaltı afrikada toucouleur halifeliği arabistanda şerif halifeliği sufi halifeliklere girmeyeyim 1993te işi d halifelik kurdu anlatabilirsiniz kimileri politik amaçları ezberlerini tekrarlayıp duruyorlar
ahlâki iktisat,vacibi slama uygun demek yıllardaki yüksek enflasyon firmaların fiyatlandırma stratejileri kârlılık üzerinde değişimlere yol açtı eş dostla aramızdaki sohbetlerin ana konusu işletmelerin kâr marjı halkın geçinemediği acı hakikat genellikle deniyor şirketler giderlerinin üstüne kâr elde gerçekten keza erdoğan sert çıkışlar yapıp kâr marjlarını baskı altına almaya çalışıyor firmaları hedef haline getiriyor şirketler enflasyon sebebiyle artan maliyetlerden şikayetçi fiyatlara yansıtmak zorunda söylüyor sattığımızı maliyetle üretemiyoruz haklı halk firmalar durum kadı nasrettin hocanın haklısın fıkrasına benziyor şaka yana kâr marjları meselesi ekonomik istikrar firma düzeyinde sürdürülebilirlik açısından kritik sorun vacibi uygunluk üzerinde ehemmiyetle durmak zorundayız türkiye sosyalist devleti gerçeği bilmek zorundayız kâr marjlarını belirleyen faktörlerden fiyatlama gücü türkiyede enflasyonun sektörlere kâr marjları üzerindeki etkisi örneğin firmalar talep esnekliği düşük sektörde faaliyet gösteriyor temel gıda ürünleri enerji zorunlu tüketim malları maliyet artışlarını fiyatlara kolay yansıtıyorlar firmalar rekabetin yüksek otomobil elektronik lüks tüketim malları sektörlerde faaliyet gösteriyor tüketicilerin alım gücünü kaybetmesi nedeniyle fiyatları sınırsız artıramıyor durum kâr marjlarının daralmasına şte 2024 yılında mahkemeler toplamda 1723 şirkete konkordato geçici mühlet kararı verilirken kesin mühlet kararlarının sayısı 827 boyunca 701 konkordato başvurusu reddedilirken 132 iflas kararı 114 tasdik kararı alındı karşımızda neoliberalizm krizi ideolojinin sorumluları kimler çıkıp özeleştiri yapmıyor topu birbirinin atıyor birbirini suçlarken temelde yatan gözden kaçırılıyor unutmuyorum tarih 24 kasım 1994 özelleştirme yasası meclisten geçince başbakan tansu çiller kürsüye çıkıp türkiye coğrafi bölgesindeki sosyalist devlet olmuştu yıktık siyasi hayatımızda benzer siyasi kandırmalar dönem meselenin özü şuydu nisan 1994te devalüasyon yaşandı dolar 40 tlye fırladı çiller hükümetinin aldığı kararlar yoğun işsizlik dalgasına gelir dağılımında ücretliler açısından adaletsizliğe yol açtı sermaye sahipleri döviz yatırımıyla gerekse uygulanan yüksek faizle paralar kazandı yanda yaşanan durgunluk firmayı küçülttü iflas ettirdi ağır kriz kamu malları satıldı rant zenginlere yabancı spekülatörlere aktarıldı değişen yıkılan sosyalist devlet bahanesi satılacak kamu malı kaldı osmanlı sosyalist devleti fiyat artışı araştırması osmanlının ekonomi hayatına dair bizde tarihsel çalışma ömer lütfi barkan halil nalcık tarihçilerimizin sayısı maalesef ekonomi deyince akla karl marks geldi suçtu genel bildiklerimiz osmanlıda üretim kitlesel talep sonucu ihtiyaçlara belirlenirdi mesela narh piyasada alım satım ürünlerin fiyat tavanının belirlenmesiydi kadı başkanlığındaki komisyon kârlılık oranı 10 20 arasında belirlerdi bahar güz kış ortasında fiyat tespiti öngörürdü tespit edilen fiyatlar bedesten arasta açık pazar satış mekanlarına asılırdı fiyatlar belirlenince piyasa başına bırakılmazdı kadı zanaat loncası başı fiyat denetimi kalite kontrolü tartı aletleri damgalama yapardı padişahlar piyasanın kontrolü mühim devlet işlerinden idi sadrazam pazara giderek fiyatları denetlerdi uymayanları çarşı cezalandırırdı hele kritik üründe ekmek et pirinçte usulsüzlüğün cezası ağırdı osmanlı pazarında amaç kâr etmek helal kazanç sağlamak idi osmanlı iktisadi sistemi bireyci modele slami toplumsal yaşamı önemseyen hayat tarzını hedefledi neymiş çiller sosyalist devleti yıkmış çillerler ahlâki iktisadı yıktı yaşadıklarımız sonucudur derine kazılmadığı sürece benzerleri yaşanmaya devam edecektir kapitalizm krizsiz
diplomam canımı acıtıyor,yazıyı yazmaya oturduğumda içimden dedim siyasi atmosfer gergin konuyu ertelesem dedim yıllık gazeteciyim dönem siyasi stres yaşamadık nsanların kuyusunu kazmak bilgi birikimimizi onca yıllık tecrübemizi sorunları çözmek kullanmak gerekmiyor yüzeysellik derine kazmak şart demek istiyorum erdoğan mamoğlunun diplomaları polemiği mezuniyet belgesinin verildiği üniversitelere odaklanmak gerekmiyor günümüzde salt türkiyede batıda orta çağın yaşanmasında üst seviyede eğitim vermesi araştırma yapması bilgi üretmesi gereken üniversitelerin payı nedir siyasi toplumsal sorunlarımızdan eleştirel düşünme becerisini kaybetmiş fikir üretemeyen hayattan izole olmuş kariyerist odaklı üniversiteler sorumlu üniversiteler şirket öğrenciler müşteriye dönüştürüldü düzenin onarıcısı aksine yıkıcısı hale getirilen üniversite gerçeğini konuşmamız gerekmiyor montreal üniversitesinde bilgi ekonomisi dersi verirken gerçekle yüzleşen catherine martelline diplomam canımı acıtıyor deyip akademisyenliği bıraktı keşke türk siyasetindeki diploma tartışmasına perspektiften bakabilsek arkadaşım haluk hepkon etkilendiği kitapları okumam tavsiye eder önerdiği cambridge üniversitesinden prof ayşe zarakolun araştırması batıdan doğu dünya düzenlerinin yükselişi düşüşü kitabı eserin özünü uluslararası tarihin dünya siyasetinin avrupa merkezci çalışma oluşturuyor 13üncü yüzyıl itibarıyla dünyanın merkezi asyanın ekonomi politiği gözler önüne seriliyor alternatif tarih yazımı daim ilgimi çekti okudum yararlandım mesela liberal uluslararası düzenin çökmekte endişesinin ele alındığı bölüm trump başta günümüz dünya siyasetini kavramak anlamlı veriler sunuyor kitabı okumanızı tavsiye ederim kitabın içeriğinden yedinci bölümdeki yazarın savunması dikkatimi çekti avrasyacı mıyım yazıyor kimliğimin kitapta savunduğum argümanları okuyucunun gözünde şüpheli hale getirebileceğinin farkındayım ankarada doğdum stanbulda yetiştim avrupa batının modern dönem uluslararası düzenleriyle kıyaslanabilecek asya avrasya dünya düzenlerini ışığına çıkardığını iddia kitap yazdım ortaya koyduğum anlatı ağırlıkla asyada türk moğol etnik dilsel grubundan hanedanların oluşturduğu ağ hakkında okuyucunun sayfalara avrasyacılık pantürkizm siyasi projeyle ilişkili çeşit gizli gündemim olduğundan asyanın 21 yüzyılda türk liderliği altında birleşmesini savunduğumdan şüphelenerek gelmiş olabileceğinin farkındayım hayatta savunmayacağım şüpheyi kayıtsızca göz ardı etmem istemem satırları okuyunca ressamın eserinin anlattığını ifade olmuş düşündüm savunma yapma duydu prof zarakol şte günümüz üniversitelerin pürmelali budur aman anlaşılmayayım düşünce insanı bertrand russellın 1948de başlattığı bbc radyoda yayınlanan reith konferanslarına 1993te konuşmacı filistin asıllı prof edward said davet edildi entelektüelin temsili idi davet ngiliz medyası kamuoyunda sert tepki gördü filistinin bağımsızlık savaşına aktif katılan bbcde konferans veremez ngilizlerin entelektüele tahammülü yoktu savaşçıdan kastettikleri saidin filistin doğu meselesinde sömürgeciliğe ödünsüz makaleler kitaplar yazmasıydı entelektüel akademisyen arasındaki fark zamana kurumlara vd yenilmemek entelektüel şöhreti ödülü makamı önemseyip nabza şerbet veren değildir aman anlaşılmayayım derdi meselesi olmayandır gerektiğinde bedel ödeyendir flah ölçüde bağımsız ruhtur açıklama ihtiyacı duymaz lakin günümüzde üniversiteler entelektüeli akademisyenden üniversiteye fon getirecek çalışmalar yapan prezantabl profesyonel bekleniyor öğrencisini akademisyenini köşeli kalıba sokmak isteyen üniversitenin olana tahammülü baskıcı tür nedenlerle bilimsel çalışma yapan prof ayşe zarakol aman anlamayın demek zorunda hissediyor kendisinin yazdığı olgular ilgiliyiz siyasi kimliği prof zarakolu anlayabiliyorum çalışmaları batı merkezci tarih anlayışı güçlü ideolojileri rahatsız akademisyenlere bedelini ağır ödetiyorlar politik doğruculuk vitrin süsüne ihtiyaç duyuyor üniversite gerçeğiyle yüzleş miyoruz yıllardır inatla diploma polemiği yapıyoruz ahlaki açıdan iflas etmiş siyasi vasata teslim olmaktır
