Başlık,Metin
hafızamdaki politikacı,türkiyenin siyasi kültürel hayatında sembol isimler ktidarın muhalefete tutumunu anlama bakımından düne isim öne çıkardı osman bölükbaşı 1911 2002 demokrat parti iktidarı partisinin muhalefetin sesi osman bölükbaşıyı susturmak neler yapmadı partisini kapattı kurduğu parti girdiği 1954 seçiminde arkadaşını milletvekili seçen kırşehir şehrini hemen ilçe demeçleri sebebiyle hakkında sayıda adli soruşturma dava açtı dokunulmazlığı kaldırıldı hapse atıldı 1957 seçimlerinden ay serbest bırakıldı uğratılmadığı eziyet kalmadı başbakan adnan menderesin kâbusu bükülmez yılmaz bölükbaşı idi bölükbaşı menderes toplantı gösterileri yasakladı basın ağır baskı tesis gazeteleri kapattı gazetecileri hapse attı ana muhalefet partisi chpyi kapatmak tahkikat komisyonu kurdu bölükbaşı daima menderes iktidarı uygulamalarına muhalefet etmeyi sürdürdü dp içindeki partililer konuda görüşteydi partiyi ortaya çıkaran 46 ruhu söndü yandan dp iktidarının hedefi yapılarak zulme uğrayan bölükbaşı askeri müdahaleye yassıada yargılamalarına idamlara çıktı şuraya gelmek istiyorum dün osman bölükbaşı ekrem mamoğlu siyasi kültürel hayat olgunlaşmıyor demokratikleşme başarılamıyor türk siyaseti temel karakteristik anlayıştan kurtulamıyor demokratik rekabeti düşmanlık algılıyor politik hayatta dost düşman demokrasinin hayli zayıf hibrit tipi otoriterleşen ülkede muhalefet hükmündedir siyasi tutum davranışlarında düşmanlık vardır türkiyede demokrasi meseledir sorundur problemdir demokrasi siyasal kültür ilişkilerinde hâlâ ortadoğuluyuz dönem bahane bulunarak sorunu çözecek darbe yapılmıyor kuşkusuz tarihsel sosyolojik kökü ekonomik temelleri geçmişten günümüze kötü siyasal deneyimleri heyhat demokrasimiz ağır aksak ilerlemiyor kurumlarıyla sürekli geriliyor dp 1950 seçimini kazanınca yüksek rütbeli askerlerin çankaya köşküne çıkarak müdahale izin istemesine cumhurbaşkanı smet nönünün katiyetle demesinin anlamı anlayışı siyasi olgunluğu korunamadı korunamıyor nönüden geriye düştük rasyonel siyasi kültür demokratik yönetim yıllardır inşa edilemiyor demokratik değerleri temel alan siyasi kültürü hayata geçirmekte zorlanılıyor toplumsal çatışmaya sebep inatla görülmüyor kendimizi kandırmayalım ülkede demokrasi kapasitesi yaşatacak zihniyet öteki gördüğüne düşmanlık yaparak fiziksel güç kullanıp etkisiz hale getirerek hükmetmek siyasette uzlaşma kültürünün adil rekabetin karşılıklı saygının olmamasının sebebi ktidarın hesap vermez günlerine gelindi 2002 ruhu söndü anlayan kişi siyasal muhalefetin sınırlandırılması etkisizleştirmesi siyasal kültür demokrasi arasındaki ilişkiyi ele alırken söz konusu çerçeve devlet hükümet yasama faaliyeti partiler sınırlandırılamaz halk yıllardır yukarıdakilerin yıkılan siyasi yük sorumluluktan kaçınılıyor yaşanılan demokrasi yozlaşmasında payı daima birilerini suçlayarak başkasından hareket bekleyerek demokrasi itibarıyla siyasi kültür inşa edilemez demokrasiyi kökleştirecek sorumlu siyasal yurttaşlık davranışına mecbur dün gördüm yanda siyasi mühendislik yapılıyor gözaltılar yarar yaramaz ana strateji mühendislik olmamalı elitist seçkinciler başta kimilerinin yükü başkasına yükleme kolaycılığı elbet iktidar muhalefet sonsuz ilelebet gereken demokrasi değerlerini siyasal sistemi kurumsallaştıracak halkın kendisidir birey siyasi aktördür bilinçte kimlikte lazım siyasete anlam mana kazandırılır kişi kültüne mecburiyet bulur kişi çoban halk sürüdür bilincinde şart hele yaşanılanlar sonucu cılız kalmış siyasete güvensizliği pompalamak iktidarın tek beklentisidir aksine demokrasiye sadakatle bağlılık gösterilmek zorundadır dünden fazla siyaset mecburiyeti doğmuştur demokrasinin varlığı rejimin bekası ölçüde halkın tutumuna bağlıdır kişinin tek başına demokrasiyi benimsemesi yeterli kolektivizm şart bertolt brecht kurtuluş tek başına beraber hiçbirimiz sorunsuz demokrasi türkiye mecbur
türkiyenin gücü,yazıma tanım başlayayım güç fikir düşünce ahlâk yönünden etki yapabilme etkiye direnme yeteneğidir güç yapabilme kapasitesini gösterir stenilen sonucu gerçekleştirmek başkalarının davranışını etkileme yeteneği mümkündür soruyu sorabiliriz türkiye dünyada güç müdür türkiye bölgesel güç müdür sorulara devlet aklı yanıt veriyor siyasi iktidar yanıt veriyor halk yanıt veriyor dünya ülkeleri yanıt veriyor cevabı aranan ölçüt belli ülkenin sahip ekonomik askeri jeopolitik diplomatik teknolojik güç maddi unsurlar yanında kültür ulusal değerlerin toplamı gücünüzü gösterir gücün gücü dengelenmediği yerde demokrasi özgürlük adalet salt askeri kuvvet üstünlük sağlamaz sosyal yapıdaki demokrasi hukuk insan hakları insani gelişmişlik yapısal fay hatlarını göz ardı edemezsiniz erozyona uğratılırsa devletin milletin kurumsal gücü zayıflar gücün kullanımı güvenlik politikaları sağlanmaz hepsinin ahenk zorunlu sorumu tekrarlayayım türkiye dünyada bölgesinde güç yanıtını vermeden türkiyenin devresini hatırlatmam atatürk dönemi soğuk savaş dönemi sovyetler birliğinin dağılıp abdnin dünya imparatoru ilan dönem dönemde türk dünyası müslüman nüfuslu ülkeler bağımsızlık egemenlik barış refah beka laik çağdaşlaşma türk modeli örnek gösterilirdi türkiye liderin ülkenin imrendiği orta güçlü ülkeydi dönemde türkiye örnek model vasfını kaybetti yaşadık özbekistan kazakistan türkmenistan kktcyi tanımazken güney kıbrıs rum kesimine büyükelçi atadı birlikte türk devletler teşkilatı kurduğumuz akrabamız ülke teşkilatın gözlemci statüsündeki kktcyi sırtından bıçaklamış türk dünyası birliğinin sembolü kızıl elma çürük çıktı daima övündüğümüz türk modeline ortadoğuda durumumuz stratejik derinlik başlayan osmanlıcılık dış politikası yanımızda tek müslüman ülke bırakmadı irak mısır suudi arabistana zamanla ettiğimiz lafların hepsini yuttuk türk müslüman dünyanın lideriyiz yapayalnızız abd başkanı trump küresel dünyayı yeniden dizayn etmeye çalışırken küresel güç dağılımında neredeyiz safımız nere önemlisi gücümüz abd pensilvanya üniversitesinin 21 kişiyle dünyanın güçlü ülkeleri sıralamasında bırakın sraili suudi arabistanın gerisinde çıktık orta güçlülükten geriye düştük sözde güçlüyüz güç sarhoşu kimimiz çenesi güçlü kendimizi kandırmaya devam edip trump düzeninde tıpkı osmanlı kurulan tuzaklara düşmeyelim aklıselim olmalıyız övündüğümüz askeri gücümüz düne silahlanması yasak almanya japonyanın gerisinde teknolojik gelişmeden sınıfta kaldı iktisadi zenginlik yaşadığımız mevcut ekonomik sıkıntı yanıt veriyor zorluğa mamoğlu tutuklaması sonucu dövizi baskılamak 36 dolar harcayan dışa bağımlı ülke derece güçlü olabilir kaçıncı uzatmayayım yakın tarihte yaşananları biliyorsunuz sorumuz olmalı türkiye gücünü artırabilir mesela türk müslüman dünyada yalnız kalarak güçlü olunabilir mesela ortadoğuda dini gruplaşmalara taraf ideolojik anlayışı sorgulamak gerekmiyor türk modeline acilen dönmek gerekmiyor önemlisi türlü muhalefete baskı uygulayıp ülke iç cephesi parçalanarak güçlü olunabilir bırakın kuşkuculuğu sadakat özveriyle vatanına bağlı ülkesine adanmışlık hissinde fedakâr doğrusunu başkasına dayatamaz insan düşünce değerlidir stikrara mecburuz atatürkün sözlerini hatırlamanın zamanı yurtta barış dünyada barış birleşik olunmadan güç olunmaz ülkeyi içe dönük olmaktan kurtaracak ulusal stratejiye ihtiyaç güçlü türkiye gelecek vizyonu şart adımı milli çözüm sürecine katkı sunacak siyasi diyalogu başlatacak toplumsal barışı sağlayacak genel aftır cesur zorundayız türkiyenin kıymetini bilmek zorundayız
beddua,bayramda bedduaya tanık oldum nsanlar bedduayı çeşit cezalandırma yöntemi kabul görmüş herhalde mamoğlunun hapse atılmasının gerekse protestolar sonucu ortaya çıkan şiddetin insanı üzüntülü yapması şaşırtıcı üzüntü insanı susturabilir söylenecek kaldı üzüntü boyun eğmeye kabullenmeye yaklaşan duygu beddua nereden çıktı duyduğumda beddua etmeyin dedim lanet okumak iyi değildir insanların duygusal halleri aklıma milan kunderanın gülüşün unutuşun kitabı romanını getirdi çek dilinden litost sözcüğünü dünya edebiyatına kazandırdı nsanın berbat hissettiğinde ayağa kaldıracak utanç hınç sarmalı bedduayı silah kullananlar üzüntüyü aşmış aşağılanmış hakarete uğramış onuru zedelenmiş hissediyor nsanlar öfkeli nsanlar hınç dolu kötüsü tehlikelisi insanlar kindar olmaya başladı duygusal isyanlarını beddua giderme arayışında kötü hastalıklı yere savruluyoruz belirsizliğin yaşandığı ülkeler duygusal yaralar parçalanır öç alma bedduası geri alınacak bilemiyorum ktidardaki kimileri hz muhammetin hadisini unuttu mazlumun bedduasından sakının bırakılsın kısasa kısas tavrı infiale kapılmadan ülkede kardeşlik hukuku inşa edilmek zorunda ktidarın amok koşusu akpli arkadaşlarım bayramlaşmada olaylar sebebiyle kimilerinde gördüğüm mahcubiyet duygusu başta mamoğlu gençlerin hapse atılmasından üzgünler kendilerini küçük düşürülmüş hissediyorlar ülkede içtenlikle utanıp sıkılan yüzü kızaran siyasilerin geleceğe dönük umut beklentisine yol açıyor akplileri merhametsiz görmeyin yazıyorum satırları başkasının acısını hissedenler hayal kırıklığına uğrayanlar partide usanmışlar rahatsızlar muallaktalar kamuoyu önünde dile getirmiyorlar sarsılmış durumdalar suçluluk pişmanlık ruh hallerini hissediyorum yüzlerinde kaçırmaya çalıştıkları gözlerinde gülümseme karamsarlar kasvetliler kendilerini suçlu hissediyorlar hatırlamak istemedikleri süreçten geçtiklerinin farkındalar kendilerini hayata kapatmışlar biriymiş yaşıyorlar farkında misiniz cesur olduklarından kuşku duymadığım akpliler çıkıp iktidarlarını destekleyen açıklama yapmıyor demeç vermiyor çaresizlik girdabına düşmüş vicdanlı akplilerin haline üzülüyorum heyhat akp iktidarının ülkede kontrolü kaybetmek düşünüyorum yalpalıyor panik atak geçiriyor gergin savunmacı psikolojik hali aklı devre dışı bırakmış görünüyor muhalefeti düşman görmüyor herkesten gereksiz şüphe duyuyor soğuk savaş dönemi taşın altında komünist arama paranoyası görüşler üzerinden devam ettiriyor dizi oyuncularına şarkıcılara hasetle cadı avı nedir yahu önüne gelene hakaret etmeler aşağılamalar bilmeli birey onuru saygıyı hak eder nsanları çileden çıkarmaya edebe hoşgörüye hepten unutuldu malezyalıların amok dedikleri ani öfke nöbeti uçuruma koşuyor akp iktidarı sahi efendi ahlâkı friedrich nietzsche 1887de ahlâkın soykütüğü üstüne kitabını yazdı kitabın bölümünde ahlâkın temel türü olduğundan bahsetti efendi ahlâkı köle ahlâkı roma mparatorluğunda efendileri aşağılanan kölelerin hissettikleri öfkeyi cezalandırma korkusuyla bastırdıklarını içlerindeki intikam duygusunu hınçlarını kışkırtıcı hareketlerle dışarı vurduklarını yazıp kavramsal açıklama soylu efendi ahlâkının karşısına hayatının kısıtlanmasına öfke duyan köle ahlâkının çıktığını belirtti efendi ahlâkı iç güdülere dayalı gücü planda tutan uyum sağlamak dönüştürmeyi salık veren tartışılmaz iyi sayan yaşam biçimini temsil ediyordu efendi ahlâkı insan tipi değer yargılarını kendisinden hareketle üretirdi vahşi insan efendi ahlâkı ehlileştirilirdi ortaklaşmayı hümanizmi özgürlüğü insanın saygı duymasını hedefleyen köle ahlâkını merhametli hastalık bulan nietzsche gurur gücü barındırdığını ileri sürdüğü efendi ahlâkını savundu acı çekmeyi meşrulaştırdı nietzsche acının toplu kabulünü tavsiye neler demedi aşağılamak aristokrat duygudur tibarıyla takipçisi hitler yahudi soykırımının sebepleri arasında nietzschenin kitabı nsanoğlu tarihindeki ahlâk kavgası mücadelesi sürecek yaşıyoruz deniyor çeşitli ahlâki kılıflar bularak hapsettiğimiz insanlar ses çıkarmayınız değerli okuyucu sormayınız safınızı kendiniz belirleyiniz ahlâkını savunuyorsunuz
bakış açısı,mamoğlu arkadaşlarının hapse atılmasıyla başlayan protestolara politik çevreler emperyalist projedir bakış açısı getirdi bakış açısı olayların meydana gelmesinde mekan şahıs şahıslar unsurların kimler göründüğüdür bakış açısının tek yorumu yoktur nereden baktığınıza değişir mesela eduardo galeano aktarımıyla karayip yerlilerinin bakış açısına tüylü şapkası kırmızı kadife ceketiyle kristof kolomb zamana görülmemiş boyutlarda papağandı hinduların kutsal inek gördüğü yerde başkaları koca hamburger görür statistikçilerin bakış açısına kişiden dolar almazsa kişi başına düşen gelir hesabında kişiden dolar almış görünür siyasi gözlemcilerin sivil protestolara bakış açısının olmasında şaşılacak yön eylemlerin arkasında sahiden emperyalist proje siyasi değerlendirme propaganda amaçlı bakış açımı tezimi yazayım 1968 kuşağı meydanlarda sokaklarda üniversitelerde 2008 kuşağı eylemlerine tanıklık ediyoruz bugünlerde çocukların gençlerin emperyalizm oyununa gelip gelmediğini değerlendirmek öncelikle analize soruyla başlamak gerekiyor çocuklar gençler ekonomi politik kültürel ortamda yetiştiler toplumsal yapıyı belirleyen ideoloji neydi küreselleşmenin emperyalizmin neoliberalizmin ülkeyi yıllardır tarumar etmesine tek söz etmeyeceksiniz adaletsizliğe çıkanları emperyalist proje kodlayıp güvensiz göstereceksiniz lk düğme gençlerin çocuk olma haklarını katı ideolojik sistemi iktidar yapanların kimler bilmiyor olamazsınız gençler iktidarınızda büyüdü eduardo galeanodan örnek vereyim karşıdan karşıya geçerken dikkatli gerektiğini açıklıyordu kolombiyalı eğitimci gustavo wilches grup çocuğa yeşil ışık yansa yanınıza yanınıza bakmadan sakın karşıya geçmeyin wilches çocuklara keresinde otomobilin çarptığını sokağın ortasına külçe fırlattığını anlattı neredeyse hayatına mal olacak felaketi hatırlayınca wilches yüzünü buruşturdu çocuklar soruyordu otomobil markaydı klimalı mıydı üstü açılıp kapanıyor muydu sis lambaları mıydı motoru silindirliydi sanırım emperyalist projeyi yerde arıyor arkadaşlar tüketim merkezli sistemin yarattığı tutsak düzene bugünlerde tepki gösterenler emperyalist proje yapmayınız gerçekte asıl tehlikenin kavrayamazsınız emperyalist ekonomi politik sistemi sürdürenler emperyalist projeden bahsediyorsunuz özünde küresel totaliter düzene yönelik protestoları ülkeye yönelikmiş gösteremezsiniz gerçekliğe kamuflaj elbisesi ideoloji giydiremezsiniz aksine tüketim çılgınlığına esirliğine çıkan özgürlükçü kuşak açayım konuyu vatanı milleti prestijli markalara indirgeyen dilini kültürünü elektronik kodlara dönüştüren sürekli değişen yüzeysel alışkanlıklarını sanal dünyayla oluşturan cehaleti yücelten sistem ideoloji emperyalizm projesi değerleri alıp satan kutsal piyasaya tek eleştiriniz zengin çocuklar yoksul çocuklar ciğerlerine zehir çekerken sesiniz çıkmıyor eylem yaptıklarında görüyor hedefe koyuyorsunuz gençleri yalnızlaştırılan bireycileştirilen çocuklar gençler kollektif çığlık atıyor güçlerini ortaklaştırıyor tüketim pazarına türlü ekrana köle 2008 kuşağının toplaşarak ortak sloganlar attığını anlamazlıktan geliyorsunuz bakınız ödül ceza istiyor liyakatsizliğe paraya özgü ayrıcalığa tüketilmeye karşılar aptallaştıran tek tipçiliğe karşılar yüceltilen cehalete karşılar ülkeye hükmeden türlü adaletsizliğe karşılar totaliter iktidarı kutsamaya mitleştirmeye gardiyanı bekçisi olmaya karşılar kovulmaya atılmaya korkutulmaya işsiz bırakılmaya iç düşman görülmeye tutuklanmaya karşılar 2008 kuşağının özgürlükçü taleplerini genelleyici politik etiketlerden ziyade anlama temelli değerlendirmek ktidar çevrelerinin güvenliği adalete tercih bakış açılarını değiştirmeleri zorunlu devletin bekası asıl bakış açısıyla erozyona uğratılıyor ülkemizde 68den yana kuşak edilip şiddeti cezayı kalkan yapan vasatlığa teslimiyet sürmesin protestolardan çıkarılacak alınacak dersler kuşak şüphe düşürmeyin
halepli akbayram ailesi,gaziantepin eski yerleşim yeri akyol mahallesi mahallenin dar sokaklarından saraç mehmet sokağında birbirine bitişik katlı taş konaklar numaralı adreste halepliler denen geniş aile oturuyor hacı dede hitap edilen devlet memuru hamdi bey halep göçmeni kardeşi şemsettin ressam konağın avlusundan güzel ses yükseliyor hamdi beyin kızı gültenin sesi müzeyyen senara benzetiyorlar sesini kız kardeşler gülşen semahat harbiye fethiye samiye eşlik repertuvarı belirleyen ağabeyleri nedimin eşi stanbullu gelin türkan ağabey oto boyacısı nedim müziğe eğlenceye düşkün kalfası ahmet özoğlu şehrin güzel seslerinden pazar günleri konakta piknikte eğlence yapılıyor şehrin geleneği sazlı sözlü toplantılar nedim türkanın bebekleri 1950nin günlerinde doğuyor edip ardından üçü kız ikisi erkek çocukları çiftin talihsiz edip ufakken çocuk felci geçiriyor aile seferber el bebek gül bebek büyütüyorlar sabiyi edip şımarık sakin kibar ayağının aksamasını sorun etmiyor daima güler yüzlü sımsıcak bakan iri gözler tutkusu halalarıyla şarkı söylemek onlarla turizm kavaklık bahçeye stanbullu şarkıcıların konserlerine gitmek eve gelince ayna karşısında taklit müzik okul değiştiriyor şehrin orkestrası siyah örümcekler müzik grubunun 19 yaşında solisti türk halk ozanlarının türkülerinin batı formatında çalınıp söylenmesi ortaya çıkan anadolu rock akımının öncüsü tülay german erdem buri paltosundan erol büyükburç alpay cem karaca barış mançolar çıktı 1960lar müzikte halkçılık dönemi 68 kuşağı siyasal söyleminin türküler kitleselleştiği süreç genç edip fikret kızıkoka özeniyor ses tonunu erkin koraya benzetmeye çalışıyor özgün sesini bulmuş öykünme yılları düğünlerde çalıyor söylediği samanyolu şarkısı lk 45lik plağını çıkarıyor neşet ertaşın kendim ettim kendim buldum türküsü adanada beyaz saray gazinosunda şarkıcılık stanbulda diş hekimliği fakültesinde öğrencilik altın mikrofon müzik yarışmasında 1972de birinci olunca hayatı değişti okulu bıraktı müziği hayatının merkezine taşıdı halkının takdir edip seveceği ışık şelalesi sanatçı ülkesine armağan edip akbayram halkını hüsrana uğratmadı çinde yücelik taşıyan halkının ideallerine sevdalı ruhu haşmetli sesine vuran koca ateş profesyonelliğe nefsi güçlü sanatçı parayla şöhretle işi nihayetinde sanatçı yaşayan midir maskesiz boyasız kalmakta inat vasata teslim sanatçı tek istediği halkının sesi sessiz çığlığını duyurmak vazgeçmedi davasından sevdalı sabırlı fedakâr insan soyluluk zarafet davranışlarında vakur mütevazi sevmek yaratılmış samimi insan hile bilmez kurnazlık yapmaz dürüst çi dışı dikensiz gül bahçesi onca bedel ödemesine edepli 1970ler ikinci yarısı çorumdaki konağın arka bahçesinde kapağı kırık teypte döne döne kaset dinliyorum cem karaca selda bağcan edip akbayram sevdiğim türkü eşkıya dünyaya hükümdar sözlerini anlamıyorum tahta kaşıkla tenekelerden yaptığım bateri çalıp eşlik ediyorum türküye lk politik dayağımı ortaokulda kasetten dinleyip ezberlediğim aldırma gönül türküsünü söylediğim yiyorum 12 eylül 1980 askeri darbesi kasetin toprağa gömülmesi albert camusnun dediği can çekişilmeyen sabah hapislere düşülmeyen akşam korkunç katliamların yaşanmadığı öğle vakti yoktu siyah beyaz televizyonda sanatçı hakkında nefretle neler söyleniyor neler kirlilik bulaşmayan şeyin kalmadığı dönem andre malrauxnun dediği çocuk saflığımızla devrimi hayata şans vermek yapacaktık heyhat insanların saygınlığı çabuk yıkıldı çabuk teslim oldular onca kötülüğe ümitsizliğe kapılan kibirliler bilgisizler hemen diz çökmez sayısı vazgeçmeyenler edip akbayram biliyordu ruhları iyileştiren iyiliğe dokunan sanatçılardır slavoj zizekin kitabının ismi gibiydi duruşu adını söylemeye cesaret sol nsanın olmaya cüret yürek ister acı çekme korkusuna tahammül zor yalnızlığa işsizliğe oluş tehlikesine edip akbayram zalimliğe boyun eğmedi erdemi sürdürmekte yiğit cesur inatçı düş kırıklığından doğan hüznün acısını tuttu yorulmaksızın haykırdı güzel günler göreceğiz çocuklar
70 yıllık ağır sömürü,tüsi ad hedefte konuya girmeden iktisat tarihi çerçevesi çizmem şart ahmet lütfi efendi osmanlı vakanüvis idi osmanlı tarihine dair 15 cilt kitap yazdı babası mehmet ağa nalıncı takunya esnafıydı baba mesleği gerekse imar meclisinde bulunması zaptiye başkatipliği stanbul kadılığı anadolu kazaskerliği yapması ahmet lütfinin osmanlı pazarında yaşananlara ilgi duymasına sebep mesela os man lıyı açık pazar haline getirerek sömürgeleştirilmesine sebep n gil te re 1838deki ti ca ret ant laş ma sı nı değerlendirdi ol ahe 1838 ti ca ret ant laş ma sı yed va hid te kel usu lü kalk tı ri ec bi in hi sa rı ban cı te ke li gel di me ma lik mah ru sa os man lı pazarında hur fu ruş lu ğa kü çük ti ca re te ka dar ec bi ler iş ti rak ey le di sa na hi li bü tün mahv at tal ol du çök tü em ti ayı ef ren ci ban cı mal lar re vaç la rak nü kud mev cu du muz mev cut pa ra mız av ru pa çe lip git me baş la dı rih dev let ali os ma ni osmanlı avrupanın ağır sömürüsü altında yaşadı türk sermaye birikimi yeniçerilik biçildi vs 1908 kinci meşrutiyet temmuz devrimi vermeyi hedefledi tüsi ad türk sanayicileri ş nsanları derneği nisan 1971de kuruldu tarihten neler hatırlatayım ktidara ttihatçılar osmanlının avrupa karşısında geri kalmasının sebebini analiz avrupada burjuva sınıfının olmaması ticaret sanayinin azınlıklar yabancıların elinde osmanlıyı zayıf bıraktı geri kalmışlığı yenmek ticaret sanayinin müslüman türklere verilerek milli burjuvazi yaratmak şart yaptılar kapitülasyonları kaldırdılar yabancı şirketlerin osmanlı hukukuna tabi ilan ettiler temel ekonomik sosyal yapılar değiştirildi lk fırsatta tibar milli bankası 236 milli anonim şirket kuruldu girişimci beklenen türk sermayesi istenilen düzeye gelemedi 1913 tarihli teşvik sanayi kanunu çıkarılsa türkler sanayiden ticaretle uğraşıp kısa süreli kârlara yönelip karaborsacılık yeraltı faaliyeti araya dünya savaşı girdi milli sermaye yaratma politikası devam araya 1929 dünya iktisat bunalımı ikinci dünya savaşı girdi itibarıyla kapkaç ekonomisi hortladı toprak ağalarının kurduğu demokrat parti menderes döneminde devlet eliyle zenginleşme doruğa çıktı anap özal döneminde neoliberalizm piyasanın krallığı başladı küreselleşme ithalata yönelim tıpkı 1838de türkiye pazarını korunaksız bıraktı sermaye sanayiden ticaretten çekilerek havadan kazanç finans ekonomisine yöneldi ülkenin milli kaynakları satıldı kapatıldı dolar tapılacak tanrı tefecilik isim değiştirdi sermayenin bölümü özal çiller kemal derviş erdoğan gül döneminde neoliberal iktisat politikalarının tavizsiz süreceği güvencesini alıp akpye destek verdi hemen hemen iktidarlar kalkınma stratejileri sermayenin daima cankurtaranı gelelim bugüne geçen yaz yurt dışındaki türk bankacı erdoğan olmasaydı 2008 krizinde beyaz türklerin iflas edecekti erdoğan tüsi adı kurtardı dedim yıllık olay türk devleti milli sermaye yaratmak gücüyle çabaladı toprakların yıllık değişmez ekonomi politiği geçen hafta tüsi ad demokrasi hukuk insan hakları deyince iktidar taraftarlarınca hedefe kondu tüsi ada derse desinler erdoğan sermaye birbirine muhtaç erdoğan sermaye birikimini karşısına alamaz gücü tüsi ad eleştirisinin zamanlamasını değerlendirmek lazım meselenin demokrasi olduğuna inanıyor musunuz sorun neoliberalizm krizi ülkemizdeki ekonomik buhran gerilimi sermaye iktidarı karşıya getirdi tüsi ad geçen senelerde eli patlarcasına erdoğanı kumpas döneminde fethullah güleni alkışlamadı demokrasisi darbeler dahil daima vasat vahşi iktidarları desteklemediler paylaşım kavgasıdır yaşanılan sermaye daim faydasına yönelik yapısal dönüşüm istiyor krizin faturasını ödemek istemiyor sonuçta yılı aşkındır devlet desteği verilen sermaye dün demokratik siyasal mücadele çıkarı mücadele veriyor bağımsız türkiye şiarıyla emperyalizme milli sermayeyi destekleyen tavrımız gerçeği görmemize engel
