Yazar,Başlık,Tarih,Metin,URL
Aytunç Erkin,24 yıl önce radara takılan yasa dışı bahis,16 Mart 2025 05:00,"Tam gazeteci dostum Murat Ağırel’in “Kirli Çark/Kırmızı Kedi Yayınevi” kitabını bitirirken operasyon haberi geldi. İstanbul Cumhuriyet Başsavcılığı Örgütlü Suçlar Soruşturma Bürosu tarafından yürütülen yasa dışı bahis soruşturması kapsamında, aralarında Pozitifbank, Flash TV ve Payfix Ödeme Kuruluşu gibi finans ve medya sektöründe faaliyet gösteren şirketlerin sahibi Erkan Kork’un da aralarında bulunduğu 59 kişiye yönelik geniş çaplı bir operasyon gerçekleştirildi. Şüpheliler, “Suç işlemek amacıyla örgüt kurma”, “Suçtan kaynaklanan mal varlığı değerlerini aklama” ve “7258 sayılı Futbol ve Diğer Spor Müsabakalarında Bahis ve Şans Oyunları Düzenlenmesi Hakkında Kanun’a muhalefet” suçlamalarıyla soruşturuluyor. Sonra kitaba daldım. İlk kez “yasa dış bahisle” tanışan Türkiye’nin hikayesi ilginçti. Tarih: 4 Aralık 2001… Adı: Lorella Razetti. İtalyan. Her şey Razetti’nin adının karıştığı bir olayla başladı. MASAK, bir bankanın ihbarı üzerine, internet üzerinden bahis oynatarak haksız kazanç sağlayan bir şebekenin peşine düştü. İlk araştırma sonucunda, Lorella Razetti adlı İtalyan kadının hesabına, çok sayıda kişinin açıklama yapmadan, dikkat çekici miktarlarda para transfer ettiği görüldü. Harekete geçen MASAK müfettişleri, “gizli” ibareli bir yazıyla, Devlet Bakanı Kemal Derviş’e bilgi verdi. Soruşturma yapmak amacıyla Derviş’e bağlı bakanlıktan onay alındı. Lorella Razetti’nin adına açılan hesaplardaki para hareketleri takibe alındı. İhbarı yapan bankadaki hesap kayıtlarında, Razetti’nin kendisini; 1959 doğumlu bir muhasebe müdürü olarak tanıttığı, adresini ise İstanbul Mecidiyeköy’de gösterdiği belirlendi. İstanbul genelindeki bankalarla yapılan yazışmalar sonucunda Razetti’nin TL, dolar ve euro üzerinden açılmış başka hesaplarının da olduğu anlaşıldı. Bir bankanın gönderdiği yazıda ise Lorella Razetti adına kurulmuş “www.easybets.com” adlı internet sitesinde, bahis oynayanların para yatırması için hesap numaraları verildiği belirtildi. Hesaplara çok sayıda vatandaşın büyük paralar yatırdığı iletildi. Bahis oynayanların Razetti’nin hesabına yatırdığı bu paraları ise; Beşiktaş 6. Noterliği aracılığıyla vekâletname verdiği Türk vatandaşı Semih Sadi’nin çektiği bildirildi. Bu sefer de Semih Sadi’nin izi sürülmeye başlandı. Sadi’nin annesi Stella Salem adına Girne’de hesap açtığı ortaya çıkarıldı. “www.kolaybahis.com” adlı bir başka internet sitesinde; müşterek bahis oynayanların paralarını Kıbrıs’taki bu hesaba yatırmasının sağlandığı anlaşıldı. MASAK, vurgunu önlemek amacıyla işbirliği yaptığı bankalara, söz konusu hesapları kapattırdı. Ancak Sadi; bu süreçte farklı yöntemler buldu ve “Nokta Otomasyon Bilişim Ticaret Limited Şirketi”ni kurdu. İnternet üzerinde “sanal kart” aracılığıyla alışveriş yapıldığı görüntüsünü vererek bahis oynattıran Sadi, para toplamaya devam etti. Bu sırada, müfettişler hesap numaralarına para yatıran Türk vatandaşlarının adres, kimlik ve vergi numaralarına ulaşmak için harekete geçti. Ancak çoğunun kimlik bilgilerine ulaşılamadı. Az sayıda kişinin ifadesi alınabildi. MASAK ve Emniyet yasadışı sanal bahis hareketini ilk kez burada tanıdı. “Yasa dışı bahis sistemi” nasıl çalışıyor? “… Sanal bahis, yalnızca kolay para kazanma vaadiyle bireyleri çeken bir oyun değil, aynı zamanda organize suç örgütlerinin kontrol ettiği devasa bir çark. Bu çarkta, oyuncular yalnızca birer piyon; kazanan ise her zaman sistemi kontrol edenler.” Peki bu “yasa dışı bahis sistemi” nasıl çalışıyor. Okuyalım: Yasadışı bahis sitelerinin yönetimi için bir “panel” kullanılır. Bu bir yazılım. Sitelerin, dönen paranın ve teknik altyapının yönetilmesi bu panel üzerinden yazılımcılarla birlikte sağlanıyor. Bahis oranları ayarlanıyor, bakiye düzenlemeleri yapılıyor. Ve sunucuları yurtdışında oluyor. Bölgesel düzeyde faaliyet gösteren ve oyuncularla doğrudan temas kuran ara birime ise “alt kasa” adı veriliyor. Bütün düzen komisyon üzerinden çalışıyor. Çarka katılan her bir birim az veya çok aldığı sorumluluğa göre komisyonunu alarak yoluna devam ediyor. Aynı anda birden fazla bankada açılmış paravan hesap gruplarıyla “set hesaplar” kuruluyor. Genelde 5 veya daha fazla hesap içeren bu yapı, organizasyonun finansal izini gizlemek için kullanılıyor. “Fraud Ekibi”ni duydunuz mu? Aslında tam da profesyonel bir holding gibi çalışıyorlar. Bunun için bir “Back Office” kuruluyor. Bu departman müşteri taleplerini karşılarken bakiye sorunlarını çözüyor ve oyunculara rehberlik ediyor. Peki hiç “Fraud Ekibi”ni duydunuz mu? Anlamı risk birimi... Oyuncuların ve hesapların sistem kurallarına uygunluğunu kontrol eder. Dolandırıcılık ya da sistemi aldatmaya yönelik bir girişim tespit edildiğinde hızlı müdahale eder. Bu düzende en çok kullanılan şey “Kripto Para Cüzdanları” oluyor. Çünkü bu sayede neredeyse hiçbir dijital iz kalmıyor. Paranın takibi yapılamıyor. Tüm ödemeler de bu şekilde gerçekleştiriliyor. Üstelik bu sitelerde bildiğiniz alışveriş sitelerindeki gibi “canlı destek” hizmeti de sunuluyor. Anlık sorunları da gidermeyi düşünen bir “müşteri memnuniyeti” kurumsal olarak kurulmuş durumda. Tabii bir de “bayilik sistemi” var. Organizasyonun bölgesel yayılmasını sağlayan komisyon bazlı yapı var. Üst kasa, alt kasalara operasyonel izinler ve komisyon payı vererek bu bayilik sistemini işletiyor. SONUÇ: Kitapta “baronlar” var, çok sayıda isim var, sistem var! Hepsinden ayrı ayrı portreler yapılır ve bu “Kirli Çark”ın fotoğrafı çekilebilir. O zaman haydi bu çarka çomak sokmaya!",https://www.nefes.com.tr/yazarlar/aytunc-erkin/24-yil-once-radara-takilan-yasa-disi-bahis-21960
Aytunç Erkin,Her şey mümkün! Bu hukuk sisteminde herkese her şeyi yapabileceğiniz ortam var,25 Mart 2025 06:00,"Dün… Ankara Valiliği, Ankara Büyükşehir Belediyesi (ABB) tarafından 2021-2024 yılları arasında düzenlenen ve müfettişler tarafından incelemeye alınan 130 konserden 33’ü hakkında, kamu zararı iddiasıyla soruşturma izni verilmesi yönünde karar aldı. Soruşturmayla ilgili ABB tarafından hemen açıklama yapıldı: “Ankara Büyükşehir Belediyesi olarak 2021-2024 yılları arasında düzenlenen bir dizi kültür ve sanat etkinlikleri bir süredir müfettişler tarafından incelemeye alınmıştı. Müfettişler tarafından sürdürülen ve 130 konseri kapsayan hizmet alımlarına ilişkin inceleme tamamlanmıştır. Söz konusu inceleme sonucunda 97 konser için herhangi bir usulsüzlük tespit edilmemiş, bu etkinliklerle ilgili soruşturma izni verilmemiştir. Ancak 33 konser hakkında, kamu zararı iddiasıyla soruşturma izni verilmesi yönünde karar alınmıştır Önemle belirtmek isteriz ki; bu etkinlikler daha önce Sayıştay’ın rutin denetimlerinde ve İçişleri Bakanlığı tarafından yapılan teftişlerde detaylıca incelenmiş, herhangi bir olumsuz bulguya rastlanmamıştır. Karara konu olan ve hakkında inceleme yapılan 9 belediye çalışanı, hukuki haklarını kullanarak Bölge İdare Mahkemesi nezdinde itirazda bulunacaklardır.” Olayın geçmişine baktığımızda… Tarih 13 Kasım 2024. Ankara Cumhuriyet Başsavcılığı, 67 ayda konserlere 810 milyon lira ödediği iddia edilen Ankara Büyükşehir Belediyesi’nin konser harcamalarında usulsüzlük yapıldığına yönelik iddiaları soruşturmak için İçişleri Bakanlığı’na müzekkere yazdı. Teftiş Kurulu da inceleme başlattı. Aynı gün Mansur Yavaş’tan şu sosyal medya paylaşımı geldi: “11 Kasım tarihinde konuyla ilgili basına açıklama yaptığım gün İçişleri Bakanlığı tarafından 2 mülkiye müfettişi konuyu incelemek üzere gönderilmiştir. Bu inceleme halen devam etmektedir. Yeni bir durum söz konusu değildir. Hesap verebilirlikte bizim üstümüze kimse yoktur. Sözümüzün arkasındayız suçu olan varsa cezasını çekecektir. Aynı davranışı tüm kamu ve belediyelerden de bekliyoruz.” Konuyla ilgili ABB Başkanı Mansur Yavaş’ı aradım. “Nasılsınız” diye sordum. Sesi kısıktı: “Ankara-İstanbul arasında gidip geldik bu sırada sesimiz kısılmış. O kadar.” Peki “33 konsere soruşturma izni” konusunda ne düşünüyor Yavaş: “Normal bir süreç. Her konuda açığız, şeffafız. Şunu söyleyebilirim sadece: Bir insana bir şey yapmak istiyorsanız hukuk sisteminde her şeyi yapabileceğiniz ortam doğmuştur maalesef.” Mansur Yavaş’ın bende kalan bazı cümleleri var. Ama şunu söyleyebilirim: Süreci yakından takip ediyor ve önümüzdeki günlerde neler yaşanabileceği konusunda mutlaka bazı öngörüleri var. Sadece şu anda sessiz ve sessiz kalmaya devam edecek gibi. 14 Mart’ta bu köşede okumuştunuz: “Erdoğan için hangisi daha zorlu rakip?” O yazımda demiştim ki: … Erdoğan, eğer İmamoğlu siyaseten saf dışı kalırsa neden karşısına kazanacağı iddia edilen Mansur Yavaş’ın çıkmasını ister? Bu konuda Ankara koridorlarında konuşulanlara kulak kabarttım: … İktidarın oyun planını anlayabilen yok. Evet, bir gerçek Ekrem Başkan’ın yargı eliyle siyaset dışı bırakılmak istendiği görülüyor. Ancak olası rakibi Mansur Yavaş’la ilgili nasıl bir kurgu içindeler? Yavaş’ın önünün açıldığına dair bir kanıt yok! Sonuçta Ankara Belediyesi de her gün müfettişler tarafından inceleniyor, SGK borçları üzerinden belediye bütçesine önemli darbe vuruldu. Eğer Ekrem Başkan’ın önü kapanırsa heybeden Yavaş için ne çıkacak? Bunu kimse bilmiyor? Ama bildiğimiz; iktidar için muhalefetin parçalı görüntü vermesi işlerine geliyor. Mansur Başkan da yarışta ve CHP içinde bir ‘kaos’ varmış algısı seçmen üzerinden etkili olabilir iktidara göre. ‘Kendi içlerinde birlik olamayanlar ülkeyi nasıl yönetecek?’ kampanyası da el altından yapılıyor.” SONUÇ: CHP her ne kadar “kayyum” konusunda önlemini almış ve 6 Nisan’da olağanüstü kurultay çağrısı yapmış olsa bile bu süreç devam ediyor. Olağanüstü kurultay kararının iptali için Hatay eski Büyükşehir Belediye Başkanı Lütfü Savaş ve iki ismin iptal kararı için başvuru yaptığını biliyoruz. Ayrıca Ankara Cumhuriyet Başsavcılığı’nda da 4-5 Kasım 2023’te gerçekleşen kurultayla ilgili soruşturmasını sürdürüyor.",https://www.nefes.com.tr/yazarlar/aytunc-erkin/her-sey-mumkun-bu-hukuk-sisteminde-herkese-her-seyi-yapabileceginiz-ortam-var-23830
Aytunç Erkin,Medyada bir yapı varsa yapının ağababası belli,17 Mart 2025 06:00,"TARTIŞMALARIN ODAĞINDAKİ İSİM, İMAMOĞLU’NUN BASIN DANIŞMANI MURAT ONGUN’LA KONUŞTUM: En son bir televizyon kanalında ‘CHP kurultay delegelerine 1200 cep telefonu alındı. Bu alımı Medya AŞ yaptı’ iddiasıyla gündeme geldi. Daha önce de başında olduğu İstanbul Büyükşehir Belediye (İBB) iştiraki Medya A.Ş.’nin ihale verdiği şirketlerin listesi tartışıldı. Murat Ongun; İBB Başkanı Ekrem İmamoğlu’nun basın danışmanı… Ongun’la son dönemde adının da geçtiği İBB iştiraki Medya A.Ş.’yi ve süreci konuştum. Murat Ongun kimdir? Gizemli biri değilim, iş hayatına başladığımdan beri hep kamuoyu önünde olan biriyim. Özgeçmişim, İBB’nin sitesinde mevcut. Yine de bu soruya şaşırmıyorum, çünkü sosyal medyada benimle ilgili hurafeleri okuyunca, insan kendinden korkabilir. Bazen ‘Vay be ben neymişim’ dedirtiyorlar insana. Çok samimiyetle şunu söyleyebilirim. Ben, işini ahlaklı ve başarılı bir şekilde yapmaya çalışan sıradan biriyim. Vazifem, Sayın Başkan’ın ve İBB’nin faaliyetlerini başta İstanbullular olmak üzere, tüm topluma ulaştırmak ve doğru şekilde anlatmak. Buna iletişim ve propaganda faaliyetleri diyoruz. Mütevazı olmayacağım, zaten işimde başarısız olsam bu kadar saldırıya, iftiraya maruz kalmazdım. ‘Türkiye’de hiçbir başarı cezasız kalmaz’ ifadesi baştan sona doğrudur. Bakınız Ekrem İmamoğlu. Çok büyük imkanlara rağmen, performansta bizim gerimizde kalanlar da, iftiralar, hurafeler, komplo teorileri uydurarak, bizleri yaftalama peşinde. Bundan da rahatsız değilim. Birileri de böyle yaşıyor, ne yapayım. Ekrem İmamoğlu ile nasıl tanıştınız? 2014 yılıydı. Ortak bir arkadaşımız vasıtasıyla oldu. Kendisi Beylikdüzü belediye başkanlığına yeni seçilmişti. Bir yol haritası belirlemişti ve benim alanımla ilgili bir yardımcıya ihtiyacı vardı. İlk görüşmemizde fikren anlaşsak da, profesyonel şartlarda anlaşamadık. İkinci bir görüşmemiz daha oldu. ‘İmamoğlu varsa çözüm var’ sloganını o gün anladım. Ne benim dediğim oldu, ne de o şartlarını değiştirdi. Ama sonuçta bir çalışan olarak beni mutlu edecek bir formül bulmuştu, öyle başladık. İyi ki de kendisiyle yol yürümek nasip olmuş. MEDYA AŞ neler yapıyor, şirketin bütçesi nedir? Medya AŞ aslında benim yüzümden hedefte. Ben başka bir şirketin yönetim kurulu başkanı olsam, o zaman da o iştirakimizi hedef alacaklardı. Neden siz? Sayın İmamoğlu ile yol arkadaşı olduğum için. Yıllardır ona yapılan saldırılara karşı her zaman en önde durduğum için. Saldıranların aksine, zeki ve doğru bir tavırla mücadele verdiğim için. Ve hiçbir zaman yılmadan cesurca karşılarına çıktığım için hedef yapıldım. Bu yeni yaşanan bir durum değil. 6 yıldır hayatımın parçası oldu bu. Bu saldırı ve tehdit paketinde milletimiz bilsin her şey var.Her şey var. Bunları, yaşamın getirdiği bir gerçeklik olarak kabul edip, konuyu da memleket meselesi olarak içselleştirirseniz o zaman sorun kalmıyor. Ben öyle yaptım. Kuşkusuz Medya AŞ’ye yapılan saldırılar beni üzüyor. Çünkü şirketimizde birbirini çok seven, omuz omuza dayanışmayla çalışan, yaptıkları işe gönülden bağlı çoğu genç çok sayıda mesai arkadaşım ve dostlarım var. Çok kıymetli genel müdürümüz, yol arkadaşım yönetici dostlarım var. Onlar üzülüyor, geriliyor diye endişe ediyorum o kadar. Düşünseniz; TGRT Haber’de bir gazeteci; ‘CHP kurultay delegelerine 1200 cep telefonu alındı. Bu alımı Medya AŞ yaptı.’ diye iftira atıyor sonra bu yalan dediğimizde ‘Bana bunu diyenin alnını karışlarım. Belgesi elimde olmasa bunu söylemem’ diyor. Benim alnımı karışlayacağına, elinde olduğunu iddia ettiği faturayı yayınlayabilse sorun çözülecek. Ama olmayan fatura yayınlanır mı? Sözüm ona aynı yayındaki gazeteci arkadaşlardan biri de ‘Belgeyi gösterin de Murat Ongun utansın’ demiyor. Diyemiyorlar. Onlar da yalan olduğunu biliyor da konu farklı. Sonra ‘aparat’ dediğim için feryat figan ediyorlar. Vasıtanızla, bir medya meydan okuması yapayım. O programdaki herkese ‘Hodri Meydan’ diyorum. Madem fatura elinizde, yayınlayın ben de tüm görevlerimden anında istifa edip sizden özür dileyeyim. Onurlu insanlar böyle yapmalı. Ben de onlar da. Hodri Meydan. Bekliyoruz faturayı. Murat Ongun’un Ekrem İmamoğlu adına sosyal medyada kurduğu trol ordusu var mı? Medyada, haber kanallarında kurduğunuz bir örgütlenme var mı? Benim bir tane örgütüm var o da Cumhuriyet Halk Partisi örgütü. 10 yıllık parti üyesiyim. 23 Mart’ta da sandığa gidip oyumu kullanacağım. Medyaya dönersek, Allahaşkına tüm medyada muhalefete yakın yayın organlarının sayısı nedir ki, orada bir yapımız olsun. Medyada bir yapı varsa, yapının ağababası belli. Yeri gelmişken demokrasi adına acı verici bir olayı anlatayım. 2019 seçimleri döneminde Ekrem İmamoğlu pek çok kanal gibi TRT Haber, CNN Türk ve NTV’ye de çıktı.2024 seçimlerinde ise TRT bırak canlı yayını, parasıyla reklamlarımızı dahi yayınlamadı. CNN Türk ve NTV de, talep etmememize rağmen Ekrem İmamoğlu’na ekranlarını açmadılar. Üstelik rakibimiz o kanallarda boy gösterirken, İmamoğlu’na bu hak tanınmadı. Türkiye’nin en eski iki haber kanalı yaptı bunu. Çok üzücü. Bize adaletsizliklerin her türlüsü yapıldı, yapılmaya devam ediyor. Kazanan yine de biz oluyoruz öyle de olmaya devam edecek göreceksiniz. Bu örnek bize sadece 5 yılda, medyada yaşadığımız demokratik gerilemeyi gösteren en güzel örnek. Bunlara rağmen, yok biz medyada örgütlenmişiz de, ordan atıp burdan tutuyormuşuz da falan filan. Baştan sona saçmalık. Gelelim sosyal medyaya. Bunların sosyal medya deyince anladıkları sadece X. İşte bizim orda da trol ordularımız varmış. Bir ordu da değil, ordular. Yahu biz olsak olsak 300 Spartalı oluruz ama yine size yeteriz merak etmeyin. Kişi kendinden bilir işi. Bunu dile getirenler asıl trol ordusu sahipleridir. Ekrem İmamoğlu bu ülkenin en sevilen siyasilerinden biri. Doğal olarak da onu sevenler, kendisine destek olan paylaşım yapabilirler. Daha önce desteklemeyenler de bu haksızlıklar ve adaletsizlikler nedeniyle artık kendisine destek oluyor. Bu o insanları trol yapmaz. Bunu anlamaktan aciz olanlar, yıllardır bir trol yalanına sarılmış, birilerini aldatıyor. Bu ‘İmamoğlu’nun trol ordusu var’ palavrası ile bazı uyanıklar sosyal medya üzerinden çok para kazandı. Kazanmaya devam ediyor. Öfkesinin ve kıskançlığının esiri olmuş TV’lerde boy gösteren çok isim var böyle. Onlar kendini önemsiyor ama halkta bir karşılıkları yok. Dost acı söyler. Medya AŞ’nin ihale verdiği kişileri koruduğunuz, bazı tanıdıklarınıza ihale verdiğiniz yönünde iddialar var. Bu iddialara ne dersiniz ve hemen ekleyeyim, Medya AŞ’den ihale alan bir basın kuruluşu var mı? Unutmamak lazım ki Medya AŞ, İBB’ye bağlı bir iştirak şirketi. Bu yüzden Sayıştay denetimine açık. Müfettiş denetimine açık. Ticaret Bakanlığı’ndan tutun da İçişleri Bakanlığı’na kadar onlarca devlet organının denetimine açık bir şirket. Açık derken, gelsinler denetlesinler demiyorum zaten her daim denetim altındayız diyorum. İBB ve iştirak şirketleri kadar denetlenen başka bir kurum-kuruluş yok Türkiye Cumhuriyeti’nde. Üstelik didik didik denetleniyoruz. Sayıştay dahil tüm raporlarımız tüm denetimlerimiz pırıl pırıl. Hatta son seçimin ardından yani daha yeni, Ticaret Bakanlığı müfettişleri denetime geldi. Raporlarını bakanlığa sunmuşlar diye duydum. Bakanlığımız, arzu eden herkese keşke o raporu verse de herkes Medya AŞ’nin nasıl çalıştığını görse. Keza, benimle ilgili de defalarca teftiş oldu. Özellikle 2022 yılında çok derinlemesine incelemelere tabi tutuldum. Sadece ben de değil, ailem de incelendi. Bakmadık şey bırakmadılar. Hakkımda MASAK Raporu bile hazırlandı. Her şey tertemiz çıktı. Hiç rahatsız olmadım bunlardan. Hiçbir zaman da olmam. Devletimizin ilgili her kurumuna istediği zaman, bildiğim her şeyle ilgili açıklama yaparım. Anında hesap vermeye hazırım. Yoksa sosyal medya şarlatanlarına yanıt verecek halim yok. Medya AŞ’de ihale alma koşulları bellidir. Ben medyadan gelen birisiyim. Pek çok eski medya çalışanı, yıllar önce kendi şirketlerini kurmuş. Kah etkinlik organizasyon alanında kah film çekimi, prodüksiyon alanında piyasaya iş yapmışlar. Aralarında başarılı çok insan var. Bunlardan bazıları yani daha önce tanıdığım kişiler de ihale koşullarını karşılamak kaydıyla iş alabilir. Az sayıda da olsa tanıdığım kişiler var tabi. Son olarak ne bir gazete, ne bir Tv ya da başka bir medya kuruluşunun bizden aldığı ihale bulunmamaktadır. Çok konuşulan bir konu daha. Para verdiğiniz gazeteci var mı? Bu çok konuşuluyor Cevap: Bu yalanı söylemekten zevk alanları birkaç gruba ayırıyorum. 1) Başarısız siyasal iletişimciler 2) ‘Bize de para verin o zaman’ duygusu yaşayan tuhaflar 3) Kıskanç loserlar Ben merkez medyada yetişmiş gazeteci kökenli birisiyim. Siyaseten hangi tarafta olursa olsun hiçbir gazeteciye böyle bir suçlamanın yapılmasını ne kabullenirim ne tasvip ederim. Gazetecilik kıymetli ve önemli bir meslektir. Bu iktidar öncesinde 4. Kuvvet olarak gösterilirdi basın. Güçlerin tamamı bire indiği için şimdi hatırlamıyorlar bile. Sizin İBB ve Medya AŞ’de yönetimi almadan önce nasıl bir tablo vardı? Geçmişe bakınca ne gördünüz? Cevap: Bizden önceki arkadaşların farklı bir çalışma tarzı var. Bazı şeyler kayıtlı bazı şeyler kayıt dışı. Kayıt dışına bir örnek vermem gerekirse. 2017 yılında, Medya A.Ş. bir TV kurmaya yetecek kadar elektronik cihaz almış. Aklınıza ne gelirse. Kamera, reji masası, ışık vesaire. Ciddi bir meblağ bu. Medya AŞ’nin kamu parasıyla aldığı bu mallar her nedense bir vakıf üniversitesine hibe edilmiş. Bunun hiçbir kaydı yok. Bunları unutmuyoruz tabi ama bugün mahkemeye gidip de kazanacak durumumuz yok. Üniversite ismi dahi veremiyoruz bu durumda. 2017’de hangi üniversite televizyon stüdyosu kurduysa onlardan biri. Yine anlam veremediğim bazı işler var. Mesela Medya A.Ş., idareden yani İBB’den çok değerli bir reklam alanının ihalesini almış. 20 yıl süreli bir ihale. İBB’den aldığı bu değerli işin üzerine sadece yüzde 1.5 kar payı ekleyerek, bir özel şirkete ihale etmiş. Oysa çok değerli bir alan. En az yüzde 30-40 kâr payı koyarak da ihale edilebilirdi. Bazı sebeplerle tercih edilmedi herhalde. Mesela bizde bu alanlardan görece daha değersiz reklam alanları dahi yüzde 30 ila yüzde 50 arasındaki karlılıkla ihaleye çıktı. Anlatacak çok şey var. Devletimiz bir gün sorarsa anlatırız teker teker. Yoksa polemik çıkarmak gibi bir derdim yok. Son olarak, bugünlerde TV’lerde özellikle şirketimiz tartışmaya açıldığı için şunu söylemek isterim. İddialar böyle diyerek akla ziyan ifadeleri dile getiren arkadaşlar bir zahmet ‘İddia böyle ama Medya AŞ’de açıklama yaptı bunları yalanladı’ demeyi öğrensinler. Aleyhimize her şeyi ‘iddia’ kılıfına sokarak saatlerce tartışıyorlar, kurumsal açıklamamızdan bir cümle bahsetmiyorlar. Bu kadar mı vicdansız oldunuz.",https://www.nefes.com.tr/yazarlar/aytunc-erkin/medyada-bir-yapi-varsa-yapinin-agababasi-belli-22150
