Yazar,Başlık,Tarih,Metin,URL
Aytunç Erkin,Beş sayfalık savunmada gazetecilik ve hayat dersi,06 Mart 2025 06:00,"1904 yılında The North American Review’de yazdığı makalesinde adına ödül verilen gazeteci Joseph Pulitzer şöyle der: “Cumhuriyetimiz ve gazeteleri ya beraber yükselir ya da beraber çöker. Hakları bilen ve bunları zekayla uygulayan, çıkarcılıktan uzak, bağımsız, kamusal hizmet bilinçli bir basın, kamusal erdemi koruyabilir. Bu erdem olmadan her hükümet sahtekar ve alaycıdır. Sinik, çıkarcı, demagojik bir basın ise zamanla kendine benzeyen insan yığını üretir.” Örneğin… 7 Eylül 2019… Güldal Mumcu, “Uğur Mumcu öldürülmeden önce o zamanki MİT Müsteşarı Teoman Koman gazetecileri MİT’e davet ediyor ve MİT’i gezdiriyor. O sırada ‘aranızdan biri öldürülecek’ diyor. Bu basında da yer aldı o zaman. Bir ülkenin MİT Müsteşarı aranızdan biri öldürülecek diyorsa eğer, kimin öldürüleceğini ve kimin öldüreceğini biliyor demektir” demişti. Bu açıklamanın peşine düşen gazeteci var mı? O zaman önceki akşam tahliye edilen Halk TV Genel Yayın Yönetmeni Suat Toktaş’ın Çağlayan’da yaptığı savunmayı okuyalım. “Benden gazetecilik dışında bir şey çıkmaz” Öne çıkmam, ekrana koşmam, tweet atmam, sosyal medyada kendimi sergilemem. Dediğim gibi benden gazetecilik dışında bir şey çıkarılamaz. Elbette politik bir kimliğim, bir duruşum bir fikrim var. Ama tek sadakatim haberdir, doğru haberciliktir. Politik kavgaların haberci olarak slogan atan taraftarı değil, onları yansıtan- aktaran bir gazeteciliktir benim yerim. Peki gazeteci kimdir? En basit tanımıyla güncel toplumu ilgilendiren olay ve olguları araştıran belge ve bilgiye dayanarak görünürdeki gerçekliğe uygun bir şekilde ve bazen kendi yorumunu da katarak, toplumun ilgisini çekebilecek konular hakkında ya da toplumun merak ettiği konular hakkında kamuoyunu bilgilendirmek amacıyla gazetecilik etik kurallarına uygun bir şekilde haber yapan kişidir. Haber kanalı nedir? 18 saat canlı yayın yapan, zamanla ve diğer kanallarla yarışan nefes nefese bir koşturmadır. En sıradan günlerde en az 100 karar verirsiniz. Çok krizli zamanlarda bu 300’ü de bulabilir, 500’ü de. Her bir kararınız doğru olmak zorundadır. İnsanlık dışı bir hayattır bazen haber kanalında çalışmak. Çünkü 24 saatlik bir günlük zaman dilimin her bir saniyesinde haber değeri taşıyan birden çok olay meydana gelirken, biz gazeteciler yaşanan bu olayları doğru ve tarafız bir şekilde, olaylar haber değerini yitirmeden en hızlı şekilde, kamuoyu ile paylaşan ilk haberi yapan olmak için zamanla ve rakiplerinle sürekli yarış halinde olmaktır. “Haber kanalları gazete değildir” Tımarhane derim ben haber kanallarına. Gazete değildir haber kanalları. Dönüp dönüp yazdığınızı kontrol edemez, yanlış varsa düzeltemezsiniz. Haber kanalında ve canlı yayında, her şey o anda olur ve haberi en hızlı ekrana vermek başarı kriteridir. Bu sebeple de ilk olma rekabetinde saniyelerle yarışırsınız. Canlı yayında haber ekrana yansıdığı anda geri dönüşü yoktur. Bir kazada 4 kişi ölmüşken, 6 kişi diye duyurursanız o 2 kişiyi tekrar diriltemezsiniz. Dolayısıyla haber kanalında verilen her karar, her zaman doğru olmak zorundadır. Peki hayat hep öyle mi yürür? Hayır! Bazen sizden, bazen ekibinizden kaynaklanan hatalar ekrana yansıyabilir. Hızla düzeltmeye çalışırsınız. Ama buna isteyen hata diye bakabilir, isteyen altında niyet arayabilir. Bu kadar acımasız bir denetim veya saldırı altında çalışırsınız hep. SONUÇ: Bilirkişinin ses kaydını yayınladığı için Silivri’de 34 gün hapis yatan gazeteci Suat Toktaş’ın beş sayfalık savunması iletişim fakültelerinde okunmalı, tartışılmalı.",https://www.nefes.com.tr/yazarlar/aytunc-erkin/bes-sayfalik-savunmada-gazetecilik-ve-hayat-dersi-19744
Aytunç Erkin,Futbol yuvarlaktır,09 Şubat 2025 06:00,"Uruguaylı sosyalist gazeteci-yazar Eduardo Galeano’nun şu cümlelerini zaman zaman mırıldanırım: “Ben basit bir iyi futbol dilencisiyim. Elimde şapkam, dünyanın dört bir yanını geziyor ve stadyumlarda yalvarıyordum: Tanrı rızası için, güzel bir maç lütfen!” Evet! Nerede iyi futbol görsem seyrederim ya da futbolla ilgili “derinlikli” bir kitap bulursam okurum. Bu pazar sizleri son okuduğum “Futbol Yuvarlaktır/Nihat Özdal/Kırmızı Kedi Yayınevi” kitabıyla buluşturmak istedim. Neden mi? Haydi başlayalım… Kitabın önsözünü usta şair-yazar Enis Batur yazmış. Eeee… Batur’un önsözünü yazdığı bir kitap da okunur değil mi: “Futbolun incelikten yoksun bir spor türü sayılmasına katılmıyorum her şeyden önce. Teknik, hüner, organizasyon, ekip çalışması açısından bakıldığında ince bir spor dalıdır futbol. Şostakoviç gibi bir bestecinin takımının maçını izlemek için trenle Moskova’dan Bakü’ye gitmesini başka gerekçelere dayandırmak şart değildir. Bizim edebiyatımızda Orhan Kemal’den Haldun Taner’e ve Ülkü Tamer’e sıkı fıkı olmuş örneklere şimdi yeni kuşağın önde gelen şairi Nihat Özdal katılıyor Futbol Yuvarlaktır ile güçlü bir serbest vuruş!” Kalede Kafka, teknik direktör Nazım! Bize hayal kurduran yazar Özdal öyle bir ilk on bir kuruyor ki… Adı da “Dünya Edebiyatı Futbol Kulübü”: Kaleci: Franz Kafka- Dünyanın absürtlüğüne ve baskıya karşı dirençli duruşuyla, kalede sağlam bir bekçi olurdu. Defans: Ernast Hemingway- Güçlü, keskin ve doğrudan tarzıyla defansın sağlam kalesi. Defans: Leo Tolstoy- İnsan doğasını derinlemesine anlama yeteneğiyle, rakip atakları öngörür. Defans: Virginia Woolf- Derin düşünceli ve keskin sezgileriyle defansın stratejik yönünü güçlendirir. Defans: Edgar Allan Poe- Katanlık ve gizemli tarzıyla rakipleri şaşırtır. Orta saha: William Shakespeare- Oyun kurucu olarak, oyunun her yönünü ustalıkla yönetir. Orta saha: Gabriel Garcia Marquez- Büyük gerçekçilikle oyunu dönüştürebilir, beklenmedik oyun açılımları yaratır. Orta saha: Jane Austen- Toplumsal zekasıyla oyunu okur ve mükemmel paslar dağıtır. Forvet: Dostoyevski- İnsan ruhunun derinliklerinden güçlü vuruşlar yapar. Forvet: Charles Dickens- Hikayelerindeki gibi, karmaşık savunmaları aşacak stratejileri geliştirir. Forvet: Sylvia Plath- Keskin ve güçlü dil kullanımıyla rakip savunmayı sarsar. Siz de bir on bir kursanız kimleri yeşil çimde görmek isterdiniz? Örneğin Şair Küçük İskender şu 11’i kurmuş: “Kaleye Yahya Kemal geçsin. Defansa Necip Fazıl, Behçet Necatigil, Melih Cevdet, Oktay Rıfat, orta sahaya Edip Cansever, Sezai Karakoç, Ece Ayhan, ileriye Attila İlhan, İlhan Berk ve Cemal Süreya. Sık sık tribüne gönderileceğini biliyorum ama, teknik direktör Nazım Hikmet.” Gol şiirseldir, futbol hayattır Örneğin şair Ahmet Erhan’ın futbolcu olduğunu ve futbolu neden bırakmak zorunda kaldığını biliyor muydunuz: “Adana Demirspor’da oynardım futbol. Adıyaman’ın sağ beki, kaval kemiğime bir girişti, kırıldı kemiğim. Benim de küsme huylarım vardır, sonuçta futbola küstüm ben. Hatta şu anda sanki şiirle de ona benzer bir mecra üzerinde gibiyim, hatta her kitapta şiiri bırakıyorum.” Peki futbolda hangi anlar şiirseldir? “Gol”den devam edelim: “Gol anını, taraftarlar büyük bir sanatsal deneyim olarak yaşar, her gol, oyunun naratifinde bir dönüm noktası sunar ve tıpkı etkileyici bir sanat eseri gibi, izleyiciler üzerinde derin bir etki bırakır. Pier Paolo Pasolini, ‘Futbolda bazı anlar yalnızca şiirseldir: gol anları. Her gol bir buluş, bir kod ihlalidir; her gol kaçınılmazlık, parıltı, hayret ve geri dönülmezlik taşır. Tam da şiirsel bir kelime gibi. Her yılın gol kralı, o yılın en iyi şairidir. En çok gol atılan maç, en şiirsel olanıdır’ diyor.” Evet… Futbol kolektif bir oyun ve paylaşımcı. Yeteneğiyle öne çıkanlar yıldız ama takım oyununda olurlarsa. Messi, Arjantin Milli Takımı’nda zayıf Barcelona’da efsane! Evet… Futbolun siyasetle de ilgisi var. Çünkü; geçici ittifaklar ve sürekli rekabetler oyunu. Tıpkı siyaset gibi, sadece toplar ve sahalar farklı. Son söz mü: Futbol bir temsil değil, hayattır.",https://www.nefes.com.tr/yazarlar/aytunc-erkin/futbol-yuvarlaktir-14073
Aytunç Erkin,"PKK/YPG, İsrail’i güvence gördüğü için üzerine almadı",04 Mart 2025 06:00,"İki açıklamayı derinleştirelim. Birinci açıklama… Abdullah Öcalan’ın “Tüm gruplar silah bıraksın” açıklamasının ardından omurgasını terör örgütü PKK/YPG’nin oluşturduğu Suriye Demokratik Güçleri (SDG) adına konuşan Mazlum Abdi, bu çağrının “Suriye’deki Kürtlerle ilgili olmadığını Türkiye’nin iç politikasıyla ilgili olduğunu”söyledi. Washington’daki bir basın kulübünün toplantısına video konferans yoluyla katılan Abdi şu ifadeleri kullandı: “Çağrı doğrudan bizim bölgemiz için değildi. PKK ile Türkiye arasındaki ilişki ve barışın sağlanması, bölgemiz üzerinde de etkili olacaktır.” İkinci açıklama… PKK/PYD’nin eski eşbaşkanı Salih Müslim, Al Arabiya’ya yaptığı açıklamada “Abdullah Öcalan’ın açıklamalarına katılıyoruz. Siyasi bir grup olarak faaliyet göstermemize izin verilirse silah bırakacağız” dedi. Mazlum Abdi’yle Salih Müslim arasındaki çelişkiyi fark etmişsinizdir. Birisi çağrıyı üzerine almadı diğeriyse olumlu karşıladı. Bu açıklamaları YPG/İsrail ilişkisi üzerinden okuduğumuzda daha anlamlı olabileceğini düşünenlerdenim. Bir not da şu: Öcalan’ın çağrısına “Çağrı doğrudan bizim bölgemizle ilgili değildi” yanıtını veren Abdi için PYD/YPG içinde de “homurdanmalar” olduğu, “Nasıl Abdullah Öcalan’ı dinlemiyor” eleştirileri yapıldığı iddialar arasında. İlk önce tarihsel bilgiyle paylaşalım. İsrail devleti 1948 yılında kuruldu. Arap-İsrail Savaşı sırasında, Kürt nüfusun yoğunlukla yaşadığı bölgelerdeki Yahudi Kürt nüfusu da yaşanan sorunlardan dolayı İsrail’e göç etti. Açık kaynaklara göre; bugün İsrail’deki 200 bin ila 500 bin arasında olduğu tahmin edilen Kürt nüfusun kökleri bu topluluğa dayanıyor. Yine 1961-1970 arasında yaşanan Eylül Ayaklanması adı verilen ilk büyük savaş sırasında İsrail, Irak’a karşı savaşan baba Mustafa Barzani güçlerine destek vermişti. İsrail bu dönemde peşmergeye askeri eğitim vermiş, baba Barzani en bildiğimiz kadarıyla iki kez İsrail’i ziyaret etmişti. Bitmedi… Irak hatırlanacağı üzere 2003 yılında Amerika tarafından işgal edildi. Saddam Hüseyin’in devrilmesinin ardından İsrail, Kürt bölgesiyle temaslarını daha da artırdı. O bölgeden çıkarılan ham petrolün yarısının da İsrail’e satıldığı biliniyor. Baba Barzani’den sonra 2017’ye kadar Irak’ın kuzeyini yöneten Mesut Barzani de İsrail ile ilişkileri hep olumlu seviyede tuttu. Yine bildiğimiz; İsrail Başbakanı Netanyahu “Irak Kürdistanı”nın bağımsız olması gerektiğini söyledi. Bugüne gelecek olursak… Neçirvan Barzani iktidarında İsrail’le ilişkiler en üst seviyede diyebiliriz. 2017 yılında bölgesel parlamento tarafından alınan ve Irak merkezi hükümeti tarafından tanınmayan bağımsızlık yolundaki kararı ilk destekleyen de İsrail’di. Uzmanlara göre, İsrail aslında Kürtler’i düşmanlarıyla arasında bir tampon olarak görüyor. Buradan çıkarılan ham petrol, yakıta ihtiyacı olan İsrail’in en önemli kaynaklarından biri. Unutmayalım… 28 Eylül 2024’te Köln’de Öcalan için düzenlenen bir mitingde İsrail bayrakları açılmıştı. 10 Kasım’da, Erdoğan’ın Suriye ve Irak’ta PKK’ya yönelik yeni bir kara operasyonlarına hazırlanıldığı açıklamasından hemen sonra İsrail’in yeni Dışişleri Bakanı Gideon Saar, Kürtler için “Siyasi bağımsızlığı olmayan büyük milletlerden biri” ve “Yahudilerin doğal müttefiki” dedi. Saar, aralık ayında da “İsrail Kürtleri savunmak için askeri bir eylemde bulunmamış olsa da onları desteklemek ahlaki ve diplomatik bir zorunluluktur. Kürtler, Batı yanlısı ve dost bir gruptur ve biz onların yanında durmalıyız” dedi. 3 Ocak 2025 tarihli Rudaw’ın şu haberini hatırlatmakta fayda var: “İsrail basını, Dışişleri Bakanı Saar’ın Rojava Özerk Yönetimi yetkililerinden İlham Ahmed ile bir telefon görüşmesi gerçekleştirdiğini bildirdi. İsrail’in gazetelerinden İsrael Hayom, İsrailli yetkililere dayandırdığı haberinde Dışişleri Bakanı Gideon Saar’ın Doğu Suriye Özerk Yönetimi Dışişleri Büro Eşbaşkanı İlham Ahmed arasında kapsamlı bir telefon görüşmesi gerçekleştirildiğini duyurdu. Bölgedeki gelişmelerin ele alındığı görüşmede Ahmed, Suriye’deki silahlı gruplar tarafından Kürt vatandaşlara yönelik keyfi tutuklamalar ve infazlar hakkında bilgi verdi. Bakan Saar ise uluslararası meslektaşlarıyla yaptığı tüm diplomatik görüşmelerde Kürtler hakkındaki endişelerini dile getirdiğini belirtti.” 25 Şubat’ta da İsrail hükümeti ve Dışişleri Bakanlığının, SDG’nin kontrolündeki bölgelerin ve Suriye’de Kürtlerin haklarının desteklenmesi yönündeki mesajları sorulan Mazlum Abdi şu yanıtı vermişti: “Bu doğruydu ve yerinde bir tutumdu. Bu onların kendi politikalarıyla ilgili. Ancak bu açıklamalarını takdir ediyoruz.” Evet; Mazlum Abdi’nin temsil ettiği örgütlenme yani SDG (PKK/YPG) İsrail/ABD’ye güveniyor ama daha geçen hafta Ukrayna lideri Zelenski neler yaşadı! Amerikan dış siyasetinin ‘ete kemiğe bürünmüş hali’ kabul edilen ABD’nin eski Dışişleri Bakanı Henry Kissinger’ın ünlü “Amerika’nın düşmanı olmak tehlikeli olabilir, ama dostu olmak ölümcüldür” sözü de hafızalarda… Ayrıca Türkiye henüz Suriye konusunda Amerika ile masaya oturmadı. Bakalım süreç nereye evrilecek?",https://www.nefes.com.tr/yazarlar/aytunc-erkin/pkkypg-israili-guvence-gordugu-icin-uzerine-almadi-19292
Aytunç Erkin,Çayırhan artık GERMİNAL’dir,16 Şubat 2025 06:00,"“… Şimdi Nisan güneşi toprağı ısıtıyor, vadilerden hayat fışkırıyor, tomurcuklar patlıyor, ekinler yükseliyordu. Her yandan tohumlar şişiyor, uzuyor, toprağı deliyordu. Ve arkadaşlar, tekrar tekrar, sanki yüzeye yaklaşmışlar gibi daha berrak bir şekilde vuruyorlar, vuruyorlardı. İnsanlar yetişiyor, kara, kin dolu bir ordu, bir asır sonraki hasada hazırlanıyor, tohumlarını patlatıyordu.” Emile Zola’nın başyapıtlarından, 1860’larda kuzey Fransa’da, maden işçilerinin gerçek grev öyküsünü anlatan Germinal’den alıntıyla başladım yazıma. Ankara’nın Nallıhan ilçesi de Germinal’dir artık. Neden mi? Nallıhan’daki Çayırhan Termik Santrali ve santrale kömür sağlayan maden ocaklarının satışına karşı geçen kasım ayından bu yana mücadele eden enerji ve maden işçisinin Ankara yürüyüşü, önceki gün Hazine ve Maliye Bakanlığı önüne ulaştı. Yapılan basın açıklamasında, Bakan Mehmet Şimşek’e “Yanlıştan dönün, sonu nereye varırsa varsın mücadeleden vazgeçmeyeceğiz” mesajı verildi. Marksist iktisatçı Prof. Dr. Korkut Boratav, “Küreselleşme, emperyalizm, yerelcilik ve işçi sınıfı” kitabında ‘Küreselleşme, emperyalizmin yeni adı” dedi ve şu tespiti yaptı: “… Birinci yenilik, bazı kuruluş ve örgütlenmelerin (IMF, Dünya Bankası, OECD, G7 gibi) kapitalist dünya sisteminin tümünü kapsayacak üstyapılar biçiminde roller üstlenmiş olmasıdır. İkinci yenilik, üçüncü dünya ülkeleri üzerinde icra edilen etkilerin yönüne ilişkindir. Ana hedef ulusal ekonomileri devletsizleştirmek ve küreselleştirmek olmuştur. Üçüncü dünya devletlerinin pek çoğu ekonomik ve sosyal politikalar alanlarında artık tam anlamıyla hükümran sayılamazlar.” Çayırhan’ın özelleştirilmesiyle ilgili Maden Mühendisleri Odası’yla görüştüm. Onlar da “ulusal ekonomileri devletsizleştirme” anlayışına karşılar. İşçilerin geleceği yok sayılıyor Önce kısa bilgi… Özelleştirme ilanında, santral kısmında 751 işçinin, kömür sahası kısmında ise 1393 işçinin çalıştığı beyan ediliyor. Santral tarafında çalışanların statüsü tam olarak bilinmemekle birlikte, kömür sahasında çalışan işçilerin Kömür İşletmeleri Anonim Şirketi (KİAŞ) işçisi ve sendikalı olduğu bilinmekte. Özelleştirme dosyasında işçilerin, gelecekleri hakkında olumlu bir madde bulunmadığı ve adeta yok sayıldığı, eylem yapan işçilerin ve sendika yöneticilerinin ifadelerinden anlaşılmakta. İşçilerin haklı eylemi ile kamuoyunun gündemine gelen bu konu bir şekilde çözümlense bile kömür havzasında plansız bölünmeler nedeni ile oluşacak problemler devam edecek. Havzanın Çayırhan tarafında özelleştirmeye konu olan saha (ÖİB sayfasında 131 milyon ton rezerv) ve 620 MW elektrik santrali, yine havzanın Mihalıççık tarafında TMSF tarafından daha önce özelleştirilen Koyunağılı sahası (yaklaşık 40-60 milyon ton rezerv) ve 290 MW elektrik santrali bulunmakta. Koyunağılı sahasında mevcut kömür, rezerv ve kalite itibarı ile santral için yeterli/uygun olmadığından santralden kapasitesine uygun elektrik üretimi yapılamamakta. Maden Mühendisleri ne diyor? Maden Mühendisleri Odası’nın yaklaşımı şöyle: Madencilik ve enerji üretimi kamucu bir anlayış ve bütünlüklü bir bakış açısı ile devlet tarafından yapılmalı. Bölgedeki kömür sahalarının plansız bir şekilde parçalanması, kaynak israfına neden olan gereksiz elektrik santrallerinin hesapsız bir anlayış ile yapılması sonucunda oluşan maliyet yoksul halkımızın sırtına yüklenmekte. Peki hangi sorulara yanıt istiyorlar? * Çayırhan Termik Santraline yenileme yatırımları kim tarafından ve ne kadar bedelle yapılmıştır? * Koyunağılı Santral ve sahası için Slovakya’dan alınan krediler kim tarafından ve ne tutarda ödenmiştir? * Geçiş dönemi olan 2020-2024 (Kasım) arasında KİAŞ firmasına doğrudan verilen kömür üretimi işi için ne kadar bedel ödenmiş ve bunun karşılığında Elektrik Üretim Anonim Şirketi (EÜAŞ) tarafından ne elde edilmiştir? * Sözleşmesi sonlandırılan Çayırhan-2 sahasında yükümlülüklerini yerine getirmeyen firmalara ne gibi bir yaptırım uygulanmıştır? * Uyarılarımıza rağmen yapılan ve yukarıda bir kısmı belirtilen plansız uygulama ve yatırımların toplam maliyeti nedir ve kim tarafından karşılanmıştır? * Koyunağılı sahasında rezerv ve kalite sorunu nedeni ile santral doğru dürüst çalışamazken, bu sahanın ihalesinin anlamı nedir? * Yapılan özelleştirme uygulamaları ve çabalarından vazgeçip havzadaki toplam rezerv (yaklaşık 180/200 milyon ton) ve toplam 910 MW (620+290) santral gücü aynı proje içinde değerlendirilip, maksimum verim alınması mümkün iken, özelleştirmede ısrar edilmesinin arkasında ne vardır?",https://www.nefes.com.tr/yazarlar/aytunc-erkin/cayirhan-artik-germinaldir-15699
Aytunç Erkin,İmamoğlu ülkeyi kiminle yönetecek?,14 Şubat 2025 06:00,"31 Mart 2024 yerel seçimleri öncesi bir afişle donatılmıştı İstanbul: “Yok bu işin sağı solu aklın yolu İmamoğlu.” Geldik 2025’e ve 23 Mart’ta cumhurbaşkanlığı adaylığı açıklanacak İmamoğlu’nun yeni “yoluna”. “Sayın İmamoğlu gazeteleri ziyaret ediyor. Hadi söyleyeyim; Karar Gazetesi’ni ziyaret ediyor. Hadi adını da vereyim. Karar yazarı Ali Bayramoğlu soru yöneltiyor: “Sizin vizyonunuz nedir? Kürt sorunu vs…” İmamoğlu yanıt veriyor: “Danışmanlarım ve heyetle ülkeyi yönetiriz.” Önceki akşam TV100’de katıldığım bir canlı yayında bu cümleleri akademisyen Ufuk Uras kurdu. Uras’ın bu bilgiyi vermesinin nedeni de programda yaptığım tespitler ve daha öncesinde de kaleme aldığım bir yazıydı. O yazıda demiştim ki: “Peki CHP adayını neden ‘erken’ belirliyor? CHP üst yönetiminin bakış açısını Ankara koridorlarında gezerken öğrendim. Diyorlar ki: ‘2.5 yıl öncesinden programıyla, çalışma arkadaşlarıyla halka umut veren bir isim çıksın ve halkı ikna etsin. Bu İmamoğlu da olabilir Yavaş da. (6 Şubat 2025/NEFES Gazetesi)” Bu bilgi ve tespitlere TV100 yayınındaki CHP eski milletvekili Turan Aydoğan itiraz etti ve partinin bir programı olduğunu söyledi. Sonra… Önceki gün Ekrem İmamoğlu’nun gazeteci İsmail Saymaz’a verdiği röportaja baktım. İmamoğlu, “Yol haritanız nasıl olacak?” sorusuna şu yanıtı verdi: “Meseleye şöyle bakarım: Bir hafta içinde ve 23 Mart’a kadar yapılması gerekenler, parti programı sürecinin içinde olduğu Nisan-Mayıs gibi bir yakın planı içine alan bir çalışma düzeni. Sonrasında muhalefeti, ama siyasi partiler, ama sivil toplum kuruluşları ekseninde, içine alan müzakerelerin, tabiri caizse hükümet programı oluşturmaya dönük bir zaman planının tasarlanması çerçevesinde, önümüzdeki sonbaharı bulabilir. Bunlar kademeli ve aşamalı bir biçimde toplumla paylaşılır. Böyle hareket edildiğinde Türkiye’nin hiç görmediği hassasiyet içerisinde halkımızın önüne sunulacağına kanaatim nettir. Bu sürecin en öndeki destekçisiyim. Umarım yakın zamanda aday da belli olur. (Kabineniz ve temel politikalarınız ilan edilecek mi?) Gayet tabii. Bu zaman diliminde bunlar da olgunlaşacaktır. Ana gövdesinin CHP olduğu, muhalefetin erklerinin bir araya geldiği bir kurumsal yapılanma Türkiye’nin önüne güçlü kadro yapısını koyacaktır. Bu da çok kapsayıcı olacaktır.” Evet CHP’nin cumhurbaşkanı adayı önümüzdeki yaz ayını ve sonbaharı anlatmış. Bu da gösteriyor ki; İmamoğlu ve ekibi çalışmalarını yapmış, programını oluşturmuş. Yaz ayında gazetecilerle, akademisyenlerle, aydınlarla, iş dünyasıyla bir dizi toplantılar yapılacağı da net! Burada soru şu: İmamoğlu “danışmanları ve heyetle mi ülkeyi yönetecek?” yoksa CHP üst yönetiminin çizeceği bir rotada mı ilerleyecek? Sonra geriye döndüm ve Ufuk Uras’ın işaret ettiği Karar Gazetesi ziyaretinde İmamoğlu’nun söylediklerine baktım. 23 Eylül 2024’te şu cümleleri kurmuş: “CHP merkezde durmalı tabii, partimiz zaten merkezde duruyor. Bunu sağ ya da sol olarak görmemek lazım. Ben de kişisel olarak merkezi temsil ediyorum; kendimi Türkiye’nin merkezinde görüyorum. CHP tabanı da bizimle aynı düşünceyi paylaşıyor. Bu yüzden hem bana hem de Mansur Bey’e büyük önem atfediyorlar.” Evet… “Kendimi Türkiye’nin merkezinde görüyorum” vurgusunun altını çizelim. Ekrem İmamoğlu’nun yakın çevresi de “Ön seçim CHP’de olacak ama İmamoğlu tüm Türkiye’nin adayı olacak. Sağdan, soldan, muhafazakar ve Kürt cenahından oy alacak. Aynı İstanbul modeli gibi” diyor. Burada unutulmaması gereken şu: Önümüzde daha iki yıl var ve uzun zamandır muhalefetle hareket eden DEM Parti kartı CHP’nin ya da İmamoğlu’nun elinden alınırsa ne olur? Bu konuyu daha sonra yazacağım.",https://www.nefes.com.tr/yazarlar/aytunc-erkin/imamoglu-ulkeyi-kiminle-yonetecek-15230
