Yazar,Başlık,Tarih,Metin,URL
Aytunç Erkin,Hakan Fidan’ın şifreli mesajı,14 Ocak 2025 05:45,"Dışişleri Bakanı Hakan Fidan, ulusal ve uluslararası medya kuruluşlarının temsilcileriyle, İstanbul’da düzenlenen toplantıda konuştu: “Örgütün birçok ülkeyle ilişkisi var, birçok istihbarat servisiyle operasyonel ilişkisi var, birçok ülkenin askeri yapısıyla ilişkileri var. Bu kadar sızılmış, manipüle edilmiş bir örgütün kendi liderlerinden gelen bir talimatla ilgili ne derece güçlü refleksi olabilir, o başka bir sorun alanı. Geçmişte de örgüt liderliği talimat verdi, ‘silahları bırakın ve çıkın’ diye, bu yönde bir çıkış başladı. Daha sonra Suriye meselesi bahane edilerek bunu durdurdular. Şimdi yaklaşık 11 yıl sonra aynı senaryoyla karşı karşıyayız. Dinlerler mi? Kendi tercihleri. (10 Ocak 2024/İstanbul) Bu açıklamalardan sonra geriye döndüm. Abdullah Öcalan, 2013’teki Nevruz’da terör örgütüne ateşkes çağrısı yapmıştı: “Artık silahlar sussun, fikirler ve siyasetler konuşsun noktasına geldik. Yok sayan, inkar eden, dışlayan modernist paradigma yerle bir oldu. Ben, bu çağrıma kulak veren milyonların şahitliğinde diyorum ki; artık yeni bir dönem başlıyor, silah değil, siyaset öne çıkıyor. Artık silahlı unsurlarımızın sınır ötesine çekilmesi aşamasına gelinmiştir. Yüreğini bana açan, bu davaya inanan herkesin sürecin hassasiyetlerini sonuna kadar gözeteceğine inanıyorum.” Çağrıya uyulmadığını herkes gördü. Devam edelim. 12 Ocak’ta Cumhurbaşkanı Başdanışmanı Mehmet Uçum, “Terörsüz Türkiye’ye her hal ve şartta ulaşılacaktır” başlıklı bir sosyal medya paylaşımı yaptı. Uçum’un yaptığı tespitlerin şifresini çözelim: - ŞİFRE1: “İlk dikkat çeken; bu yeni aşamayı bir müzakereymiş gibi gösterme çabası, İmralı görüşmesi üzerinden politik şovlara yeltenilmesi ve konuya yeni aktörler katma girişimi oldu. Bunlar tarihi fırsatı tahrip edecek tutumlardır.” Bu cümlelerde DEM heyetinin (Pervin Buldan-Sırrı Süreyya Önder) İmralı sonrası Meclis’te grubu olan partilerle yaptığı görüşmelerin “müzakere-pazarlık-şov” ekseninde yürütüldüğüne ilişkin eleştiri var. En önemli eleştiriyse “Konuya yeni aktörler katma girişimi” cümlesinde. Burada da Selahattin Demirtaş’ın ismine dikkat çekiliyor. - ŞİFRE 2: “Özetle, terörün sona ermesine yönelik devlet inisiyatifi çok nettir: Terör her anlamda ve her mecrada devamlı surette sonlandırılacaktır. Bunun hiçbir farklı konuyla ilişkisi yoktur. Bunun için bir müzakere ve pazarlık söz konusu değildir. Terörü sona erdirmek için mutabakat aramak, komisyon kurmak, yasama yetkisine atıf yapmak abestir. Bunlar işi yokuşa sürmektir.” Mehmet Uçum’un tepkilerinden birisi de CHP’nin “Meclis’te komisyon kuralım” önerisine. Bu noktada Beştepe de MHP de “Önce silaha son verilsin, örgüt lağvedilsin. Sonrasında neler konuşulacak bunlar masaya yatırılacaktır” çizgisinde. Edirne ziyaretine uzanalım. Edirne’de hapis yatan Selahattin Demirtaş’ın, DEM heyetini ziyaretinden sonra yaptığı açıklama çarpıcı. Demirtaş’ın bazı cümlelerin altı çizildi. - Örneğin: “Barış dilinin tüm çevrelere hakim olması da önemlidir. Bu konularda konuşan herkes tehdit, şantaj, aşağılama dilinden ve provokatif söylemlerden uzak durmak, yenme ve yenilme üzerinden boş ve anlamsız bir retorik oluşturmak yerine herkesin, hepimizin kazanacağı ortak bir gelecek üzerinde durmalıdır.” Bu tespitlerin adresi Cumhur İttifakı! Çünkü; iktidar cenahı “Terör yenilmiştir” açıklamasını sık sık yapıyor. Oysa HDP’nin eski lideri “yenme yenilme üzerinden boş ve anlamsız retorik oluşturmak” dedi. - Demirtaş dedi ki: “Bizler, barış girişimlerine bu aşamada her türlü desteği sunarız. Ancak çağrıyı yapacak olan da olası bir çağrının muhatabı da biz değiliz. Temel sorumluluğumuz; demokrasi, özgürlükler, eşitlik, adalet ve temel insan hakları için barışçıl, sivil, siyasi mücadeleyi büyütmektir. Bu mücadelenin kanal ve imkanlarının şimdiden açılması gerekir ki barış zemini de güçlensin. Bu hususu da ilgililerin dikkatine sunmak isteriz.” - Demirtaş’ın mesajı şöyle okundu: “Benim içeride olmam doğru değil. Destek vereceksem ‘kanal ve imkanlar’ açılmalı.” Burada kararı verecek olan Beştepe ve Devlet Bahçeli. Bakalım, Demirtaş’ın önü açılacak mı?",https://www.nefes.com.tr/yazarlar/aytunc-erkin/hakan-fidanin-sifreli-mesaji-8182
Aytunç Erkin,İç dinamiklerle çözme konusunda mutabıkız,04 Ocak 2025 06:00,"MHP Genel Başkanı Devlet Bahçeli’nin çağrısından sonra DEM Parti heyetinin İmralı’da Abdullah Öcalan’la görüşmesiyle devam eden süreçle ilgili gelişmeler sürüyor. İmralı ziyaretinin ardından MHP liderini ziyaret eden Pervin Buldan ve Sırrı Süreyya Önder’le birlikte DEM Parti heyetinin içinde yer alan Ahmet Türk’le konuştum. Türk, MHP lideri Bahçeli’nin tavrının çok olumlu olduğunu söyledi. BU GÖRÜŞME BİR BAŞLANGIÇ Bahçeli ziyaretiniz nasıl geçti Ahmet Türk? İyi bir görüşme oldu. Aslında insanlar, sanki hazırlanmış bir konu var ve bunun üzerine konuşulduğunu düşünüyor. Öyle değil. Bir başlangıçtır bu. Toplumun da hepimizin de buna ihtiyacı var. Yıllarca acılar çekildi. Türk halkı da Kürt halkı da. Dünyaya baktığımızda Ortadoğu’ya baktığımızda; nasıl Malazgirt’te başlayan Türk-Kürt ittifakı varsa aslında bugün de çok geçerli. Süreç bunu bize anlatıyor. Ortadoğu bataklığında aslında -bir bütün olarak söylüyorum sadece Kürtler için söylemiyorum- tehlikelerle dolu bir süreç yaşanıyor. Bunu iç dinamiklerimizle oturarak konuşmak gerekiyor. Bu konuda da mutabıkız. Çünkü bu durumu kaşıyacak çok kuvvet var. Herkes çıkar ortaya. Herkes derken… Uluslararası güçler mi diyorsunuz? Uluslararası güçler. Emperyalizmi görmeliyiz. Yayılmacı politikaları gün geçtikçe halklar üzerinde büyüyor. Böyle bir dönemde gerçekten yeniden bir hukuk oluşturmak, yeniden Türk-Kürt dostluğunu kurmamız gerekiyor. Ortadoğu’da kendi sorununu çözmüş olan Türkiye hem demokrasi ihraç edebilecek hem de çok etkili bir aktör olacak. Kendi iç sorunlarını çözmeyen ülkelerin karanlık bir döneme girdiklerini görüyoruz. Türk-Kürt dostluğu bugün gerçekleştirmek gerekiyor. Devlet Bahçeli’nin tavrı nasıldı? Bahçeli’nin tavrı çok olumluydu, gerçekten saygılı ve samimi olduğunu görüyorsunuz. Genel bir sohbetti. PARTİLERİN TAVRI ÜZERİNDE DURDUK Öcalan’ın 7 maddelik mektubu gündeme geldi mi? Ziyaretti, sohbetti. Herkesin, tüm siyasi partilerin, parlamentoda olan olmayan partilerin bu sürece katkısı nasıl olacak? Bunun üzerinde durduk. Genel bir değerlendirme. Öcalan silah bırakma çağrısı vs. konuşuldu mu? Daha önce açıklandı bu konular. Ben İmralı'ya giden heyette değildim. Bu görüşmeler sonucunda iki veya üçüncü İmralı ziyaretinde silah bırakma çağrısı gelebilir. Şimdiden bir şey söyleyemeyiz. Bizim de aldığımız bilgiler öyle. Bütün siyasi partilerle görüşüp, heyetin tekrar İmralı’ya gitmesi ve ona göre de değerlendirme yapılacağı anlaşılıyor. Yani siyasi partilerle yapılan görüşmelerden çıkacak sonuç da İmralı’da değerlendirilecek. Elbette. Kendisi de ‘parlamentoda çözülmesi gerekiyor’ dedi. Parlamentodaki partilerin düşünceleri önemli. Bunlar da değerlendirilecek. Bu bir başlangıç adına süreç diyemeyiz. Adı konulmamış bir süreç. Evet. Adı konulmamış, iyi niyetli bir başlangıç. Türk-Kürt halkının tarihten gelen dostluğu var ve bu tekrar inşa edilmeli. Şunu da görüyoruz: Irak’a da gittim, Suriye’ye gittim. Şu anda dışarıya çıkamıyorum. Ama bütün Kürtler’in gözü Türkiye’de. Kendilerini hala Osmanlı’dan bu yana Türkiye’nin bir parçası olarak görüyorlar. Kürtler sadece Türklerle adil bir yaşam sürebilir, özgürleşir. Başka şansları da yok. Türkler’in de Kürtleri dışlayan tavrı doğru değil. Sürecin en başında 1 Ekim öncesinde Devlet Bahçeli’yle bir temasınız oldu mu? Sadece Sırrı Süreyya Önder telefondayken ‘Ahmet ağabey de yanımda’ dedi ve telefonu verdi. Sayın Bahçeli’yle konuştum, hal hatır sorduk. O kadar bir görüşme oldu. Tesadüfen bir görüşme oldu. Bir genel af talebi oldu mu Bahçeli’yle görüşmenizde? Bunlar spekülasyon. Öcalan da görüşmede umut hakkı gibi konuları gündeme getirmemiş. Suriye, Türkiye’deki gelişmeler, emperyalizmin Ortadoğu’yu ele geçirme çabası… Bunlar gündeme gelmiş Öcalan’la yapılan görüşmede de. Bunlara karşı ne yapmak gerekiyor? Kendi meselemizi kendimiz çözmemiz gerekiyor düşüncesi konuşulmuş. Başkası müdahil olmasın. Öcalan da ‘bu iç mesele’ diyor ve parlamentonun çözmesi gerektiğini anlatıyor. Görüşmeyi yapan arkadaşların verdiği bilgiler ama fazlasını söyleyemem.",https://www.nefes.com.tr/yazarlar/aytunc-erkin/ic-dinamiklerle-cozme-konusunda-mutabikiz-6152
Aytunç Erkin,“Hani faiz artınca enflasyon düşecekti”,27 Aralık 2024 06:00,"İDDİA… ERDOĞAN, MEHMET ŞİMŞEK’E BÖYLE SESLENMİŞ: “Mehmet Bey; faiz artınca enflasyon düşecekti ama düşmedi.” Bu cümleyi Cumhurbaşkanı Tayyip Erdoğan’ın, AKP’nin 30 Haziran 2024’te yapılan Kızılcahamam kampında kurduğu iddia edildi. Erdoğan’ın bu serzenişinin ardından konuyu değiştirdiği ve özellikle o dönem eleştiri oklarının yöneldiği Sağlık eski Bakanı Fahrettin Koca’yla ilgili tespitlere geçtiği de belirtildi. Sonrasında Koca’nın görevden alındığını biliyoruz ama Şimşek’le ilgili tartışmalar koridorlarda fısıltı halinde sürdü. Neden bu kulis bilgisiyle başladım? Dün… Merkez Bankası 250 baz puanlık faiz indirimine giderek politika faizini yüzde 47.5’e çekti. Böylece Şubat 2023’ten bu yana ilk faiz indirim kararı alınmış oldu. Karar metninde öncü verilerin aralık ayında enflasyonun ana eğiliminde düşüşe işaret ettiği belirtildi. Maliye politikasının artan eşgüdümünün dezenflasyon sürecine önemli katkı sağlayacağı vurgulandı. Merkez Bankası bunun yanında faiz koridorunu da 600 baz puandan 300 baz puana daralttı. Aslında işareti iktidara yakınlığıyla bilinen Yenişafak Gazetesi vermişti. 24 Aralık’ta gazetenin sürmanşetinde şu başlık vardı: “Yüksek faiz çıkmazına son.” Haberi okuyalım: “Yüksek faiz politikasıyla ekonomiyi soğutma çalışması enflasyonu beklenen ölçüde düşürmezken yatırımların azalmasına, emek yoğun sektörlerde işten çıkarmalara ve bazı işletmelerin üretimi yurt dışına kaydırmasına neden oldu. İş dünyası indirim bekliyor.” Yine aynı gazete, Merkez Bankası’nın kararını açıklayacağı dün de birinci sayfasından şu haberi verdi: “Faizle yabancıya döviz bazında yüzde 30 kazandırdık. Yüksek faiz ve baskılanan kur, üretim yerine paradan para kazanma yolunu tercih edenlerin ekmeğine yağ sürüyor. Yüksek faiz politikası nedeniyle Türkiye’yi tercih eden sıcak para yatırımcısı, büyük kazanç elde ediyor. Yatırımcıların para birimi veya menkul kıymet gibi varlıkları belirli bir süre elinde tutması ve taşıması karşılığında elde ettiği ara dönem kazancı anlamına gelen ‘carry trade’ yöntemini tercih eden yabancılar, bu yıl döviz bazında yaklaşık yüzde 30 kazanç elde etti.” Hatırlayın; Yenişafak Gazetesi, dönemin Merkez Bankası Başkanı Naci Ağbal’ı hedef almış ve “Bu operasyonu kim adına çektiniz” manşetini atmıştı: “Dünya, ekonomideki faiz etkisini azaltmaya çalışırken Türkiye’de Merkez Bankası, 83 milyonun sesine kulak tıkayarak faizi yüzde 17’den yüzde 19’a çıkardı. Piyasa beklentisinin bile üzerinde yapılan 200 baz puanlık müdahale, ekonomik gerekçelerle izah edilemeyen bir faiz artışı oldu. Merkez Bankası’nın Türkiye’nin büyümesini frenleyecek bu operasyonu kim veya kimler adına ve hangi amaçla çektiği merak ediliyor. (19 Mart 2021)” Sonuçta 2025 yılı Mehmet Şimşek ve ekibinin hedeflediği enflasyon yüzde 30 ve işveren artı dünya finans kuruluşlarının talebiyle asgari ücrete yüzde 30 zam yapıldı. Ya yüzde 30 enflasyonu tutmazsa? Dün… “Emre itaatsizlik eden komutan” yazımdan sonra Çetin Doğan Paşa aradı. Önce yazıyı kısaca hatırlatayım: “PKK’nın Irak’ın kuzeyinde bulunan üslerine yönelik “Şafak Harekâtı” ismiyle kapsamlı bir operasyon planlandı. Harekâtı bizzat Asayiş Kolordu Komutanı Korgeneral Çetin Doğan Paşa yönetecekti. On beş günün sonunda PKK’nın tüm mevzileri susturuldu. Tam o sırada üs bölgesinde bulunan kriptolu telefon çaldı. Telefonu Çetin Paşa açtı. Üsteğmen Engin Çırakoğlu o sırada hemen yanındaydı. Arayan dönemin Genelkurmay İkinci Başkanı’ydı. İkinci Başkan, ‘Amerikalıların bölgede alçak uçuş eğitimi yapacakları için bölgeye yapılan topçu atışları ile uçak ve Kobra helikopter uçuşlarının durdurulmasını istediklerini’ söyledi. ABD’lilerin PKK’lılara zaman kazandırmak istedikleri çok açıktı. Çetin Paşa, ‘Bu isteği yerine getirmeyeceğim komutanım!’ diye karşılık verdi.” Çetin Doğan telefonda daha bilmediğimiz o kadar çok olayın olduğunu söyledi: “Irak’ın içlerine girmiştik. Barzani birlikleri de bize katıldı. PKK-Talabani de bize saldırdı. Adım adım ilerledik. O zaman Genelkurmay İkinci Başkanı’na söylediğim bir söz var: ‘Siz ben asi ve deli bir olarak biliyorsunuz. Sizden bilgi istedim mi sizden bu harekatı yapmak için. (Hayır, istemedin.) Şu halde bu harekatta başarısız olursam, o zaman beni asarsınız. Ama başarılı olursam biz emir verdik, yaptık dersiniz. Nihayetinde başarılı olduk ve ikinci dediğim oldu.”",https://www.nefes.com.tr/yazarlar/aytunc-erkin/hani-faiz-artinca-enflasyon-dusecekti-4741
Aytunç Erkin,Özdağ için beş ay sonra gelen rapor,23 Ocak 2025 06:07,"Zafer Partisi Genel Başkanı Ümit Özdağ’ın ideolojik çizgisini eleştirebilirsiniz, yaptığı muhalefeti beğenmeyebilirsiniz ancak… Özdağ’ı, “Cumhurbaşkanına hakaretten” gözaltına alıp ‘halkı kin ve düşmanlığa tahrik’ten tutuklarsanız burada sorun var demektir! * Özet bilgiyle başlayalım: İstanbul Cumhuriyet Başsavcılığı önceki akşam, Zafer Partisi lideri Ümit Özdağ hakkında “halkı kin ve düşmanlığa tahrik” suçlamasıyla tutuklama talep etti. Savcılık, Özdağ’ın 2020’den bu yana yaptığı 11 X paylaşımını delil gösterdi. Tutuklama talebinde, Özdağ’ın mültecilerle ilgili paylaşımlarının resmi kurumlar tarafından yalanlandığı belirtildi. Ayrıca Temmuz 2024’te Kayseri’de meydana gelen ve 15 bin kişinin katıldığı protesto eylemlerinde 263 ikamet ve 166 araçta hasar oluştuğu, 25 emniyet ve itfaiye personelinin yaralandığı olayların şüphelisi olarak değerlendirildi. Günün sonunda Özdağ tutuklandı ve Silivri Cezaevi’ne konuldu. Tam da bu noktada Ümit Özdağ’ın tutuklanmasına neden olan bir rapor var. Kayseri’de yaşanan provokasyon da dosyada Ümit Özdağ gözaltına ne zaman alındı? 20 Ocak Pazartesi saat 19.45 civarı İran Caddesi’nde (Ankara) bir lokantada yemek yiyordu. Etrafı polisler tarafından çevrildi ve Antalya’daki konuşmasında Tayyip Erdoğan’a hakaret ettiği iddiasıyla gözaltına alındı. Özdağ sonrasında İstanbul’a getirildi. * 21 Ocak Salı. Özdağ sabah saatlerinde hala İstanbul Emniyeti’ndeydi ve savcılığa götürülmemişti. Saat 13.03 civarında İstanbul Cumhuriyet Başsavcılığı’nca ifadesi alınmak üzere adliyeye sevk edildi. İşte tam da bu noktada Kayseri Emniyet Müdürlüğü Güvenlik Şube Müdürlüğü Kamu Güvenliği Büro Amirliği’nden bir “rapor” İstanbul Cumhuriyet Başsavcılığı’na ulaştırıldı. * Raporun FİHRİST bölümünde olay anlatılıyordu: “30 Haziran 2024- 3 Temmuz 2024 tarihleri arasında meydana gelen olaylar. Yine bu olaylarla ilgili Zafer Partisi’ne üye veya müzahir şahıslarca yapılan suç unsuru paylaşımlar ve ilgili adli işlemler...” * Peki 30 Haziran-3 Temmuz 2024 tarihleri arasında ne yaşandı? Rapordan okuyalım: “İlimiz Melikgazi İlçesi Danişmentgazi Mahallesi Pazar yeri yan tarafında bulunan umuma açık lavaboda 30 Haziran 2024’te gerçekleşen küçük yaşta çocuğa cinsel istismar olayının X (Twitter) isimli sosyal sitesinde paylaşılmasıyla 30.06.2024-03.07.2024 günleri arasında il merkezi farklı noktalarında yaklaşık 15.100 kişi protesto eylemi başlatmış olup…” * Raporun devamında da Zafer Partisi üyelerine yapılan adli işlemler anlatıldı ve “Değerlendirme” yapıldı: “İlimizde meydana gelen olaylarla ilgili olarak haklarında işlem yapılan şahısların yüzde 68’inin 10-25 yaş aralığı, yüzde 38’inin 25 ve üstü şahıs olduğu bu şahısların genel değerlendirmesinde Zafer Partili ve müzahir şahıslar tarafından sosyal platformlarında yapmış oldukları paylaşımlardan da etkilenmiş oldukları değerlendirilmektedir.” Özdağ: Provokasyonu engelledim Kayseri Emniyeti’nin raporunun Ümit Özdağ’ın adliyeye sevk edildiği gün savcılığa gönderilmesi dikkat çekici değil mi? Beş ay önce Kayseri’de yaşanmış bir olayla ilgili haklarında adli işlem yapılmış kişilerin Zafer Partili olması ve beş ay sonra bunun rapora dökülmesi… Sonuçta savcılığın Özdağ’ı tutuklamaya sevk yazısında ve tutuklama kararında da Kayseri’de yaşanan olaylara da atıf var. Özdağ da savcılık ifadesinde diyor ki: “Kayseri’de yaşanan olaylarda, bir Suriyeli genç, bir Suriyeli kızı taciz etmiştir. Olayların duyulmasıyla, Kayseri’nin farklı mahallelerinden insanlar olay yerine gelmiştir. Olayların başladığı gün, provokasyon yapan bir sosyal medya hesabına, ‘Yanlış diyebilmek için açık adını buraya yazacaksın. Kayseri’ye gideceksin. Oradan sokaktan fotoğraf paylaşacaksın. Böyle sahte isimler ile sosyal medyadan Türk Milletini sokağa çağırmayacaksın. Halk tepki gösterdi, bu yol ile kimse yollanmaz, sadece ülke emperyalizmin istediği gibi karıştırılır. Suriyelileri, Afganları yollamak istiyorsan oyunu Zafer Partisi’ne vereceksin ve hukuk içinde gidecekler. Sevgili Kayserililer, polis bizim, devlet bizim, ülke bizim. Şehrinize sahip çıktınız, artık evinize dönün. Bilinçli bilinçsiz tahrikçilere izin vermeyin’ cevabını verdim. Aynı gün saat 00:41 ve 22:56’da Kayseri halkını evlerine dönmeye davet eden ve sokağa çıkma yasağı ilan edilmesini öneren iki ayrı paylaşımda bulundum. Ayrıca ertesi gün 3 genel başkan yardımcımızı bölgeye göndererek, Zafer Partisi üyelerinin olaylara karışmamasını sağladım. Olaylara ilişkin raporlarda, Zafer Partisi mensuplarının bu olaylarda yer aldığına dair herhangi bir delil bulunmamaktadır.” Sonuçta; Ümit Özdağ’ın adliyeye sevk edildiği gün savcılığa giden bir emniyet raporu var ve bu rapor üzerinden de Zafer Partisi liderinin tutuklandığı anlaşılıyor.",https://www.nefes.com.tr/yazarlar/aytunc-erkin/ozdag-icin-bes-ay-sonra-gelen-rapor-10153
Aytunç Erkin,İmamoğlu’ndan “savaş” ilanı!,28 Ocak 2025 06:00,"Ekrem İmamoğlu’na yakınlığıyla bilinen bir dostum dedi ki: “Ekrem Başkan altı yıldır Tayyip Bey’le uzlaşmaya çalışıyordu. Görüşme talebinde bulundu, dışardan yatırımlar için destek getirdi ve Erdoğan’la oturmak istedi. Ancak bu talepleri karşılık bulmadı. Dün yaptığı toplantı İmamoğlu açısından ‘savaş ilanıydı’ diyebiliriz.” - Saraçhane’ye uzanalım. Bilirkişinin merkezde olduğu toplantıda dersine iyi hazırlanmış bir portre çizdi İstanbul Büyükşehir Belediye Başkanı Ekrem İmamoğlu. Soruşturmalarla ilgili “derin” bir konuyu halkın anlayacağı dille anlattı ve kamuoyunu ikna etti diyebiliriz. Benim dikkatimi yoğunlaştırdığımsa Cumhuriyet yazarı Barış Pehlivan’ın sorusu oldu. Pehlivan, CHP koridorlarında konuşulan bir konuyu gündeme getirdi. İmamoğlu, “Bu baskı sürecinde Cumhurbaşkanı adayının erkenden açıklaması gerektiğini düşünüyor musunuz” sorusuna şu yanıtı verdi: “Şu anda çok yoğun ve baskıcı bir ortam var, siyasetin bu tarafına girmeyeceğim. Zaten partimiz gereken çalışmaları yapıyor, gereken açıklama gereken zamanda parti genel başkanımız tarafından yapılacaktır. Ben bugün siyaset ve yargı çerçevesinde kalmak istiyorum.” Evet… CHP’de bir grup diyor ki: “Ekrem Bey’in adaylığı şimdiden ilan edilsin ve yargı baskısına karşı önlem alınsın. Ya da İstanbul’da büyük bir belediyeye daha operasyon yapılırsa CHP’nin başına geçsin.” İkinci olasılıkla ilgili yani CHP genel başkanlığı konusunda İmamoğlu cephesinin “sıcak” olmadığı ve “Soruşturma olacak ve biz de korkup partini başına mı geçeceğiz?” değerlendirmesi yapılıyor. CHP yönetimiyse “Çift forvetten birinin küstürülmemesini” istediği için açıklama yapmakta aceleci davranmıyor. Çift forvetten biri Ekrem İmamoğlu diğeri Ankara Büyükşehir Belediye (ABB) Başkanı Mansur Yavaş. Küstürülmemek istenen Yavaş’ın da 9 Kasım 2024’te yaptığı açıklamanın arkasında durduğu belirtiliyor: “Son 50 ankete baktığınız zaman hemen hemen hepsinde hem başarı oranları açısından hem de kamuoyu yoklamalarında hep ben birinci çıkıyorum. Son bir hafta 10 gündür acımasız bir saldırı var. Gerek konserler üzerinden gerek her türlü iddiaya başladılar saldırmaya. Bunu görüyoruz ve bu maalesef sağlı sollu yapılıyor. Buna dikkatinizi çekmek isterim. Ama çekindiğimiz hiçbir şey yok. Yargıyı sopa gibi kullanıp kumpas yapmak, bunlar FETÖ taktikleridir, tavsiye etmem.” Ancak Ankara’nın havasını iyi koklayanlara göre ibre her geçen gün İmamoğlu’na dönüyor. Özellikle son soruşturmalarla birlikte İBB Başkanı “olası adaylıktan”, “adaylığa” doğru yol almakta. Bu durum Mansur Yavaş’a yakınlığıyla bilinen AREA Araştırma’nın son yaptığı ankete de yansımış durumda. Ankete göre; Cumhurbaşkanlığı seçiminde CHP’nin adayı olması durumunda Mansur Yavaş’a oy vereceğini belirtenlerin oranı yüzde 51.6, oy vermeyeceğini belirtenlerin oranı yüzde 38.6’dır. Oy verme konusunda kararsız kalanların oranı ise yüzde 9.8. Ancak Cumhurbaşkanlığı seçiminde bağımsız aday olması durumunda Mansur Yavaş’a oy vereceğini belirtenlerin oranı yüzde 43.9, oy vermeyeceğini belirtenlerin oranı yüzde 46.4. Oy verme konusunda kararsız kalanların oranı ise 9.7. “CHP’nin adayı - bağımsız aday” sorularına göre aradaki fark yüzde 8. - Anketteki kritik soruysa şu: “Yapılacak ilk Cumhurbaşkanlığı seçiminde, muhalefetin ortak aday üzerinde anlaşamaması durumunda aşağıdaki isimler aday olursa tercihiniz ne olur?” Yanıtlara göre; Tayyip Erdoğan yüzde 30.6, bağımsız aday Mansur Yavaş yüzde 28, CHP’nin adayı Ekrem İmamoğlu 27.9. Yani CHP’nin adayıyken aldığı oy yüzde 51.6 oy alan Yavaş, üçlü bir seçimde ve bağımsız aday olursa yüzde 23 daha az oy alıyor (yüzde 28). Buradan da ortaya çıkan tablo: CHP’nin adayı olmak önemli! Mansur Yavaş cephesinden yapılan bir değerlendirmeyi de eklemekte fayda var: “CHP, DEM kartını AKP’ye kaptırırsa… Cumhur İttifakı’ndan milliyetçi seçmeni kendisine çekebilecek ve dengeyi değiştirebilecek tek isim Mansur Yavaş. Ama bu DEM Parti’nin AKP’yle hareket etmesine bağlı. O zaman da CHP’nin Yavaş’tan başka şansı kalmayabilir.” Anketten bir notla bitirelim: AREA’nın anketine göre; İYİ Parti lideri Müsavat Dervişoğlu’nun Çağlayan Adliyesi önünde Zafer Partisi lideri Ümit Özdağ’a verdiği desteği ve yaptığı birlik çağrısını “olumlu” değerlendirenlerin oranı yüzde 48.8, “olumsuz” değerlendirenlerin oranı yüzde 33.6’. Fikir belirtmeyenlerin oranı ise yüzde 17.6. CHP seçmeninin yüzde 74’ü de “birlik çağrısına” destek veriyor.",https://www.nefes.com.tr/yazarlar/aytunc-erkin/imamoglundan-savas-ilani-11272
