Yazar,Başlık,Tarih,Metin,URL
Aytunç Erkin,"“Gün, ayrışmadan birlik beraberlik günü”",04 Nisan 2025 06:00,"Arkadaşlar! Partimizin her kurultayı, denebilir ki, bir dönüm başında toplanmıştır. 1927 kurultayı, doğuda kopan azıyı yenerek cumhuriyetin sarsılmaz temelde olduğunun anlaşılmasına; 1931 kurultayı güvenlik ve sükûnun kesin olarak kurulmasına rast gelir. Bu kurultayımız ise, geniş ölçüde gelişim devri içinde bulunduğumuz günlerde toplanmış oluyor. Kurultayın, yeniden alacağı ilerleme ve yükselme tedbirleriyle; vatanın yüksek yönetimini erdemli ellerinde tutan partimizin şerefli tarihini zenginleştireceğine, şüphe yoktur.” Mustafa Kemal Atatürk, 4 Mayıs 1935’te, CHP’nin 4. Kurultay açış konuşmasında bu cümleleri kurmuştu. Neden, 4. Kurultay’la başladım? Çünkü; pazar günü CHP Olağanüstü Kurultay’ını gerçekleştirecek ve CHP içinde “kanatların” ne yapacağı merak konusu. Dün, CHP’nin 7. Genel Başkanı Kemal Kılıçdaroğlu kurultayla ilgili son noktayı koydu. Habertürk yazarı Muharrem Sarıkaya’ya konuşan Kılıçdaroğlu, “Aday mısınız?” sorusuna, “Hayır efendim. Ben aday değilim…” yanıtını verdi. “Kurultaya gidecek misiniz?” şeklindeki soruya da cevap veren Kılıçdaroğlu, “Biliyorsunuz bir süredir bayram dolayısıyla tatildeyim. Eğer davetiye geldiyse giderim. Ofiste olmadığım için davetiyenin gelip gelmediği hakkında da bilgim yok. Bir iki güne döneceğim, eğer davetiye gelmişse giderim” ifadelerini kullandı. Kimsenin açıp kendisine sormadan hakkında yorumda bulunduğunun altını çizen Kılıçdaroğlu, “Herkes aday yapıyor ama ben aday değilim” ifadelerini kullandı. Peki Ekrem İmamoğlu ve ekibi pazar günü için ne düşünüyor? Önce bir bilgi. CHP lideri Özgür Özel, Silivri’de İmamoğlu’nu ziyaretinde aralarında “gerilim” olduğu ve görüşmenin kısa sürdüğü kulislerde konuşulmuştu. Peki gerçek ne? Ekrem İmamoğlu’na yakın isimler dedi ki: “Bu kurultay kararı çok acele alındı. Ekrem Bey en başından bu yana böyle düşünüyor. Özgür Bey’e de ‘Çok acele bir karar, o kadar acele edilmesine gerek görmüyorum. Ama tabii bir kayyum riski varsa alınması gereken bir karardır. Eğrisini doğrusuna getiririz’ diyor. Aralarında konuşmayı kısa kesecek bir gerilim yaşanmıyor. Tam tersi, meseleleri uzun uzun konuştuklarını kendisi ifade etti.” Şimdi gelelim kurultaya. İmamoğlu çevresinde gelen bilgileri aktaralım: “Şimdi bir imza kampanyası başladı. Önümüzde 23 Nisan ve 19 Mayıs var. Süreç hızlı gelişiyor. Bunlardan sonra parti, en geç 2026 Kasım ayında süresi dolacağı için olağan kurultayını yapacak. Biz olağanüstü kurultayda kurultay delegesi seçmiyoruz. 2026’nın Kasım ayında olacak ya da daha önce olacak olağan kurultayda delegelerimizi de seçeceğiz. Olağan kurultaydan evvel bir yerel ve genel seçim olma şansı var mı? Bunu çok zayıf gördüğümüzü söyleyebiliriz. “Bu kurultay milletin eline kılıcı alıp da cengaver gibi birbirine girişeceği bir zamanda yapılmıyor. Türkiye’nin ve partinin toplu bir saldırı yaşandığı günlerde yapılıyor. Bu saldırıyı püskürtmek için partiyi bütünleştirecek doğru kurultay görüntüsü verecek bir etkinliğe ihtiyacımız var. “Ekrem Başkan da ‘Gün birlik beraberlik günü. Ayrışmadan yola devam edeceğiz” düşüncesinde. SONUÇ: 6 Nisan olağanüstü kurultayı bir başlangıç. Kılıçdaroğlu’nun tavrı net ve aday olmayacak. İmamoğlu cephesi de “birlik-beraberlik” vurgusu yapıyor ve bakalım pazar günü oluşacak yeni Parti Meclisi ve sonrasında neler yaşanacak?",https://www.nefes.com.tr/yazarlar/aytunc-erkin/gun-ayrismadan-birlik-beraberlik-gunu-25916
Aytunç Erkin,O mektup,21 Mart 2025 06:00,"Bugün “Gezi soruşturmasından” gözaltında olan gazeteci İsmail Saymaz, 11 Kasım 2024’te tutuklanan Esenyurt eski Belediye Başkanı Ahmet Özer’in mektubunu yayımlamıştı. Özer, “İmamoğlu’nu oyun dışı bırakmayı hedefliyorlar” başlıklı mektubunda açık konuşmuştu: “Esenyurt’ta iki kişiden birinin oyunu alarak seçildim. Hakkımda çok kara propaganda yaptılar, halk itibar etmedi. O zaman seçimle elde edemediklerini yargı yoluyla ele geçirmeye çalışıyorlar, ancak kayyum halk iradesinin gaspıdır. Meselenin ikinci kısmı, buradan sonuç alırlarsa İmamoğlu’nu oyun dışı bırakmayı hedefliyorlar. Üçüncü hedef, partimizin bu operasyonlarla iktidar yolculuğunu engellemek olacak.” Herkes biliyordu, kimse konuşmuyordu. “Hedefte İmamoğlu var” ve sonrasındaki hedef CHP! Dün Ahmet Özer iddianamesini yazdım: “… Esenyurt Belediye Başkanı olan şüpheli Ahmet Özer gibi İstanbul ilinde görevli bir kısım Belediye Başkanı, Başkan Yardımcısı ve Belediye Meclis Üyesi’nin 31/03/2024 yerel seçimler sonrasında terör örgütünce verilen talimatla ‘Kent Uzlaşısı’ faaliyeti kapsamında terör örgütünün uzlaşma sağladığı partiden seçilmeleri sağlanarak görev yapmaya başladıkları ve halen görevli oldukları, yukarıda da izah edildiği üzere özerlik sistemi ve kent uzlaşısı formülünün, DEM Parti üstü bir örgütlenme sistemi olduğu, özellikle örgütlenme konusunda çalışmalar yürüten örgüt bünyesindeki oluşumların (DBP, HDK) örgütün taban (halk) örgütleme sistemini geliştiren ve yöneten esas kurumlar olduğu hususu da nazara alındığında bu şahısların terör örgütünün Kent Uzlaşısı faaliyeti kapsamında faaliyet yürüten örgüt mensuplarından oldukları anlaşılmıştır. (Sayfa 25)” Bütün bunlara rağmen, “Ben geliyorum” diyen operasyonlara rağmen net bir tepki gelmemişti ana muhalefetten. Sonra devam etti. İstanbul Cumhuriyet Başsavcılığı, “yolsuzluk” ve “terör” suçlarından başlattığı iki ayrı soruşturma kapsamında gözaltına alınan İstanbul Büyükşehir Belediye Başkanı Ekrem İmamoğlu için “suç örgütü lideri” ifadesini kullandı. Başsavcılıkça yapılan açıklamada, “Suç örgütü lideri şüpheli Ekrem İmamoğlu, Murat Ongun, Tuncay Yılmaz, Fatih Keleş, Ertan Yıldız ve bu şahıslarla bağlantılı 95 şüpheli başta olmak üzere toplam 106 kişi hakkında gözaltı kararı verilmiştir” denildi. Tarih 15 Mart 2025. Ekrem İmamoğlu, Ankara’da konuştu: “Bu hazırlıkların, bu davaların, soruşturmaların hepsi temelsiz, kanıtsız, zorlama iddialar. Tüm uyduruk iddiaları bir araya getirecekler, İmamoğlu’nun etrafında toplanmış çıkar amaçlı bir örgüt icat etme çabasındalar. Hepsi tek tek denetlenmiş göz önündeki ihaleleri bahane ederek yapacaklar, etrafımdaki kişileri de kurdukları kirli hesap düzeniyle onları suçlu ilan etmeye çalışacaklar. Önce ‘23 Mart’ta ön seçim olmadan İmamoğlu’nun işini bitirelim’ derdindeler. ‘Turbun büyüğü’ diyerek heybeden, eskiden yaptıkları gibi, sözüm ona örgüt çıkarmak. İmamoğlu’nu, hapse atmaktan bile bahsediyorlar. Köşe yazılarında bunlar var. İmamoğlu oyun dışı kalacakmış!” İmamoğlu da belki sonrasında fark etti ve 15 Mart’ta kendisine yönelik operasyonu anlattı. Peki ya CHP ne yapacak? Örneğin; Esenyurt’a gelen kayyumdan sonra nöbet mi tutacak ve unutulacak gidecek! İktidara karşı “ben de varım, buradayım” mı diyecek? Ya da İmamoğlu’nun diploması iptal edildikten sonra CHP lideri Özgür Özel’in dediği “İdare mahkemesi var” cümlesini mi kuracak? Evet… Saraçhane’de karargah kuran CHP liderliği halkı her akşam 20.30’da belediyenin önüne çağırıyor ve operasyonu diri tutmaya çalışıyor. Ancak bir dağınıklık olduğu konuşuluyor. Burada CHP’yi toparlayacak “baba/ağabey” figürüne ihtiyaç olduğu açık ve İmamoğlu gündemiyle birlikte yeni yol haritası için harekete geçmek gerekiyor. Tam yazıyı bitirirken TKP Genel Sekreteri Kemal Okuyan’ın sol portalda yazısını gördüm. Yazının ana fikri çarpıcı: “İmamoğlu’na dönük ardı ardına gelen hamlelerin ne beşinci kolla, ne yolsuzlukla, ne sahtecilikle bir ilgisi var. İşin özü, ‘bu kadar seçim bize yeter’ yaklaşımını sevdiler. Bu anlamda hayatı boyunca müesses nizamı savunmuş bir gelenekten gelen İYİ Parti Genel Başkanı’nın ‘Cumhurbaşkanlığı seçimi boykot edilsin’ açıklaması önemlidir. Bu elbette bir direniş çağrısı değil, sistemin bu şekilde işlemeyeceğine ilişkin ‘içerden’ bir uyarıdır.”",https://www.nefes.com.tr/yazarlar/aytunc-erkin/o-mektup-23088
Aytunç Erkin,AKP’nin oy depolarında destek az CHP’nin oy depolarında destek çok,08 Nisan 2025 06:00,"“II. Meşrutiyet’in ilanından dört ay sonra Osmanlı, büyük bir krizle sarsıldı. 5 Ekim 1908’de Bulgaristan bağımsızlığını ilan etti, ertesi gün Avusturya-Macaristan Bosna-Hersek’i işgal etti. Osmanlı’nın buna karşı savaş açacak gücü yoktu, ancak halk öfkeliydi. Çözüm, Servet-i Fünun’da ‘Horasani’ takma adıyla yazan Jön Türk Ubeydullah Efendi’den geldi. Avusturya ve Bulgar ürünlerine boykot önerisi, Hüseyin Cahit’in Tanin gazetesinde işlemesiyle geniş yankı uyandırdı. Boykotun hedefinde Avusturya’dan ithal edilen fes ve şeker vardı. İttihatçıların örgütlü yapısı ve Boykotaj Sendikası’nın çalışmalarıyla ülkeye yayılan protestolar sonucunda tüccarlar siparişlerini iptal etti, liman işçileri Avusturya mallarını indirmedi. Sokaklarda Avusturya fesleri parçalanırken, kalpak popüler hale geldi. Gazeteler, bu hareketi “iktisadi savaş” olarak tanımlarken, Osmanlı’da ‘milli iktisat’ kavramı da yaygınlaştı. Avusturya boykotu protesto etti ancak İttihat ve Terakki geri adım atmadı. Beş ay süren boykot hem Osmanlı hem de Avusturyalı tüccarları zarara uğrattı. Sonunda Avusturya ve Bulgaristan cüzi bir tazminat ödemeyi kabul etti ve boykot sona erdi. (Doğan Çetinkaya, 1908 Osmanlı Boykotu: Bir Toplumsal Hareketin Analizi, İletişim Yayınları, 2004)” Hafta sonu “1908 Osmanlı Boykotu”nu, “Boykotaj Sendikası”nı ve İttihat Terakki’nin temellerini attığı “Milli İktisat/ulus devlet” değerlendirmelerini okurken Ankara merkezli Toplum Çalışmaları Enstitüsü’nden Siyasi Direktör Hüseyin Raşit Yılmaz’ın bana ilettiği bir çalışmayı analiz etmeye çalıştım. Raporun başlığı: Boykot Etki Analiz. Birinci bölümde Google Maps’in sağladığı “yoğunluk saatleri” verileri kullanılarak İstanbul ve Ankara’daki seçili AVM’lerin yoğunluk düzeyleri incelenmiş. Örneğin… İstanbul’da, AKP’nin toplumsal tabanının güçlü olduğu ilçelerdeki AVM’lerde, boykotun gerçekleştiği 2 Nisan 2025 tarihinden bir gün sonra 3 Nisan tarihinde gözlemlenen yoğunluk değişimlerine bakalım. Veriler, bu ilçelerdeki AVM’lerde boykotun ertesi günü yoğunluğun hafif bir artış gösterdiğini ortaya koymakta. Güngören’deki Kale Outlet Center’da ortalama yoğunluk 3.66, Başakşehir’deki Mall of İstanbul’da 3.88, Esenyurt’taki Marmara Park’ta ise 3.22 puan artmış. Örneğin… CHP’nin toplumsal tabanının daha güçlü olduğu ilçelerdeki AVM’lerdeki değişimlerse AKP’nin güçlü olduğu yerlerden daha farklı. Buna göre, boykot günü olan 2 Nisan’a kıyasla, 3 Nisan’da AVM’lerdeki yoğunlukta çok daha yüksek oranlı artışlar meydana gelmiş. Şişli’deki City’s Nişantaşı AVM’de yoğunluk 29, Sarıyer’deki İstinye Park’ta 14.55, Beşiktaş’taki Akmerkez’de ise 13.77 puan artmış. Bu yüksek oranlar, muhalefet seçmeninin boykot çağrısına çok daha güçlü bir şekilde karşılık verdiğini ve bu eylem etrafında daha yoğun bir şekilde birleştiğini göstermekte. Raporun ikinci bölümündeyse boykotun ertesi günü olan 3 Nisan 2025 tarihinde Ankara’da 384 esnaf ve işletme çalışanı ile gerçekleştirilen yüz yüze anketlerin sonuçları analiz edilmiş Esnaf tespitinde de, AVM’lerde olduğu gibi, iktidar- muhalefet seçmen yoğunluğu dikkate alınmış. Ankete katılan işletmelere veya çalışanlarına “Boykot eylemini doğru buluyor musunuz?” sorusu yöneltilmiş. Boykotu doğru bulmayanların oranı, yüzde 43.3 seviyesinde. Ankete katılanların yüzde 9.7’si boykotu haklı bulmasa da siyasi bir çaresizlik sonucu ortaya çıktığını kabul etmekte. Boykotu doğru bulan esnafla (yüzde 47), boykota karşı olsa da bir seçeneksizlik nedeniyle ortaya çıktığını belirten esnafın toplamı yüzde 56.7. Son olarak, ankete katılanlara “Boykot demokratik bir eylemdir ve insanların tepkilerini dile getirebilmek için boykot etme hakkı vardır” şeklinde bir ifade okunmuş ve “1” hiç katılmıyorum, “10” tamamen katılıyorum olacak şekilde puanlamaları istenmiş. Yüzde 16.5’u “hiç katılmadığını”, yüzde 42.1’i de “tamamen katılıyorum” yanıtını vermiş. Yani; söz konusu ifadeye tamamen katılan esnafın oranı yüksek kabul edilebilecek seviyede. SONUÇ: CHP tarafından 2 Nisan 2025 tarihinde uygulanmak üzere ilan edilen genel boykot toplumun nasıl kutuplaştığını bizlere gösteriyor. Muhalefetin güçlü olduğu yerlerde eyleme destek var, iktidarın güçlü olduğu yerlerdeyse destek az. Ve görülen şu: CHP’nin Pazar günü gerçekleştirdiği olağanüstü kurultayının ardından bu kutuplaşma daha da artacak.",https://www.nefes.com.tr/yazarlar/aytunc-erkin/akpnin-oy-depolarinda-destek-az-chpnin-oy-depolarinda-destek-cok-26695
Aytunç Erkin,İmamoğlu’nu aşan “kim bu gençler?”,01 Nisan 2025 05:00,"Protestocuları eylemlere katılmaya motive eden en önemli iki unsur sorulduğunda ‘gelecek kaygısı’ yüzde 60.6 ile en çok tercih edilen seçenek olmuştur. Bunu yüzde 52.9 ile ‘hükümetin anti-demokratik uygulamaları’ seçeneği takip etmiştir. Yüzde 31.7 ile ‘mevcut siyasi sistemin taleplerime cevap vermemesi’ en çok tercih edilen üçüncü seçenek olmuştur. İBB başkanı Ekrem İmamoğlu’nun tutuklanmasıyla başlayan protestolarda ‘Ekrem İmamoğlu’nun şahsında muhalefete yönelik tutum’ seçeneğini katılımcıların yalnızca yüzde 11.1’i işaretlemiştir.” Toplum Çalışmaları Enstitüsü’nün Ankara merkezli “Kim Bu Gençler” başlıklı raporu üç-dört gündür tartışılıyor. Yazımın girişine raporun çarpıcı tespitiyle başladım. Neden “çarpıcı tespit” dedim? Çünkü; protestolarda Ekrem İmamoğlu’nun şahsında muhalefete yönelik tutumun yüzde 11.1, gelecek kaygısınınsa yüzde 60.6 çıkması! Kısa bir notla raporun analizine başlayalım: “Rapora dayanak oluşturan veriler, 24-25-26 Mart 2025 tarihlerinde 19.00-23.00 saatleri arasında Ankara’nın Kızılay meydanında toplanan ve 19 Mart 2025’te Ekrem İmamoğlu’nun gözaltına alınmasıyla başlayan protestolara katılan 208 eylemciyle, eylemler sırasında, yüz yüze görüşerek oluşturulmuş.” Bu noktada geçen pazar günü yayımlanan yazımda bahsettiğim, İmamoğlu’nun CHP’li Hurşit Güneş’in Silivri ziyaretinde kurduğu şu cümleleri hatırlatayım: “Planımızı yaptık. Mesele cumhurbaşkanlığı değil. Haksızlığa karşı kamuoyu oluşturmak gerekiyordu. Ben liderlik edecektim topluma, şimdi millet bana liderlik yapar hale geldi. Ben arkasında kaldım.” Evet; “millet bana liderlik yapar hale geldi” cümlesinin “gelecek kaygısıyla” birleştiğini söyleyelim. Gençlerin “ekonomi mi adalet mi?” sorusuna verdikleri yanıt son dönemde yapılan anketlerden farklı bir sonuca ulaşmış: “Ankette Türkiye’nin çözülmesi gereken sorunlarını protestocuların nasıl öncelediği de ölçülmüştür. Bu çerçevede protestoculara, ‘Türkiye’nin çözülmesi gereken en önemli sorunu nedir?’ diye sorulduğunda yüzde 54.3’ü adalet seçeneğini işaretlemiştir. Ekonomiyi en önemli sorun olarak görenlerin oranı yüzde 13.9’da kalmıştır. Bu sonuçlar karşılaştırmalı olarak incelendiğinde anlam kazanmaktadır, zira Toplum Çalışmaları Enstitüsü’nün çalışmalarında ekonomi yüzde 54.1 ile en önemli sorun olarak belirirken adalet yüzde 14.2 ile üçüncü sırada yer almaktadır. Dolayısıyla Türkiye’nin sorunlarına yönelik protestocuların ülkenin geneliyle ayrışan bir konumda olduğu gözlenmiştir. Protestocular için adalet sorunu ekonomik sorunun çok önünde görünmektedir.” Raporun “gelecek kaygısı”nı güçlendiren sonuçları da siyasetin anlaması gereken sonuçlar. Örneğin; şu anki ekonomik durumunuzu ne kadar tatmin edici buluyorsunuz diye sorulduğunda protestocuların yüzde 31.7’si “1” seçeneğini işaretlemiş, yani hiç tatmin edici bulmadığını belirtmiş. Örneklemin ortalaması 10 üzerinden 2,77 olarak ölçülmüş. Örneğin; ‘Türkiye’nin mevcut iktidarla yakın gelecekte ekonomik olarak nasıl bir gelişme göstereceğini düşünüyorsunuz?’ diye sorulduğunda katılımcıların yüzde 63.5’i “1” yani “çok daha kötü olacak” seçeneğini işaretlemiştir. Bu soruda da örneklemin ortalaması 10 üzerinden 1.79 olarak ölçülmüş. Örneğin; protestocuların yüzde 37.2’si “Türkiye’nin yönetimi bu şekilde devam ettiği sürece ben ne yaparsam yapayım bu ülkede iyi bir geleceğim olmayacak” ifadesine tamamen (10/10) katılmaktadır. Bu ifadeye katılım 10 üzerinden 6.88 olarak ölçülmüş. Ankara ve Saraçhane eylemlerinde hakim olan “Mustafa Kemal Atatürk”, “Türk Bayrağı” ve milliyetçi pankart/sloganlardı. Gelelim raporun bana göre önümüzdeki dönemde tartışılması gereken sonuçlarına. “Protestocuların ideolojik olarak kendilerini nasıl tanımladıklarını ve oy verme davranışlarını anlamak için de çeşitli sorular sorulmuştur. Buna göre protestocuların yüzde 55.6’sı kendisini Atatürkçü olarak tanımlamaktadır. Bunu sırasıyla Milliyetçi (yüzde 16.9), Sosyalist (yüzde 10.1) ve Sosyal Demokrat (yüzde 9.7) seçenekleri takip etmektedir. Yani protestocuların yüzde 72.5’i kendisini Atatürkçü yahut Türk milliyetçisi olarak tarif etmektedir. Bu yüksek oran kalabalıklarda çokça rastlanan milli ve milliyetçi sembollerin zeminini de açıklar niteliktedir.” Buradan çıkan sonuç ve eylemlerden anladığımız, “Atatürk’ün yeniden keşfedildiği” değil mi? Aslında durum şu: Fransız İhtilali ve sonrasında kurulan ‘ulus-devletler’ üzerinden ‘milliyetçilik’, bugün halkçılık ile birleşmiştir ve emperyalizmden kopuş anlamına gelmektedir! 1640 İngiliz ve 1789 Fransız burjuva demokratik devrimleri, feodaliteye son verdi ve milli pazarı oluşturdu. Emperyalizm döneminde milli devrimler, mazlumların emperyalizme verdiği ders üzerine kuruldu. Türk Devrimi de bu yüzden milliyetçi-halkçı-devletçi sac ayakları üzerinde başarıya ulaştı. Yazımın sonunda “Devrimci Türkçülük” fikrinin ideoloğu Yusuf Akçura’ya uzanalım: “… Banka, Reji, Düyûn-u Umumiye Avrupa kapitalinin Türkiye istiklal-i iktisadiyesini asmak için hazırladığı altından bir sehpadır. (19 Haziran 1921…)” SONUÇ: Önümüzdeki dönem; “ulus-devlet” diyenlerle küreselcilik arasında bir tercih yapılacak.",https://www.nefes.com.tr/yazarlar/aytunc-erkin/imamoglunu-asan-kim-bu-gencler-25256
Aytunç Erkin,Lider ben olacaktım şimdi toplum bana liderlik yapıyor,30 Mart 2025 05:00,"Olağanüstü dönemlerde, baskıdan-sansürden kaçabilmek için kitaplar, tüm tehlikeler göze alınarak gizlice yazılıp, gizlice basılıp, gizlice dağıtılır. Ruslar bu tür kitaplara ‘Samizdat’ adını koydu ve bu isim evrensel hale geldi…” Yani… Kişisel basım (Samizdat)… Soner Yalçın, Silivri Cezaevi’nde bu kitabı kaleme aldı ve o dönemi anlatan en iyi tanıklıklardan biriydi. Tam Maltepe mitingini ve Silivri’yi yazacaktım ki AKP’li eski vekil Mehmet Metiner’in sosyal medya paylaşımı önüme düştü: “Gezi sürecinde hiç kimse çıkıp konuşmadı. 17/25 Aralık’ta hiç kimse çıkıp konuşmadı. Uzunca bir süre hem de. Ekranlara çıkıp konuşan birkaç kişinin dışında herkes derin bir suskunluğa gömüldü. FETÖ ile mücadele sürecinde Reis kendisine alenen destek veren bir kaç kişinin dışında yalnızdı. Reis sadece yalnız bırakılmadı, içeriden de vuruldu. Kendi içimizdeki muhalefet daha kıyıcıydı. 15 Temmuz’da onlar meydanlarda yoktu. 16 Temmuz’un mücahitleri olarak zuhur ettiler. Ama onlar hep bir yolunu bulup itibarlı katlarda oldular. Şimdi de birkaç kişinin dışında çıkıp konuşan, tepki veren yok. Derin bir sessizlik çölündeyiz. En itibarlı katlarda olanlardan çoklarının bir tek paylaşımı bile yok. Tebrik ediyorum kendilerini. Pek bir akıllılar, vesselam!” Metiner’in dediği gibi, İmamoğlu operasyonu başladığı günden bu yana derin bir sessizlik var AKP cenahında. Neden? 2002’de “özgürlük” adına yola çıkan partinin “kodlarını” kaybettiği için olabilir mi? Ya da “derin yoksulluk” ya da “adaletsizlik”. Bildiğimiz; AKP içinde bu operasyonlara karşı olan ve sessiz kalmaktan başka seçeneği olmayan bir “kadro” var. Bildiğimiz; İstanbul Büyükşehir’e kayyum atanmasına itiraz eden bir “kadro” var ve o “kadro” Erdoğan’ı “kayyum atanmaması” için ikna etti. Peki bu durum nereye kadar gidecek? Diğer taraftan operasyonun “yarım kaldığını” düşünenlerin de olduğunu söyleyelim. O zaman “Samizdat” gibi herkes kişisel basımını, kişisel tanıklığını anlata anlata bir yol bulunacak diyelim ve Silivri’ye geçelim. Ekrem İmamoğlu geçen Pazar gününden bu yana Silivri Cezaevi’nde. Her gün onlarca kişi İmamoğlu’nu ziyaret ediyor. Ziyaretçilerden birisi de CHP’nin ağır isimlerinden eski milletvekili Hurşit Güneş’ti. Güneş’i aradım ve ne gördüğünü sordum. “Çok kalabalıktı erken gitmeme rağmen. Ekrem Bey’le uzun konuşamadım. ‘Herkes geldi Hurşit Güneş gelmedi dememen için geldim. Bir ay sonra gelirim daha uzun konuşuruz’ diye söze başladım. Necati Özkan’la, Emrah Şahan’la, Mahir Polat’la, Murat Çalık’la konuştum. Rahatlardı. Necati Özkan bana ‘Ağustos’tan bu yana hazırlanıyorduk bu duruma’ dedi. Aynı cümleyi Ekrem Bey de kurdu: ‘Planımızı yaptık. Mesele cumhurbaşkanlığı değil. Haksızlığa karşı kamuoyu oluşturmak gerekiyordu. Ben liderlik edecektim topluma şimdi millet bana liderlik yapar hale geldi. Ben arkasında kaldım’ diye konuştu. “Görüşebildiğim herkese, metin olun, dışarıda yapılacak mücadele sizin ruhsal durumunuzla da ilgili. Sizin sağlıklı olmanız kitleyi de etkiler dedim. Ama şunu unutmamak gerekiyor: Siyaset yapmak gerekiyor. Sadece mitinglerle gitmez. Bu bir maraton. Altı ay sonra seçim yok. “Saraçhane’deki topluluk Gezi gibi değil. Gezi olayları olduğunda ‘iktidara geliyoruz’ diye umutlandık ama olmadı. Türkiye’nin yüzde 80’i aydın, ilerici, üniversiteli gençlerden oluşmuyor. Bu sosyolojiden çok büyük bir siyasal sonuca atlamayalım. Tabii ki önemli. Türkiye’nin aydın gençlerinin kaygılı olduğunu gösteriyor. Özgürlük ve gelecek kaygıları olduğunu gösteriyor ve meselenin de sadece İmamoğlu olmadığını söylüyorlar. İmamoğlu bir sembol ve birikimin sonucu. Teğmenlerden başladı bu durum, Ümit Özdağ’ın hapishaneye atılması, TÜSİAD gözaltıları, diploma vs… Bardak taştı ve gençlik Saraçhane’de buluştu. Önemli. “Sürekli mitinglerle iktidar değişir mi? Çünkü; seçimlere üç yıl var. Başkanlık sistemi var ve güçlü bir liderlik var. Mitinglerden vazgeçilmemeli tabii ki. Meclis siyasetini kapatmamak gerekiyor, sadece protesto siyasetiyle olmaz bu. “Onlara söyledim. Evet bu davaların hepsi siyasi ama hukuki boyutunu unutmamalı. Hukuk mücadelesi de yapılmalı. Mesela Mahir Polat, Emrah Şahan diyor ki, ‘Her bir sorularına cevap verdim’. Dosyaları ne kadar biliyorsunuz diye sordular. 560 milyar liradan bahsediliyor. 20 milyar dolar yapar. Afaki rakamlar. Dosyanın içeriğine bakıyorsunuz, yüz lira para yollamış. Olmaz. Metro ihaleleri neden yok? İstanbul belediyesi metro ihaleleri yaptı ama dosyada yok. Aklımızla alay etmesinler. Siyasi dava ama hukuki savunma da yapılmalı.”",https://www.nefes.com.tr/yazarlar/aytunc-erkin/lider-ben-olacaktim-simdi-toplum-bana-liderlik-yapiyor-24873
