Yazar,Başlık,Tarih,Metin,URL
Nuray Babacan,AKP’de kadrolar sil baştan,12 Şubat 2025 06:00,"AKP’nin yönlendirmesiyle gözlerin CHP’ye çevirdiği şu günlerde, iktidar partisinde çok şey oluyor. 12 gün sonra yapılacak büyük kongrede, kimlerin gideceği kimlerin kalacağı sancılı bir süreç. Ekipler ve gruplar, AKP tarihinin en kritik seçimlerinde söz sahibi olmak için kapalı kapılar ardında ciddi mücadele veriyor. Doğal olarak AKP kulislerinde ‘kimler gidecek, kimler kalacak’ lotosu oynanıyor. Genel merkez yönetiminin yarısından fazlasının değişeceği hesabı yapılıyor. AKP’nin karar vericileri, siyasetin rotasında pek etkileri olmasa da kişisel ikballeri için bir yerlerde olmaya çalışıyorlar. SÜRPRİZ İSİMLER Kongre yaklaşırken, ilginç isimler yeniden ortaya çıkarak, pozisyon almaya başladı. Bunlardan biri eski İçişleri Bakanı Süleyman Soylu. Soylu’nun işlevsiz komisyon başkanlığı görevinden sıkıldığı, partide veya MKYK’da görev almak istediği öne sürülüyor. Soylu’nun bir süre önce ‘siyaseti bırakacağım’ sözlerinin ‘beni değerlendirin’ mesajı olarak okuyanlar var. Erdoğan’ın kendisine MKYK’da bir görev vererek, ‘kontrol edebileceği’ bir mesafede tutmayı tercih edeceği iddialar arasında. Başka bir sürpriz isim, Mehmet Özhaseki. Çevre ve Şehircilik bakanıyken, birtakım çatışmalar ve başarısızlık iddiasıyla görevden alınan Özhaseki’nin parti yönetimine girmek için kulis yaptığı başka bir iddia. Bir küs-bir barışık damat Berat Albayrak’ın ekibi de kendisinin bazen parti yönetimi, bazen de yeni kabinede görev alması için iktidara yakın mecralarda haber yaptırıp, ismini güncel tutmaya çalışıyor. KULİSLER HIZLANDI Partinin mevcut yönetimi de kendini kurtarma derdinde. Görevde kalmasına kesin gözüyle bakılan isimler arasında Efkan Ala ve Ömer Çelik bulunuyor. Fatih Şahin’in görev yerinin değiştirileceği öne sürülüyor. Mustafa Elitaş, Hayatı Yazıcı ve Erkan Kandemir’in görevlerinde kalacağını iddia edenler kadar, gideceğini savunanlar da var. Yerel Yönetimler Başkanı Yusuf Ziya Yılmaz, Seçim İşleri Başkanı Ali İhsan Yavuz, Tanıtım ve Medya İşleri Başkanı Hamza Dağ, Sosyal Politikalar Başkanı Fatma Betül Sayan Kaya, Halkla İlişkiler Başkanı Belgin Uygur, Çevre ve Şehircilik Başkanı Çiğdem Karaaslan’ın değişebileceği anlatılıyor. Özellikle, Fatma Betül Sayan Kaya ve Çiğdem Karaaslan’ın hiçbir politika üretmemelerine rağmen her dönem görev alması çok eleştiriliyor. Onlar için ‘çakılı kadro’ benzetmesi yapılıyor. KONFERANS GİBİ TOPLANTI Bu arada partide hemen herkesin itiraz ettiği tek konu, sayıları 110 kişiye ulaşan MKYK yapısı. AKP’nin kuruluşunda 50 kişiden oluşan ve partinin ürettiği her siyasette söz sahibi olan kadrolar artık yok. Daha önceki kongrelerde bu sayı arttırılınca, artık kimse konuşmaz, siyaset üretmez oldu. “İl başkanları toplantısı gibi MKYK toplantısı yapıyoruz. Cumhurbaşkanı açılış yapıyor. Bazen bakanlara bazen genel merkez yöneticileri söz alıyor, sonra da dağılıyoruz. Ne politika üretiliyor ne de tartışılıyor…” yakınmalarını duymadığımız gün yok. MKYK sayısını yeniden 50’ye çekmek için tüzük değişikliği önerileri zaman zaman gündeme geldi ama Erdoğan’dan vize almadı. Bu kongre öncesinde de bunun denendiğini biliyoruz, ama herkes umutsuz. ÜÇ ALANDA DEĞİŞİM Bu kongrede oluşacak kadrolar, partinin haziran ayında yapılacak Meclis Grubu seçimleriyle ilgili de fikir verecek. Haziranda grup yönetiminde de değişiklik bekleniyor. Meclis başkanlığı için yapılacak zorunlu seçimde Numan Kurtulmuş’un tekrar aday gösterilmesi bekleniyor. Görüldüğü gibi iktidar partisinde, şubat-haziran ayları arasında ‘genel merkez yönetimi, kabine, meclis yönetiminde’ değişiklikler yapılacak. Yeni isimler bize, partinin hataları görüp değişmeyi mi tercih ettiği, yoksa ‘reise biatın mı? esas alındığını gösterecek. Siyasi tabloya bakınca pek umutlu olmaya gerek yok.",https://www.nefes.com.tr/yazarlar/nuray-babacan/akpde-kadrolar-sil-bastan-14744
Nuray Babacan,Erdoğan’ın tipik taktiği!,19 Şubat 2025 06:00,"Siyaset stratejisi, son yılların en gözde sözcüğü. Askeri bir terim olan strateji, siyasi liderlerin amaca ulaşmak için uyguladığı yöntemlerin tümü olarak hizmet ediyor. Cumhurbaşkanı Tayyip Erdoğan’ın uyguladığı siyaset taktiklerine bakınca ilginç bir fotoğraf çıkıyor. Özellikle son yıllarda, doğru-yanlış, iyi-kötü ayrımı yapılmadığı ise en büyük eleştiri… Bu yazı, siyasilerle yapılan bir sohbetin ürünü. Son aylarda demokratik bakış açısından uzak kişileri bile şaşkına çeviren ‘muhalefet operasyonu’ kimilerine göre Erdoğan’ın siyasi hayatının başından beri uyguladığı taktikler zincirinin devamı. Örnekler şöyle; - Geçmişte, iktidar gücünü korumak ve rakipleri etkisiz hale getirmekle ilgili yapılan ilk operasyonlar geldi akıllara. Partinin dışında kalarak, yüzde 2-3 de olsa oy kaybına neden olabilecek Numan Kurtulmuş ve Süleyman Soylu’nun partinin içine alınmasını örnek gösterdiler. İçeri al, etkisiz hale getir. - Ali Babacan ve Ahmet Davutoğlu ikilisinin ayrı ayrı kurduğu partilerin güç odağı olmasının da bu yöntemle engellediği anlatılıyor. Zaman zaman bu gruplarda çıkan çatlak seslerin de AKP destekli olduğu biliniyor. Partilerin son durumu da ‘görünürde yok sayma, arkadan uğraşma’ taktiğinin tuttuğunu gösteriyor. Buna bir de parti içinde itiraz edenlerin sessiz tasfiyesini eklemek gerekir. - Bu tür girişimlere, ‘tehdit oluşturma’ çizgisine gelmediği sürece müdahale edilmiyor. Bu anlatılanlar arasında en ağır bedel ödenen işbirliği, FETÖ’cüler. Devlet organizasyonunu yönetmek için FETÖ’den destek almak, onların illegal iş çevirme potansiyelinden yararlanmak. Örgüt büyüyüp tehdit oluşturana kadar süren bu ilişki, yine bir operasyona sonlandırıldı. - Gelelim, son genel seçimlerdeki Millet İttifakı operasyonuna. Seçimi kaybetme olasılığı göründüğü andan itibaren hayata geçirilen stratejinin, yapılanların en büyüğü olduğu aktarılıyor. İYİ Parti Genel Başkanı Meral Akşener’in ‘truva atı’ olarak kullanıldığı, Millet İttifakı’na her kafadan ses çıkan bir yapı görüntüsü verdiği anlatılıyor. Millet İttifakı’nı oluşturan kimi isimlerin hırsları da bu sürece hizmet etti. Bu yapının hızlı bir manevra ile Ekrem İmamoğlu veya Mansur Yavaş’ı aday göstermesi engellenirken, Kemal Kılıçdaroğlu’nun aday yapılmasının AKP içerisinde yarattığı mutluluk, operasyonun başarıyla sonuçlandığını gösterdi. GÜNDEM SAPTIRILDI Halen CHP içindeki tartışmaları büyütmek ve göstermek de bu stratejinin bir parçası. Burada da iktidar medyasının hizmeti devreye giriyor. AKP içinde yaşananlar, bakanlıklardaki sorunlar, Cumhurbaşkanlığı Saray’ındaki tartışmalar, kamu kurumlarındaki yönetim zafiyeti, ekonomideki kriz es geçilip, sadece CHP konuşuluyor. Tabi, strateji sadece iktidar partilerinin aracı değil. Muhalefetin de kendi stratejisini oluşturma kabiliyeti ve kendisine yönelik planları görme yeteneği olması gerekir. Özgür Özel’in genel başkan ağırlığını oluşturamama sorunu, İmamoğlu ve Yavaş’ın gizli yarışı, kaşımak için çok müsait. PANİK HAVASI Buradaki tek önemli sorun, stratejilerin hukuka, siyasi etik ve ahlaka uygun geliştirilip geliştirilmediği. Başvurulan yöntemler, bu açıdan herkesi açığa düşürüp, karşı tarafın adım atmasını zorlaştırıyor olabilir. Belki de amaç da tam budur. Panik havası yaratmak. Özellikle erken seçim planları yapıldığı bu süreçte, ‘başı kesik tavuk’ gibi sürdürülen bu operasyonları, iktidarın kaybetme korkusunun artması ve daha önce profesyonelce yönettiği stratejileri kontrolsüz uygulamaya koyduğu şeklinde yorumlayanlar da var. İktidar partisinde bu yaşananları tam anlamıyla analiz edecek kurmay bulmak zor. Herkes pazılın küçük parçası gibi yaşıyor. Özellikle kongre öncesinde ekip ve gruplar, kendileri için etki alanı yaratma çabasında. Listede kim var kim yok telaşındalar. Stratejik planlama yöntemi, siyasette aktif rol oynayanların elinde güçlü bir araç. Ancak bu yöntem “doğru” ve “yanlış” arasında ayrım yapmak zorunda. Maalesef siyaset bunu kaybedeli çok oldu…",https://www.nefes.com.tr/yazarlar/nuray-babacan/erdoganin-tipik-taktigi-16382
Nuray Babacan,İstanbul’a kayyum atamak!,07 Şubat 2025 06:00,"Yargının hızını alamayıp, üçüncü kez İstanbul Büyükşehir Belediye Başkanı Ekrem İmamoğlu hakkında iddianame hazırlaması, Ankara bir kez daha dalgalanmaya neden oldu. İktidarda, tüm bunların akıllı bir planın parçası olmadığını düşünenler olduğu gibi, bu sürecin, İstanbul’a kayyum atanmasıyla sonuçlanacağını iddia edenler de var. Gün geçtikçe, iktidar partisinde konuşulanlar, ‘daha karmaşık, daha öngörülemez, daha tuhaf’ olmaya başladı. AKP’lilerin büyük bölümü ‘sadece izleyici’ olsa da kafa yoranlar da ‘dağılmış’ gibi… ERDOĞAN’A GİDEN EKİP, ELİ BOŞ DÖNDÜ AKP’lilerin analizlerine geçmeden önce, buraya önemli bir not bırakalım. CHP’li belediyelere kayyum atanmasının başladığı günlerde, partinin önde gelenleri ve bazı bakanların cumhurbaşkanına gittiği, yaşananların iktidar açısından sıkıntı yaratacağı, aynı zamanda hukuki açıdan sorunlu olduğunu dile getirdikleri, ancak Tayyip Erdoğan’ın yaklaşımının değişmediği anlatılıyor. İstanbul Büyükşehir Belediye Başkanı Ekrem İmamoğlu ve avukatlarına haber verilmeden önce iktidar medyasına servis edilen son iddianameye bu çerçevede bakmak lazım. 7 yıla kadar hapis cezası ve siyaset yasağı talep eden iddianame, İmamoğlu hakkındaki üçüncü dosya oldu. AKP’DE ÜÇ FARKLI SENARYO İktidar partisinde bu yaşananlara bakış açısını 3 başlıkta toplamak mümkün. Bütün bunların muhalefetin işine yaradığını düşünenler, gelişmeleri Mansur Yavaş açısında yorumlayanlar, bir de bu planın CHP’nin içini karıştıracağı, bunun da kendilerine yarayacağına inananlar; 1- Demokratik süreçler açısından sıkıntılı olduğunu söyleyenler; “Bu olayda, bize yönelik art niyet var mı diye soruyor arkadaşlar. Her şeye rağmen yargının siyasallaşmaması gerekir. Olay, yargıyla İmamoğlu arasında kör döğüşüne dönüştü. Ayrıca dava süreci öyle kolay ilerlemez. İstinaf ve yargıtay süreçlerinin tamamlanması zaman alır, erken seçim kararı da tüm bunları askıya alır. İmamoğlu’nu engellesen bile ne değişir ki; karşı tarafı kenetlersin, bir başkası daha güçlü gelir…” 2- Muhalefetin adayının Mansur Yavaş olması için uğraşılıyor diyenler, ‘Yavaş Kürtlerden oy alamaz, seçim kampanyasında da dağılır’ tezini savunuyor. Ancak, ‘Yavaş, rahatsız muhafazakarları oyunu daha kolay alır bizim için daha büyük risk. CHP’ye oy veren Kürt seçmen ideolojik olarak bizi zaten tercih etmez, yanlış hesap yapılıyor’ diyen de az değil... 3- Bir grup ise çok keskin. “Bundan sonra hiçbir şey sürpriz olmaz. Bu iş, İstanbul’a kayyum atamasına kadar gider” diyenler var. İmamoğlu’nun siyaseten önünü kesmenin, geçmişte Tayyip Erdoğan’a yapılanlar gibi sonuç doğurmayacağını, İmamoğlu’nun siyaset dışı kalmasının karşı cepheyi böleceğine inanıyorlar. CHP’de ortaya çıkacak çatlaktan yararlanmak isteyen Kemal Kılıçdaroğlu ekibinin yeniden ortaya çıkacağını, hatta Özgür Özel’in bile adaylık için potaya gireceğini, bu bölünmüşlüğün AKP’nin işine yarayacağını savunanların beklentisi net. Tıpkı, son seçimlerde Millet İttifakı’nda son dakika yaşananlar gibi parçalı yapıdan medet ummak. İktidar cephesinde durum bu. Yüzde 40 yüzde 40 ayrışmış seçmen tabanında, 10 puan için yapılan bu mücadeleyi yorumlayanlar hiçbir şeyden tam emin değil. Kendileri dışında yapılan senaryolar ve karışık duygularla yol alıyorlar!",https://www.nefes.com.tr/yazarlar/nuray-babacan/istanbula-kayyum-atamak-13649
Nuray Babacan,Suriye'den YGP adımı: Erdoğan’ın beklediği telefon,02 Şubat 2025 05:45,"Hükümetin önemle izlediği iki başlık, ABD’nin yeni hükümetinin tutumuyla yakından ilgili. Suriye’nin geçici hükümetinin YPG ile yaptığı görüşmelerin sonucu, açılım sürecinin geleceğini belirleyeceği gibi, Cumhurbaşkanı Tayyip Erdoğan’ın önümüzdeki hafta yapması beklenen Donald Trump görüşmesi de her ikisini birden etkileyecek. İLK RESMİ GÖRÜŞME Kamuoyunun bildiği gibi, Cumhurbaşkanı Tayyip Erdoğan seçilmesinin hemen ardından 7 Aralık tarihinde Trump’la bir telefon görüşmesi gerçekleştirmişti. Tebrik amaçlı bu görüşme ‘atılacak adımlara’ ilişkin sonuç içermezken, Ankara, önemli başlıkların görüşüleceği ikinci telefon görüşmesine kitlendi. Sorunların genel başlıklarının ele alınması beklenen bu resmi görüşmenin ilk adımları, geçtiğimiz günlerde iki ülkenin dışişleri bakanlarının yaptığı temasta atıldı. Ardından istihbarat başkanlarının telefon görüşmesi gerçekleşti. Şimdi sırada liderlerin görüşmesi var ki; ekonomiden savunmaya birçok başlığı içerecek. En önemlisi de Suriye olacak. Ankara yönetimi, Suriye konusunda ABD’nin yeni yönetiminden ılımlı tutum bekliyor. Örneğin, Trump yönetiminin dış yardımlara sınırlama getirmesinin YPG bölgesinde çok tedirginlik yarattığı ifade ediliyor. Bu yapının ABD’nin desteği ile ayakla kaldığını savunan istihbarat kurmayları, ‘Amerika artık maaşlarını gönderemeyecek. Etkileri yakında görülür’ yorumu yapıyorlar. AKP iktidarı, Suriye’nin yeni yönetiminin aldığı kararları ve attığı adımları da yakından izliyor. Geçici hükümetin, başlangıçtaki çizgisini koruduğu, küçük yol kazalarına rağmen genel olarak ülkenin bütününü tahkim etme konusunda istikrarlı gittiğini düşünüyor. YPG NEYİ BEKLİYOR? Türkiye’nin yakından izlediği en önemli başlık, doğal olarak YPG bölgesi. YPG yönetiminin Suriye’nin yeni hükümetiyle yaptığı görüşmelerde, kısmen belli bir noktaya gelindiği aktarılıyor. YPG’nin örgütün yanıtını beklediği gelen önemli bilgiler arasında. PKK yönetiminin istenilen taleplere vereceği yanıtın, terör örgütü elebaşı Abdullah Öcalan’ın önümüzdeki günlerde açıklaması beklenen ‘mektubuyla’ yakından ilgili olduğu biliniyor. Dolayısıyla, konuların birbiriyle olan bağı da çok açık görülebiliyor. Aktarılanlara göre, bu sürecin tamamlanması için YPG’ye bir süre verildi. Bu süre sona erdiğinde, bölgedeki tüm silahlı güçler merkezi hükümetin ordusuna devredilecek. Bu yapının içinde PKK’lılar olmayacak ve Suriye dışı tüm güçler ülkeyi terk edecek. Bu konuda gerekli adımlar atılmazsa, merkezi hükümetten B planını devreye sokarak, buradaki silahlı güçlerle mücadele etmesi beklenecek. İDLİB MODELİ Ankara, Suriye’nin geçici hükümetinin ülke genelinde etkinliğini sağlamasının ardından ‘İdlib modeli’ bir yönetim anlayışını sürdürmesini bekliyor. Son 7 yıl içerisinde İdlib bölgesinde sağlanan ‘yaşam alanının’ Esad rejimi ortadan kalktıktan sonra bölgeye gelenleri şaşırttığı anlatılıyor. 2018 yılının başında “teknokratik” anlayışla kurulan yönetimin, başta insani yardımların organize edilmesi olmak üzere sıkıntılı birçok konuyu yönetmeyi başardığı, idare alanda deneyim kazandığı anlatılıyor. Bölgede 5 milyon yerinden edilmiş insanının barındırıldığı, uluslararası ve yerel insani yardımların ihtiyaç sahiplerine ulaştırıldığı, zaman içerisinde de sosyal hayatın canlandırıldığı dile getiriliyor. İdlib’in idari yapısının 5 bölgeye ayrıldığı, kısa süre sonra bölgesel mahkemeler ve bölgesel eğitim kurumlarının açıldığı, 8 bin kamu çalışanının görevini yürüttüğü, hastanelerin ve devlet kurumlarının hizmetini sürdürdüğü aktarılıyor. Bu bölgede kazanılan tecrübenin, ülke genelinde sonuç alınması için iyi bir model olduğunu savunan AKP kurmayları, Suriye’nin yeniden yapılanması sürecine desteklerinin süreceğini de anlatıyorlar. Beklentiler ise çok net, YPG bölgesine ilişkin açıkça ifade edilen şartların yerine getirilmesi ve PKK varlığının sonlandırılması….",https://www.nefes.com.tr/yazarlar/nuray-babacan/suriyeden-ygp-adimi-erdoganin-bekledigi-telefon-12453
Nuray Babacan,Saray’da neler oluyor?,17 Ocak 2025 05:45,"Altı yıl sonra Cumhurbaşkanlığı Genel Sekreterliği’ne geri dönülmesi, AKP’deki ‘üçlü yapı’ tartışmalarını güncelledi. Saray, genel merkez ve parti grubu arasında ‘karar vericinin kim olduğu’ konusundaki çekişmeyi bilmeyen yok. Şimdi, kulislerde bu yeniden yapılanmanın devamı konuşuluyor. Direkt, şikayet konularıyla girelim. Biri yasama ile ilgili. Cumhurbaşkanlığındaki 9 Kurul, TBMM’ye gönderilecek taslak metinler üzerinde ayrı bir çalışma yapıyordu. İlgili bakanı çağırıp, metin baştan yazılıyordu. Bu çalışma daha sonra parti grubuna gönderiliyordu. Bu kez de Grup başkanvekillerinden birinin başkanlığında ikinci bir çalışma yapılıyor. Ciddi bir zaman kaybı ve bürokrasi yarattığı gerçeğini bir tarafa bırakırsanız, sorun burada başladı. Doğal olarak siyasi sorumluluğu olan milletvekili ekibi, Saray ekibinin müdahale ettiği metni değiştirebiliyordu. Cumhurbaşkanlığı kurul üyelerinin, ‘Bizim hazırladığımız metinleri değiştiriyorlar, bu doğru değil” diye itiraz ettikleri ortaya çıktı. Aylarca devam eden bu durum, sistemdeki ilk çatlak oldu. Grup ve genel merkez yönetimi, atanan bürokratların yeni bir ‘ara mekanizma’ yaratarak, kendilerine iş buyurmalarından hoşlanmadı. Yaşanan diğer sorun ise siyasi. Saray’da 40 başdanışman, bir o kadar danışman ve 9 kurulla oluşturulan bu ‘bürokratik yapı’ yeni bir güç merkezi haline geldi. AKP milletvekilleri, “Seçim bölgelerimizde veya Ankara’da bize sorunlarını ileten seçmen için ilgili kurumlarda devreye giriyoruz. Sonra fark ettik ki; ‘milletvekilleri iş yapamıyor, Saray’dan danışmanlara ulaşalım. Onların sözü daha çok geçiyor’ şeklinde bir arayış başlamış…” gibi ilginç hikayeler anlatmaya başladılar. Kendilerini, atanan bürokratlardan daha güçsüz hisseden milletvekillerinin şikayetleri giderek arttı. Bu tartışmalar sürerken, Resmi Gazete’de yayınlanan ve yeniden genel sekreter yapılanmasına dönülme kararı, kimi AKP’liler tarafından değişimin başlangıcı olarak yorumlandı. Kararname ile ‘Cumhurbaşkanlığı İdari İşler Başkanlığı’ yerine ‘Cumhurbaşkanlığı Genel Sekreterliği’ getirildi. İdari İşler Başkanı, Türkiye Cumhuriyeti’nin ‘en yüksek devlet memuru’ sıfatını taşıyor. İlk başkan şu an Anayasa Mahkemesi (AYM) üyesi olan Metin Kıratlı’ydı. Mevcut ‘Cumhurbaşkanlığı İdari İşler Başkanı’ ise Kıratlı’nın yerine getirilen Hakkı Suzmaz. Hakkı Suzmaz tüm görev ve sorumluluklarıyla birlikte Cumhurbaşkanlığı Genel Sekreteri görevini üstlendi. İktidar kulislerine göre bu gelişme, Cumhurbaşkanlığı Saray’ında oluşan kadrolar ve çok başlı görüntünün ortadan kaldırılmasının ilk adımı. Yapısal değişikliğin, Saray’ın içinden gerçekleşeceğini, gereksiz ara mekanizmaların ortadan kaldırılacağı, siyasete müdahalenin azalacağı iddia ediliyor. Bu süreçte, parti yönetimiyle zaman zaman çatışma yaşayan Saray’daki 9 kurulun kaldırılacağı iddiaları ‘şimdilik’ mümkün görünmüyor. Ancak, bu kurulların yasama üzerindeki baskısının azaldığı,, Hukuk Kurulu Başkanı Mehmet Uçum’un kişisel çıkışları dışında, bu yapıların eskisi gibi aktif olmadığı aktarılıyor. Geçen sene, 9 kurula ilave olarak üç yeni kurul oluşturulmasıyla ilgili çalışmalar yapıldığı, AKP yönetiminin buna karşı çıktığı ve Cumhurbaşkanı Tayyip Erdoğan’ın da buna izin vermediği anlatılanlar arasında. Bir örnek daha, AKP Genel Merkezi’nde sessiz ve sedasız şekilde yeni anayasa çalışmaları yapılıyor. Genel Başkan Yardımcısı Hayati Yazıcı’nın kurduğu bir ekip, tüm eski taslakları göz önünde bulundurarak, yeni bir anayasanın ‘alt yapısını’ oluşturuyor. Saray ekibinin, çalışmanın dışında kalmaktan rahatsız olduğu da aktaralım. Bütün bunlar, zaman zaman gündeme gelen Cumhurbaşkanlığı Hükümet Sistemi’nin aksayan yönlerinin reforme edilmesine ilişkin önerilerin içini dolduruyor. Aksayan çok yön var. Bunların büyük bir kısmı anayasa değişikliği gerektiriyor. Ancak, yasa ve kararnamelerle yapılabileceklerle ilgili küçük adımlar atıldığı kesin. Bunun yetmeyeceği düşünülmüş ki; AKP Genel Merkezi’nde yapılan hem anayasa çalışmaları hem de strateji ekibi tarafından yapılan reform çalışmalarının içinde Cumhurbaşkanlığı Hükümet Sistemi’nin reformu var. Dolayısıyla, güç savaşının ilk raundunu AKP yönetimi kazanmış gibi…",https://www.nefes.com.tr/yazarlar/nuray-babacan/sarayda-neler-oluyor-8911
