Yazar,Başlık,Tarih,Metin,URL
Nuray Babacan,Suriye’de zor başlıklar,30 Aralık 2024 06:00,"Yeni yılda birbiriyle bağlantısı olan iç ve dış gelişmelerle çok haşır-neşir olacağız. Kürt sorunun çözümüyle, Suriye’deki gelişmeleri birbirinden bağımsız değerlendirmek mümkün değil. Hükümette, Suriye konusunda atılması gereken zor adımlara ilişkin değerlendirmeler sürüyor. HTŞ yönetimiyle temasların 7 yıl öncesine dayandığı, sürecin başarıyla tamamlanması için üç başlık olduğu anlatılıyor. “YPG bölgesi, demokratikleşme ve ekonomi” Konunun ayrıntılarına girmeden önce “fetihçi” açıklamalarda bulunan bazı partililerin kulakları çekildiğini, Suriye konusunda kimsenin açıklama yapmaması uyarısında bulunulduğunu aktaralım. Türkiye’nin Suriye geçici yönetimiyle kurduğu ilişkide henüz testi zorlayacak olumsuz bir gelişme yaşanmamış. Sürecin uzun ve zor olduğu kabul ediliyor. Ayrıca provokasyona çok açık olduğunun altı çiziliyor. *** Dışişleri’nin, Suriye dosyasındaki ana başlıklardan gidersek, birbirinden zor konular olduğunu da görürüz; - Suriye’nin yeniden ayağa kaldırılması için diplomatik girişimlerin başlatılması gerekiyor. Ancak, yeni yönetiminin yapısı ve siyasi bakışı net olarak görünmediği için ülkeler ince eleyip sık dokuyor. Türkiye buradaki en önemli muhatap. - Öncelikle yaptırımların kaldırılması, ardından uluslararası yardım kampanyası başlatılması ve uluslararası fonu kurulması gerektiği dile getiriliyor. Bu en zor başlıklardan birini oluşturuyor. - Şu anda Suriye’ye ekonomik destek sağlayan iki ülkenin olduğu belirtiliyor. Katar ve Sudi Arabistan. Batılı ülkelerin desteğini almanın zor olduğu görülüyor. Yeni yönetimin neye evrileceği ve demokratik refleksleri henüz bilinmiyor. Talibanvari bir yapıya dönüşme korkusu hakim. - İslam İşbirliği Teşkilatı’nın devreye sokulabileceği anlatılıyor. Ancak geçmişte birlikte hareket edemeyen bu yapıyla ilgili de şüpheler var. - Ülkede, enerji, sağlık, ulaşım ve eğitim alt yapısı konusunda ciddi sıkıntılar olduğu biliniyor. Suriye’nin yeniden yapılandırılması için ilk aşamada 200 milyar dolarlık bir kaynağa ihtiyaç olduğu hesaplanıyor. *** - Türkiye açısından en önemli konu YPG bölgesi. Türkiye’nin şartları çok net. PKK unsurlarının tamamen temizlenmesi. Suriyeli olmayanların sınır dışı edilmesi. YPG’nin silah bırakarak siyasi bir yapıya dönüşmesi ve merkezi hükümetle birlikte iş yapması… - YPG bölgesindeki kamplardaki 50 bin İŞİD’linin durumu ayrı bir sorun. Diğer ülkelerin kendi vatandaşı olan İŞİD militanlarını almasıyla ilgili çağrıya olumlu yanıt veren kimsenin olmadığı belirtiliyor. - Suriye’de çoğulcu bir anlayışta herkesin temsil edildiği demokratik bir devlet yapısının oluşturulması, bunun mekanizmalarının kurulması önemli. Bu konuda Türkiye’ye verilen sözler de açık. AKP kurmayları, “Bunlar babamızın oğlu değil, güvenilir olup olmadıklarını göreceğiz” diyorlar. - Şimdilik ABD yönetiminin Suriye konusunu Ankara üzerinden götürdüğü belirtiliyor. Ancak bu konuda Donald Trump hükümeti beklenecek. Tek bir ABD olmadığı, Siyonist anlayışın zaman zaman ön plana çıktığı iddia ediliyor. - ABD ile bu konuda kurulan ilişkilerde son derece ‘temkinli’ bir yaklaşım söz konusu. Trump’ın imalı sözleri aklı başında dış politika uzmanları tarafından farklı okunuyor. - ABD ile müzakerelerin ana konusunu, YPG bölgesi oluşturuyor. ABD’nin YPG konusundaki tavrında netlik bekleniyor. Bütünleşmiş bir Suriye için YPG’nin siyasi bir yapıya dönüşmesi ve silahlı güçlerin lağvedilmesi gerekiyor. Şu andaki görüşmelerdeki en büyük sıkıntıyı bu oluşturuyor. - Bu arada AKP iktidarının imaj oluşturmak için attığı bazı adımların, Suriye’nin gerçek sorunlarıyla ilgisi olmaması da dikkat çekici. Emevi Cami’nin halıları yenilenecek, İbn-i Arabi Cami’nin çevre düzenlemesi yapılacak gibi savaş yorgunu kadın ve çocukların sorunlarına çare olmayacak adımlar eleştiriliyor. Sembolik dini mesajlar yerine insani öncelikler ne güne duruyor…",https://www.nefes.com.tr/yazarlar/nuray-babacan/suriyede-zor-basliklar-5211
Nuray Babacan,Randevu alamayan bakan,15 Ocak 2025 05:45,"Siyaset, üç konu etrafında dönüyor. Çözüm süreci, iktidarın muhalefet belediyelerine el koyma operasyonu ve Suriye’deki gelişmeler. Ancak iktidar partisi mensuplarının sohbetlerinde farklı konular da var. Siyasetin renkli, ilginç, şaşırtıcı kulislerini buraya taşıyarak, bu kez farklı tarafa bakmak istedik. *** Yunus Emre Vakfı’ndaki büyük yolsuzluğu bilmeyen kalmadı. Genç gazeteci arkadaşlar çok iyi iş çıkardı. Bu konunun çarpıcı başka bir boyutundan söz etmek istiyorum. Aile ve Sosyal Hizmetler Bakanı Mahinur Özdemir Göktaş yurt dışından transfer edilince parti, eşini işe yerleştirdi! Yunus Emre Enstitüsü Başkan Yardımcılığı görevine getirilen Rahmi Göktaş, yolsuzluk iddiaları henüz kamuoyunda patlamadan önce görevden ayrılmak istiyor. Bakan Mahinur Özdemir Göktaş, konuyu anlatmak ve hem de eşinin itibarını kurtarmak için Cumhurbaşkanı Tayyip Erdoğan’dan randevu istiyor. Maalesef kadın bakan Erdoğan’la görüşemiyor. Bakan, haftalarca sonuç alamayınca ‘derdini’ partinin grup yöneticileriyle paylaşıyor ve bazı kadın milletvekillerinden aracı olmaları için yardım istiyor. Bu arada gizli tutulmaya çalışılan soruşturma kamuoyuna taşınıyor. Bakanın eşi istifa ederek, ‘benim bu işlerle ilgim yok’ mesajı vermeye çalışıyor. Kabinenin bir bakanının böylesine önemli bir konuda haftalarca Cumhurbaşkanının randevu alamaması kulislerde şaşkınlıkla anlatılıyor. *** AKP’nin büyük kongresi yaklaşmaya başlarken, yeni kabine ve değişecek isimlerle ilgili iddialar havada uçuşmaya başladı. Kulislerde dolaşan isimlerin çoğu, yine AKP’liler tarafından bir başkasına yer hazırlamak için ortaya atılıyor. Ancak, tam da bu süreçte partide yaptırılan anketlerin verdiği mesaj çok net. Suriye’deki gelişmelerden kısa süre önce parti yönetimi ‘öncelikle sorunların’ saptanması için bir araştırma yaptırıyor. Ekonomik kriz ve adalet duygusunun zedelenmesi yine ilk sırada çıkıyor. Özellikle yereldeki AKP’li yöneticilerinin, vali, belediye başkanı ve kaymakamın yerine karar verici tavırları çok eleştiriliyor. Parti içinde bile ‘kibir, gösteriş, şatafat ve yolsuzluk’ iddiaları çok konuşuluyor. Cumhurbaşkanı Tayyip Erdoğan’ın Rize-Trabzon kongrelerinde dile getirdiği, ‘partiyi ticarethaneye çevirme’ uyarısının tam da bundan kaynaklandığı anlatılıyor. AKP’de bu bir kongre geleneğidir, sadece o dönem kullanılan ‘simgeler’ yaratılır. Daha önceki kongrelerde ‘Yeni Ömerler bulacağız’ diye yola çıkılmıştı. ‘Adalet dürüstlük ve çalışkanlık’ ölçü olacak sloganları kullanılmıştı. Sonrasına oluşturulan kadrolara bakıldığında hayal kırıklığı yaratmıştı. Ancak bu kez Cumhurbaşkanı durum tespiti yaparken, “ticarethane’ benzetmesiyle AKP’nin şu andaki durumunu anlatmaya çalışan muhalefet parti liderlerine taş çıkarttı. *** Gelelim, iki ayda bir gündeme gelen Şanlıurfa Büyükşehir Belediye Başkanı Kasım Gürpınar’ın ‘siyasi rotasına’… AKP kulisleri, yıllarca partide milletvekilliği yapan, belediye seçimlerinde aday gösterilmeyince Yeniden Refah Partisi’ne geçen sonra istifa ederek bağımsız kalmayı tercih eden Gülpınar bilmecesinden sıkılmış gibi. Partide iki ayrı görüş hakim. 1- Zaten gitmesine izin vermemeliydi, Şanlıurfa’da hem milletvekili hem de belediye başkan adaylarına yönelik tercihler çok kötü yönetildi. Kendisine gitmekten başka seçenek bırakılmadı. Geri dönmesi sağlanmalı 2- Sürekli kendisini önceliyor, partiyi öne koymalıydı… diyenler var. Hikaye, yerel seçimler öncesinde başlıyor. AKP Genel Merkez yöneticileri, ‘Seni Şanlıurfa belediye başkan adayı yapacağız, hazırlan. Adaylık başvurusu yapmana gerek yok. Biz sana haber vereceğiz” diye haber gönderiyorlar. Gülpınar hazırlıklarını yaparken aynı genel merkez kadrosu, “Üzgünüz, Şanlıurfa milletvekilleri seni istemiyor, o yüzden aday yapamayacağız” telefonu açıyor. Filmin bu noktada koptuğu ve Gülpınar’ın Yeniden Refah Partisi’nin kapısını çaldığı biliniyor. İktidar ile muhalefetin çatışmasının ortasında kalmak istemeyen Gülpınar’ın bağımsızlığı ‘bir sonraki adıma olanak yaratma’ amacıyla yapıldığı anlatılıyor. Gülpınar’ın eninde sonunda AKP’ye katılacağı, bakan ve parti yöneticileriyle arasının iyi olduğu iddia ediliyor. Tüm hazırlıkların genel seçime yönelik olduğu ve bakanlık beklentisinin halen sürdüğü aktarılanlar arasında. Anlayacağınız, kulislerde yok yok… Cumhurbaşkanlığı kadrosuyla parti yönetimi arasındaki çekişmeden tutun da büyük kongrede MKYK üyesi olmak için kulis yapanlar, kendi bakanları kabine revizyonunda görevden alınmasın diye çabalayan bürokratlar, kamu kurumlarına birilerini yerleştirmek için ‘bu kurumda kimin gücü var?” diye partiden veya aileden isim araştıranlar…",https://www.nefes.com.tr/yazarlar/nuray-babacan/randevu-alamayan-bakan-8399
Nuray Babacan,Kim kime yakın kongresi,01 Ocak 2025 06:00,"YENİ YILDA, YENİ VİTRİN İktidar Partisi’nin aylardan beri süren kongre hazırlığında sona gelindi. İki ay sonra AKP’nin yeni vitrini belli olacak. Partide yüzde 50 oranında değişim yapılacak. Bu yenilenme olarak lanse edilecek. Ancak emin olun, parti içinde konuşulan tek konu, “Kimin adamı, kime yakın, Erdoğan ailesi işin neresinde?” AKP çok uzun süreden beri, “yeni, dinamik, genç, etkili ve güçlü” ekip oluşturma gücünü yitirdi. İktidarın ilk 10 yılındaki refleksler artık yok. Bunu gündeme almamızın nedeni, partide süren büyük kongre hazırlıkları. Büyük iller en sona bırakıldı. Ocak ayında diğer iller, şubatta üç büyük ilin kongreleri tamamlanacak. Şubat sonu en geç mart ayında büyük kongre yapılacak. *** Konuya İstanbul’dan bakarsak; partinin mevcut il başkanı yeniden aday olmayacağını açıkladı. Zaten kimsenin de onu yeniden başkan yapmayı düşündüğü yoktu. Bir süreden beri Bilal Erdoğan’a yakınlığı ile bilinen Ensar Vakfı eski yöneticisi Cenk Dilberoğlu’nun il başkanı yapılacağı konuşuluyor. Dilberoğlu’nun tabandan kopuk, teşkilatları harekete geçirecek yapıya sahip olmadığını öne sürerek itiraz edenler var. Bu isimden çok memnun olmayan bazı İstanbul milletvekilleri, Eski Beyoğlu Belediye Başkanı Haydar Ali Yıldız’ın il başkanı yapılması için kulis yapmaya başladılar. Aile karşısında pek şansları yok gibi. Çünkü başta söylediğimiz gibi konu liyakat veya başarı değil. Cumhurbaşkanı Tayyip Erdoğan’ın İstanbul’la bir toplantı yaptığı ve değişecek başkanları belirlediği biliniyor. 39 ilçe başkanının yarısı topun ağzında. Değişiklik olmazsa, İstanbul il kongresi 8 Şubat’ta yapılacak, sonucu birlikte göreceğiz. *** Tüm illerde aynı rutin sürüyor. ‘Tek tip, tek adaylı, yarışsız ısmarlama organizasyonlar’ demek daha doğru olur. Zaten aylar önce il başkanlarının büyük bölümü genel merkez tarafından atandığı için, yapılan kongreler de şeklen. Hepsi anahtar teslimi. Bir AKP klasiğidir, rakamsal olarak yüzde 50 yenileme hep yapılır. İl yönetimlerinden, MYK ve MKYK gibi üst yönetimlerde de aynı oranda değişim yaşanır. Ancak asıl sorun nitelik. *** Başka bir tartışma konusu, son üç seçimdeki başarısızlıktan sorumlu tutulan mevcut genel merkez yönetiminin hâlâ görevde kalması. Partiyi genel seçime hazırlanacak yeni kadroların bu isimler tarafından belirleniyor olması. Kendileri hesap vermedikleri gibi yeni yapıyı da kendilerine göre oluşturdukları iddia ediliyor. ‘Hataları gören, gençlere kapı açan, ülke sorunlarına duyarlı yeni bir kadronun’ bu yaklaşımdan çıkmayacağı iddia ediliyor. *** Partide siyaset yapanların tek derdi de bu değil. Daha önce de kaleme aldığımız üçlü yapı en büyük sorun. ‘Parti grubu, genel merkez ve saray kadrosu’ ayrı telden çalıyor. Buna bir de kabine ve dışarıdan atanan bakanları ekleyin… Uygulanan politikalarda bir bütünlük olmadığı, tek merkezden, ortak akılla üretilmediği eleştiriliyor. Her yapının karar vericileri, kendilerini en üstte görüyor. Tam bir kaos… *** AKP’de parti içi siyaset sohbetlerinin bir başka konusu da her iki ayda bir değişeceği iddia edilen kabine. Bunu servis edenler de yine partide beklentileri olanlar. Bütçe görüşmeleri öncesinde değişiklik yapılacağını iddia edenler, bütçe görüşmelerinin ardından aynı beklentiyi yine servise koydular. Ama bu kez kimse satın almadı. Partiyi yakından izleyenler, büyük kongreye iki ay kala böyle bir değişikliğin yapılmayacağını biliyor. “Cumhurbaşkanı Erdoğan, partinin vitrini olan MYK ve MKYK’ya dışarıdan görevlendirmeler yapacak. Sonra da kabinede 4-5 bakanlık bir değişiklikle yola devam edecek” deniliyor. Ama yine aynı soru soruluyor; “kimin adamı, kime yakın?”",https://www.nefes.com.tr/yazarlar/nuray-babacan/kim-kime-yakin-kongresi-5595
Nuray Babacan,Emekliye hayal bile satmıyorlar,08 Ocak 2025 05:50,"Hayal kırıklığı yaratan emekli zammı ve asgari ücret artışı öncesinde, 22 Aralık tarihli yazımızda, “Özetle… en düşük emekli maaşına bin 500 liralık iyileştirme, tüm emeklilere yüzde 16 zam, asgari ücreti de 22 bine çıkartarak defteri kapatmayı planlıyorlar” değerlendirmesi yapmışız. Kimileri, ‘iktidar müjdeye hazırlanıyor’ şeklindeki umut tacirliği yapan başlıklarının hesabını bile vermezken, böylesine umutsuz bir tabloyu öngörmenin ne anlamı var ki… Herkesin önceki gün yapılan kabine toplantısından sonra açıklanmasını beklediği ‘iyileştirme haberleri’ bir türlü gelmedi. Çünkü çalışmada sorun var. Öncelikle söyleyeyim işçi ve memur emekli maaş artış oranındaki farkın eşitlenmesi düşünülmüyor. Bu konudaki beklentiler boşuna… Tartışılan tek konu en düşük emekli maaşına yapılacak iyileştirme. TBMM’nin önüne gelecek yasayla yapılacak düzenleme henüz tamamlanmadı. Cumhurbaşkanı Tayyip Erdoğan da bu nedenle açıklama yapmadı. Ancak iyileştirmenin 1000-1500 TL ile sınırlı kalması bekleniyor. Yanılmayı umuyorum… Bu konunun toplumda yarattığı tepkiyi günlerdir takip ediyoruz. Dar gelirliler, emekliler ve asgari ücretlilere görülen reva, gerçekten can yakıcı. Bu gerçek, tüm milletvekillerinin tepkisi çekiyor. Ancak AKP milletvekilleri, “içten yanmalı motor” gibi. Kapalı kapılar ardında sürekli şikayet etseler de dışarıda ne sesleri çıkıyor, ne de hezeyanları sonucu değiştiriyor. Biliyoruz ki; asgari ücret ve emekli maaş zammı ilk açıklandığında parti yöneticilerine eleştirilerde bulundular. “Biz, asgari ücreti 23 bin 500 lira 24 bin bekliyorduk. Rakam açıklanınca şaşırdık. Cumhurbaşkanı müdahale eder diye bekledik. Şimdi sürekli seçim bölgelerinden tepki telefonları alıyoruz” diyorlar. Hepsi bu. Konu ekonomi olunca, başka bir perde arkasıyla devam edelim. Hazine ve Maliye Bakanı zaman zaman iş çevreleriyle bir araya gelerek onların sorunlarını dinliyor. Sokaktaki dar gelirlilerin bakana ulaşma şansı yok ama iş insanlarının var. Kendisine, “Asgari ücret konusunda destek düşünüyor musunuz?” diye soruluyor. İşte bakanın yanıtı; “Asgari ücrete işçi başına, İşsizlik Fonu’ndan yapılan destek 700 lira. Asgari ücrete kadar vergi alınmadığı için şirketlerin büyük kısmı çalışanların bu yöntemle istihdam ediyor. Bütçeye etkisi yıllık 850 milyar. Zorlanan belli sektörlere desteğin arttırılması çalışması var. Önümüzdeki haftalarda tamamlanacak…” Aynı toplantıda, “2025 enflasyon muhasebesi devam edecek mi? Enflasyon muhasebesi işlemler çok uzun ve ağır, bunların kısaltılması mümkün mü?” sorusu yöneltiliyor. Bakan Şimşek, “Son 3 yılın enflasyonu yüzde 100’ün üzerinde ise enflasyon muhasebesi uygulanacak. Son 3 yılın ortalaması bu yönde olduğu için devam edecek. İşlemlerin büyük bölümü dijital yapılabiliyor, arkadaşlar işlemleri basitleştirsinler, kar etmeyen mükellefin bize faydası yok. Uyum maliyetleri üzerinde çalışıyor ekibimiz…” diyor. Bakan sosyal güvenlik primlerinden şikayet eden iş insanlarını da rahatlatıyor. Şimşek, işverenlerin sosyal güvenlik primini bazı alanlarda 4’e indirme, reeskont kredilerine destek olma, istihdam ve prim destekleri konusunda yeni çalışmalar yapma müjdesi veriyor. Konuşmanın hiçbir yerinde dar gelirliler ve emekliler geçmiyor….",https://www.nefes.com.tr/yazarlar/nuray-babacan/emekliye-hayal-bile-satmiyorlar-6883
Nuray Babacan,Güç zehirlenmesi mi?,31 Ocak 2025 06:00,"Son birkaç hafta içerisinde, gözaltına alınan gazeteciler, siyasilere yönelik girişimler, belediyelere operasyonlar ve tehdit dilinin her cephede dehşetli yankıları oldu. Bunun mantığını açıklayabilen ve doğru kararlar olduğunu dile getirebilen tek bir siyasetçi yok, trolleri saymıyoruz. AKP iktidarında yıllara yayılan antidemokratik uygulamalar az değil. Ancak sanki kapak açılmış gibi hukuki alt yapıdan yoksun, çifte standartlı, tamamıyla siyasi görünen operasyonlar parti içinde de anlamlandırılamıyor. Muhalefetin bu konudaki görüşleri zaten kamuoyuna açık olarak görülüyor. AKP’lilerin şaşırtıcı hızla yaşanan bu antidemokratik gelişmeleri nasıl değerlendirdiğine bakmak lazım. Yaşananları, komplo teorileriyle değerlendirenler de var, güç zehirlenmesine bağlayanlar da. Sessiz kalan kitle ise ya içten içe onaylıyor ya da cumhurbaşkanına göre pozisyon almayı tercih ediyor. VURA VURA GETİRECEKLER ADAMI… * “Vura vura getirecekler adamı…” diyerek İstanbul Büyükşehir Belediye Başkanı Ekrem İmamoğlu’na yapılanları işaret edenlere göre, AKP geçmişte kendisine yapılanların aynısını rakiplerine yapmaya başladı. Bu benzerlik, aklı selim olanları korkutuyor. “O dönemin iktidarı, yaptıklarının yanlış olduğunu, yeni mağduriyetler yaratarak, kitleleri ‘bu kadarı da yapılmaz ki?’ noktasına getirdiğini nasıl görmediyse, bizimkiler de görmüyor. Üstelik bu kararlar alınırken, Cumhurbaşkanı da sürece dahil ediliyor. Ortaya konulan gerekçeler her neyse ikna oluyor. Bu bir tuzak. Partide istişare kalktığı günden beri aynı hatalara düşülüyor…” diyenler var. ‘GÜÇ ZEHİRLENMESİ’ DİYENLER *Farklı düşünenler ise; “Yapılan korkunun tahkim edilmesi. Sadece muhalefete değil, kendi cenahına da korku salıyor. Bu gücü tahkim etme yöntemi. Parti içerisinde bir kişi de ‘bu yapılanlar yanlış diyemiyor” Amaçta bu zaten. Yaratılan bu ortam yanlışları gören muhafazakar mahalleyi de susturmaya yönelik. Buna güç zehirlenmesi demek daha doğru olur. İktidardan gitmemek için yapılan oyunlar. Kendi ayağımıza sıkıyoruz, kimseyi suçlayamayız…” şeklinde yorum yapabiliyor. DUYGUSUZ- HİSSİZ OLANLAR *Bir grup ise yaşananları başka bir ülkede, başkalarının başına geliyormuş gibi izliyor. Bu konularda yorum yapmaktan kaçınıyor. Olumlu ya da olumsuz görüş belirtmeyi tercih etmiyor. Otomatiğe bağlanmış gibi, grup toplantılarında coşkulu alkışlarla görünür oluyor. TBMM Genel Kurul çalışmalarında doğru-yanlış analizi yapmadan gerekirse muhalefetin üzerine yürüyor. Cumhurbaşkanın bulunduğu karelere girerek, kongre öncesinde ‘tercih edilen, işini yürüten’ olmaya çalışılıyor. BU ÜÇ GRUBUN GELECEĞİ Partide üç tip siyasetçi var… “Bize tuzak kuruluyor, yanlış işler yapıyoruz…” kaygısı taşıyan birinci grup, hala bir şeyleri değiştirebileceklerini düşünerek, kapalı kapılar ardında çaba sarf ediyor. Bunların etkin alanları halen var ama sayıları az. “Yanlış okuyorsunuz, kimsenin bize tuzak kurduğu filan yok. Bu güç zehirlenmesi. Gittikçe demokrasiden uzaklaşan bir partiye dönüştük…” diyenlerin, zaten partide etkisi yok. Bunlar yapılan yanlışları söyledikleri için dışlananlardan oluşuyor. Yorumsuz kalıp, cumhurbaşkanının karesine girmeye çalışanlar ise son dönemlerde partide varlık gösterenler. Parti, her kongrede bu tip siyasilerden yeni bir vitrin oluşturup yoluna devam ediyor. Sorgusuz sualsiz biat edenler yönetime seçiliyor. Her kongrede ‘değişim zamanı, yeni nesiller geliyor’ anonsunun arkasında yatan genellikle bu oluyor. Hikaye, ‘artık etkisi olmayan eskiler, yanlışları görüp ses çıkarmayan mevcutlar ve onların yerini doldurmayı bekleyen hazır askerler’ şeklinde sürüp gidiyor…",https://www.nefes.com.tr/yazarlar/nuray-babacan/guc-zehirlenmesi-mi-12004
Nuray Babacan,İktidardan kötü sürprizler!,16 Şubat 2025 06:00,"Büyük siyasi krizler ve iktidarın her kesime yönelik sert kararları, bazen küçük ama önemli ayrıntıları gözden kaçmasına neden oluyor. Örneğin, yasaların içine monte edilen özgürlükler ve haklarla ilgili tartışmalı maddeler gibi. Bir süredir üzerinde çalışan üç ayrı yasayla ilgili ‘kötü kokular’ geliyor. Öncelikle şunu söyleyelim, bahar aylarında TBMM’nin önüne gelecek bazı yasa hazırlıkları var. Daha çok ekonomik alanı düzenliyor. Yeni bir torba yasa hazırlanıyor. Özellikle enerji yatırımlarını kolaylaştıran ve yenilebilir enerji yatırımlarına öncelik veren bir çalışma. YETKİ EL Mİ DEĞİŞTİRECEK? Edindiğimiz bilgiye göre bu yasanın içinde tarım alanları ve belediyelerin yetkileriyle ilgili maddeler bulunacak. Konu enerji olunca, doğa, tarım alanları ve su havzalarıyla ilgili endişe verici düzenlemeler olabiliyor. İddiaya göre bazı tarım alanlarını içeren düzenlemeler olacak. Ayrıca belediyelerin bu alandaki yetkileri sınırlandırılacak. Muhalefet belediyelerini devreden çıkaracak bazı maddelerden söz ediliyor. EKONOMİ PAKETİ GELİYOR Başka bir bütüncül yasa ise yine ekonomiye ilgili olacak. Sapma yaşanan ekonomik hedefleri tutturmak için yeni bir paket hazırlanıyor. Bu paketin de önümüzdeki aylarda TBMM’ye gönderileceği iddia ediliyor. Daha çok kamu mali disiplini ve tasarruf hedefleriyle ilgili hükümler içereceği söyleyen bu yasanın yatırım teşvik alanlarını değiştireceği de iddialar arasında. İktidar partisi kurmayları, ekonomi programının yeniden değerlendirildiğini, enflasyon hedeflerindeki sapmada ücret artışlarının etkili olduğunu, yeni düzenlemelerle yeni önlemlerin alınacağını öne sürüyorlar. Kötü sürprizler ve yeni vergiler bekleyenler çoğunlukta. MEDENİ KANUN KORKUSU Başka bir çalışma Adalet Bakanlığı’nda yürütülüyor. Bu kadınları yakından ilgilendiriyor. Medeni Kanun yeniden masaya yatırılıyor. Bu seferki çalışma cezai değil, hukuki yapısını içeriyor. Bakan yardımcısının başkanlığında kurulan komisyonun, nafaka ve kolay boşanma dahil birçok başlığı masaya yatırdığı belirtiliyor. Uzun soluklu bu çalışmanın kadın hakları açısından sıkıntı yaratacak düzenlemeler içermesine ilişkin kaygılar var. Çalışmaya katılanlar olumsuz başlıklar içermediğini söylese de geçmişteki ‘tutucu ve kadın haklarını’ zora sokan adımlar herkesi korkutuyor. KÖTÜ ANILAR CANLANDI Daha önce yapılan değişiklikle müftülere resmi nikah kıyma yetkisi verilmiş, 2017 yılında da müftülerin bu yetkiyi Diyanet İşleri Başkanlığı’nın onayıyla devretmesine olanak sağlanmıştı. Bu, köy imamların bile nikah kıyması anlamına geleceği gerekçesiyle muhalefetin sert tepkisine neden olmuştu. Kontrolü zor bu evliliklerin kız çocuklarının küçük yaşta evlendirilmesi, tacizci ve tecavüzcüyle evlendirme olaylarına kapı açması gibi gerekçelerle eleştirilmişti. Küçük yerlerde kontrol ve denetimden uzak kıyılacak bu nikahları takip etmenin mümkün olmadığı savunulmuştu. Narin cinayetinde görüldüğü gibi koca bir köy halkının cinnet geçirircesine olayı nasıl kapatmaya, polisi yanıltmaya çalıştığı görülmüştü. Kadın hakları savunucuları, nafaka hakkı başta olmak üzere kadının şiddetten ve geleneksel baskılardan korunması, eğitim hayatına devam edebilmesinin yolunun kapatılmaması için yasa koruyuculuğunun açık ve net olmasını dile getiriyorlar. Son yıllarda kadınlara ve çocuklara yönelik şiddet ve saldırılardaki artış, Medeni Kanun’da açılacak gediklerin çok ciddi sonuçları olacağını ortaya koyuyor. Malum, İstanbul Sözleşmesi’nden çıkılmasının yarattığı psikolojinin, gerici zihniyete verdiği güç nedeniyle her yasa çalışması endişe yaratıyor. Hepsinin takipçisi olacağız…",https://www.nefes.com.tr/yazarlar/nuray-babacan/iktidardan-kotu-surprizler-15704
