Yazar,Başlık,Tarih,Metin,URL
Nuray Babacan,"Açılım, ne oldu sahi?",02 Nisan 2025 05:50,"Ülkede, hızla esen anti demokratik rüzgarlar, ana muhalefet partisini ve onun cumhurbaşkanı adayını etkisiz hale getirme çabaları, ‘devletle Kürtleri barıştırma projesi’ olarak sunulan açılım sürecinin geleceğiyle ilgili şüphe yarattı. Kimileri açısından muhalefet bloğunu bölme amacı taşıyan bu çalışmanın hangi noktaya geldiğinin izini sürdük. 19 Mart darbesinden önce zaman zaman yazdığımız açılım süreci, son olarak Cumhurbaşkanı Tayyip Erdoğan’ın bayram mesajındaki sözleri nedeniyle radarımıza girdi. Erdoğan iki gün önce “Şimdi sıra, örgütün çağrıya amasız fakatsız uymasına gelmiştir. Bu konuda da sınırsız bir vakte ve tahammüle sahip değiliz. Daha fazla oyalanılmadan, örgütün kendini feshetmesini ve silahlarını tamamen bırakmasını bekliyoruz” dedi. Konuyla yakından ilgilenenler, teknokratlar düzeyinde çalışmaların sürdüğünü anlatıyor. Kongrenin nerede yapılacağına ilişkin seçenekler ve zaman zaman PKK’dan gelen çatlak sesler, süreci sulandırma çabası olarak nitelendiriliyor. İSTİHBARAT NE DİYOR? İstihbarat kaynakları, açılım çalışmalarının başında da kaleme aldığımız gibi Kandil’in PKK’nın fesih kongresinin toplanacağı yer olarak netleştiği iddia ediyor. Zaman zaman Kobani ve Süleymaniye gibi ortaya atılan toplantı yerlerinin hiç gündeme gelmediği savunuluyor. PKK lideri Abdullah Öcalan’ın kongreye katılması söz konusu değil. Görsel bir mesaj şimdilik yok. Sadece yazılı mesaj ileteceği iddia ediliyor. Tarihine gelince. Devlet kongre sürecinin uzamasını istemiyor. Mart ayı için yapılan planlar suya düştü-düşürüldü. En geç nisan ayının ikinci yarısında PKK kongresinin toplanacağı, örgütün kendini lağvetmesi, silahların bırakılması, silahların toplanması gibi süreçlerin en az iki ay süreceği hesabı yapılıyor. UZARSA SABOTE EDİLİR Ayrıca Kobani bölgesinde TSK operasyonun da sivillerin ölmesinin nedeninin farklı grupların süreci provoke etme çabası olduğu öne sürülüyor. Yönlendirilmiş yanlış istihbarat ihtimalinden söz ediliyor. İran ve İsrail’le işbirliği içinde olan grupların sabote etmiş olabileceğine vurgu yapılıyor. Sürecin uzamasının böyle provokasyonlara kapı açacağı yorumları yapılıyor. Evdeki hesap çarşıya uyarsa, yaz aylarında da daha önce yazıldığı gibi Öcalan için umut hakkı konuşulmaya başlanacak. Tabi ülkenin iç mekanizmaları izin verirse… ÇATLAK SESLER…. Bu arada, PKK içindeki çatlak sesler halen devam ediyor. Dört ayrı ekibin yer aldığı yapının her kesiminden farklı ses çıktığı anlatılıyor. Öcalan ve Murat Karayılan ekibiyle birlikte anılıyor. Cemil Bayık’ın İran etkisinde olduğu belirtiliyor. Tunceli grubu ile Dursun Kalkan ekibinden oluşan eskilerin de etkisinin olduğu savunuluyor. PKK kongresinin hareketin önderi olan Öcalan’ın gücünün görünmesi açısından önemli olduğu belirtiliyor. Terör örgütü içindeki çatlak sesler, bölünme gibi durumların ortaya çıkması, Öcalan’ın gücünün sınanması anlamına da geleceği ifade ediliyor. DEMOKRASİ SINAVI Gelelim ülkede yaşanan iklimin, bütün bu planlara izin verip vermeyeceğine. Ülkenin ana muhalefet partisine operasyon düzenlenirken, muhalif belediyelere birer birer kayyum atanırken, protesto hakkını kullanan gençler cezaevinde tutulurken, AKP’liler bile ‘yargıda neler oluyor?’ sorularını sorarken, bütün bu çalışmaların amacına ulaşacağına ilişkin ‘inanç’ zayıf. Bu inanç, sadece vatandaşlarda değil, devletin çeşitli kademelerinde bile azalmış gibi. Tabi, Kürt siyasetçilerin sürekli savundukları demokrasiye bağlılıkları da bu arada test edilecek…",https://www.nefes.com.tr/yazarlar/nuray-babacan/acilim-ne-oldu-sahi-25478
Nuray Babacan,Dipten gelen dalga yaratıyor,09 Nisan 2025 06:00,"Sis bulutu dağılmaya başlayınca, İstanbul Büyükşehir Belediye Başkanı Ekrem İmamoğlu’na yapılan siyasi operasyon konusunda, AKP’de yaratıcı benzetmeler yapılmaya, çarpıcı sorular sorulmaya başladı. Parti kulislerinde, 19 Mart darbesi sonrasında CHP’nin yönetiminde başlatılan mücadele sürecini ‘eklemeli imalata’ benzetenler var. Yani, üç boyutlu üretimi düşünün. Printer aracılığıyla sıfırdan başlayarak bir şey ortaya çıkarıyorsunuz. Bu nedenle CHP’nin süreç yönetiminin dipten gelen dalgaya dönüşeceği savunuluyor. Öncelikle, partinin resmi açıklamalarına, artık pek etkisi olmayan MYK ve MKYK’daki konuşmalara bakıldığında tam tersi bir havayı görürsünüz. İktidar yansılı köşe yazarları da sürekli güzelleme yaparak, ‘görüneni görmeme’ oyunu oynarlar. *** Ancak, siyaseti yakından izleyen, siyaset sosyolojine kafa yoran, yakın siyasi tarihi bilen AKP’liler, son 20 günde siyasi rakiplere operasyon amaçlı yapılan siyasi darbenin ‘sonuçları’ konusunda ilginç yorumlar yapıyorlar. İşte en farklısı... “Eklemeli imalat diye bir şey vardır. Üç boyutlu imalat gibi düşünün. Sıfırdan başlayarak bir şey yaratıyorsunuz. Küçük bir noktaya vura vura başlıyorsunuz ve sonra ortaya bir obje çıkıyor. Mermerden heykel yapmasının tam tersi gibi düşünün… Şimdi, CHP’de bunu yapmaya çalışıyor, her durumda bu gelişmeler, iktidarla ilgili sonuç doğurur. Şimdi herkes bulunduğu yerden hareket etmek istemese de sandık önüne geldiğinde bu etkilerin sonuçları görünür. İnce ince üretim yapılıyor. iktidar yıpratılıyor. O yüzdendir ki; anketlerde CHP sürekli AKP’nin önünde çıkıyor. Uzun vadeli bir hikaye yazılmaya çalışılıyor. Bütün bu yapılanlar dipten gelen derin dalgaya dönüşebilir…” Modern üretim süreçlerinde devrim yaratan eklemeli imalatın, siyasi bir analizde kullanılması, sonuçları itibariyle çarpıcı bir benzetme. ‘Geleneksel imalat metotlarının aksine, eklemeli imalat; katman katman malzeme ekleyerek ürünlerin üretilmesini sağlayan yenilikçi bir süreçtir’ diye tarif ediliyor. İktidar, geleneksel siyaset yapma yöntemleriyle, medya karartması, algı operasyonu, gözaltı, talimatlı haber ve köşe yazdırma gibi yöntemlerle uğraşırken, ‘eklemeli imalat’ katman katman çoğalıyor. *** Sohbette, siyasi gelişmeleri başka bir deyişle yorumlayanlar da oldu. Bir Brezilya atasözüyle. CHP’nin istikrarlı şekilde operasyonu gündemde tutma ve mitingler aracılığıyla tepkisini sürdürme kararına örnek olarak gösterildi. “Kayalara şekil veren dalgaların gücü değil, sürekliliğidir’ veya “Taşı delen suyun gücü değil, damlaların sürekliliğidir…” İki biçimde de kullanılan bu deyim, “Motivasyon ve odaklanma hayatımızda çok önemlidir. Eğer öz disiplin ve süreklilik bilincine sahipsek, istediğimiz işi başarabilir, ne koşulda olursak olalım sonuç alabiliriz…” şeklinde yorumlanmış. Konuya oldukça farklı bakan siyasiler var. Hem CHP’nin yaklaşımını hem de bütün bunların iktidarda yaratacağı sonuçlara ilişkin derin analizler yapılıyor. *** Bu da yine bir AKP’li yorumu; “Ekrem İmamoğlu ve ekibine yapılan operasyona, şahinlerle atmacaların kapışması gibi bakmak lazım. İşin içinde devletin farklı unsurları vardır. Siz doğru yaptığınızı sanırken, aslında farklı planlar yürütülüyor olabilir. Son noktada kimin avantajlı çıkacağına bakmak gerekir…” Benzetmeler de yorumlar da ilginç. Kimden, neden şüphe edildiği açıkça ifade edilemediği için devreye mecazlar giriyor. Ama Türk siyaseti bu imalı yorumları hep sevmiştir. Artık, ‘elmanın sadece elma’ olduğu günleri özlüyor insan….",https://www.nefes.com.tr/yazarlar/nuray-babacan/dipten-gelen-dalga-yaratiyor-26940
Nuray Babacan,PKK feshedilmeden adım yok,16 Nisan 2025 06:20,"Cumhurbaşkanı Tayyip Erdoğan, DEM heyetine randevu vererek, dikkatleri üzerine çekti. Ama açılım sürecinin gündemi değiştirmesini bekleyenler aradığını bulamadı. DEM heyetinin cuma günü Adalet Bakanlığı’nda yapacağı görüşmeye fazla anlam yükleyenler de yanılacak. Henüz ön hazırlık ve plan yok. PKK kendisini feshetmeden ve silahları temsil etmeden ‘hukuki çalışma’ başlatılmayacak. Öncelikle şunu söyleyelim, DEM yönetimi cuma günü kamuoyuna açıkladıkları taleplerini bir kez de Adalet Bakanına iletilecek. Ancak DEM heyeti gelecek diye bakanlıkta özel bir çalışmanın yapılmadığını öğrendik. BAKANLIK BEKLEMEDE Yani, ‘Önce bir gelin taleplerinizi alalım, sonra bunu Cumhurbaşkanlığı ve ilgili kurumlarla konuşalım. Hangisine ne zaman yol verilebilir sonra karar alalım…’ duygusundalar. Her iki sözlerinden biri de ‘PKK kendisini feshetmeden ve silahları teslim etmeden hiçbir adım atılmaz…’ Öyle olası yasal düzenlemelerin müzakere edilmesi, ayrıntıya girilmesi beklenmiyor. Görüşme iyi niyet beyanı şeklinde gerçekleştirilecek. Süreci yakından izleyenlere göre daha sonra istihbarat bürokratları, adalet bakanlığı bürokratları ve sarayın temsilcileri bir araya gelip, olasılıklar konusunda ön çalışma yapacak. Yasal hazırlıklar ve adımlar ondan sonra atılacak. Bu da en iyi olasılıkla yaz ayları demek. Zaten ellerinde 2015’de atılan adımlara ilişkin bir eski yol haritası var. YOL DAHA UZUN O süreci hatırlayalım. Başbakan Tayyip Erdoğan, 1 Ekim 2012 tarihinde demokratikleşmeye ilişkin 63 maddelik bir yol haritası açıklamıştı. 4 ayrı yargı paketi TBMM tarafından kabul edilerek yasalaşmıştı. Daha sonra “Çözüm Süreci Kurulu ile Kurumlar Arası İzleme ve Koordinasyon Komisyonlarının Kurulması’na ilişkin Bakanlar Kurulu Kararı çıkartıldı. Ardından “Terörün Sona Erdirilmesi ve Toplumsal Bütünleşmenin Güçlendirilmesine” dair kanun tasarısı, TBMM Genel Kurulu’nda kabul edilmişti. Tüm bunlara ilişkin adımlar 2012 sonunda başlayıp, 2015’de sonlandırıldı. Cumhur İttifakı daha hızlı bir süreç planlasa bile en az bir yıl gerekiyor. ÖCALAN’A EV HAPSİ Bu arada PKK terör örgütü lideri Abdullah Öcalan’ın serbest bırakılması gibi bir başlık hiçbir yerde konuşulmuyor. Öcalan’ın İmralı’da ev hapsinden çıkartılmayacağı, en fazla konuk ağırlayıp dışarıyla iletişime geçebileceği anlatılıyor. Hatta izinle yurt içinde hareket etmesinden bile geri adım atılmış gibi. AMAÇ ERDOĞAN’I KURTARMAK Sonuç olarak, aylarca ağırdan alan Erdoğan’ın dört elle açılım sürecine sarılmasının nedenleri konusunda siyasilerin net fikirleri var. AKP’lilerin en büyük düşü, kendilerinin öngördükleri tarihte seçimi erkene almak. Amaç, Cumhurbaşkanı Tayyip Erdoğan’ın yeniden aday olmasının kapısını açmak. Bunun için TBMM’de DEM’in oylarına ihtiyacı var. Ayrıca seçimlerde DEM takviyesi yapmak istiyorlar. AKP’yi terk eden muhafazakar Kürt seçmenin geri dönmesini sağlamayı planlıyorlar. Zira, açılım sürecinin milliyetçi seçmeni partiden uzaklaştıracağı da biliniyor. Bütün bunlar konuşulurken, MHP Genel Başkanı Devlet Bahçeli’nin durup durup seçimin zamanında yapılacağına ilişkin vurgusunu ne yapmak lazım? ‘Hayat siz planlar yaparken başınıza gelen şeydir’ sözünü anımsatarak, bitirelim…",https://www.nefes.com.tr/yazarlar/nuray-babacan/pkk-feshedilmeden-adim-yok-28495
Nuray Babacan,Hükümette koğuş ağası kafası!,04 Nisan 2025 06:00,"Kötü ebeveynlerin çocuklarını dayak arsızı yapıp sonra da ‘Bu çocuk nasıl böyle oldu?’ diye sorması gibi bir durum yaşanıyor. Anayasa’nın kendilerine verdiği protesto haklarını kullanan gençlerin, tutuksuz yargılanabilecekken, cezaevlerine konulması aynı mantık. Gençleri sırf, ‘psikolojik işkence olsun’ diye normal koğuşlardan alıp, adi suçluların arasına koymak da aynı ruh hali. Günlerdir konuşulan kötü muamele iddiaları, Avrupa Birliği’nin de dikkatini çekti. Şimdi bir heyet inceleme yapmak üzere Türkiye’ye geliyor. AB heyetinin Türkiye’ye gelme kararından öncesine giderek, yaşananlarla ilgili perde arkası gelişmelere bakalım. *** Protesto eylemlerine katılan öğrenciler poliste yaşadıkları kötü muameleden sonra, önce normal koğuşlara konuluyor. Gençlerin birbirinden güç aldığı ve itirazlarını içeride de sürdürdüğü iddiasıyla ‘bir nevi çifte ceza olması amacıyla’ adi suçluların olduğu koğuşlara dağıtılmasına karar veriliyor. Koğuş ağaları marifetiyle zorlamalar, aşağılamalar, haklarının kullanılmasının engellenmesi gibi sorunlar yaşanıyor. Düşünün; tutuksuz yargılanabilecek, hepsi pırıl pırıl başarılı üniversite öğrencileri, hırsız, dolandırıcı bir grup suçluya ‘ayar vermeleri’ için teslim ediliyor. Tutukluların poliste gözaltında kaldıkları süre başta olmak üzere fiziksel ve psikolojik işkence gördükleri iddialarının kamuoyunda yankılanmasının ardından karardan geri adım atılıyor. İddiaya göre bu haftadan itibaren öğrenciler adi suçluların kaldığı koğuşlardan alınarak normal koğuşlara taşınacak. Bir şey daha yapılıyor. Şikayetlerin artması üzerine cezaevi yöneticilerine insan haklarına aykırı, infaz rejimine gölge düşürecek davranışlarda bulunulmaması, tutukluların haklarına azami özen gösterilmesi konusunda talimat veriliyor. Tam da Avrupa Birliği heyetinin cezaevlerinde inceleme talebinin öncesinde. Bu başvuruya olumlu yanıt verildiğini öğrendik. Son dakikada engellenmezse önümüzdeki günlerde bir heyet cezaevlerinde inceleme yapacak. *** Bu arada, başta İmamoğlu olmak üzere bu süreçte tutuklanan siyasilerin cezaevlerinden sosyal medya aracılığıyla topluma mesaj göndermeleri de ciddi rahatsızlık yaratmış. Kamuoyuna yansıyan bu gelişme de iktidar kanadında tartışmaya neden oluyor. Bir yanda derhal iktidar trolleri devreye sokularak engellenmesi gerektiğine ilişkin kampanya başlatılırken, öte tarafta “Diğer tutukluların kullandığı haklar kullanılıyor. Herkesin avukatlarıyla ve yakınlarıyla görüşme hakkı var. Onlar aracılığıyla görüşlerini paylaşan ilk kişi bunlar değil. Burada hukuksuz bir durum yok. Bu engellenirse başka yollar bulunur” diyenler var. İktidarın bir kanadının, normal bir hak gibi gördüğü bu durum için de farklı yollarla engelleme girişimlerin başlıyor ve suç duyurusu yaptırılarak, işin içine yine İstanbul Başsavcılığı sokuluyor. Siyasilerin ve ilgili kurumların görüşleri bir kez daha askıda kalıyor. Bir başka tartışma Silivri Cezaevi’nde rahatsızlanan İBB Genel Sekreter Yardımcısı Mahir Polat’ın tutuksuz yargılanmasıyla ilgili. Hem öğrencilerin hem de Polat’ın tutuksuz yargılanması gerektiğini söyleyenlere karşı da direnç var. İktidar kanadında ‘farklı yolları savunanların’ çatışmasına bir kez daha tanık oluyoruz. *** Ama, Türkiye’nin taraf olduğu tüm uluslararası sözleşmeler ve mevcut Anayasa, ‘herkesin bir gün ihtiyaç duyacağı’ işkence, zalimane, insanlık dışı, aşağılayıcı muamele ve bu suçların etkili biçimde soruşturulması konusunda net hükümler içeriyor. Bırakın devletin kötü muamelenin aracı olmasını, devletleri, açık bir şikâyetin olmadığı durumlarda dahi işkence ve kötü muamele yapıldığına ilişkin belirtileri soruşturmakla yükümlü kılıyor. Yani devletin, 20 yaşındaki gençleri sindirmek için adi suçluların koğuş ağalarından medet ummaması gerekiyor.",https://www.nefes.com.tr/yazarlar/nuray-babacan/hukumette-kogus-agasi-kafasi-25917
Nuray Babacan,Kaygılı AKP’lilerin ‘tuzak’ şüphesi,24 Mart 2025 06:00,"“Toplum kırılgan bir ekosistemdir. Yalanlarla insanların gözlerini kamaştırabilirsiniz. Gözlerinin önündeki deliliğe karşı kör olurlar. Sonunda her şey geri alınamayacak bir kabusa dönüşür…” Bu sözler, Alacakaranlık Kuşağı dizi serisinde ‘siyasi yalanlarla algı operasyonu yaratanları’ anlatan bir bölümden… Türkiye’de son bir haftadır, gerçeklerle yalanların karıştığı bir alacakaranlık kuşağı yaşıyor. Bu kasvetten, muhalefet ve muhalif olanlar nasibini alsa da yaratılan ekosistemin kendilerine ciddi zarar vereceğinden endişe eden ve bunu ilginç sözlerle açıklayan AKP’liler de var. KAYGILI AKP’LİLER İstanbul Büyükşehir Belediye Başkanı Ekrem İmamoğlu’na yapılan operasyon, CHP’ye yönelik sürdürülen hazırlıklar, muhalif medya, şirketler ve kişilerle ilgili baskı ve susturma girişimleri bir paket olarak servis edilirken, AKP kurmayları arasında gelişmesinden rahatsız olan, her kararı ekrandan öğrenmekten şikayet edenler var. Trolleri saymazsak, konuya ekonomi, dış politika, açılım süreci, güven ve yatırım ortamının zedelenmesi gibi açılardan bakıyorlar. İmamoğlu ve CHP’ye yönelik operasyonlar planlandığı gibi sonuçlansa da Türkiye’nin çok şey kaybedeceğini savunuyorlar. İşte kapalı kapılar ardındaki bu hezeyanlardan bazıları; DAHA ÖNCE DE YAŞADIK - “Garip işler dönüyor. Bunun kime operasyon olduğunu iyi araştırmak lazım. Daha önce de komplo kokan girişimler olmuştu. Birisi de Rahip Brunson olayıydı. Türkiye-ABD ilişkilerinde tamiri güç zararlar açtı. O dönemde gizli tanık ortaya çıktı. Dosyasını incelemiştik, suçlamalar boştu. Türkiye hem ekonomik hem de siyasi açıdan çok şey kaybetti. O dönem yapılan bu operasyonun çok zararını gördük. - Dosyaların altı dolu bile olsa bu saatten sonra kimseye bunun siyasi olmadığını anlatamazsınız. Özellikle diploma olayını bunun içine katarak konu iyice sulandırıldı. O dönem, bizim arkadaşlarımızdan da geçiş yapanlar oldu, o zaman kolay yoldu. Tercih eden oldu. Hukuki bir sorun varsa diploma alandan değil, bu hakkı tanıyanlardan hesap sorarsın… - Bir sabah kalkıyorsun, düğmeye basılmış gibi bütün bunları karşında buluyorsun. Peki niye şimdi? Bugüne kadar neden durdun? Bundan önceki hukuksuzluklara neden itiraz etmedin? YETKİLİ ORGANLARDA KONUŞULMADI - Parti içinde kimsenin bu gelişmelerden haberi yoktu. Hiçbir yetkili organda konuşulmadı. Siyasilerin tamamı ekranda gördü. Tahmin etmek ayrı bir şey, bütün süreçlerden haberdar edilmek ayrı bir şey. Herkes kucağında buldu bunu… - Sonra da buna dönük, pozisyon almak, açıklama yapmak zorunda bırakılıyorsun. Tek talebim, bu dosyaların içindeki iddialar gerçek olması. Yoksa, kimseyi kendimize inandıramayız. Günün sonunda siyasi rakibine operasyon çeken iktidar durumuna düşeriz… - Her açıdan tuhaf. ‘Neler oluyor?’ diye sorup araştırmaya kalksak yadırganırsın. Daha alt kademelerden bilgi almaya çalışıyoruz. Doğru düzgün bir bilgi akışı yok parti içinde. Herkes birbirine ‘Gerçekte ne oluyor?’ diye soruyor… SEKTEYE UĞRADILAR - Gelinen bu noktada, kırılgan ekonomiyle ilgili alınan tüm kararların uygulanmasında zorlanılıyor. Yurt dışındaki imajımız zarar gördü. Açılım sürecinin etkilenmemesi için çaba var ama herkeste tereddüt oluştu. Doğru adımlar ve projeler bu kaos ortamından etkileniyor. Daha aklı selim kararlar alınmalı ve soğukkanlı adımlar atılmalı…” Parti içinde bu ruh halinde olanlar var. BAKANLARIN POZİSYONU! Ayrıca bu krizden en çok etkilenen iki isim, Hazine ve Maliye Bakanı Mehmet Şimşek ile Adalet Bakanı Yılmaz Tunç. İki bakanın, sürece dahil olmadıkları gibi yaratılan krizin sonuçlarına katlanmak ve yönetmek zorunda oldukları anlatılıyor. Şimşek’in ekonomik program hedefinde yaşanan kırılmaya müdahale etmekte güçlük çektiği, Tunç’un ise sadece ‘duruma uygun açıklamalar yapması beklenen’ makam olarak kullanıldığı aktarılıyor. Bırakın karar vermeyi, gelişmelerden dahi haberdar edilmedikleri iddialar arasında…",https://www.nefes.com.tr/yazarlar/nuray-babacan/kaygili-akplilerin-tuzak-suphesi-23590
Nuray Babacan,Öcalan’a ‘kısıtlı’ özgürlük,03 Mart 2025 06:00,"Terör örgütü lideri Abdullah Öcalan’ın, MİT’in yardımlarıyla oluşturulan PKK’nın şartsız feshini içeren açıklama metni, yeni bir kapının açılmasına neden oldu. Bundan sonra atılması gereken ilk adımlar, zaten 2013 açılımındaki hazır listeden biliniyor. Önemli olan finali nasıl yapacağı? Eğer açılım projesi tam istendiği gibi işlerse, Öcalan özgür kalacak… Ama kısıtlı. İmralı’da ikamet edecek, dışardan ziyaretçi kabul edecek. Türkiye sınırları içerisinde izinle seyahat edecek. Yurt dışına çıkamayacak, seçme ve seçilme hakkı olmayacak. Yani Türkiye, bu yıl içinde Umut Hakkı’nı konuşacak. Umut Hakkı’nın sınırlarını devlet belirleyecek. *** Tekrar hatırlatalım. Umut Hakkı, ömür boyu cezaevinde infaz edilecek bir hapis cezasına mahkum edilen hükümlülerin serbest bırakılıp bırakılmayacağının idari veya yargısal bir makam tarafından değerlendirilmesi. “İdari makam” ifadesine dikkatinizi çekerim. PKK’nın kendini feshetmesi için kongresini toplayacağı biliniyor. Bunun tarihi konusunda farklı görüşler var. Ankara istihbarat kaynakları PKK kongresinin iki hafta sonra toplanmasından söz ediyor. 21 Mart Nevruz Bayramı’nın tarih olarak kullanılmaması için öncesine alınması planı var. Her şey yolunda giderse, Umut Hakkı’nı yaz aylarında konuşmaya başlayacağız. Ve… Tüm plan sistematik olarak devletin öngördüğü gibi gider, fesih, silahların teslimi, lider kadroların başka ülkelere göç etmesi, tüm kamp ve yaşam alanları ve mağaraların boşaltılması gibi operasyonlar kazasız belasız biterse, af konuşulmaya başlanacak. Kaynaklar, bunun için en az bir yıl olduğunu, yapılacaklar hesaba katıldığında iki yılı bulacağını dile getiriyorlar. Açılım sürecinin takvimine sondan baktık ama herkesin merak ettiği yer de orası. Çünkü nasıl başlayacağı konusunda deneyimimiz var. Nasıl biteceği konusunda tecrübesiziz. Şimdiye kadar hiç başarılı olunmadığı için… O yüzden final önemli…. *** Gelelim bu sürecin ilerleyin zamanlarında beklenen demokratik adımlara. Ankara’nın planına göre, Kürtçe dilinin günlük hayatta, düğünde, cenazede kullanmayla ilgili baskılar kalkacak. Yerel yönetimlerde çift dilli tabelalar, panolar yeniden hayatımıza girecek. Kürtçe şarkılar daha rahat dinlenecek. Kayyum baskısı kalkacak. Ancak, ana dilde eğitim bu çalışmanın hiçbir yerinde yok. Bu sürecin, siyasi nedenlerle cezaevine konulan kişilerle ilgili sonuç doğurması da bekleniyor. PKK’lıları birer birer affederken, sadece muhalif oldukları için insanları cezaevinde tutmaya devam edemeyeceklerini biliyorlar. Bunun doğru ve hukuki bir tutum olmasına inanmaktan çok, sadece PKK’ları serbest bırakan bir iktidar olmayı seçmene anlatamayacakları için…",https://www.nefes.com.tr/yazarlar/nuray-babacan/ocalana-kisitli-ozgurluk-19044
