Yazar,Başlık,Tarih,Metin,URL
Nuray Babacan,Bal gibi de af..,28 Şubat 2025 06:00,"100 BİN KİŞİ SERBEST KALACAK İktidar partisi bir süreden beri kiminin kısmi af, kiminin infaz düzenlemesi diye adlandırdığı bir çalışma yürütüyor. Adalet Bakanlığı’nın bu çalışmasına MHP destek veriyor. Tartışmaların iki boyutu var. Biri ‘iyi hal kapsamındaki infaz indirimi’, diğeri ise ‘kısmi af’ olarak nitelendirilecek ‘pandemi yasasını’ genişletme. Bizim konumuz, ‘pandemi dönemindeki kısmi affın’ genişletilmesi. Sonuçta, etkisi af gibi olacak ve en az 100 bin kişinin aşama aşama tahliye edilmesi sonucunu doğuracak. Onun da oldukça karışık ve tuhaf bir hikayesi var. Şöyle ki; Adalet Bakanlığı, pandemi döneminde cezaevlerini kısmen de olsa boşaltmak için bir düzenleme yaptı. Covid Yasası olarak bilinen ve 31 Temmuz 2023 itibarıyla ‘cezası kesinleşmiş olanların’ yararlandığı düzenleme taa başta hazırlanırken, yanlış yapıldı. ‘Cezası kesinleşenler’ ifadesi konularak, Anayasa’nın eşitlik ilkesine aykırı bir yasa kurgulandı. O tarihten önce işlenen tüm suçları kapsaması gerekirken, bu durum, “Kapsam çok geniş olacaktı, toplumda infial yaratmasın diye sınır koyduk, nasıl olsa Anayasa Mahkemesi’nden döner, o zaman yeniden düzenleriz diye düşünmüştük’ diye açıklandı. Ama ne hikmetse Anayasa Mahkemesi bu yasayı iptal etmedi… Fakat cezaevlerinin hızla dolması ve yeniden yaşanan kaos, Adalet Bakanlığı’na yanlış ve eksik yaptığı bu yasaya yeniden sarılma olanağı verdi. İşte af olarak nitelendirilen asıl çalışma bu olacak. Şimdi yeni bir düzenlemeyle bu tarihten önce işlenen tüm suçların, cezası kesinleşmiş olup olmadığına bakılmaksızın aftan yararlanması sağlanacak. Şimdi bu tarihten önce suç işleyen herkes af kapsamına alınacak. Dolayısıyla ‘henüz yakalanmayan, davası başlamamış, davası süren’ kişiler de kapsama girecek. O dönem pandemi gerekçesiyle salınan ve kimsenin doğru dürüst tartışmadığı bu düzenlemeden 85 bin kişi yararlandı ve aşama aşama tahliye edildiler. Henüz davası süren veya başlanmayanlar tam bilinmediği için yeni düzenlemeden yararlanacakların sayısı da kesin değil. Ama en az 100 bin kişinin tahliyesinden söz ediliyor. Belirtelim, tüm suçları kapsıyor. Cinayet, kadına tecavüz ve terör olmak üzere… Sistem şöyle işliyor; verilen cezanın 3’te ikisini yatan mahkumlar, belli bir süre dolunca kapalı cezaevinden açık cezaevine geçiriyor, oradan da tahliye ediliyorlar. Bu süreler yasayla kısaltıldığı için geçişler ve tahliye de hızlanacak. Hesaplara göre maksimum ceza indirimi 8 yılı bulacak. 8 yıl büyük bir süre. Şimdi iktidar bir yıldır tartıştığı bu düzenlemeyi, Yargı Paketi’ne mi koysa, uygun bir yasaya önergeyle mi monte etse, yoksa AKP ve MHP’li üyelerin ortak teklifine mi dönüştürse ona karar vermeye çalışılıyor. Amaç, cezaevlerini boşaltmak. Bu düzenlemenin ilk ayağı uygulandığında 360 bin olan cezaevindeki mahkum sayısı 250 bine düşmüştü. Şimdi cezaevleri yeniden doldu ve mahkum sayısı 400 bine çıktı. 20 kişilik koğuşlarda 50 kişinin kaldığı anlatılıyor. Kamuoyuna pek yansımasa da gerginlik, tartışma ve kavgalar yaşanıyor. Ayrıca, mahkumların aylık iaşelerinin maliyeti bile hesaplanıyor. İddiaya göre bir mahkumun aylık maliyeti 20 bin lira. İşte bu çalışmanın adı bize göre en hafifinden kısmi af. Ancak bu teklif, başka bir eşitliksizlik yaratmayacak mı? Bu kez 23 Temmuz 2023’ten sonra suç işleyenler açısından. Kapsamı daha da genişletmek veya genel bir affa dönüştürmenin yolları mı aranıyor? Tam da açılımı konuşurken, hep birlikte göreceğiz….",https://www.nefes.com.tr/yazarlar/nuray-babacan/bal-gibi-de-af-18506
Nuray Babacan,AKP’de transfer krizi,26 Şubat 2025 06:00,"Kongre, parti yönetimi seçimi derken, isimler belirlenip, toz-duman dağılınca, geriye oldukça memnuniyetsiz bir kitle kaldı. Açıktan seslerini çıkarmasalar da iktidar partisinin koridorlarında hem transferler hem de parti organlarına seçilen isimlerle ilgili kazan kaynıyor. Nedenlerine gelince, birden fazla… Öncelikle, bir önceki yazımızda kalem aldığımız gibi diğer partilerden transfer edilenlerin 24 saat geçmeden partinin üst yönetimine hatta genel merkeze taşınmaları en büyük rahatsızlık. Yıllardır partide siyaset yapan isimler, hop oturup hop kalkıyor. YÖNETİME TAŞINAN YENİLER Partinin tüm kademelerinde siyaset yapanların emeklerinin boşa gittiği, yıllarca siyasi etik açısından eleştirilen milletvekili transfer kültürünün yüceltildiği yorumları yapılıyor. “Demek ki biz de bir süre dışarıda kalıp, partiye ve cumhurbaşkanına sert eleştiriler yöneltip, öyle gelmeliydik…” sitemleri duyuluyor. Cumhurbaşkanı Tayyip Erdoğan’ın tarzını bilenlerin yorumu daha farklı. “Erdoğan bu hareketiyle AKP’ye gelmek isteyenlere, ‘gelirseniz sizi her türlü iktidar imkanından yararlandırırım. Partinin yönetimine bile alırım’ mesajı verdi. İç kamuoyunun tepkisi kendisini pek ilgilendirmiyor” diyenler var. ERDOĞAN TAKTİĞİ… Erdoğan’ın bu tavrıyla, TBMM’de olası kritik bir oylamada 360 rakamına ulaşmayı hedefliyor. Bu erken seçim olur, yeni anayasa metninin halkoyuna sunulması olur, fark etmez. Bugünden bakıldığında zor gibi görünen bu rakamın taşlarının döşendiği iddia ediliyor. Yeni transferler için pazarlıkların sürdüğünü de gelen bilgiler arasında. KÜRTLER YOK Bir başka eleştiri konusu MKYK’daki bölgesel dengelerin tamamen bozulması. Özellikle Doğu ve Güneydoğu temsilcilerinin kalmadığı yakınmaları çok. Açılım süreci ve Kürt halkına sıcak mesajlar verilmesi gereken bir dönemde, bölge temsilcilerinin neredeyse hiç olmaması tepki çekti. Listelerde Karadeniz hakimiyeti, eski muhafazakar isimlerin olmasına rağmen milliyetçi egemenliği de eleştiriliyor. SEÇİM BAŞARISIZLARI Bu arada son iki seçimin başarısızları olarak adlandırılan genel başkan yardımcılarından Erkan Kandemir, Hamza Dağ ve Fatih Şahin’in genel merkez yönetimine alınmaması ‘troyka gitti’ şeklinde yorumlanıyor. Ancak aynı başarısızlıktan sorumlu olan Seçim İşleri Başkanı Ali İhsan Yavuz’un aynı görevde kalması herkesi şaşırttı. Hatta kendisinin de şaşırdığı aktarılıyor. Bu ekibin, seçim sürecinde aday listeleri başta olmak üzere, birçok konuda etkin olduğu, kendi ekiplerini ve adamlarını ön plana çıkardıkları iddia ediliyordu. Bir anlamda seçimin faturası bu üç isme kesilmiş oldu. Bu isimlerden bazılarının bakan olarak değerlendirilecekleri de iddialar arasında. Kimileri ise bunu düşük olasılık olarak değerlendiriyor. Ayrıca MKYK’da Binali Yıldırım’ın izleri tamamen silindi. Yıldırım’ın kontenjanı olan isimler de listeye konulmadı. AKP SOSYETESİ! Bu arada partililerin ‘AKP’nin sosyetesi’ olarak adlandırdığı ve birbirinden ayrılmayan Osman Gökçek, Nilhan Ayan, Derya Ayaydın’ın birlikte MKYK’ya girmesi ayrıca rahatsızlık yarattı. Partiye hiçbir katkıları olmadığı öne sürülen isimlerin üst yönetimde yer alması tepki çekti. Bu ekipten ayrılmayan Şebnem Bursalı’nın da ‘ıstakoz skandalı’ nedeniyle dışarda kaldığı esprileri yapılıyor. Genel merkez yönetiminde yer alan Efkan Ala, Hayati Yazıcı, Mustafa Elitaş, Ömer Çelik, Nihat Zeybekçi gibi isimlerin partinin geçmişiyle bağını koruduğu, özellikle Hayati Yazıcı’nın partinin hafızası olduğu anlatılıyor. Bu isimlerin bazılarına görev verilmeyeceği ve Saray’a danışman olacakları iddia edilmişti. Partinin ‘ideoloji, tavrı ve kimliğinden’ taviz verdiği ve bambaşka bir kişiliğe büründüğünü savunanlar, kapalı kapılar ardında tepkili. Sonuç alamadıklarını son kongre de gösterdi. Seçime giden bu süreçte, ‘kişisel beklentiler ve ilkeler’ daha ne kadar çatışacak, hep birlikte göreceğiz…",https://www.nefes.com.tr/yazarlar/nuray-babacan/akpde-transfer-krizi-17982
Nuray Babacan,AKP’de sinir bozukluğu!,10 Mart 2025 06:20,"Yok artık bu kadarı da olmaz’ dediğimiz ama olan günlerde yaşıyoruz. Gastronomi yazarı Vedat Milor hakkında, kent lokantalarının reklamını yaptığı gerekçesiyle soruşturma açılması, AKP’lilerin bile sinirlerini bozdu. Son dönemde İstanbul’da yürütülen soruşturma ve operasyonların ‘neye hizmet ettiği’ soruları daha sık sorulmaya başlandı. Özellikle Vedat Milor soruşturmasını ‘sözün bittiği yer’ olarak değerlendirenler oldu. ŞAŞKIN AKP’LİLER! Bunlar sıradan vekiller değil, parti yöneticisi isimler. Kendi bakanlarının CİMER’e şikayet geldiği gerekçesiyle başlattığı soruşturmaya tepki gösteriyorlar. Parti yönetimi bundan rahatsızsa, bakanlığı ‘akıl tutulması’ sayılabilecek bu soruşturmayı açması konusunda kim yüreklendiriyor? Tüm tutarsız soruşturmalarda ya CİMER’e şikayet ya da gizli tanık çıkıyor ortaya. Artık herkes bu rutini ezberledi. Neyse biz dönelim AKP kulislerindeki manzaralara… Yerel seçimlerden sonra yapılan toplantılarda, bazı milletvekillerinin seçimin kaybedilmesinde kent lokantalarının etkisinin olduğunu söylediğinde Cumhurbaşkanı Tayyip Erdoğan’ın ne kadar rahatsız olduğunu biliyoruz. Hatta o dönem yapılan MKYK toplantısında, Erdoğan’ın, ‘Kent lokantasıyla seçim mi kaybedilirmiş? Nedeni bu olur mu?’ diyerek sinirli şekilde tepki gösterdiği yazılıp çizilmişti. Sinir bozan bu proje cezalandırılıyor gibi. ‘AÇILIM’ SESLERİ YÜKSELİYOR Partideki diğer manzara yeni açılım süreciyle ilgili. DEM ve MHP’liler kadar gelişmelerden haberdar edilmediklerini düşünen milletvekillerinin sayısı az değil. Bu konuda kendilerine herhangi bir bilgilendirme yapılmamasından rahatsızlık duyuyorlar. Yeni süreçle ilgili şu ana kadar MYK dışında hiçbir platformda bir değerlendirme yapılmadı. Son MYK toplantısında da Cumhurbaşkanı sadece ‘Yeni süreçte hassas olalım. Toplumun hassas kesimleri var, bunları incitecek sözlerden kaçınalım’ şeklinde uyarıda bulundu o kadar. Yeni MYK üyelerinden tek bir kişi bile görüşünü dile getirememiş. Gerekçe de zaman darlığı… Büyük kongreden sonra ilk toplantıyı yapıyorsun ve önümüzdeki günlerdeki siyaset stratejisiyle ilgili tek kelime edilmiyor. Hatta bazı vekillerin, DEM Partililerden bilgi almaya çalıştıkları anlatılıyor. Geçtiğimiz günlerde Sırrı Süreyya Önder, AKP kulisine gelerek sohbet etti. Önder, akil adam olarak AKP’lileri bilgilendirdi! Son olarak da DEM’li Cengiz Çandar iktidar kulisinde göründü. AKP milletvekilleriyle bir araya gelerek sürece ilişkin değerlendirmeler yaptığı anlatılıyor. Anlayacağınız, Cumhurbaşkanlığı, genel merkez yönetimi, MİT, TSK, İçişleri Bakanlığı, Dışişleri Bakanlığı dururken, AKP’liler gelişmelerle ilgili olarak DEM’den bilgi almaya çalıştı. KABİNE BEKLENTİSİ SOĞUDU Bu arada partinin büyük kongresinden hemen sonra yapılacağı iddia edilen kabine değişikliği de artık kulislerde bir numaralı gündem olmaktan çıktı. Kimine göre nisana, kimine göre hazirana kaldı. Hatta bir ara her bakanlık çılgın gibi ‘yeni proje’ tanıtım toplantısı yapmaya başlamıştı. Gün geçmiyordu ki bakanların gösterisi olmasın. Ancak son günlerde kabine değişikliğinin tamamen kaldığını, en fazla 3 bakanla sınırlı olacağını iddia edenler var. Büyük kongredeki değişim konusunda hayal kırıklığına uğrayan, parti MKYK’sına alınan isimler konusunda rahatsız olan partililer, kabine değişikliğinden de umudunu yitirmiş gibi. Olsa bile başarı, liyakat, yetenek gibi konularda mesaj vermeyeceği düşünülüyor.",https://www.nefes.com.tr/yazarlar/nuray-babacan/akpde-sinir-bozuklugu-20606
Nuray Babacan,Erdoğan’ın 3 yıl planı,19 Mart 2025 06:00,"Cumhurbaşkanı Tayyip Erdoğan’ın önceki gün ‘3 yıl sonraki seçim’ sözlerinden kastettiğinin ‘zamanında seçim’ olmadığını herkes anladı. Daha önce yazdığımız ve AKP sözcülerinin de zaman zaman dile getirdiği gibi ‘erkene alınmış seçim’ planı yapıldığı biliniyor. CHP’siz bu planın işleyebilmesi için transferlere ve pazarlıklara güveniliyor. İktidar kendine avantaj yaratacak tarihi belirleyerek hem Cumhurbaşkanı Tayyip Erdoğan’ın aday olmasını sağlayacak hem de ekonomik krizin yaralarının kısmen sarıldığını görecek. ‘Muhalefet nasıl olsa seçimden kaçamaz’ mantığıyla yapılan planlar, aylar önce CHP Genel Başkanı Özgür Özel’in ‘2027 yılı içinde birkaç ay öne alınacak seçime destek vermeyiz’ sözleriyle işlevsiz kaldı. CHP erken seçim istediği tarihte olmazsa, üç-beş ay direnip, Erdoğan’ın adaylığını ortadan kaldıracak, ‘zamanında seçimi’ tercih edecek. *** Bu nedenle, iktidar partisi seçimi kendi şartlarına uygun yapabilmenin yollarını arıyor. Bu da transfer edeceği milletvekillerine ve küçük partilerle yapacağı pazarlıklara bağlı. Çünkü seçimin tarihini değiştirmek için TBMM’de karar alınması gerekiyor. 360 milletvekilinin desteği gereken bu karar için AKP’nin ‘vekil açığını’ kapatması gerekecek. Cumhur İttifakı’nın şimdilik 41 milletvekiline ihtiyacı var. Partinin 2027’nin ilkbahar ya da sonbaharında seçim yapabilmesi için ince hesaplar yaptığı aktarılıyor. AKP kongresinde yapılan transferler ve bu kişilerinin partinin yönetim kadrolarında değerlendirilmesi de bunun mesajını taşıyor. Parti içinde transferlere yönelik tepkilerini dile getirenler de Erdoğan’ın ‘geleceğe dönük’ mesaj verdiğini iddia etmişlerdi. O analizleri anımsayalım… “Cumhurbaşkanı ‘partinin sahibi benim’ dedi. Taktik olarak milletvekili transfer etmek ayrı bir şey, bu isimleri partinin en üst kurullarına taşımak başka bir şey. AKP’ye gelecek vekillere, sizi en üst düzeyde değerlendiririm. İktidarın avantajlarından yararlanırsınız mesajı verdi’ demişlerdi. Şimdi iktidar partisinin planına bu açıdan bakarsak, bağımsız olan veya küçük partilere birer-ikişer dağılmış durumda 31 milletvekili var. Millet İttifakı gibi yeni bir yapı ufukta görünmediği için bu kişilerin neredeyse tamamı giderlerse bir daha gelemeyecekler. Dolayısıyla, yeniden seçilmek ya da daha avantajlı olmak için erkene alınmış seçime ‘evet’ diyebilirler. Bu hesaba DEM, İYİ Parti dahil değil. İYİ Partililerin seçim yaklaşırken nasıl refleks göstereceği az buçuk tahmin edilebilir. Dağılma korkusunun her şeyi yaptıracağı net. *** DEM’e gelince... Onların Erdoğan’ın planlarına hizmet etmesi tamamen açılım sürecindeki gelişmelere bağlı. Şu anda yol almakta zorluk çeken açılım süreci ve terör örgütü lideri Abdullah Öcalan’ın tavrı DEM’i etkileyecek. Düne kadar kayyum dahil hukuksuz uygulamalardan yakınan DEM yönetiminin hızla tavır değiştirerek AKP ile birlikte hareket etmesi kimseyi şaşırtmaz. Dolayısıyla, ülke gerçekleri AKP’yi daha erken bir seçime zorlamazsa, parti kendi kurguladığı ‘erkene alınmış seçimi’ transferler ve pazarlıklarla CHP’siz gerçekleştirme olanağı bulabilir. ÖNEMLİ NOT: Ankara siyasetini 40 yıla yakın bir süreden beri ‘kesintisiz’ izleyen bir gazeteciyim. Cumhurbaşkanlığı, Başbakanlık ve TBMM’de uzun yıllar gelişmeleri yakından takip ettim. Bağımsız ve objektif gazetecilik temel ilkemdir. Bir süreden beri tanımadığım Nuray Başaran’la karıştırıldığımı görüyorum. Lütfen NURAY BABACAN’ın yorum ve köşe yazılarıyla, yeni ekran yorumcularını karıştırmamanızı rica ediyorum.",https://www.nefes.com.tr/yazarlar/nuray-babacan/erdoganin-3-yil-plani-22631
Nuray Babacan,Topal ördek stratejisi,26 Mart 2025 05:45,"Son bir hafta içerisinde yaşananlar karşısında AKP’li siyasetçilerin ruh hali çok dalgalı. Troller ve iktidar medyası aracılığıyla yaratılmak isteyen havaya rağmen, sokaklarla biraz ilişkisi olan siyasetçiler hiç de rahat değil. Ama ben asıl, partide ‘reform paketi hazırlayan’ ekibin ruh halini merak ediyorum! SESLERİ İÇLERİNE KAÇTI! AKP’de aylarca süren ve ölü doğan bir çalışmadan söz etmek istiyorum. Genel Başkan Vekili Efkan Ala, göreve geldikten sonra bir strateji grubu kurarak, ‘reform paketi’ hazırlama kararı aldı. Aylar süren çalışma boyunca bakanlar tek tek davet edilerek, Türkiye’nin hukuk sistemindeki aksaklıklar, ekonomi ve yatırım ortamının güvenirliği, adalet duygusundaki zedelenme, dış politikada istikrar, dijital reform gibi 10 başlıktan oluşan bir dönüşüm çalışması yapıldı. Yapıldı ama gören olmadı. Zira partinin büyük kongresinde Cumhurbaşkanı Tayyip Erdoğan üç cümle ile bahsetti ve konu kapandı. Aylarca süren ve yüzlerce sayfadan oluşan bu çalışma, muhalefete yapılan antidemokratik operasyonla rafa kalktı. Nasıl kalkmasın ki; orada zedelenen adalet duygusunun tamir edilmesinden, yargının bağımsızlığından, ekonomik kararların sürdürülebilirliğinden, Anayasanın üstünlüğünden, cumhurbaşkanlığı hükümet sisteminin revize edilerek aksayan yönlerinin giderilmesinden söz ediliyordu. Derin AKP, başka bir paket açıkladı! O paketin içinde olanları da tüm Türkiye son bir haftadır izliyor. Anti demokratik hamleler art arda gelince, partinin zaten sessiz olan demokratlarının sesleri iyice içine kaçtı! TOPAL ÖRDEK STRATEJİSİ Gelelim, iktidar kanadının İmamoğlu ve ekibini yolsuzluk iddialarıyla yorma ve kayyum kartını askıda tutma kararına. Topal ördek yaratma amacı taşıyan bu kararda iki amaç var. 1-CHP’nin, parti meclisinden belirleyeceği yeni başkan ile İstanbul belediye yönetimi silikleştirilecek. Bu yönetim, aylarca yolsuzluk iddialarından temize çıkmakla uğraştırılacak. Ayrıca, devletin tüm kurumları tam saha büyükşehir belediyesinin ekonomik gücünü daraltmaya ve nefes almasını zorlaştırmaya çalışacak. 2-Ekrem İmamoğlu’nun cezaevinde kalış süresine bağlı olarak etkisi zayıflatılacak. Kendisi yolsuzluk iddialarının asılsız olduğunu ispat için uğraşırken, partinin ve sokaktakilerin enerjisi düşecek. İmamoğlu bir süre sonra Selahattin Demirtaş gibi zaman zaman açıklamaları medyaya yansıyan siyasi tutukluya dönüştürülecek. AKP, ilk senaryosuna kıyasla geri adım atmış bile olsa yeni bir hesap yapıyor. DEV ANKET NE DİYOR? Hesaplar yapıla dursun, son günlerin ilginç bir kıyaslamasını buraya aktarmak istiyorum. İstanbul Büyükşehir Belediye Başkanı Ekrem İmamoğlu’nun gözaltına alınmadan hemen önceki videosu 28 milyon, Cumhurbaşkanı Tayyip Erdoğan’ın Bakanlar Kurulu toplantısından sonra yaptığı açıklaması 886 bin izleniyor. ‘Rakamlara takılmayın’ deniliyorsa; Erdoğan’ın cumartesi günü yaptığı ve devletin en üst yöneticisi üslubu yerine ‘sağdan soldan balya balya paralar fışkırıyor…’ şeklinde cümleler kullandığı yolsuzluk iddia eden açıklamasının altına yazılan yorumlara bakılsın. Önceden ‘Reis için ölürüz’ kıvamında olan yorumlardan çok az. 6 bin 500 kişi yanıt yazıyor, çoğu AKP iktidarında yapılan yolsuzluklar, haksızlıklar ve hukuksuzluklardan örnek içeriyor. FETO ile ilgili işbirliği hatırlatmaları çabası. Geri kalanı da iş talebinde bulunup, yaşadığı sıkıntıları aktarıyor. 13 milyon 500 bin kişinin katıldığı Ekrem İmamoğlu’nun adaylığına destek anketini küçümseyenler, Erdoğan’ın yolsuzluk iddialarını içeren tweetinin altındaki bu yorumlara baksınlar. 3 bin seçmenin katıldığı kamuoyu araştırmalarıyla aday belirleyen, siyasi strateji geliştiren AKP yönetiminin, tamamen gönüllülük esası üzerinden saatlerce kuyrukta bekleyen 13 milyon 500 bin kişiyi görmezden gelmesi, tüm zamanların en büyük hatası olacak gibi…",https://www.nefes.com.tr/yazarlar/nuray-babacan/topal-ordek-stratejisi-24064
Nuray Babacan,AKP’nin Ekrem-Mansur denklemi!,17 Mart 2025 06:00,"İktidar partisinin, CHP’nin cumhurbaşkanı adayını ‘engelleme ve muhalefet açısından sorunlu bir alana dönüştürme’ üzerine kurduğu denklem, gittikçe hız kazanmaya başladı. Adil bir yarış yerine, müdahaleyle sakatlanmış bir süreç planlayan AKP’de, ilginç değerlendirmeler yapılıyor. Öncelikle söyleyelim, parti içinde bu planı bir bütün olarak görebilen yok. Cumhurbaşkanı Tayyip Erdoğan’ın anlayışı konusundaki tüm değerlendirmeler birden fazla ihtimal üzerinden yapılıyor. AKP’NİN OYUN PLANI Basitçe; 1- İstanbul Büyükşehir Belediye Başkanı Ekrem İmamoğlu’nun adaylığı, hukuki olmayan müdahaleyle engellenecek. 2- Ondan sonra sıra Mansur Yavaş’a gelecek. 3- Plan bu kadar net sonuçlanmasa bile İmamoğlu ile Yavaş’ın arasının açılması ve bölünme sağlanacak. 4- Genel seçimlerde olduğu gibi muhalefetin parçalı ve sorunlu bir şekilde seçime girmesi sağlanacak. Ayrıntılara ve kulislerdeki değerlendirmelere gelince. Konuya sadece Ekrem İmamoğlu’nun adaylığının engellenmesi üzerinden bakanlar var. Onlara göre, plan sadece İmamoğlu’nun adaylığının engellenmesini içeriyor. Muhalefetin adayının Mansur Yavaş olması planlanıyor. TERCİH, YAVAŞ DİYENLER Yavaş’ın adaylığının devletin içindeki milliyetçi kanadın da tercihi olduğu, yapılan operasyonların onun önüne açmak amacı taşıdığı yorumları yapılıyor. Alt yapının ona uygun hale getirmeye hazırlandığı iddiaları var. Yavaş’ın bu süreçte seviyeli ve mesafeli tavrının bundan kaynaklandığı, topun ayağına geleceğini bildiği için de CHP’lileri ve bu tabandan gelecek oylara ket vurmamak için dengeli tavır sergilediği yorumları yapılıyor. AKP’liler, Erdoğan’ın İmamoğlu yerine neden Yavaş’ı rakip olarak tercih edeceğiyle ilgili sorulara ise 1-İmamoğlu’nun sokakla kurduğu güçlü ilişki Erdoğan için ciddi risk oluşturuyor. 2- Mansur Yavaş, seçim kampanyasında kolay rakip olabilir. 3- Ülkenin tümünü kapsama sorunu yaşayabilir. Zaten Kürtlerle mesafeli olan Yavaş, açılım sürecinden sonuç alınırsa, bu kitleden hiç destek göremez. Kolay rakibe dönüşür. Bu senaryoyu daha da ileri götürenler, Yavaş’ın Erdoğan’a karşı kazanması durumunda bile ‘daha kolay ilişki kurulacak, kendileriyle ilgili daha az risk oluşturacak, hesap sorma ve geçmiş dönem sabıkası yaratma konusunda kolay ikna edilebilecek’ biri olmasını gerekçe gösteriyor. Bu değerlendirmeler bize ilginç geldi… ‘HATA YAPIYORUZ’ DİYENLER Başta dediğimiz gibi AKP içerisinde bütüncül bir yorum yapılmıyor. Tüm bu gelişmelere şüpheyle bakan, kendileri açısından dezavantaja dönüşeceği söyleyenler de az değil. AKP’li bir kurmay, “Ekrem İmamoğlu ile ilgili atılan her adım içeriğine bakılmaksızın siyasi olarak değerlendiriliyor ve kendisine puan yazıyor. Kamuoyu açısından inandırıcılığı yok. Bizim kitlemiz bile şüpheyle yaklaşıyor. Adamla beş yıldır uğraşıyoruz, ona prim kazandırmaktan başka işe yaramadı” değerlendirmesi yaptı. İmamoğlu’na siyasi yasak getirilmesini yanlış bulanlar, bunun kamuoyu algısı açısından kötü sonuçları olacağını değerlendiriyorlar. Daha önce de yazdığımız gibi ’vura vura başkan yapacaklar adamı’ diyenler de var. İmamoğlu’nda yaratılan mağduriyetin orta vadede ona yarayacağı değerlendiriliyor. Bütün bu hukuksuz çabaların ‘muhalefetin adayı kim olursa olsun’ onun etrafında kenetlenme yaratacağını kaygısı taşıyanları da unutmamak gerekir. PARÇALA-BÖL-YÖNET Bu değerlendirmeler arasında en önemli olanı, muhalefetin ‘bir aday etrafında kenetlenmesini önleme’ stratejisi. Cumhurbaşkanı Tayyip Erdoğan, tek bir aday etrafında kenetlenme yerine parçalı bir yapı istiyor. İmamoğlu’nun Yavaş’a, Yavaş’ın da İmamoğlu’na destek verdiği bir yapı istenmiyor. Tıpkı, genel seçimlerde Millet İttifakı’nda yapılan operasyonlar gibi. O yüzden iktidar medyasının da yardımıyla kurgulanan oyun; hukuk, etik, ilke gibi ahlaki kuralların hiçbirini içermeden sahneleniyor. Ülkenin gerçek gündemi, yoksuzluk, yolsuzluk, hayat pahalılığı, ekonomik kriz, adaletsizlik hiç konuşulmadan muhalefet kendisine kurulan tuzaklarla boğuşmak zorunda bırakılıyor…",https://www.nefes.com.tr/yazarlar/nuray-babacan/akpnin-ekrem-mansur-denklemi-22154
